排名,项目名称,完整名称,作者,描述,语言,Stars,Forks,Issues,创建时间,更新时间,仓库链接,主页链接,许可证,大小(KB),是否Fork,是否已归档
1,PowerToys,microsoft/PowerToys,microsoft,Microsoft PowerToys is a collection of utilities that help you customize Windows and streamline everyday tasks,C#,125398,7459,7535,2019-05-01T17:44:02Z,2025-11-03T01:11:31Z,https://github.com/microsoft/PowerToys,,MIT License,455935,False,False
2,v2rayN,2dust/v2rayN,2dust,"A GUI client for Windows, Linux and macOS, support Xray and sing-box and others",C#,89273,13561,6,2019-07-30T03:47:24Z,2025-11-03T01:34:57Z,https://github.com/2dust/v2rayN,https://v2rayn.2dust.link,GNU General Public License v3.0,44529,False,False
3,shadowsocks-windows,shadowsocks/shadowsocks-windows,shadowsocks,A C# port of shadowsocks,C#,59110,16342,199,2013-01-14T07:54:16Z,2025-11-02T16:57:55Z,https://github.com/shadowsocks/shadowsocks-windows,,Other,13489,False,False
4,PowerShell,PowerShell/PowerShell,PowerShell,PowerShell for every system!,C#,50665,8052,1333,2016-01-13T23:41:35Z,2025-11-03T00:37:21Z,https://github.com/PowerShell/PowerShell,https://microsoft.com/PowerShell,MIT License,101195,False,False
5,jellyfin,jellyfin/jellyfin,jellyfin,The Free Software Media System - Server Backend & API,C#,45300,4082,696,2018-12-09T06:36:45Z,2025-11-03T02:00:36Z,https://github.com/jellyfin/jellyfin,https://jellyfin.org,GNU General Public License v2.0,69894,False,False
6,Files,files-community/Files,files-community,A modern file manager that helps users organize their files and folders.,C#,39961,2491,493,2019-01-04T18:19:14Z,2025-11-03T00:42:27Z,https://github.com/files-community/Files,https://files.community,MIT License,263086,False,False
7,aspnetcore,dotnet/aspnetcore,dotnet,"ASP.NET Core is a cross-platform .NET framework for building modern cloud-based web applications on Windows, Mac, or Linux.",C#,37339,10475,3518,2014-03-11T06:09:42Z,2025-11-03T01:04:23Z,https://github.com/dotnet/aspnetcore,https://asp.net,MIT License,368563,False,False
8,RevokeMsgPatcher,huiyadanli/RevokeMsgPatcher,huiyadanli,:trollface: A hex editor for WeChat/QQ/TIM - PC版微信/QQ/TIM防撤回补丁（我已经看到了，撤回也没用了）,C#,35073,3797,58,2019-07-21T15:12:52Z,2025-11-03T01:56:55Z,https://github.com/huiyadanli/RevokeMsgPatcher,,GNU General Public License v3.0,3739,False,False
9,ShareX,ShareX/ShareX,ShareX,"ShareX is a free and open-source application that enables users to capture or record any area of their screen with a single keystroke. It also supports uploading images, text, and various file types to a wide range of destinations.",C#,34236,3503,562,2013-10-08T23:32:10Z,2025-11-02T16:57:34Z,https://github.com/ShareX/ShareX,https://getsharex.com,GNU General Public License v3.0,63695,False,False
10,DevToys,DevToys-app/DevToys,DevToys-app,A Swiss Army knife for developers.,C#,30333,1669,294,2021-09-29T01:40:41Z,2025-11-03T00:58:39Z,https://github.com/DevToys-app/DevToys,https://devtoys.app/,MIT License,229048,False,False
11,Avalonia,AvaloniaUI/Avalonia,AvaloniaUI,"Develop Desktop, Embedded, Mobile and WebAssembly apps with C# and XAML. The most popular .NET UI client technology",C#,29093,2520,1845,2013-12-05T20:13:21Z,2025-11-02T23:33:43Z,https://github.com/AvaloniaUI/Avalonia,https://avaloniaui.net,MIT License,189738,False,False
12,dnSpy,dnSpy/dnSpy,dnSpy,.NET debugger and assembly editor,C#,28462,5392,185,2015-07-01T16:05:10Z,2025-11-03T00:08:41Z,https://github.com/dnSpy/dnSpy,,,35047,False,True
13,semantic-kernel,microsoft/semantic-kernel,microsoft,Integrate cutting-edge LLM technology quickly and easily into your apps,C#,26587,4322,566,2023-02-27T17:39:42Z,2025-11-03T01:44:43Z,https://github.com/microsoft/semantic-kernel,https://aka.ms/semantic-kernel,MIT License,91419,False,False
14,ScreenToGif,NickeManarin/ScreenToGif,NickeManarin,"🎬 ScreenToGif allows you to record a selected area of your screen, edit and save it as a gif or video.",C#,25891,2298,306,2016-08-02T01:28:59Z,2025-11-02T15:44:58Z,https://github.com/NickeManarin/ScreenToGif,http://www.screentogif.com,Microsoft Public License,25973,False,False
15,eShopOnContainers,dotnet-architecture/eShopOnContainers,dotnet-architecture,"Cross-platform .NET sample microservices and container based application that runs on Linux Windows and macOS. Powered by .NET 7, Docker Containers and Azure Kubernetes Services. Supports Visual Studio, VS for Mac and CLI based environments with Docker CLI, dotnet CLI, VS Code or any other code editor. Moved to https://github.com/dotnet/eShop.",C#,24465,10233,71,2016-10-05T22:35:23Z,2025-11-01T12:06:59Z,https://github.com/dotnet-architecture/eShopOnContainers,https://dot.net/architecture,,661091,False,True
16,WaveFunctionCollapse,mxgmn/WaveFunctionCollapse,mxgmn,Bitmap & tilemap generation from a single example with the help of ideas from quantum mechanics,C#,24407,1308,9,2016-09-30T11:53:17Z,2025-11-03T01:50:06Z,https://github.com/mxgmn/WaveFunctionCollapse,,Other,31161,False,False
17,ILSpy,icsharpcode/ILSpy,icsharpcode,".NET Decompiler with support for PDB generation, ReadyToRun, Metadata (&more) - cross-platform!",C#,23946,3557,223,2011-02-04T11:24:20Z,2025-11-02T21:40:30Z,https://github.com/icsharpcode/ILSpy,,MIT License,44606,False,False
18,SteamTools,BeyondDimension/SteamTools,BeyondDimension,🛠「Watt Toolkit」是一个开源跨平台的多功能 Steam 工具箱。,C#,23563,1527,1081,2020-12-15T13:52:11Z,2025-11-02T14:43:31Z,https://github.com/BeyondDimension/SteamTools,https://steampp.net,GNU General Public License v3.0,267926,False,False
19,maui,dotnet/maui,dotnet,".NET MAUI is the .NET Multi-platform App UI, a framework for building native device applications spanning mobile, tablet, and desktop.",C#,23021,1889,4305,2020-05-08T18:11:05Z,2025-11-03T01:09:53Z,https://github.com/dotnet/maui,https://dot.net/maui,MIT License,748187,False,False
20,CodeHub,CodeHubApp/CodeHub,CodeHubApp,CodeHub is an iOS application written using Xamarin,C#,22703,613,237,2013-07-23T22:19:57Z,2025-10-24T10:58:22Z,https://github.com/CodeHubApp/CodeHub,http://www.codehub-app.com,,75636,False,True
21,QuickLook,QL-Win/QuickLook,QL-Win,Bring macOS “Quick Look” feature to Windows,C#,21373,1197,192,2017-04-12T14:57:38Z,2025-11-03T01:38:25Z,https://github.com/QL-Win/QuickLook,,GNU General Public License v3.0,325754,False,False
22,awesome-dotnet-core,thangchung/awesome-dotnet-core,thangchung,":honeybee: A collection of awesome .NET core libraries, tools, frameworks and software",C#,20868,2940,184,2016-03-17T03:52:09Z,2025-11-02T23:12:33Z,https://github.com/thangchung/awesome-dotnet-core,,,1368,False,False
23,roslyn,dotnet/roslyn,dotnet,The Roslyn .NET compiler provides C# and Visual Basic languages with rich code analysis APIs.,C#,19976,4195,6170,2015-01-11T02:39:03Z,2025-11-02T09:52:31Z,https://github.com/dotnet/roslyn,https://docs.microsoft.com/dotnet/csharp/roslyn-sdk/,MIT License,2393667,False,False
24,UniGetUI,marticliment/UniGetUI,marticliment,UniGetUI: The Graphical Interface for your package managers. Could be terribly described as a package manager manager to manage your package managers,C#,19009,639,250,2021-06-15T12:57:58Z,2025-11-02T20:49:42Z,https://github.com/marticliment/UniGetUI,https://www.marticliment.com/unigetui/,MIT License,896695,False,False
25,ml-agents,Unity-Technologies/ml-agents,Unity-Technologies,The Unity Machine Learning Agents Toolkit (ML-Agents) is an open-source project that enables games and simulations to serve as environments for training intelligent agents using deep reinforcement learning and imitation learning.,C#,18803,4381,50,2017-09-08T21:09:04Z,2025-11-02T20:37:51Z,https://github.com/Unity-Technologies/ml-agents,https://unity.com/products/machine-learning-agents,Other,3019598,False,False
26,PEASS-ng,peass-ng/PEASS-ng,peass-ng,PEASS - Privilege Escalation Awesome Scripts SUITE (with colors),C#,18635,3304,27,2019-01-13T19:58:24Z,2025-11-02T19:48:27Z,https://github.com/peass-ng/PEASS-ng,https://book.hacktricks.xyz,Other,64265,False,False
27,CMWTAT_Digital_Edition,TGSAN/CMWTAT_Digital_Edition,TGSAN,"CloudMoe Windows 10/11 Activation Toolkit get digital license, the best open source Win 10/11 activator in GitHub. GitHub 上最棒的开源 Win10/Win11 数字权利（数字许可证）激活工具！",C#,18551,2146,31,2018-05-27T13:45:02Z,2025-11-02T15:36:33Z,https://github.com/TGSAN/CMWTAT_Digital_Edition,https://cmwtat.cloudmoe.com,Other,59447,False,False
28,Dapper,DapperLib/Dapper,DapperLib,Dapper - a simple object mapper for .Net,C#,18108,3683,532,2011-04-14T08:42:59Z,2025-11-01T02:59:49Z,https://github.com/DapperLib/Dapper,https://www.learndapper.com/,Other,49973,False,False
29,CleanArchitecture,ardalis/CleanArchitecture,ardalis,Clean Architecture Solution Template: A proven Clean Architecture Template for ASP.NET Core 9,C#,17652,3005,33,2016-09-30T14:19:20Z,2025-11-02T21:15:08Z,https://github.com/ardalis/CleanArchitecture,,MIT License,3520,False,False
30,lively,rocksdanister/lively,rocksdanister,Free and open-source software that allows users to set animated desktop wallpapers and screensavers powered by WinUI 3.,C#,17489,1188,303,2019-08-08T05:57:26Z,2025-11-03T02:00:36Z,https://github.com/rocksdanister/lively,https://rocksdanister.com/lively,GNU General Public License v3.0,313320,False,False
31,osu,ppy/osu,ppy,rhythm is just a *click* away!,C#,17441,2560,1652,2014-07-31T04:26:30Z,2025-11-02T23:08:30Z,https://github.com/ppy/osu,https://osu.ppy.sh,MIT License,188992,False,False
32,server,bitwarden/server,bitwarden,"Bitwarden infrastructure/backend (API, database, Docker, etc).",C#,17355,1464,191,2015-11-23T23:45:33Z,2025-11-02T13:22:14Z,https://github.com/bitwarden/server,https://bitwarden.com,Other,40582,False,False
33,optimizer,hellzerg/optimizer,hellzerg,The finest Windows Optimizer,C#,17346,1116,84,2017-09-13T07:49:36Z,2025-11-02T21:44:10Z,https://github.com/hellzerg/optimizer,,GNU General Public License v3.0,47555,False,False
34,runtime,dotnet/runtime,dotnet,".NET is a cross-platform runtime for cloud, mobile, desktop, and IoT apps.",C#,17084,5210,8435,2019-09-24T23:36:39Z,2025-11-03T01:10:31Z,https://github.com/dotnet/runtime,https://docs.microsoft.com/dotnet/core/,MIT License,1012127,False,False
35,netch,netchx/netch,netchx,A simple proxy client,C#,16995,2794,4,2019-06-25T09:55:30Z,2025-11-02T11:50:09Z,https://github.com/netchx/netch,,GNU General Public License v3.0,11389,False,False
36,ContextMenuManager,BluePointLilac/ContextMenuManager,BluePointLilac,🖱️ 纯粹的Windows右键菜单管理程序,C#,16676,751,155,2020-10-15T06:27:04Z,2025-11-03T00:39:49Z,https://github.com/BluePointLilac/ContextMenuManager,https://bluepointlilac.github.io/ContextMenuManager,GNU General Public License v3.0,1843,False,False
37,Bulk-Crap-Uninstaller,Klocman/Bulk-Crap-Uninstaller,Klocman,Remove large amounts of unwanted applications quickly.,C#,16228,727,130,2016-08-01T15:17:05Z,2025-11-02T19:56:40Z,https://github.com/Klocman/Bulk-Crap-Uninstaller,https://www.bcuninstaller.com/,Apache License 2.0,10408,False,False
38,OpenRA,OpenRA/OpenRA,OpenRA,"Open Source real-time strategy game engine for early Westwood games such as Command & Conquer: Red Alert written in C# using SDL and OpenGL. Runs on Windows, Linux, *BSD and Mac OS X.",C#,16078,2818,1542,2010-10-04T07:38:05Z,2025-11-02T02:25:23Z,https://github.com/OpenRA/OpenRA,https://www.openra.net,GNU General Public License v3.0,345597,False,False
39,MaterialDesignInXamlToolkit,MaterialDesignInXAML/MaterialDesignInXamlToolkit,MaterialDesignInXAML,"Google's Material Design in XAML & WPF, for C# & VB.Net. ",C#,15867,3484,161,2015-02-07T23:30:48Z,2025-11-02T16:29:41Z,https://github.com/MaterialDesignInXAML/MaterialDesignInXamlToolkit,,MIT License,73043,False,False
40,N_m3u8DL-CLI,nilaoda/N_m3u8DL-CLI,nilaoda,"[.NET] m3u8 downloader 开源的命令行m3u8/HLS/dash下载器，支持普通AES-128-CBC解密，多线程，自定义请求头等. 支持简体中文,繁体中文和英文. English Supported.",C#,15542,2270,254,2019-04-18T13:43:49Z,2025-11-01T11:21:51Z,https://github.com/nilaoda/N_m3u8DL-CLI,https://nilaoda.github.io/N_m3u8DL-CLI/,MIT License,6399,False,False
41,AssetStudio,Perfare/AssetStudio,Perfare,"AssetStudio is a tool for exploring, extracting and exporting assets and assetbundles.",C#,14727,2807,184,2016-08-02T11:59:11Z,2025-11-03T01:12:13Z,https://github.com/Perfare/AssetStudio,,MIT License,40176,False,True
42,efcore,dotnet/efcore,dotnet,"EF Core is a modern object-database mapper for .NET. It supports LINQ queries, change tracking, updates, and schema migrations.",C#,14443,3324,2420,2014-01-23T00:52:01Z,2025-11-02T18:19:46Z,https://github.com/dotnet/efcore,https://learn.microsoft.com/ef/,MIT License,215771,False,False
43,Jackett,Jackett/Jackett,Jackett,API Support for your favorite torrent trackers,C#,14272,1408,206,2015-10-29T16:23:19Z,2025-11-03T01:29:32Z,https://github.com/Jackett/Jackett,,GNU General Public License v2.0,42630,False,False
44,Polly,App-vNext/Polly,App-vNext,"Polly is a .NET resilience and transient-fault-handling library that allows developers to express policies such as Retry, Circuit Breaker, Timeout, Bulkhead Isolation, and Fallback in a fluent and thread-safe manner. From version 6.0.1, Polly targets .NET Standard 1.1 and 2.0+.",C#,14023,1263,7,2013-05-05T04:40:04Z,2025-10-31T14:22:25Z,https://github.com/App-vNext/Polly,https://www.thepollyproject.org,"BSD 3-Clause ""New"" or ""Revised"" License",52493,False,False
45,abp,abpframework/abp,abpframework,"Open-source web application framework for ASP.NET Core! Offers an opinionated architecture to build enterprise software solutions with best practices on top of the .NET. Provides the fundamental infrastructure, cross-cutting-concern implementations, startup templates, application modules, UI themes, tooling and documentation.",C#,13888,3623,360,2016-12-03T22:56:24Z,2025-11-02T16:58:17Z,https://github.com/abpframework/abp,https://abp.io,GNU Lesser General Public License v3.0,1948934,False,False
46,QuestPDF,QuestPDF/QuestPDF,QuestPDF,"Generate and edit PDF documents in your .NET applications using the open-source QuestPDF library and its C# Fluent API. Build invoices, reports and data exports with ease.",C#,13455,724,221,2021-01-04T22:47:16Z,2025-10-31T17:49:20Z,https://github.com/QuestPDF/QuestPDF,https://www.questpdf.com,Other,673645,False,False
47,winsw,winsw/winsw,winsw,"A wrapper executable that can run any executable as a Windows service, in a permissive license.",C#,13373,1652,240,2010-02-03T02:49:39Z,2025-11-02T17:21:24Z,https://github.com/winsw/winsw,,MIT License,3510,False,False
48,duplicati,duplicati/duplicati,duplicati,Store securely encrypted backups in the cloud!,C#,13371,993,719,2014-08-05T08:28:16Z,2025-11-02T23:33:14Z,https://github.com/duplicati/duplicati,,MIT License,187256,False,False
49,YoutubeDownloader,Tyrrrz/YoutubeDownloader,Tyrrrz,Downloads videos and playlists from YouTube,C#,13222,1684,12,2018-11-16T11:30:50Z,2025-11-03T01:39:52Z,https://github.com/Tyrrrz/YoutubeDownloader,,MIT License,1341,False,False
50,AspNetCore.Docs,dotnet/AspNetCore.Docs,dotnet,Documentation for ASP.NET Core,C#,13011,25096,604,2014-12-19T17:38:02Z,2025-11-02T14:25:38Z,https://github.com/dotnet/AspNetCore.Docs,https://docs.microsoft.com/aspnet/core,Creative Commons Attribution 4.0 International,854865,False,False
51,modular-monolith-with-ddd,kgrzybek/modular-monolith-with-ddd,kgrzybek,Full Modular Monolith application with Domain-Driven Design approach.,C#,12997,2067,66,2019-08-23T00:12:03Z,2025-11-03T00:52:13Z,https://github.com/kgrzybek/modular-monolith-with-ddd,,MIT License,8423,False,False
52,BBDown,nilaoda/BBDown,nilaoda,Bilibili Downloader. 一个命令行式哔哩哔哩下载器.,C#,12723,1515,226,2020-07-26T11:43:28Z,2025-11-03T00:40:42Z,https://github.com/nilaoda/BBDown,,MIT License,18900,False,False
53,MonoGame,MonoGame/MonoGame,MonoGame,One framework for creating powerful cross-platform games.,C#,12672,2994,773,2011-04-07T00:23:40Z,2025-11-03T01:10:57Z,https://github.com/MonoGame/MonoGame,http://www.monogame.net,Other,97606,False,False
54,Lean,QuantConnect/Lean,QuantConnect,"Lean Algorithmic Trading Engine by QuantConnect (Python, C#)",C#,12664,3783,256,2014-11-28T04:20:19Z,2025-11-03T01:08:27Z,https://github.com/QuantConnect/Lean,https://lean.io,Apache License 2.0,581249,False,False
55,ArchiSteamFarm,JustArchiNET/ArchiSteamFarm,JustArchiNET,C# application with primary purpose of farming Steam cards from multiple accounts simultaneously.,C#,12619,1094,7,2015-10-25T05:12:33Z,2025-11-02T22:10:28Z,https://github.com/JustArchiNET/ArchiSteamFarm,,Apache License 2.0,237888,False,False
56,EverythingToolbar,srwi/EverythingToolbar,srwi,Everything integration for the Windows taskbar.,C#,12598,499,35,2020-09-13T17:20:21Z,2025-11-03T00:44:12Z,https://github.com/srwi/EverythingToolbar,,Other,26577,False,False
57,Sonarr,Sonarr/Sonarr,Sonarr,Smart PVR for newsgroup and bittorrent users.,C#,12589,1706,109,2011-09-27T05:57:16Z,2025-11-03T00:13:02Z,https://github.com/Sonarr/Sonarr,https://sonarr.tv,GNU General Public License v3.0,299829,False,False
58,UnityCsReference,Unity-Technologies/UnityCsReference,Unity-Technologies,Unity C# reference source code.,C#,12578,2549,17,2018-03-23T13:08:32Z,2025-11-02T15:21:16Z,https://github.com/Unity-Technologies/UnityCsReference,,Other,71743,False,False
59,FileConverter,Tichau/FileConverter,Tichau,File Converter is a very simple tool which allows you to convert and compress files using the context menu in windows explorer.,C#,12550,804,262,2015-04-06T10:15:53Z,2025-11-03T01:58:43Z,https://github.com/Tichau/FileConverter,https://file-converter.io/,GNU General Public License v3.0,212994,False,False
60,Radarr,Radarr/Radarr,Radarr,Movie organizer/manager for usenet and torrent users.,C#,12366,1096,374,2016-12-25T11:38:26Z,2025-11-03T01:38:52Z,https://github.com/Radarr/Radarr,https://radarr.video,GNU General Public License v3.0,315998,False,False
61,csharplang,dotnet/csharplang,dotnet,The official repo for the design of the C# programming language,C#,12328,1051,268,2016-12-09T01:45:27Z,2025-11-03T00:33:38Z,https://github.com/dotnet/csharplang,,,15135,False,False
62,aspnetboilerplate,aspnetboilerplate/aspnetboilerplate,aspnetboilerplate,ASP.NET Boilerplate - Web Application Framework,C#,11980,3822,161,2013-08-18T20:45:08Z,2025-10-31T11:00:51Z,https://github.com/aspnetboilerplate/aspnetboilerplate,https://aspnetboilerplate.com,MIT License,65111,False,False
63,MediatR,LuckyPennySoftware/MediatR,LuckyPennySoftware,"Simple, unambitious mediator implementation in .NET",C#,11792,2177,5,2014-03-03T15:01:22Z,2025-11-02T09:47:49Z,https://github.com/LuckyPennySoftware/MediatR,,Other,6054,False,False
64,Playnite,JosefNemec/Playnite,JosefNemec,"Video game library manager with support for wide range of 3rd party libraries and game emulation support, providing one unified interface for your games.",C#,11701,579,688,2017-03-25T19:16:06Z,2025-11-03T00:14:56Z,https://github.com/JosefNemec/Playnite,https://playnite.link,MIT License,69701,False,False
65,Flow.Launcher,Flow-Launcher/Flow.Launcher,Flow-Launcher,:mag: Quick file search & app launcher for Windows with community-made plugins,C#,11676,456,246,2020-04-21T08:12:15Z,2025-11-02T12:53:21Z,https://github.com/Flow-Launcher/Flow.Launcher,https://flowlauncher.com,MIT License,97283,False,False
66,garnet,microsoft/garnet,microsoft,"Garnet is a remote cache-store from Microsoft Research that offers strong performance (throughput and latency), scalability, storage, recovery, cluster sharding, key migration, and replication features. Garnet can work with existing Redis clients.",C#,11568,618,41,2023-08-21T21:54:58Z,2025-11-02T09:10:38Z,https://github.com/microsoft/garnet,https://microsoft.github.io/garnet/,MIT License,2800555,False,False
67,subtitleedit,SubtitleEdit/subtitleedit,SubtitleEdit,the subtitle editor :),C#,11494,1120,272,2014-02-03T08:17:41Z,2025-11-02T20:24:04Z,https://github.com/SubtitleEdit/subtitleedit,http://www.nikse.dk/SubtitleEdit/Help,GNU General Public License v3.0,476564,False,False
68,ImageGlass,d2phap/ImageGlass,d2phap,"🏞 A lightweight, versatile image viewer",C#,11486,638,238,2012-12-30T16:13:14Z,2025-11-02T23:06:41Z,https://github.com/d2phap/ImageGlass,https://imageglass.org,Other,475919,False,False
69,mono,mono/mono,mono,"Mono open source ECMA CLI, C# and .NET implementation.",C#,11394,3839,2275,2010-07-22T18:06:36Z,2025-11-02T13:17:21Z,https://github.com/mono/mono,https://www.mono-project.com,Other,579418,False,False
70,PDFPatcher,wmjordan/PDFPatcher,wmjordan,PDF补丁丁——PDF工具箱，可以编辑书签、剪裁旋转页面、解除限制、提取或合并文档，探查文档结构，提取图片、转成图片等等,C#,11375,1448,96,2021-12-24T12:30:42Z,2025-11-03T01:21:13Z,https://github.com/wmjordan/PDFPatcher,https://pdfpatcher.cnblogs.com/,,60586,False,False
71,g-helper,seerge/g-helper,seerge,"Lightweight, open-source control tool for ASUS laptops and ROG Ally. Manage performance modes, fans, GPU, battery, and RGB lighting across Zephyrus, Flow, TUF, Strix, Scar, and other models.",C#,11348,409,120,2023-02-10T23:11:28Z,2025-11-02T21:13:55Z,https://github.com/seerge/g-helper,https://g-helper.com,GNU General Public License v3.0,40654,False,False
72,better-genshin-impact,babalae/better-genshin-impact,babalae,📦BetterGI · 更好的原神 - 自动拾取 | 自动剧情 | 全自动钓鱼(AI) | 全自动七圣召唤 | 自动伐木 | 自动刷本 | 自动采集/挖矿/锄地 | 一条龙 | 全连音游 - UI Automation Testing Tools For Genshin Impact,C#,11302,743,517,2023-08-27T01:02:45Z,2025-11-03T00:46:56Z,https://github.com/babalae/better-genshin-impact,https://bettergi.com,GNU General Public License v3.0,366041,False,False
73,BenchmarkDotNet,dotnet/BenchmarkDotNet,dotnet,Powerful .NET library for benchmarking,C#,11229,1028,228,2013-08-18T06:17:48Z,2025-11-02T11:27:00Z,https://github.com/dotnet/BenchmarkDotNet,https://benchmarkdotnet.org,MIT License,65265,False,False
74,Newtonsoft.Json,JamesNK/Newtonsoft.Json,JamesNK,Json.NET is a popular high-performance JSON framework for .NET,C#,11200,3312,810,2012-02-18T07:30:28Z,2025-11-01T20:08:48Z,https://github.com/JamesNK/Newtonsoft.Json,https://www.newtonsoft.com/json,MIT License,26473,False,False
75,choco,chocolatey/choco,chocolatey,Chocolatey - the package manager for Windows,C#,11064,931,499,2014-12-30T22:12:11Z,2025-11-02T18:34:31Z,https://github.com/chocolatey/choco,https://chocolatey.org,Other,45633,False,False
76,Locale-Emulator,xupefei/Locale-Emulator,xupefei,Yet Another System Region and Language Simulator,C#,11055,806,212,2013-03-17T13:51:51Z,2025-11-03T01:49:18Z,https://github.com/xupefei/Locale-Emulator,https://pooi.moe/Locale-Emulator/,GNU Lesser General Public License v3.0,1173,False,True
77,basic-computer-games,coding-horror/basic-computer-games,coding-horror,"An updated version of the classic ""Basic Computer Games"" book, with well-written examples in a variety of common MEMORY SAFE, SCRIPTING programming languages. See https://coding-horror.github.io/basic-computer-games/",C#,11024,1336,5,2021-01-30T21:28:22Z,2025-11-02T22:56:18Z,https://github.com/coding-horror/basic-computer-games,,The Unlicense,78423,False,False
78,LKY_OfficeTools,OdysseusYuan/LKY_OfficeTools,OdysseusYuan,一键自动化 下载、安装、激活 Office 的利器。,C#,10852,988,2,2022-10-27T14:58:30Z,2025-11-02T22:01:03Z,https://github.com/OdysseusYuan/LKY_OfficeTools,Email: OdysseusYuan@foxmail.com,GNU General Public License v3.0,49445,False,False
79,spectre.console,spectreconsole/spectre.console,spectreconsole,A .NET library that makes it easier to create beautiful console applications.,C#,10803,606,293,2020-07-21T09:59:20Z,2025-11-03T01:00:49Z,https://github.com/spectreconsole/spectre.console,https://spectreconsole.net,MIT License,11056,False,False
80,Dependencies,lucasg/Dependencies,lucasg,"A rewrite of the old legacy software ""depends.exe"" in C# for Windows devs to troubleshoot dll load dependencies issues.",C#,10724,868,137,2017-06-25T15:00:10Z,2025-11-03T01:17:40Z,https://github.com/lucasg/Dependencies,,MIT License,15341,False,False
81,orleans,dotnet/orleans,dotnet,Cloud Native application framework for .NET,C#,10560,2105,679,2014-12-19T14:32:50Z,2025-11-01T15:18:12Z,https://github.com/dotnet/orleans,https://docs.microsoft.com/dotnet/orleans,MIT License,70421,False,False
82,eShopOnWeb,dotnet-architecture/eShopOnWeb,dotnet-architecture,"Sample ASP.NET Core 8.0 reference application, now community supported: https://github.com/NimblePros/eShopOnWeb",C#,10557,5900,20,2017-02-28T02:39:37Z,2025-11-02T21:11:06Z,https://github.com/dotnet-architecture/eShopOnWeb,,MIT License,61146,False,True
83,Captura,MathewSachin/Captura,MathewSachin,"Capture Screen, Audio, Cursor, Mouse Clicks and Keystrokes",C#,10425,1949,120,2015-08-29T10:30:45Z,2025-11-01T17:22:07Z,https://github.com/MathewSachin/Captura,https://mathewsachin.github.io/Captura/,MIT License,5730,False,True
84,Terminal.Gui,gui-cs/Terminal.Gui,gui-cs,Cross Platform Terminal UI toolkit for .NET,C#,10395,725,184,2017-12-11T03:23:45Z,2025-11-02T23:01:25Z,https://github.com/gui-cs/Terminal.Gui,https://gui-cs.github.io/Terminal.Gui/,MIT License,116187,False,False
85,practical-aspnetcore,dodyg/practical-aspnetcore,dodyg,"Practical samples of ASP.NET Core 10 RC 2, 9, 8.0, 7.0, 6.0, 5.0, 3.1, 2.2, and 2.1,projects you can use. Readme contains explanations on all projects.",C#,10279,1403,173,2016-07-27T08:23:40Z,2025-11-02T23:47:57Z,https://github.com/dodyg/practical-aspnetcore,,MIT License,45266,False,False
