排名,项目名称,完整名称,作者,描述,语言,Stars,Forks,Issues,创建时间,更新时间,仓库链接,主页链接,许可证,大小(KB),是否Fork,是否已归档
88,EarTrumpet,File-New-Project/EarTrumpet,File-New-Project,EarTrumpet - Volume Control for Windows,C#,9812,539,100,2015-07-11T08:43:37Z,2025-07-28T08:39:56Z,https://github.com/File-New-Project/EarTrumpet,https://eartrumpet.app,Other,35434,False,False
89,better-genshin-impact,babalae/better-genshin-impact,babalae,📦BetterGI · 更好的原神 - 自动拾取 | 自动剧情 | 全自动钓鱼(AI) | 全自动七圣召唤 | 自动伐木 | 自动刷本 | 自动采集/挖矿/锄地 | 一条龙 | 全连音游 - UI Automation Testing Tools For Genshin Impact,C#,9806,641,391,2023-08-27T01:02:45Z,2025-07-28T09:43:24Z,https://github.com/babalae/better-genshin-impact,https://bettergi.com,GNU General Public License v3.0,349972,False,False
90,Hangfire,HangfireIO/Hangfire,HangfireIO,An easy way to perform background job processing in .NET and .NET Core applications. No Windows Service or separate process required,C#,9791,1731,939,2013-08-06T09:43:04Z,2025-07-28T08:04:24Z,https://github.com/HangfireIO/Hangfire,https://www.hangfire.io,Other,38980,False,False
91,RestSharp,restsharp/RestSharp,restsharp,Simple REST and HTTP API Client for .NET,C#,9764,2338,50,2009-11-16T02:01:45Z,2025-07-23T22:11:29Z,https://github.com/restsharp/RestSharp,https://restsharp.dev,Apache License 2.0,41566,False,False
92,nopCommerce,nopSolutions/nopCommerce,nopSolutions,ASP.NET Core eCommerce software. nopCommerce is a free and open-source shopping cart.,C#,9718,5616,162,2014-04-09T05:47:50Z,2025-07-28T04:39:06Z,https://github.com/nopSolutions/nopCommerce,https://www.nopcommerce.com,Other,1417154,False,False
93,UniTask,Cysharp/UniTask,Cysharp,Provides an efficient allocation free async/await integration for Unity.,C#,9656,927,19,2019-05-19T16:09:55Z,2025-07-28T07:54:58Z,https://github.com/Cysharp/UniTask,,MIT License,5694,False,False
94,MahApps.Metro,MahApps/MahApps.Metro,MahApps,A framework that allows developers to cobble together a better UI for their own WPF applications with minimal effort.,C#,9647,2450,103,2011-10-16T04:16:10Z,2025-07-27T22:04:25Z,https://github.com/MahApps/MahApps.Metro,https://mahapps.com,MIT License,121459,False,False
95,uno,unoplatform/uno,unoplatform,"Open-source platform for building cross-platform native Mobile, Web, Desktop and Embedded apps quickly.  Create rich, C#/XAML, single-codebase apps from any IDE. Hot Reload included! 90m+ NuGet Downloads!!",C#,9531,801,1558,2018-05-07T11:52:27Z,2025-07-28T09:20:22Z,https://github.com/unoplatform/uno,https://platform.uno,Apache License 2.0,286171,False,False
96,FluentTerminal,felixse/FluentTerminal,felixse,A Terminal Emulator based on UWP and web technologies.,C#,9482,457,253,2018-01-21T09:45:11Z,2025-07-28T09:29:25Z,https://github.com/felixse/FluentTerminal,,GNU General Public License v3.0,18890,False,False
97,FluentValidation,FluentValidation/FluentValidation,FluentValidation,A popular .NET validation library for building strongly-typed validation rules.,C#,9429,1249,1,2009-12-20T19:17:03Z,2025-07-25T19:36:24Z,https://github.com/FluentValidation/FluentValidation,https://fluentvalidation.net,Apache License 2.0,20002,False,False
98,Notepads,0x7c13/Notepads,0x7c13,"A modern, lightweight text editor with a minimalist design.",C#,9426,496,410,2019-06-01T01:20:33Z,2025-07-28T07:17:59Z,https://github.com/0x7c13/Notepads,https://www.NotepadsApp.com,MIT License,40407,False,False
99,Quasar,quasar/Quasar,quasar,Remote Administration Tool for Windows,C#,9418,2590,138,2014-07-08T12:27:59Z,2025-07-27T03:34:28Z,https://github.com/quasar/Quasar,,MIT License,5205,False,True
100,ET,egametang/ET,egametang,Unity3D Client And C# Server Framework,C#,9398,3177,84,2010-06-27T15:50:52Z,2025-07-27T15:39:45Z,https://github.com/egametang/ET,,Other,164591,False,False
