排名,项目名称,完整名称,作者,描述,语言,Stars,Forks,Issues,创建时间,更新时间,仓库链接,主页链接,许可证,大小(KB),是否Fork,是否已归档
1,PowerToys,microsoft/PowerToys,microsoft,Windows system utilities to maximize productivity,C#,121218,7200,6931,2019-05-01T17:44:02Z,2025-07-28T08:47:36Z,https://github.com/microsoft/PowerToys,,MIT License,440491,False,False
2,v2rayN,2dust/v2rayN,2dust,"A GUI client for Windows, Linux and macOS, support Xray and sing-box and others",C#,83848,12999,21,2019-07-30T03:47:24Z,2025-07-28T09:59:37Z,https://github.com/2dust/v2rayN,https://v2rayn.2dust.link,GNU General Public License v3.0,42642,False,False
3,shadowsocks-windows,shadowsocks/shadowsocks-windows,shadowsocks,A C# port of shadowsocks,C#,58942,16353,195,2013-01-14T07:54:16Z,2025-07-28T09:00:57Z,https://github.com/shadowsocks/shadowsocks-windows,,Other,13489,False,False
4,PowerShell,PowerShell/PowerShell,PowerShell,PowerShell for every system!,C#,48075,7743,1222,2016-01-13T23:41:35Z,2025-07-28T09:49:44Z,https://github.com/PowerShell/PowerShell,https://microsoft.com/PowerShell,MIT License,98470,False,False
5,jellyfin,jellyfin/jellyfin,jellyfin,The Free Software Media System - Server Backend & API,C#,41634,3734,510,2018-12-09T06:36:45Z,2025-07-28T08:44:42Z,https://github.com/jellyfin/jellyfin,https://jellyfin.org,GNU General Public License v2.0,69035,False,False
6,Files,files-community/Files,files-community,A modern file manager that helps users organize their files and folders.,C#,37909,2384,510,2019-01-04T18:19:14Z,2025-07-28T10:01:56Z,https://github.com/files-community/Files,https://files.community,MIT License,258212,False,False
7,aspnetcore,dotnet/aspnetcore,dotnet,"ASP.NET Core is a cross-platform .NET framework for building modern cloud-based web applications on Windows, Mac, or Linux.",C#,36914,10415,3798,2014-03-11T06:09:42Z,2025-07-28T07:37:55Z,https://github.com/dotnet/aspnetcore,https://asp.net,MIT License,366460,False,False
8,RevokeMsgPatcher,huiyadanli/RevokeMsgPatcher,huiyadanli,:trollface: A hex editor for WeChat/QQ/TIM - PC版微信/QQ/TIM防撤回补丁（我已经看到了，撤回也没用了）,C#,33621,3716,102,2019-07-21T15:12:52Z,2025-07-28T09:55:20Z,https://github.com/huiyadanli/RevokeMsgPatcher,,GNU General Public License v3.0,3693,False,False
9,ShareX,ShareX/ShareX,ShareX,"ShareX is a free and open-source application that enables users to capture or record any area of their screen with a single keystroke. It also supports uploading images, text, and various file types to a wide range of destinations.",C#,33124,3423,521,2013-10-08T23:32:10Z,2025-07-28T09:55:32Z,https://github.com/ShareX/ShareX,https://getsharex.com,GNU General Public License v3.0,63294,False,False
10,DevToys,DevToys-app/DevToys,DevToys-app,A Swiss Army knife for developers.,C#,29519,1601,277,2021-09-29T01:40:41Z,2025-07-28T10:03:34Z,https://github.com/DevToys-app/DevToys,https://devtoys.app/,MIT License,228971,False,False
11,Avalonia,AvaloniaUI/Avalonia,AvaloniaUI,"Develop Desktop, Embedded, Mobile and WebAssembly apps with C# and XAML. The most popular .NET UI client technology",C#,28264,2437,1769,2013-12-05T20:13:21Z,2025-07-28T09:35:45Z,https://github.com/AvaloniaUI/Avalonia,https://avaloniaui.net,MIT License,187963,False,False
12,dnSpy,dnSpy/dnSpy,dnSpy,.NET debugger and assembly editor,C#,27950,5340,185,2015-07-01T16:05:10Z,2025-07-28T03:54:55Z,https://github.com/dnSpy/dnSpy,,,35047,False,True
13,semantic-kernel,microsoft/semantic-kernel,microsoft,Integrate cutting-edge LLM technology quickly and easily into your apps,C#,25562,4077,483,2023-02-27T17:39:42Z,2025-07-28T09:54:13Z,https://github.com/microsoft/semantic-kernel,https://aka.ms/semantic-kernel,MIT License,88820,False,False
14,ScreenToGif,NickeManarin/ScreenToGif,NickeManarin,"🎬 ScreenToGif allows you to record a selected area of your screen, edit and save it as a gif or video.",C#,25428,2276,304,2016-08-02T01:28:59Z,2025-07-28T03:49:04Z,https://github.com/NickeManarin/ScreenToGif,http://www.screentogif.com,Microsoft Public License,25739,False,False
15,eShopOnContainers,dotnet-architecture/eShopOnContainers,dotnet-architecture,"Cross-platform .NET sample microservices and container based application that runs on Linux Windows and macOS. Powered by .NET 7, Docker Containers and Azure Kubernetes Services. Supports Visual Studio, VS for Mac and CLI based environments with Docker CLI, dotnet CLI, VS Code or any other code editor. Moved to https://github.com/dotnet/eShop.",C#,24490,10259,71,2016-10-05T22:35:23Z,2025-07-28T05:19:25Z,https://github.com/dotnet-architecture/eShopOnContainers,https://dot.net/architecture,,661091,False,True
16,WaveFunctionCollapse,mxgmn/WaveFunctionCollapse,mxgmn,Bitmap & tilemap generation from a single example with the help of ideas from quantum mechanics,C#,24160,1294,8,2016-09-30T11:53:17Z,2025-07-28T08:44:27Z,https://github.com/mxgmn/WaveFunctionCollapse,,Other,31161,False,False
17,ILSpy,icsharpcode/ILSpy,icsharpcode,".NET Decompiler with support for PDB generation, ReadyToRun, Metadata (&more) - cross-platform!",C#,23369,3512,243,2011-02-04T11:24:20Z,2025-07-28T09:54:22Z,https://github.com/icsharpcode/ILSpy,,MIT License,43797,False,False
18,maui,dotnet/maui,dotnet,".NET MAUI is the .NET Multi-platform App UI, a framework for building native device applications spanning mobile, tablet, and desktop.",C#,22814,1866,4489,2020-05-08T18:11:05Z,2025-07-28T09:56:41Z,https://github.com/dotnet/maui,https://dot.net/maui,MIT License,598702,False,False
19,CodeHub,CodeHubApp/CodeHub,CodeHubApp,CodeHub is an iOS application written using Xamarin,C#,22740,614,237,2013-07-23T22:19:57Z,2025-07-26T04:30:41Z,https://github.com/CodeHubApp/CodeHub,http://www.codehub-app.com,,75636,False,True
20,SteamTools,BeyondDimension/SteamTools,BeyondDimension,🛠「Watt Toolkit」是一个开源跨平台的多功能 Steam 工具箱。,C#,22656,1486,1043,2020-12-15T13:52:11Z,2025-07-28T09:53:33Z,https://github.com/BeyondDimension/SteamTools,https://steampp.net,GNU General Public License v3.0,267926,False,False
21,awesome-dotnet-core,thangchung/awesome-dotnet-core,thangchung,":honeybee: A collection of awesome .NET core libraries, tools, frameworks and software",C#,20643,2930,179,2016-03-17T03:52:09Z,2025-07-28T05:50:55Z,https://github.com/thangchung/awesome-dotnet-core,,,1368,False,False
22,QuickLook,QL-Win/QuickLook,QL-Win,Bring macOS “Quick Look” feature to Windows,C#,20450,1166,186,2017-04-12T14:57:38Z,2025-07-28T09:06:24Z,https://github.com/QL-Win/QuickLook,,GNU General Public License v3.0,324827,False,False
23,roslyn,dotnet/roslyn,dotnet,The Roslyn .NET compiler provides C# and Visual Basic languages with rich code analysis APIs.,C#,19709,4146,6982,2015-01-11T02:39:03Z,2025-07-27T22:16:06Z,https://github.com/dotnet/roslyn,https://docs.microsoft.com/dotnet/csharp/roslyn-sdk/,MIT License,2346024,False,False
24,ml-agents,Unity-Technologies/ml-agents,Unity-Technologies,The Unity Machine Learning Agents Toolkit (ML-Agents) is an open-source project that enables games and simulations to serve as environments for training intelligent agents using deep reinforcement learning and imitation learning.,C#,18455,4318,55,2017-09-08T21:09:04Z,2025-07-28T07:41:41Z,https://github.com/Unity-Technologies/ml-agents,https://unity.com/products/machine-learning-agents,Other,3023579,False,False
25,CMWTAT_Digital_Edition,TGSAN/CMWTAT_Digital_Edition,TGSAN,"CloudMoe Windows 10/11 Activation Toolkit get digital license, the best open source Win 10/11 activator in GitHub. GitHub 上最棒的开源 Win10/Win11 数字权利（数字许可证）激活工具！",C#,18083,2116,31,2018-05-27T13:45:02Z,2025-07-28T09:33:09Z,https://github.com/TGSAN/CMWTAT_Digital_Edition,https://cmwtat.cloudmoe.com,Other,59447,False,False
26,PEASS-ng,peass-ng/PEASS-ng,peass-ng,PEASS - Privilege Escalation Awesome Scripts SUITE (with colors),C#,17997,3265,26,2019-01-13T19:58:24Z,2025-07-28T09:07:24Z,https://github.com/peass-ng/PEASS-ng,https://book.hacktricks.xyz,Other,64179,False,False
27,Dapper,DapperLib/Dapper,DapperLib,Dapper - a simple object mapper for .Net,C#,17996,3681,527,2011-04-14T08:42:59Z,2025-07-28T02:52:43Z,https://github.com/DapperLib/Dapper,https://www.learndapper.com/,Other,49973,False,False
28,CleanArchitecture,ardalis/CleanArchitecture,ardalis,Clean Architecture Solution Template: A proven Clean Architecture Template for ASP.NET Core 9,C#,17244,2948,32,2016-09-30T14:19:20Z,2025-07-28T07:57:48Z,https://github.com/ardalis/CleanArchitecture,,MIT License,3326,False,False
29,UniGetUI,marticliment/UniGetUI,marticliment,UniGetUI: The Graphical Interface for your package managers. Could be terribly described as a package manager manager to manage your package managers,C#,17109,560,210,2021-06-15T12:57:58Z,2025-07-28T08:42:58Z,https://github.com/marticliment/UniGetUI,https://www.marticliment.com/unigetui/,MIT License,888619,False,False
30,osu,ppy/osu,ppy,rhythm is just a *click* away!,C#,16956,2485,1569,2014-07-31T04:26:30Z,2025-07-28T09:45:05Z,https://github.com/ppy/osu,https://osu.ppy.sh,MIT License,185337,False,False
31,server,bitwarden/server,bitwarden,"Bitwarden infrastructure/backend (API, database, Docker, etc).",C#,16898,1425,209,2015-11-23T23:45:33Z,2025-07-28T09:06:00Z,https://github.com/bitwarden/server,https://bitwarden.com,Other,38831,False,False
32,netch,netchx/netch,netchx,A simple proxy client,C#,16894,2770,0,2019-06-25T09:55:30Z,2025-07-28T00:27:20Z,https://github.com/netchx/netch,,GNU General Public License v3.0,11387,False,False
33,lively,rocksdanister/lively,rocksdanister,Free and open-source software that allows users to set animated desktop wallpapers and screensavers powered by WinUI 3.,C#,16770,1145,311,2019-08-08T05:57:26Z,2025-07-28T07:58:26Z,https://github.com/rocksdanister/lively,https://rocksdanister.com/lively,GNU General Public License v3.0,295210,False,False
34,runtime,dotnet/runtime,dotnet,".NET is a cross-platform runtime for cloud, mobile, desktop, and IoT apps.",C#,16677,5095,8501,2019-09-24T23:36:39Z,2025-07-28T09:10:34Z,https://github.com/dotnet/runtime,https://docs.microsoft.com/dotnet/core/,MIT License,974275,False,False
35,optimizer,hellzerg/optimizer,hellzerg,The finest Windows Optimizer,C#,16443,1051,75,2017-09-13T07:49:36Z,2025-07-28T08:57:54Z,https://github.com/hellzerg/optimizer,,GNU General Public License v3.0,47555,False,False
36,OpenRA,OpenRA/OpenRA,OpenRA,"Open Source real-time strategy game engine for early Westwood games such as Command & Conquer: Red Alert written in C# using SDL and OpenGL. Runs on Windows, Linux, *BSD and Mac OS X.",C#,15742,2780,1535,2010-10-04T07:38:05Z,2025-07-28T07:32:16Z,https://github.com/OpenRA/OpenRA,https://www.openra.net,GNU General Public License v3.0,345170,False,False
37,MaterialDesignInXamlToolkit,MaterialDesignInXAML/MaterialDesignInXamlToolkit,MaterialDesignInXAML,"Google's Material Design in XAML & WPF, for C# & VB.Net. ",C#,15730,3481,170,2015-02-07T23:30:48Z,2025-07-28T10:02:39Z,https://github.com/MaterialDesignInXAML/MaterialDesignInXamlToolkit,http://materialdesigninxaml.net,MIT License,72867,False,False
38,ContextMenuManager,BluePointLilac/ContextMenuManager,BluePointLilac,🖱️ 纯粹的Windows右键菜单管理程序,C#,15699,716,146,2020-10-15T06:27:04Z,2025-07-28T08:44:03Z,https://github.com/BluePointLilac/ContextMenuManager,https://bluepointlilac.github.io/ContextMenuManager,GNU General Public License v3.0,1843,False,False
39,Bulk-Crap-Uninstaller,Klocman/Bulk-Crap-Uninstaller,Klocman,Remove large amounts of unwanted applications quickly.,C#,15390,707,109,2016-08-01T15:17:05Z,2025-07-28T06:56:35Z,https://github.com/Klocman/Bulk-Crap-Uninstaller,https://www.bcuninstaller.com/,Apache License 2.0,11164,False,False
40,N_m3u8DL-CLI,nilaoda/N_m3u8DL-CLI,nilaoda,"[.NET] m3u8 downloader 开源的命令行m3u8/HLS/dash下载器，支持普通AES-128-CBC解密，多线程，自定义请求头等. 支持简体中文,繁体中文和英文. English Supported.",C#,15299,2259,254,2019-04-18T13:43:49Z,2025-07-28T08:55:48Z,https://github.com/nilaoda/N_m3u8DL-CLI,https://nilaoda.github.io/N_m3u8DL-CLI/,MIT License,6399,False,False
41,AssetStudio,Perfare/AssetStudio,Perfare,"AssetStudio is a tool for exploring, extracting and exporting assets and assetbundles.",C#,14374,2751,184,2016-08-02T11:59:11Z,2025-07-28T04:55:26Z,https://github.com/Perfare/AssetStudio,,MIT License,40176,False,True
42,efcore,dotnet/efcore,dotnet,"EF Core is a modern object-database mapper for .NET. It supports LINQ queries, change tracking, updates, and schema migrations.",C#,14229,3284,2444,2014-01-23T00:52:01Z,2025-07-27T12:00:54Z,https://github.com/dotnet/efcore,https://learn.microsoft.com/ef/,MIT License,209391,False,False
43,Polly,App-vNext/Polly,App-vNext,"Polly is a .NET resilience and transient-fault-handling library that allows developers to express policies such as Retry, Circuit Breaker, Timeout, Bulkhead Isolation, and Fallback in a fluent and thread-safe manner. From version 6.0.1, Polly targets .NET Standard 1.1 and 2.0+.",C#,13877,1259,12,2013-05-05T04:40:04Z,2025-07-28T01:38:16Z,https://github.com/App-vNext/Polly,https://www.thepollyproject.org,"BSD 3-Clause ""New"" or ""Revised"" License",45597,False,False
44,Jackett,Jackett/Jackett,Jackett,API Support for your favorite torrent trackers,C#,13724,1372,208,2015-10-29T16:23:19Z,2025-07-28T09:47:10Z,https://github.com/Jackett/Jackett,,GNU General Public License v2.0,39090,False,False
45,abp,abpframework/abp,abpframework,"Open-source web application framework for ASP.NET Core! Offers an opinionated architecture to build enterprise software solutions with best practices on top of the .NET. Provides the fundamental infrastructure, cross-cutting-concern implementations, startup templates, application modules, UI themes, tooling and documentation.",C#,13658,3591,358,2016-12-03T22:56:24Z,2025-07-28T07:06:06Z,https://github.com/abpframework/abp,https://abp.io,GNU Lesser General Public License v3.0,1701753,False,False
46,QuestPDF,QuestPDF/QuestPDF,QuestPDF,"Generate and edit PDF documents in your .NET applications using the open-source QuestPDF library and its C# Fluent API. Build invoices, reports and data exports with ease.",C#,13138,698,189,2021-01-04T22:47:16Z,2025-07-27T22:48:05Z,https://github.com/QuestPDF/QuestPDF,https://www.questpdf.com,Other,571261,False,False
47,winsw,winsw/winsw,winsw,"A wrapper executable that can run any executable as a Windows service, in a permissive license.",C#,13091,1641,237,2010-02-03T02:49:39Z,2025-07-28T08:24:59Z,https://github.com/winsw/winsw,,MIT License,3510,False,False
48,AspNetCore.Docs,dotnet/AspNetCore.Docs,dotnet,Documentation for ASP.NET Core,C#,12936,25159,603,2014-12-19T17:38:02Z,2025-07-28T06:24:22Z,https://github.com/dotnet/AspNetCore.Docs,https://docs.microsoft.com/aspnet/core,Creative Commons Attribution 4.0 International,852100,False,False
49,duplicati,duplicati/duplicati,duplicati,Store securely encrypted backups in the cloud!,C#,12927,978,699,2014-08-05T08:28:16Z,2025-07-28T05:14:32Z,https://github.com/duplicati/duplicati,,MIT License,186435,False,False
50,UnityCsReference,Unity-Technologies/UnityCsReference,Unity-Technologies,Unity C# reference source code.,C#,12396,2535,16,2018-03-23T13:08:32Z,2025-07-27T22:34:04Z,https://github.com/Unity-Technologies/UnityCsReference,,Other,71411,False,False
51,modular-monolith-with-ddd,kgrzybek/modular-monolith-with-ddd,kgrzybek,Full Modular Monolith application with Domain-Driven Design approach.,C#,12383,1967,65,2019-08-23T00:12:03Z,2025-07-28T09:26:39Z,https://github.com/kgrzybek/modular-monolith-with-ddd,,MIT License,8423,False,False
52,YoutubeDownloader,Tyrrrz/YoutubeDownloader,Tyrrrz,Downloads videos and playlists from YouTube,C#,12367,1586,22,2018-11-16T11:30:50Z,2025-07-28T08:30:07Z,https://github.com/Tyrrrz/YoutubeDownloader,,MIT License,1325,False,False
53,MonoGame,MonoGame/MonoGame,MonoGame,One framework for creating powerful cross-platform games.,C#,12362,2973,747,2011-04-07T00:23:40Z,2025-07-28T04:32:09Z,https://github.com/MonoGame/MonoGame,http://www.monogame.net,Other,97491,False,False
54,ArchiSteamFarm,JustArchiNET/ArchiSteamFarm,JustArchiNET,C# application with primary purpose of farming Steam cards from multiple accounts simultaneously.,C#,12267,1086,3,2015-10-25T05:12:33Z,2025-07-28T09:57:11Z,https://github.com/JustArchiNET/ArchiSteamFarm,,Apache License 2.0,237559,False,False
55,csharplang,dotnet/csharplang,dotnet,The official repo for the design of the C# programming language,C#,12167,1053,257,2016-12-09T01:45:27Z,2025-07-28T01:23:41Z,https://github.com/dotnet/csharplang,,,14842,False,False
56,Sonarr,Sonarr/Sonarr,Sonarr,Smart PVR for newsgroup and bittorrent users.,C#,12121,1608,118,2011-09-27T05:57:16Z,2025-07-28T08:39:50Z,https://github.com/Sonarr/Sonarr,https://sonarr.tv,GNU General Public License v3.0,300338,False,False
57,BBDown,nilaoda/BBDown,nilaoda,Bilibili Downloader. 一个命令行式哔哩哔哩下载器.,C#,12092,1447,209,2020-07-26T11:43:28Z,2025-07-28T09:02:29Z,https://github.com/nilaoda/BBDown,,MIT License,18874,False,False
58,aspnetboilerplate,aspnetboilerplate/aspnetboilerplate,aspnetboilerplate,ASP.NET Boilerplate - Web Application Framework,C#,11945,3822,158,2013-08-18T20:45:08Z,2025-07-26T18:12:56Z,https://github.com/aspnetboilerplate/aspnetboilerplate,https://aspnetboilerplate.com,MIT License,65080,False,False
59,Lean,QuantConnect/Lean,QuantConnect,"Lean Algorithmic Trading Engine by QuantConnect (Python, C#)",C#,11893,3606,256,2014-11-28T04:20:19Z,2025-07-28T08:26:19Z,https://github.com/QuantConnect/Lean,https://lean.io,Apache License 2.0,545285,False,False
60,Radarr,Radarr/Radarr,Radarr,Movie organizer/manager for usenet and torrent users.,C#,11862,1068,389,2016-12-25T11:38:26Z,2025-07-28T08:38:10Z,https://github.com/Radarr/Radarr,https://radarr.video,GNU General Public License v3.0,315918,False,False
61,EverythingToolbar,srwi/EverythingToolbar,srwi,Everything integration for the Windows taskbar.,C#,11860,483,31,2020-09-13T17:20:21Z,2025-07-28T09:56:29Z,https://github.com/srwi/EverythingToolbar,,Other,6693,False,False
62,MediatR,LuckyPennySoftware/MediatR,LuckyPennySoftware,"Simple, unambitious mediator implementation in .NET",C#,11721,2126,4,2014-03-03T15:01:22Z,2025-07-28T09:26:45Z,https://github.com/LuckyPennySoftware/MediatR,,Other,5987,False,False
63,garnet,microsoft/garnet,microsoft,"Garnet is a remote cache-store from Microsoft Research that offers strong performance (throughput and latency), scalability, storage, recovery, cluster sharding, key migration, and replication features. Garnet can work with existing Redis clients.",C#,11370,587,43,2023-08-21T21:54:58Z,2025-07-27T12:38:33Z,https://github.com/microsoft/garnet,https://microsoft.github.io/garnet/,MIT License,4555458,False,False
64,mono,mono/mono,mono,"Mono open source ECMA CLI, C# and .NET implementation.",C#,11332,3835,2274,2010-07-22T18:06:36Z,2025-07-27T22:16:07Z,https://github.com/mono/mono,https://www.mono-project.com,Other,579418,False,False
65,Newtonsoft.Json,JamesNK/Newtonsoft.Json,JamesNK,Json.NET is a popular high-performance JSON framework for .NET,C#,11119,3302,806,2012-02-18T07:30:28Z,2025-07-27T05:00:26Z,https://github.com/JamesNK/Newtonsoft.Json,https://www.newtonsoft.com/json,MIT License,26458,False,False
66,Playnite,JosefNemec/Playnite,JosefNemec,"Video game library manager with support for wide range of 3rd party libraries and game emulation support, providing one unified interface for your games.",C#,11105,554,678,2017-03-25T19:16:06Z,2025-07-28T09:51:33Z,https://github.com/JosefNemec/Playnite,https://playnite.link,MIT License,68639,False,False
67,BenchmarkDotNet,dotnet/BenchmarkDotNet,dotnet,Powerful .NET library for benchmarking,C#,11084,1016,238,2013-08-18T06:17:48Z,2025-07-28T01:11:29Z,https://github.com/dotnet/BenchmarkDotNet,https://benchmarkdotnet.org,MIT License,54420,False,False
68,basic-computer-games,coding-horror/basic-computer-games,coding-horror,"An updated version of the classic ""Basic Computer Games"" book, with well-written examples in a variety of common MEMORY SAFE, SCRIPTING programming languages. See https://coding-horror.github.io/basic-computer-games/",C#,11006,1344,22,2021-01-30T21:28:22Z,2025-07-28T10:03:37Z,https://github.com/coding-horror/basic-computer-games,,The Unlicense,78428,False,False
69,choco,chocolatey/choco,chocolatey,Chocolatey - the package manager for Windows,C#,10916,919,693,2014-12-30T22:12:11Z,2025-07-28T02:08:47Z,https://github.com/chocolatey/choco,https://chocolatey.org,Other,44564,False,False
70,ImageGlass,d2phap/ImageGlass,d2phap,"🏞 A lightweight, versatile image viewer",C#,10854,617,222,2012-12-30T16:13:14Z,2025-07-28T08:42:07Z,https://github.com/d2phap/ImageGlass,https://imageglass.org,Other,474227,False,False
71,Locale-Emulator,xupefei/Locale-Emulator,xupefei,Yet Another System Region and Language Simulator,C#,10796,799,212,2013-03-17T13:51:51Z,2025-07-27T11:24:12Z,https://github.com/xupefei/Locale-Emulator,https://pooi.moe/Locale-Emulator/,GNU Lesser General Public License v3.0,1173,False,True
72,subtitleedit,SubtitleEdit/subtitleedit,SubtitleEdit,the subtitle editor :),C#,10635,1057,190,2014-02-03T08:17:41Z,2025-07-28T09:43:43Z,https://github.com/SubtitleEdit/subtitleedit,http://www.nikse.dk/SubtitleEdit/Help,GNU General Public License v3.0,469928,False,False
73,FileConverter,Tichau/FileConverter,Tichau,File Converter is a very simple tool which allows you to convert and compress files using the context menu in windows explorer.,C#,10597,726,228,2015-04-06T10:15:53Z,2025-07-28T06:31:11Z,https://github.com/Tichau/FileConverter,https://file-converter.io/,GNU General Public License v3.0,213001,False,False
74,g-helper,seerge/g-helper,seerge,"Lightweight Armoury Crate alternative for Asus laptops and ROG Ally. Control tool for ROG Zephyrus G14, G15, G16, M16, Flow X13, Flow X16, TUF, Strix, Scar and other models",C#,10466,378,95,2023-02-10T23:11:28Z,2025-07-28T07:58:24Z,https://github.com/seerge/g-helper,https://g-helper.com,GNU General Public License v3.0,40130,False,False
75,eShopOnWeb,dotnet-architecture/eShopOnWeb,dotnet-architecture,"Sample ASP.NET Core 8.0 reference application, now community supported: https://github.com/NimblePros/eShopOnWeb",C#,10458,5809,20,2017-02-28T02:39:37Z,2025-07-28T01:58:32Z,https://github.com/dotnet-architecture/eShopOnWeb,,MIT License,61146,False,True
76,spectre.console,spectreconsole/spectre.console,spectreconsole,A .NET library that makes it easier to create beautiful console applications.,C#,10457,578,276,2020-07-21T09:59:20Z,2025-07-28T08:28:54Z,https://github.com/spectreconsole/spectre.console,https://spectreconsole.net,MIT License,10965,False,False
77,Flow.Launcher,Flow-Launcher/Flow.Launcher,Flow-Launcher,:mag: Quick file search & app launcher for Windows with community-made plugins,C#,10443,392,236,2020-04-21T08:12:15Z,2025-07-28T09:43:42Z,https://github.com/Flow-Launcher/Flow.Launcher,https://flowlauncher.com,MIT License,96591,False,False
78,orleans,dotnet/orleans,dotnet,Cloud Native application framework for .NET,C#,10441,2092,634,2014-12-19T14:32:50Z,2025-07-28T07:55:26Z,https://github.com/dotnet/orleans,https://docs.microsoft.com/dotnet/orleans,MIT License,70337,False,False
79,Captura,MathewSachin/Captura,MathewSachin,"Capture Screen, Audio, Cursor, Mouse Clicks and Keystrokes",C#,10322,1931,120,2015-08-29T10:30:45Z,2025-07-28T06:43:02Z,https://github.com/MathewSachin/Captura,https://mathewsachin.github.io/Captura/,MIT License,5730,False,True
80,LKY_OfficeTools,OdysseusYuan/LKY_OfficeTools,OdysseusYuan,一键自动化 下载、安装、激活 Office 的利器。,C#,10310,943,7,2022-10-27T14:58:30Z,2025-07-28T08:07:42Z,https://github.com/OdysseusYuan/LKY_OfficeTools,Email: OdysseusYuan@foxmail.com,GNU General Public License v3.0,49445,False,False
81,Dependencies,lucasg/Dependencies,lucasg,"A rewrite of the old legacy software ""depends.exe"" in C# for Windows devs to troubleshoot dll load dependencies issues.",C#,10266,825,135,2017-06-25T15:00:10Z,2025-07-28T09:16:25Z,https://github.com/lucasg/Dependencies,,MIT License,15341,False,False
82,Terminal.Gui,gui-cs/Terminal.Gui,gui-cs,Cross Platform Terminal UI toolkit for .NET,C#,10215,720,185,2017-12-11T03:23:45Z,2025-07-28T07:23:07Z,https://github.com/gui-cs/Terminal.Gui,https://gui-cs.github.io/Terminal.Gui/,MIT License,106211,False,False
83,PDFPatcher,wmjordan/PDFPatcher,wmjordan,PDF补丁丁——PDF工具箱，可以编辑书签、剪裁旋转页面、解除限制、提取或合并文档，探查文档结构，提取图片、转成图片等等,C#,10190,1330,91,2021-12-24T12:30:42Z,2025-07-28T09:14:16Z,https://github.com/wmjordan/PDFPatcher,https://pdfpatcher.cnblogs.com/,,48000,False,False
84,AutoMapper,LuckyPennySoftware/AutoMapper,LuckyPennySoftware,A convention-based object-object mapper in .NET. ,C#,10149,2363,8,2010-02-06T15:17:58Z,2025-07-27T03:41:45Z,https://github.com/LuckyPennySoftware/AutoMapper,https://automapper.io,Other,127255,False,False
85,CefSharp,cefsharp/CefSharp,cefsharp,.NET (WPF and Windows Forms) bindings for the Chromium Embedded Framework,C#,10090,2940,68,2010-12-03T15:23:23Z,2025-07-28T08:32:00Z,https://github.com/cefsharp/CefSharp,http://cefsharp.github.io/,Other,288812,False,False
86,practical-aspnetcore,dodyg/practical-aspnetcore,dodyg,"Practical samples of ASP.NET Core 10 Preview 5, 9, 8.0, 7.0, 6.0, 5.0, 3.1, 2.2, and 2.1,projects you can use. Readme contains explanations on all projects.",C#,10010,1362,174,2016-07-27T08:23:40Z,2025-07-27T21:07:41Z,https://github.com/dodyg/practical-aspnetcore,,MIT License,45079,False,False
87,mRemoteNG,mRemoteNG/mRemoteNG,mRemoteNG,"mRemoteNG is the next generation of mRemote, open source, tabbed, multi-protocol, remote connections manager.",C#,9952,1475,876,2010-01-06T15:53:17Z,2025-07-26T17:58:52Z,https://github.com/mRemoteNG/mRemoteNG,https://mRemoteNG.org/,GNU General Public License v2.0,265421,False,False
