排名,项目名称,完整名称,作者,描述,语言,Stars,Forks,Issues,创建时间,更新时间,仓库链接,主页链接,许可证,大小(KB),是否Fork,是否已归档
86,mRemoteNG,mRemoteNG/mRemoteNG,mRemoteNG,"mRemoteNG is the next generation of mRemote, open source, tabbed, multi-protocol, remote connections manager.",C#,10274,1513,822,2010-01-06T15:53:17Z,2025-11-03T01:53:43Z,https://github.com/mRemoteNG/mRemoteNG,https://mRemoteNG.org/,GNU General Public License v2.0,268191,False,False
87,AutoMapper,LuckyPennySoftware/AutoMapper,LuckyPennySoftware,A convention-based object-object mapper in .NET. ,C#,10187,2383,3,2010-02-06T15:17:58Z,2025-11-02T12:35:21Z,https://github.com/LuckyPennySoftware/AutoMapper,https://automapper.io,Other,127339,False,False
88,CefSharp,cefsharp/CefSharp,cefsharp,.NET (WPF and Windows Forms) bindings for the Chromium Embedded Framework,C#,10146,2950,65,2010-12-03T15:23:23Z,2025-11-02T05:10:30Z,https://github.com/cefsharp/CefSharp,http://cefsharp.github.io/,Other,289867,False,False
89,EarTrumpet,File-New-Project/EarTrumpet,File-New-Project,EarTrumpet - Volume Control for Windows,C#,10142,548,89,2015-07-11T08:43:37Z,2025-11-02T22:54:46Z,https://github.com/File-New-Project/EarTrumpet,https://eartrumpet.app,Other,35498,False,False
90,UniTask,Cysharp/UniTask,Cysharp,Provides an efficient allocation free async/await integration for Unity.,C#,10071,942,25,2019-05-19T16:09:55Z,2025-11-02T22:03:37Z,https://github.com/Cysharp/UniTask,,MIT License,6066,False,False
91,Hangfire,HangfireIO/Hangfire,HangfireIO,An easy way to perform background job processing in .NET and .NET Core applications. No Windows Service or separate process required,C#,9898,1740,944,2013-08-06T09:43:04Z,2025-11-02T19:04:32Z,https://github.com/HangfireIO/Hangfire,https://www.hangfire.io,Other,39034,False,False
92,nopCommerce,nopSolutions/nopCommerce,nopSolutions,ASP.NET Core eCommerce software. nopCommerce is a free and open-source shopping cart.,C#,9837,5731,163,2014-04-09T05:47:50Z,2025-11-02T14:10:48Z,https://github.com/nopSolutions/nopCommerce,https://www.nopcommerce.com,Other,1568583,False,False
93,MudBlazor,MudBlazor/MudBlazor,MudBlazor,Blazor Component Library based on Material Design principles with an emphasis on ease of use and extensibility,C#,9798,1547,1312,2020-08-18T10:47:27Z,2025-11-02T22:03:11Z,https://github.com/MudBlazor/MudBlazor,http://mudblazor.com,MIT License,39980,False,False
94,RestSharp,restsharp/RestSharp,restsharp,Simple REST and HTTP API Client for .NET,C#,9792,2336,51,2009-11-16T02:01:45Z,2025-10-31T02:05:05Z,https://github.com/restsharp/RestSharp,https://restsharp.dev,Apache License 2.0,41438,False,False
95,MahApps.Metro,MahApps/MahApps.Metro,MahApps,A framework that allows developers to cobble together a better UI for their own WPF applications with minimal effort.,C#,9698,2453,106,2011-10-16T04:16:10Z,2025-11-02T19:54:07Z,https://github.com/MahApps/MahApps.Metro,https://mahapps.com,MIT License,121532,False,False
96,uno,unoplatform/uno,unoplatform,"Open-source platform for building cross-platform native Mobile, Web, Desktop and Embedded apps quickly.  Create rich, C#/XAML, single-codebase apps from any IDE. Hot Reload included! 90m+ NuGet Downloads!!",C#,9676,821,1412,2018-05-07T11:52:27Z,2025-11-02T11:30:13Z,https://github.com/unoplatform/uno,https://platform.uno,Apache License 2.0,289650,False,False
97,Notepads,0x7c13/Notepads,0x7c13,"A modern, lightweight text editor with a minimalist design.",C#,9660,517,426,2019-06-01T01:20:33Z,2025-11-02T20:12:50Z,https://github.com/0x7c13/Notepads,https://www.NotepadsApp.com,MIT License,40432,False,False
98,DiscordChatExporter,Tyrrrz/DiscordChatExporter,Tyrrrz,Saves Discord chat logs to a file,C#,9570,845,20,2017-07-12T17:18:19Z,2025-11-03T01:58:57Z,https://github.com/Tyrrrz/DiscordChatExporter,,MIT License,3514,False,False
99,Quasar,quasar/Quasar,quasar,Remote Administration Tool for Windows,C#,9561,2625,138,2014-07-08T12:27:59Z,2025-11-03T01:11:54Z,https://github.com/quasar/Quasar,,MIT License,5205,False,True
100,eShop,dotnet/eShop,dotnet,A reference .NET application implementing an eCommerce site,C#,9547,3210,151,2023-10-18T23:00:45Z,2025-11-02T18:50:17Z,https://github.com/dotnet/eShop,,MIT License,25354,False,False
