排名,项目名称,完整名称,作者,描述,语言,Stars,Forks,Issues,创建时间,更新时间,仓库链接,主页链接,许可证,大小(KB),是否Fork,是否已归档
1,linux,torvalds/linux,torvalds,Linux kernel source tree,C,201558,57620,502,2011-09-04T22:48:12Z,2025-09-08T01:25:02Z,https://github.com/torvalds/linux,,Other,5659901,False,False
2,scrcpy,Genymobile/scrcpy,Genymobile,Display and control your Android device,C,127680,11967,2523,2017-11-21T18:00:27Z,2025-09-08T01:44:47Z,https://github.com/Genymobile/scrcpy,,Apache License 2.0,7586,False,False
3,netdata,netdata/netdata,netdata,"The fastest path to AI-powered full stack observability, even for lean teams.",C,75761,6141,241,2013-06-17T18:39:10Z,2025-09-08T00:08:00Z,https://github.com/netdata/netdata,https://www.netdata.cloud,GNU General Public License v3.0,237892,False,False
4,redis,redis/redis,redis,"For developers, who are building real-time data-driven applications, Redis is the preferred, fastest, and most feature-rich cache, data structure server, and document and vector query engine.",C,70779,24214,2668,2009-03-21T22:32:25Z,2025-09-08T01:33:34Z,https://github.com/redis/redis,http://redis.io,Other,203105,False,False
5,Ventoy,ventoy/Ventoy,ventoy,A new bootable USB solution.,C,70474,4470,961,2020-03-10T15:19:19Z,2025-09-08T01:49:10Z,https://github.com/ventoy/Ventoy,https://www.ventoy.net,GNU General Public License v3.0,218248,False,False
6,obs-studio,obsproject/obs-studio,obsproject,OBS Studio - Free and open source software for live streaming and screen recording,C,66671,8670,987,2013-10-01T02:40:31Z,2025-09-08T00:31:16Z,https://github.com/obsproject/obs-studio,https://obsproject.com,GNU General Public License v2.0,77724,False,False
7,git,git/git,git,Git Source Code Mirror - This is a publish-only repository but pull requests can be turned into patches to the mailing list via GitGitGadget (https://gitgitgadget.github.io/). Please follow Documentation/SubmittingPatches procedure for any of your improvements.,C,56371,26622,258,2008-07-23T14:21:26Z,2025-09-08T00:52:34Z,https://github.com/git/git,,Other,285392,False,False
8,FFmpeg,FFmpeg/FFmpeg,FFmpeg,Mirror of https://git.ffmpeg.org/ffmpeg.git,C,53040,13015,3,2011-04-14T14:12:38Z,2025-09-08T00:20:36Z,https://github.com/FFmpeg/FFmpeg,https://ffmpeg.org/,Other,449988,False,False
9,wrk,wg/wrk,wg,Modern HTTP benchmarking tool,C,39458,3015,201,2012-03-20T11:12:28Z,2025-09-08T00:26:08Z,https://github.com/wg/wrk,,Other,38743,False,False
10,php-src,php/php-src,php,The PHP Interpreter,C,39425,7932,1530,2011-06-16T01:52:25Z,2025-09-08T00:30:50Z,https://github.com/php/php-src,https://www.php.net,Other,607258,False,False
11,tmux,tmux/tmux,tmux,tmux source code,C,38841,2262,63,2015-06-03T23:32:55Z,2025-09-08T00:19:39Z,https://github.com/tmux/tmux,,Other,17979,False,False
12,curl,curl/curl,curl,"A command line tool and library for transferring data with URL syntax, supporting DICT, FILE, FTP, FTPS, GOPHER, GOPHERS, HTTP, HTTPS, IMAP, IMAPS, LDAP, LDAPS, MQTT, POP3, POP3S, RTMP, RTMPS, RTSP, SCP, SFTP, SMB, SMBS, SMTP, SMTPS, TELNET, TFTP, WS and WSS. libcurl offers a myriad of powerful features",C,38746,6844,33,2010-03-18T22:32:22Z,2025-09-08T00:42:54Z,https://github.com/curl/curl,https://curl.se/,Other,112819,False,False
13,ijkplayer,bilibili/ijkplayer,bilibili,"Android/iOS video player based on FFmpeg n3.4, with MediaCodec, VideoToolbox support.",C,33005,8215,2886,2013-06-03T04:12:04Z,2025-09-07T16:06:22Z,https://github.com/bilibili/ijkplayer,,GNU General Public License v2.0,8283,False,False
14,rufus,pbatard/rufus,pbatard,The Reliable USB Formatting Utility,C,32533,2806,11,2011-11-19T19:12:05Z,2025-09-08T01:09:27Z,https://github.com/pbatard/rufus,https://rufus.ie,GNU General Public License v3.0,42876,False,False
15,jq,jqlang/jq,jqlang,Command-line JSON processor,C,32518,1661,446,2012-07-18T19:57:25Z,2025-09-07T21:22:36Z,https://github.com/jqlang/jq,https://jqlang.org,Other,7251,False,False
16,my-tv,lizongying/my-tv,lizongying,我的电视 电视直播软件，安装即可使用,C,32163,3606,148,2023-12-04T12:18:39Z,2025-09-07T15:47:13Z,https://github.com/lizongying/my-tv,https://lyrics.run/my-tv.html,,72954,False,False
17,mpv,mpv-player/mpv,mpv-player,🎥 Command line media player,C,31970,3116,1019,2012-10-13T08:08:44Z,2025-09-08T01:09:33Z,https://github.com/mpv-player/mpv,https://mpv.io,Other,110573,False,False
18,lede,coolsnowwolf/lede,coolsnowwolf,Lean's LEDE source,C,30959,19546,772,2017-09-06T07:39:03Z,2025-09-08T00:57:51Z,https://github.com/coolsnowwolf/lede,,Other,320676,False,False
19,stb,nothings/stb,nothings,stb single-file public domain libraries for C/C++,C,29899,7886,352,2014-05-25T16:51:23Z,2025-09-08T01:25:16Z,https://github.com/nothings/stb,https://twitter.com/nothings,Other,5774,False,False
20,os-tutorial,cfenollosa/os-tutorial,cfenollosa,How to create an OS from scratch,C,28774,3437,124,2014-09-29T08:39:34Z,2025-09-08T01:33:18Z,https://github.com/cfenollosa/os-tutorial,,"BSD 3-Clause ""New"" or ""Revised"" License",152,False,False
21,ExplorerPatcher,valinet/ExplorerPatcher,valinet,This project aims to enhance the working environment on Windows,C,28712,1175,283,2021-08-09T14:17:24Z,2025-09-08T01:23:01Z,https://github.com/valinet/ExplorerPatcher,,GNU General Public License v2.0,9215,False,False
22,openssl,openssl/openssl,openssl,TLS/SSL and crypto library,C,28488,10808,1621,2013-01-15T22:34:48Z,2025-09-08T00:35:16Z,https://github.com/openssl/openssl,https://www.openssl.org,Apache License 2.0,300231,False,False
23,raylib,raysan5/raylib,raysan5,A simple and easy-to-use library to enjoy videogames programming,C,28065,2654,26,2013-10-24T15:46:04Z,2025-09-08T01:49:17Z,https://github.com/raysan5/raylib,http://www.raylib.com,zlib License,410021,False,False
24,nginx,nginx/nginx,nginx,The official NGINX Open Source repository.,C,27940,7506,287,2015-06-23T10:26:27Z,2025-09-07T21:15:31Z,https://github.com/nginx/nginx,https://nginx.org/,"BSD 2-Clause ""Simplified"" License",75001,False,False
25,WindTerm,kingToolbox/WindTerm,kingToolbox,A professional cross-platform SSH/Sftp/Shell/Telnet/Tmux/Serial terminal.,C,27921,2167,2194,2019-10-09T19:56:09Z,2025-09-08T01:44:21Z,https://github.com/kingToolbox/WindTerm,https://kingtoolbox.github.io,,18742,False,False
26,GoodbyeDPI,ValdikSS/GoodbyeDPI,ValdikSS,GoodbyeDPI — Deep Packet Inspection circumvention utility (for Windows),C,27157,2045,147,2017-05-16T18:48:52Z,2025-09-07T22:01:01Z,https://github.com/ValdikSS/GoodbyeDPI,https://ntc.party/c/community-software/goodbyedpi,Apache License 2.0,285,False,False
27,yabai,koekeishiya/yabai,koekeishiya,A tiling window manager for macOS based on binary space partitioning,C,26909,674,230,2019-05-04T15:00:50Z,2025-09-08T01:35:03Z,https://github.com/koekeishiya/yabai,,MIT License,7762,False,False
28,the_silver_searcher,ggreer/the_silver_searcher,ggreer,"A code-searching tool similar to ack, but faster.",C,26857,1433,563,2011-11-19T19:50:47Z,2025-09-07T16:10:15Z,https://github.com/ggreer/the_silver_searcher,http://geoff.greer.fm/ag/,Apache License 2.0,2426,False,False
29,darknet,pjreddie/darknet,pjreddie,Convolutional Neural Networks,C,26296,21262,1983,2014-04-11T07:59:16Z,2025-09-07T19:58:45Z,https://github.com/pjreddie/darknet,http://pjreddie.com/darknet/,Other,6526,False,False
30,libuv,libuv/libuv,libuv,Cross-platform asynchronous I/O,C,25772,3744,196,2013-11-30T00:29:56Z,2025-09-07T18:16:49Z,https://github.com/libuv/libuv,https://libuv.org/,MIT License,16880,False,False
31,zstd,facebook/zstd,facebook,Zstandard - Fast real-time compression algorithm,C,25592,2309,216,2015-01-24T00:22:38Z,2025-09-07T14:12:18Z,https://github.com/facebook/zstd,http://www.zstd.net,Other,40054,False,False
32,masscan,robertdavidgraham/masscan,robertdavidgraham,"TCP port scanner, spews SYN packets asynchronously, scanning entire Internet in under 5 minutes.",C,24835,3156,424,2013-07-28T05:35:33Z,2025-09-07T17:38:35Z,https://github.com/robertdavidgraham/masscan,,GNU Affero General Public License v3.0,3289,False,False
33,TDengine,taosdata/TDengine,taosdata,"High-performance, scalable time-series database designed for Industrial IoT (IIoT) scenarios",C,24308,4957,427,2019-07-11T08:33:48Z,2025-09-08T01:17:00Z,https://github.com/taosdata/TDengine,https://tdengine.com,GNU Affero General Public License v3.0,695590,False,False
34,hashcat,hashcat/hashcat,hashcat,World's fastest and most advanced password recovery utility,C,24214,3220,257,2015-12-04T14:46:51Z,2025-09-08T01:30:08Z,https://github.com/hashcat/hashcat,https://hashcat.net/hashcat/,,95903,False,False
35,openwrt,openwrt/openwrt,openwrt,This repository is a mirror of https://git.openwrt.org/openwrt/openwrt.git It is for reference only and is not active for check-ins.  We will continue to accept Pull Requests here. They will be merged via staging trees then into openwrt.git.,C,23643,11522,3549,2015-11-09T07:13:55Z,2025-09-08T01:52:52Z,https://github.com/openwrt/openwrt,,Other,273449,False,False
36,Tasmota,arendst/Tasmota,arendst,"Alternative firmware for ESP8266 and ESP32 based devices with easy configuration using webUI, OTA updates, automation using timers or rules, expandability and entirely local control over MQTT, HTTP, Serial or KNX. Full documentation at",C,23630,4967,11,2017-01-28T13:37:08Z,2025-09-08T01:31:07Z,https://github.com/arendst/Tasmota,https://tasmota.github.io/docs,GNU General Public License v3.0,257162,False,False
37,valkey,valkey-io/valkey,valkey-io,A flexible distributed key-value database that is optimized for caching and other realtime workloads.,C,22861,980,499,2024-03-22T00:42:17Z,2025-09-08T01:07:52Z,https://github.com/valkey-io/valkey,https://valkey.io,Other,142990,False,False
38,How-to-Make-a-Computer-Operating-System,SamyPesse/How-to-Make-a-Computer-Operating-System,SamyPesse,How to Make a Computer Operating System in C++,C,22323,3476,87,2013-11-29T17:36:32Z,2025-09-08T01:35:00Z,https://github.com/SamyPesse/How-to-Make-a-Computer-Operating-System,https://samypesse.gitbook.io/how-to-create-an-operating-system,Apache License 2.0,5986,False,False
39,radare2,radareorg/radare2,radareorg,UNIX-like reverse engineering framework and command-line toolset,C,22210,3112,883,2012-07-03T07:42:26Z,2025-09-07T18:45:36Z,https://github.com/radareorg/radare2,https://www.radare.org/,Other,186063,False,False
40,bcc,iovisor/bcc,iovisor,"BCC - Tools for BPF-based Linux IO analysis, networking, monitoring, and more",C,21742,4005,1041,2015-05-01T19:52:32Z,2025-09-08T01:48:11Z,https://github.com/iovisor/bcc,,Apache License 2.0,23678,False,False
41,The-Art-Of-Programming-By-July-2nd,julycoding/The-Art-Of-Programming-By-July-2nd,julycoding,本项目曾冲到全球第一，干货集锦见本页面最底部，另完整精致的纸质版《编程之法：面试和算法心得》已在京东/当当上销售,C,21487,7067,65,2013-12-14T10:00:06Z,2025-09-07T14:19:54Z,https://github.com/julycoding/The-Art-Of-Programming-By-July-2nd,,,27547,False,False
42,lvgl,lvgl/lvgl,lvgl,"Embedded graphics library to create beautiful UIs for any MCU, MPU and display type. ",C,21303,3814,123,2016-06-08T04:14:34Z,2025-09-08T01:29:59Z,https://github.com/lvgl/lvgl,https://lvgl.io,MIT License,478514,False,False
43,micropython,micropython/micropython,micropython,MicroPython - a lean and efficient Python implementation for microcontrollers and constrained systems,C,20795,8410,1787,2013-12-20T11:47:07Z,2025-09-08T01:24:15Z,https://github.com/micropython/micropython,https://micropython.org,Other,68634,False,False
44,C,TheAlgorithms/C,TheAlgorithms,"Collection of various algorithms in mathematics, machine learning, computer science, physics, etc implemented in C for educational purposes.",C,20788,4582,21,2016-07-16T10:17:03Z,2025-09-08T01:50:29Z,https://github.com/TheAlgorithms/C,https://thealgorithms.github.io/C,GNU General Public License v3.0,20365,False,False
45,mimikatz,gentilkiwi/mimikatz,gentilkiwi,A little tool to play with Windows security,C,20740,3952,180,2014-04-06T18:30:02Z,2025-09-07T11:26:50Z,https://github.com/gentilkiwi/mimikatz,http://blog.gentilkiwi.com/mimikatz,,6158,False,False
46,HandBrake,HandBrake/HandBrake,HandBrake,HandBrake's main development repository ,C,20648,1501,264,2015-08-22T16:32:28Z,2025-09-08T01:45:26Z,https://github.com/HandBrake/HandBrake,https://handbrake.fr,Other,120452,False,False
47,nnn,jarun/nnn,jarun,n³ The unorthodox terminal file manager,C,20543,779,1,2016-08-20T14:10:14Z,2025-09-07T21:39:43Z,https://github.com/jarun/nnn,,"BSD 2-Clause ""Simplified"" License",7136,False,False
48,timescaledb,timescale/timescaledb,timescale,A time-series database for high-performance real-time analytics packaged as a Postgres extension,C,20087,969,543,2017-03-07T20:03:41Z,2025-09-08T01:39:42Z,https://github.com/timescale/timescaledb,https://www.tigerdata.com/,Other,51992,False,False
49,unleashed-firmware,DarkFlippers/unleashed-firmware,DarkFlippers,Flipper Zero Unleashed Firmware,C,20036,1677,107,2022-03-16T12:46:45Z,2025-09-08T01:16:23Z,https://github.com/DarkFlippers/unleashed-firmware,https://flipperunleashed.com,GNU General Public License v3.0,100702,False,False
50,goaccess,allinurl/goaccess,allinurl,GoAccess is a real-time web log analyzer and interactive viewer that runs in a terminal in *nix systems or through your browser.,C,19775,1161,437,2013-07-14T03:42:08Z,2025-09-07T21:59:41Z,https://github.com/allinurl/goaccess,https://goaccess.io,MIT License,8481,False,False
51,cosmopolitan,jart/cosmopolitan,jart,build-once run-anywhere c library,C,19703,699,185,2020-06-15T14:16:13Z,2025-09-07T21:33:31Z,https://github.com/jart/cosmopolitan,,ISC License,306105,False,False
52,HarmonyOS,Awesome-HarmonyOS/HarmonyOS,Awesome-HarmonyOS,A curated list of awesome things related to HarmonyOS. 华为鸿蒙操作系统。,C,19697,3306,49,2019-08-09T11:24:00Z,2025-09-06T03:43:01Z,https://github.com/Awesome-HarmonyOS/HarmonyOS,,,23807,False,False
53,qmk_firmware,qmk/qmk_firmware,qmk,Open-source keyboard firmware for Atmel AVR and Arm USB families,C,19570,42492,589,2014-12-08T22:02:05Z,2025-09-07T20:01:20Z,https://github.com/qmk/qmk_firmware,https://qmk.fm,GNU General Public License v2.0,461318,False,False
54,llama2.c,karpathy/llama2.c,karpathy,Inference Llama 2 in one file of pure C,C,18724,2350,178,2023-07-23T05:15:06Z,2025-09-07T19:24:07Z,https://github.com/karpathy/llama2.c,,MIT License,1275,False,False
55,ish,ish-app/ish,ish-app,Linux shell for iOS,C,18472,1132,654,2017-05-05T00:10:35Z,2025-09-07T12:21:09Z,https://github.com/ish-app/ish,https://ish.app,Other,5514,False,False
56,postgres,postgres/postgres,postgres,"Mirror of the official PostgreSQL GIT repository. Note that this is just a *mirror* - we don't work with pull requests on github. To contribute, please see https://wiki.postgresql.org/wiki/Submitting_a_Patch",C,18463,5088,0,2010-09-21T11:35:45Z,2025-09-08T01:07:44Z,https://github.com/postgres/postgres,https://www.postgresql.org/,Other,671557,False,False
57,pgvector,pgvector/pgvector,pgvector,Open-source vector similarity search for Postgres,C,17413,882,11,2021-04-20T21:13:52Z,2025-09-08T01:21:26Z,https://github.com/pgvector/pgvector,,Other,1732,False,False
58,BlackHole,ExistentialAudio/BlackHole,ExistentialAudio,BlackHole is a modern macOS audio loopback driver that allows applications to pass audio to other applications with zero additional latency.,C,17263,700,8,2019-09-27T18:40:46Z,2025-09-08T01:36:51Z,https://github.com/ExistentialAudio/BlackHole,,GNU General Public License v3.0,5518,False,False
59,blurhash,woltapp/blurhash,woltapp,A very compact representation of a placeholder for an image.,C,16621,375,48,2019-06-26T10:45:33Z,2025-09-07T14:32:16Z,https://github.com/woltapp/blurhash,https://blurha.sh,MIT License,12283,False,False
60,fastfetch,fastfetch-cli/fastfetch,fastfetch-cli,"A maintained, feature-rich and performance oriented, neofetch like system information tool.",C,16451,561,20,2021-02-18T21:25:19Z,2025-09-08T00:52:38Z,https://github.com/fastfetch-cli/fastfetch,,MIT License,13913,False,False
61,ffmpeg.wasm,ffmpegwasm/ffmpeg.wasm,ffmpegwasm,"FFmpeg for browser, powered by WebAssembly",C,16415,997,392,2019-10-16T11:21:16Z,2025-09-08T00:48:47Z,https://github.com/ffmpegwasm/ffmpeg.wasm,https://ffmpegwasm.netlify.app,MIT License,17078,False,False
62,vlc,videolan/vlc,videolan,"VLC media player - All pull requests are ignored, please use MRs on https://code.videolan.org/videolan/vlc",C,16322,5422,2,2012-01-29T19:30:36Z,2025-09-07T17:51:19Z,https://github.com/videolan/vlc,http://www.videolan.org/vlc,GNU General Public License v2.0,593889,False,False
63,kcp,skywind3000/kcp,skywind3000,:zap: KCP - A Fast and Reliable ARQ Protocol,C,16317,2571,189,2014-12-26T16:46:34Z,2025-09-08T01:39:31Z,https://github.com/skywind3000/kcp,,MIT License,532,False,False
64,reactos,reactos/reactos,reactos,A free Windows-compatible Operating System,C,16255,1941,158,2017-10-03T08:04:52Z,2025-09-08T00:39:53Z,https://github.com/reactos/reactos,https://reactos.org/,GNU General Public License v2.0,628741,False,False
65,esp-idf,espressif/esp-idf,espressif,Espressif IoT Development Framework. Official development framework for Espressif SoCs.,C,16180,7843,1482,2016-08-17T10:40:35Z,2025-09-08T00:58:39Z,https://github.com/espressif/esp-idf,,Apache License 2.0,369368,False,False
66,open-gpu-kernel-modules,NVIDIA/open-gpu-kernel-modules,NVIDIA,NVIDIA Linux open GPU kernel module source,C,16176,1479,257,2022-05-02T22:00:04Z,2025-09-07T22:41:25Z,https://github.com/NVIDIA/open-gpu-kernel-modules,,Other,98315,False,False
67,shadowsocks-libev,shadowsocks/shadowsocks-libev,shadowsocks,Bug-fix-only libev port of shadowsocks. Future development moved to shadowsocks-rust,C,16032,6306,125,2012-12-15T08:11:07Z,2025-09-07T18:42:57Z,https://github.com/shadowsocks/shadowsocks-libev,https://github.com/shadowsocks/shadowsocks-rust,GNU General Public License v3.0,10618,False,False
68,sway,swaywm/sway,swaywm,i3-compatible Wayland compositor,C,15894,1178,1239,2015-08-05T01:31:45Z,2025-09-07T22:52:05Z,https://github.com/swaywm/sway,https://swaywm.org,MIT License,30648,False,False
69,Sandboxie,sandboxie-plus/Sandboxie,sandboxie-plus,Sandboxie Plus & Classic,C,15882,1782,648,2020-04-09T09:26:37Z,2025-09-07T18:56:24Z,https://github.com/sandboxie-plus/Sandboxie,https://Sandboxie-Plus.com,GNU General Public License v3.0,175347,False,False
70,Flipper,UberGuidoZ/Flipper,UberGuidoZ,Playground (and dump) of stuff I make or modify for the Flipper Zero,C,15854,3595,24,2022-05-09T22:41:48Z,2025-09-08T01:39:57Z,https://github.com/UberGuidoZ/Flipper,,GNU General Public License v3.0,2190440,False,False
71,libsql,tursodatabase/libsql,tursodatabase,"libSQL is a fork of SQLite that is both Open Source, and Open Contributions.",C,15478,424,402,2022-09-29T18:56:16Z,2025-09-07T21:24:16Z,https://github.com/tursodatabase/libsql,https://turso.tech/libsql,MIT License,170043,False,False
72,clay,nicbarker/clay,nicbarker,High performance UI layout library in C.,C,15333,587,187,2024-07-21T01:40:27Z,2025-09-08T01:35:23Z,https://github.com/nicbarker/clay,https://nicbarker.com/clay,zlib License,16372,False,False
73,sumatrapdf,sumatrapdfreader/sumatrapdf,sumatrapdfreader,SumatraPDF reader,C,15314,1828,621,2012-10-02T06:59:55Z,2025-09-08T01:22:25Z,https://github.com/sumatrapdfreader/sumatrapdf,http://www.sumatrapdfreader.org,GNU General Public License v3.0,305818,False,False
74,rofi,davatorium/rofi,davatorium,"Rofi: A window switcher, application launcher and dmenu replacement",C,14911,648,94,2013-01-20T11:54:45Z,2025-09-08T01:02:29Z,https://github.com/davatorium/rofi,https://davatorium.github.io/rofi/,Other,31946,False,False
75,flipperzero-firmware,flipperdevices/flipperzero-firmware,flipperdevices,Flipper Zero firmware source code,C,14749,3078,229,2020-07-31T21:43:20Z,2025-09-07T16:03:53Z,https://github.com/flipperdevices/flipperzero-firmware,https://flipperzero.one,GNU General Public License v3.0,74022,False,False
76,systemd,systemd/systemd,systemd,The systemd System and Service Manager ,C,14601,4081,2960,2015-03-25T15:27:27Z,2025-09-08T01:16:23Z,https://github.com/systemd/systemd,https://systemd.io,GNU General Public License v2.0,518472,False,False
77,ecapture,gojue/ecapture,gojue,Capturing SSL/TLS plaintext without a CA certificate using eBPF. Supported on Linux/Android kernels for amd64/arm64.,C,14597,1544,7,2022-03-13T07:40:48Z,2025-09-07T16:38:37Z,https://github.com/gojue/ecapture,https://ecapture.cc,Apache License 2.0,14510,False,False
78,ImageMagick,ImageMagick/ImageMagick,ImageMagick,"ImageMagick is a free, open-source software suite for creating, editing, converting, and displaying images. It supports 200+ formats and offers powerful command-line tools and APIs for automation, scripting, and integration across platforms.",C,14409,1485,72,2015-05-17T20:07:50Z,2025-09-08T00:06:08Z,https://github.com/ImageMagick/ImageMagick,https://imagemagick.org,Other,182072,False,False
79,winlator,brunodev85/winlator,brunodev85,Android application for running Windows applications with Wine and Box86/Box64,C,14351,924,441,2023-07-26T13:02:11Z,2025-09-07T23:18:49Z,https://github.com/brunodev85/winlator,https://winlator.org,MIT License,502944,False,False
80,esp8266_deauther,SpacehuhnTech/esp8266_deauther,SpacehuhnTech,Affordable WiFi hacking platform for testing and learning,C,14322,2719,92,2017-01-07T13:39:23Z,2025-09-08T01:29:23Z,https://github.com/SpacehuhnTech/esp8266_deauther,http://deauther.com,Other,16399,False,False
81,glfw,glfw/glfw,glfw,"A multi-platform library for OpenGL, OpenGL ES, Vulkan, window and input",C,14185,5634,722,2013-04-18T15:24:53Z,2025-09-07T20:17:38Z,https://github.com/glfw/glfw,https://www.glfw.org,zlib License,17004,False,False
82,OpenCorePkg,acidanthera/OpenCorePkg,acidanthera,OpenCore bootloader,C,14176,2183,8,2019-04-03T19:14:29Z,2025-09-07T18:57:19Z,https://github.com/acidanthera/OpenCorePkg,,"BSD 3-Clause ""New"" or ""Revised"" License",243152,False,False
83,memcached,memcached/memcached,memcached,memcached development tree,C,13970,3307,75,2009-04-24T23:34:25Z,2025-09-07T23:36:18Z,https://github.com/memcached/memcached,https://memcached.org,"BSD 3-Clause ""New"" or ""Revised"" License",6390,False,False
84,nuklear,vurtun/nuklear,vurtun,A single-header ANSI C gui library,C,13933,1114,236,2015-03-25T13:32:06Z,2025-09-08T00:15:04Z,https://github.com/vurtun/nuklear,,,12127,False,True
85,Dummy-Robot,peng-zhihui/Dummy-Robot,peng-zhihui,我的超迷你机械臂机器人项目。,C,13902,2958,120,2021-10-07T11:42:58Z,2025-09-08T01:31:00Z,https://github.com/peng-zhihui/Dummy-Robot,,,80730,False,False
86,nginx-rtmp-module,arut/nginx-rtmp-module,arut,NGINX-based Media Streaming Server,C,13869,3585,1150,2012-03-14T05:37:38Z,2025-09-08T01:32:03Z,https://github.com/arut/nginx-rtmp-module,http://nginx-rtmp.blogspot.com,"BSD 2-Clause ""Simplified"" License",3176,False,False
87,skynet,cloudwu/skynet,cloudwu,A lightweight online game framework,C,13813,4248,28,2012-08-01T03:30:42Z,2025-09-03T13:25:52Z,https://github.com/cloudwu/skynet,,MIT License,5058,False,False
88,seafile,haiwen/seafile,haiwen,"Beyond file syncing and sharing, a new way to organize your files with extensible file properties and flexible views",C,13640,1602,174,2012-07-12T06:47:55Z,2025-09-08T01:09:50Z,https://github.com/haiwen/seafile,http://seafile.com/,Other,12320,False,False
89,SDL,libsdl-org/SDL,libsdl-org,Simple DirectMedia Layer,C,13591,2339,754,2021-01-15T19:55:54Z,2025-09-08T00:51:56Z,https://github.com/libsdl-org/SDL,https://libsdl.org,zlib License,124613,False,False
90,raspberry-pi-os,s-matyukevich/raspberry-pi-os,s-matyukevich,Learning operating system development using Linux kernel and Raspberry Pi,C,13590,1331,65,2017-06-22T16:09:36Z,2025-09-07T06:40:01Z,https://github.com/s-matyukevich/raspberry-pi-os,,MIT License,2016,False,False
91,wazuh,wazuh/wazuh,wazuh,Wazuh - The Open Source Security Platform. Unified XDR and SIEM protection for endpoints and cloud workloads.,C,13430,1970,2685,2015-08-11T17:39:03Z,2025-09-07T21:37:16Z,https://github.com/wazuh/wazuh,https://wazuh.com/,Other,468735,False,False
92,openresty,openresty/openresty,openresty,High Performance Web Platform Based on Nginx and LuaJIT,C,13308,1587,308,2010-01-20T03:57:59Z,2025-09-08T01:26:59Z,https://github.com/openresty/openresty,https://openresty.org,Other,2782,False,False
93,tengine,alibaba/tengine,alibaba,A distribution of Nginx with some advanced features,C,13074,2515,492,2012-03-21T06:34:37Z,2025-09-07T17:27:30Z,https://github.com/alibaba/tengine,https://tengine.taobao.org,"BSD 2-Clause ""Simplified"" License",24318,False,False
94,zephyr,zephyrproject-rtos/zephyr,zephyrproject-rtos,"Primary Git Repository for the Zephyr Project. Zephyr is a new generation, scalable, optimized, secure RTOS for multiple hardware architectures.",C,13054,7877,3228,2016-05-26T17:54:19Z,2025-09-08T01:11:06Z,https://github.com/zephyrproject-rtos/zephyr,https://docs.zephyrproject.org,Apache License 2.0,783340,False,False
95,coturn,coturn/coturn,coturn,coturn TURN server project,C,12915,2157,364,2015-07-17T08:15:16Z,2025-09-07T16:27:00Z,https://github.com/coturn/coturn,,Other,5905,False,False
96,libsodium,jedisct1/libsodium,jedisct1,"A modern, portable, easy to use crypto library.",C,12907,1806,3,2013-01-20T00:03:40Z,2025-09-07T22:23:31Z,https://github.com/jedisct1/libsodium,https://libsodium.org,Other,10710,False,False
97,tig,jonas/tig,jonas,Text-mode interface for git,C,12864,632,203,2009-03-01T20:39:25Z,2025-09-06T03:22:32Z,https://github.com/jonas/tig,https://jonas.github.io/tig/,GNU General Public License v2.0,6933,False,False
98,robotjs,octalmage/robotjs,octalmage,Node.js Desktop Automation. ,C,12652,995,198,2014-08-31T14:13:47Z,2025-09-07T17:32:44Z,https://github.com/octalmage/robotjs,http://robotjs.io,MIT License,939,False,False
