排名,项目名称,完整名称,作者,描述,语言,Stars,Forks,Issues,创建时间,更新时间,仓库链接,主页链接,许可证,大小(KB),是否Fork,是否已归档
1,anoma,anoma/anoma,anoma,Reference implementation of Anoma,Elixir,34053,4113,133,2021-02-02T10:00:16Z,2026-02-22T18:53:21Z,https://github.com/anoma/anoma,https://anoma.net,MIT License,78350,False,False
2,elixir,elixir-lang/elixir,elixir-lang,"Elixir is a dynamic, functional language for building scalable and maintainable applications",Elixir,26455,3482,26,2011-01-09T08:43:57Z,2026-02-23T00:38:54Z,https://github.com/elixir-lang/elixir,https://elixir-lang.org/,Apache License 2.0,68844,False,False
3,analytics,plausible/analytics,plausible,"Simple, open source, lightweight and privacy-friendly web analytics alternative to Google Analytics.",Elixir,24265,1347,50,2018-12-04T22:33:36Z,2026-02-22T23:37:31Z,https://github.com/plausible/analytics,https://plausible.io,GNU Affero General Public License v3.0,545972,False,False
4,phoenix,phoenixframework/phoenix,phoenixframework,Peace of mind from prototype to production,Elixir,22895,3048,48,2014-01-20T14:14:11Z,2026-02-22T23:56:37Z,https://github.com/phoenixframework/phoenix,https://www.phoenixframework.org,MIT License,23515,False,False
5,awesome-elixir,h4cc/awesome-elixir,h4cc,"A curated list of amazingly awesome Elixir and Erlang libraries, resources and shiny things. Updates:",Elixir,13088,1186,10,2014-07-01T21:12:03Z,2026-02-22T05:54:20Z,https://github.com/h4cc/awesome-elixir,https://twitter.com/AwesomeElixir,MIT License,2794,False,False
6,electric,electric-sql/electric,electric-sql,"Read-path sync engine for Postgres that handles partial replication, data delivery and fan-out.",Elixir,9914,309,245,2022-06-01T14:18:11Z,2026-02-22T22:52:43Z,https://github.com/electric-sql/electric,https://electric-sql.com,Apache License 2.0,202135,False,False
7,firezone,firezone/firezone,firezone,Enterprise-ready zero-trust access platform built on WireGuard®.,Elixir,8418,403,461,2020-04-22T04:05:12Z,2026-02-23T01:49:06Z,https://github.com/firezone/firezone,https://www.firezone.dev,Apache License 2.0,209472,False,False
8,teslamate,teslamate-org/teslamate,teslamate-org,A self-hosted data logger for your Tesla  🚘 [main maintainer=@JakobLichterfeld],Elixir,7649,902,52,2019-03-31T20:27:26Z,2026-02-22T21:50:59Z,https://github.com/teslamate-org/teslamate,https://docs.teslamate.org,GNU Affero General Public License v3.0,90297,False,False
9,realtime,supabase/realtime,supabase,"Broadcast, Presence, and Postgres Changes via WebSockets",Elixir,7489,421,58,2019-09-23T12:15:45Z,2026-02-22T06:18:16Z,https://github.com/supabase/realtime,https://supabase.com/realtime,Apache License 2.0,10250,False,False
10,phoenix_live_view,phoenixframework/phoenix_live_view,phoenixframework,"Rich, real-time user experiences with server-rendered HTML",Elixir,6725,1032,77,2018-09-12T01:27:33Z,2026-02-22T23:56:59Z,https://github.com/phoenixframework/phoenix_live_view,https://hex.pm/packages/phoenix_live_view,MIT License,20725,False,False
11,ecto,elixir-ecto/ecto,elixir-ecto,A toolkit for data mapping and language integrated query.,Elixir,6437,1474,10,2013-06-12T18:42:06Z,2026-02-21T19:34:08Z,https://github.com/elixir-ecto/ecto,https://hexdocs.pm/ecto,Apache License 2.0,16370,False,False
12,papercups,papercups-io/papercups,papercups-io,Open-source live customer chat,Elixir,5929,556,174,2020-07-15T14:46:06Z,2026-02-21T16:43:22Z,https://github.com/papercups-io/papercups,https://app.papercups.io/demo,MIT License,4816,False,False
13,livebook,livebook-dev/livebook,livebook-dev,Automate code & data workflows with interactive Elixir notebooks,Elixir,5708,487,28,2021-01-07T19:57:18Z,2026-02-23T00:07:01Z,https://github.com/livebook-dev/livebook,https://livebook.dev,Apache License 2.0,128239,False,False
14,credo,rrrene/credo,rrrene,A static code analysis tool for the Elixir language with a focus on code consistency and teaching.,Elixir,5143,437,32,2015-09-27T13:16:15Z,2026-02-21T01:14:46Z,https://github.com/rrrene/credo,http://credo-ci.org/,MIT License,5944,False,False
15,pinchflat,kieraneglin/pinchflat,kieraneglin,Your next YouTube media manager,Elixir,4595,118,194,2024-01-19T04:45:13Z,2026-02-22T20:20:46Z,https://github.com/kieraneglin/pinchflat,,GNU Affero General Public License v3.0,14757,False,False
16,elixir_style_guide,christopheradams/elixir_style_guide,christopheradams,A community driven style guide for Elixir,Elixir,4419,302,8,2013-09-24T09:35:30Z,2026-02-16T08:23:32Z,https://github.com/christopheradams/elixir_style_guide,,,214,False,False
17,blockscout,blockscout/blockscout,blockscout,Blockchain explorer for Ethereum based network and a tool for inspecting and analyzing EVM based blockchains. ,Elixir,4417,2990,270,2018-01-12T22:45:24Z,2026-02-22T16:32:40Z,https://github.com/blockscout/blockscout,http://docs.blockscout.com,GNU General Public License v3.0,212375,False,False
18,absinthe,absinthe-graphql/absinthe,absinthe-graphql,The GraphQL toolkit for Elixir,Elixir,4394,545,74,2015-10-17T01:56:28Z,2026-02-17T01:35:10Z,https://github.com/absinthe-graphql/absinthe,http://absinthe-graphql.org,Other,4418,False,False
19,oban,oban-bg/oban,oban-bg,"💎 Robust job processing in Elixir, backed by modern PostgreSQL, SQLite3, and MySQL",Elixir,3815,359,3,2019-02-25T15:29:11Z,2026-02-22T10:00:47Z,https://github.com/oban-bg/oban,https://oban.pro,Apache License 2.0,3191,False,False
20,guardian,ueberauth/guardian,ueberauth,Elixir Authentication,Elixir,3516,387,1,2015-06-16T19:53:40Z,2026-02-17T15:01:23Z,https://github.com/ueberauth/guardian,,MIT License,1269,False,False
21,magnetissimo,sergiotapia/magnetissimo,sergiotapia,"Web application that indexes all popular torrent sites, and saves it to the local database.",Elixir,3076,188,9,2016-07-22T13:50:35Z,2026-02-18T04:21:59Z,https://github.com/sergiotapia/magnetissimo,,MIT License,8977,False,False
22,30-days-of-elixir,seven1m/30-days-of-elixir,seven1m,A walk through the Elixir language in 30 exercises.,Elixir,3062,430,0,2013-12-10T05:24:55Z,2026-02-07T19:10:03Z,https://github.com/seven1m/30-days-of-elixir,,MIT License,149,False,False
23,plug,elixir-plug/plug,elixir-plug,Compose web applications with functions,Elixir,2988,603,3,2013-11-15T10:30:47Z,2026-02-23T00:06:49Z,https://github.com/elixir-plug/plug,https://hex.pm/packages/plug,Other,2969,False,False
24,distillery,bitwalker/distillery,bitwalker,Simplify deployments in Elixir with OTP releases!,Elixir,2967,398,56,2016-07-15T00:12:24Z,2026-02-08T14:21:17Z,https://github.com/bitwalker/distillery,,MIT License,1598,False,False
25,nx,elixir-nx/nx,elixir-nx,Multi-dimensional arrays (tensors) and numerical definitions for Elixir,Elixir,2858,215,7,2020-10-29T00:15:01Z,2026-02-22T12:20:59Z,https://github.com/elixir-nx/nx,,,8032,False,False
26,changelog.com,thechangelog/changelog.com,thechangelog,Changelog makes world-class developer pods. This is our open source platform.,Elixir,2767,244,7,2015-12-28T16:18:22Z,2026-02-18T19:23:46Z,https://github.com/thechangelog/changelog.com,https://changelog.com/posts/changelog-is-open-source,Other,69147,False,False
27,broadway,dashbitco/broadway,dashbitco,Concurrent and multi-stage data ingestion and data processing with Elixir,Elixir,2619,172,6,2018-11-05T11:52:33Z,2026-02-22T18:09:21Z,https://github.com/dashbitco/broadway,https://elixir-broadway.org,Apache License 2.0,683,False,False
28,nerves,nerves-project/nerves,nerves-project,Craft and deploy bulletproof embedded software in Elixir,Elixir,2447,202,26,2016-01-23T21:42:42Z,2026-02-21T00:43:58Z,https://github.com/nerves-project/nerves,http://nerves-project.org,,7887,False,False
29,asciinema-server,asciinema/asciinema-server,asciinema,Platform for hosting and sharing terminal session recordings,Elixir,2446,283,4,2011-03-09T18:00:49Z,2026-02-21T03:22:12Z,https://github.com/asciinema/asciinema-server,https://docs.asciinema.org/manual/server/,Apache License 2.0,38640,False,False
30,quantum-core,quantum-elixir/quantum-core,quantum-elixir,:watch: Cron-like job scheduler for Elixir,Elixir,2397,153,9,2015-04-27T11:56:49Z,2026-02-21T08:22:58Z,https://github.com/quantum-elixir/quantum-core,https://hexdocs.pm/quantum/,Apache License 2.0,1035,False,False
31,elixir-koans,elixirkoans/elixir-koans,elixirkoans,Elixir learning exercises,Elixir,2388,621,24,2015-12-16T12:47:51Z,2026-02-20T16:39:04Z,https://github.com/elixirkoans/elixir-koans,,MIT License,502,False,False
32,httpoison,edgurgel/httpoison,edgurgel,Yet Another HTTP client for Elixir powered by hackney,Elixir,2368,340,36,2013-09-11T07:21:25Z,2026-02-22T22:34:21Z,https://github.com/edgurgel/httpoison,https://hex.pm/packages/httpoison,MIT License,374,False,False
33,ash,ash-project/ash,ash-project,"A declarative, extensible framework for building Elixir applications.",Elixir,2313,366,137,2019-10-03T03:07:55Z,2026-02-22T23:14:58Z,https://github.com/ash-project/ash,https://www.ash-hq.org,,28527,False,False
34,supavisor,supabase/supavisor,supabase,"A cloud-native, multi-tenant Postgres connection pooler.",Elixir,2144,92,41,2023-01-12T16:16:57Z,2026-02-22T12:57:56Z,https://github.com/supabase/supavisor,https://supabase.github.io/supavisor/,Apache License 2.0,4940,False,False
35,phoenix_live_dashboard,phoenixframework/phoenix_live_dashboard,phoenixframework,"Realtime dashboard with metrics, request logging, plus storage, OS and VM insights",Elixir,2140,202,15,2019-11-27T23:29:51Z,2026-02-20T06:43:32Z,https://github.com/phoenixframework/phoenix_live_dashboard,,MIT License,4457,False,False
36,floki,philss/floki,philss,Floki is a simple HTML parser that enables search for nodes using CSS selectors.,Elixir,2136,163,27,2014-11-02T20:49:15Z,2026-02-21T00:59:36Z,https://github.com/philss/floki,https://hex.pm/packages/floki,MIT License,1680,False,False
37,surface,surface-ui/surface,surface-ui,A server-side rendering component library for Phoenix,Elixir,2135,150,35,2019-07-17T22:32:27Z,2026-02-20T11:01:42Z,https://github.com/surface-ui/surface,https://surface-ui.org,MIT License,2858,False,False
38,libcluster,bitwalker/libcluster,bitwalker,Automatic cluster formation/healing for Elixir applications,Elixir,2132,199,22,2016-09-30T18:33:32Z,2026-02-16T05:22:52Z,https://github.com/bitwalker/libcluster,,MIT License,217,False,False
39,tesla,elixir-tesla/tesla,elixir-tesla,"The flexible HTTP client library for Elixir, with support for middleware and multiple adapters.",Elixir,2066,359,25,2015-03-16T22:55:37Z,2026-02-15T17:40:17Z,https://github.com/elixir-tesla/tesla,,MIT License,2384,False,False
40,scenic,ScenicFramework/scenic,ScenicFramework,Core Scenic library,Elixir,2050,137,28,2018-05-01T01:37:59Z,2026-02-15T19:05:50Z,https://github.com/ScenicFramework/scenic,,Apache License 2.0,3177,False,False
41,ex_machina,beam-community/ex_machina,beam-community,Create test data for Elixir applications,Elixir,2045,144,2,2015-09-14T15:40:28Z,2026-02-21T07:57:44Z,https://github.com/beam-community/ex_machina,https://hex.pm/packages/ex_machina,MIT License,522,False,False
42,poison,devinus/poison,devinus,"An incredibly fast, pure Elixir JSON library",Elixir,2030,213,40,2014-04-06T23:29:31Z,2026-02-11T13:27:57Z,https://github.com/devinus/poison,,BSD Zero Clause License,2376,False,False
43,keila,pentacent/keila,pentacent,Open Source Newsletter Tool.,Elixir,1995,139,70,2021-01-01T22:29:37Z,2026-02-23T00:44:36Z,https://github.com/pentacent/keila,https://keila.io,GNU Affero General Public License v3.0,9325,False,False
44,commanded,commanded/commanded,commanded,Use Commanded to build Elixir CQRS/ES applications,Elixir,1987,257,18,2016-03-25T22:01:38Z,2026-02-23T02:00:10Z,https://github.com/commanded/commanded,,MIT License,2549,False,False
45,sequin,sequinstream/sequin,sequinstream,"Postgres change data capture to streams, queues, and search indexes like Kafka, SQS, Elasticsearch, HTTP endpoints, and more",Elixir,1983,116,41,2024-06-26T01:50:46Z,2026-02-22T10:30:11Z,https://github.com/sequinstream/sequin,https://sequinstream.com,MIT License,137576,False,False
46,bamboo,beam-community/bamboo,beam-community,"Testable, composable, and adapter based Elixir email library for devs that love piping.",Elixir,1953,339,3,2015-11-03T02:30:34Z,2026-02-14T07:19:24Z,https://github.com/beam-community/bamboo,https://hex.pm/packages/bamboo,MIT License,940,False,False
47,bandit,mtrudel/bandit,mtrudel,Bandit is a pure Elixir HTTP server for Plug & WebSock applications,Elixir,1875,102,1,2019-11-10T21:14:23Z,2026-02-23T00:06:50Z,https://github.com/mtrudel/bandit,,MIT License,15941,False,False
48,manifold,discord/manifold,discord,Fast batch message passing between nodes for Erlang/Elixir.,Elixir,1828,72,2,2017-02-15T20:57:49Z,2026-02-21T03:28:52Z,https://github.com/discord/manifold,,MIT License,87,False,False
49,expert,elixir-lang/expert,elixir-lang,Official Elixir Language Server Protocol implementation,Elixir,1806,84,63,2024-09-18T13:26:43Z,2026-02-23T00:42:11Z,https://github.com/elixir-lang/expert,https://www.expert-lsp.org,Apache License 2.0,4510,False,False
50,timex,bitwalker/timex,bitwalker,A complete date/time library for Elixir projects.,Elixir,1806,401,62,2014-07-27T06:53:52Z,2026-02-14T07:19:20Z,https://github.com/bitwalker/timex,https://hexdocs.pm/timex,MIT License,2575,False,False
51,wallaby,elixir-wallaby/wallaby,elixir-wallaby,Concurrent browser tests for your Elixir web apps.,Elixir,1792,210,55,2016-02-26T16:57:42Z,2026-02-21T11:17:00Z,https://github.com/elixir-wallaby/wallaby,https://twitter.com/elixir_wallaby,MIT License,1316,False,False
52,dialyxir,jeremyjh/dialyxir,jeremyjh,Mix tasks to simplify use of Dialyzer in Elixir projects.,Elixir,1783,161,78,2013-05-28T03:39:58Z,2026-02-21T12:02:29Z,https://github.com/jeremyjh/dialyxir,,Apache License 2.0,709,False,False
53,sobelow,nccgroup/sobelow,nccgroup,Security-focused static analysis for the Phoenix Framework,Elixir,1772,116,37,2017-05-12T17:44:17Z,2026-02-20T13:53:42Z,https://github.com/nccgroup/sobelow,,Apache License 2.0,1395,False,False
54,elixir-ls,elixir-lsp/elixir-ls,elixir-lsp,"A frontend-independent IDE ""smartness"" server for Elixir. Implements the ""Language Server Protocol"" standard and provides debugger support via the ""Debug Adapter Protocol""",Elixir,1735,224,61,2018-03-25T22:45:34Z,2026-02-21T12:50:47Z,https://github.com/elixir-lsp/elixir-ls,https://elixir-lsp.github.io/elixir-ls/,Apache License 2.0,9434,False,False
55,desktop,elixir-desktop/desktop,elixir-desktop,"Building Local-First apps for Windows, MacOS, Linux, iOS and Android using Phoenix LiveView & Elixir!",Elixir,1733,61,4,2021-03-01T17:39:36Z,2026-02-20T16:41:08Z,https://github.com/elixir-desktop/desktop,https://hexdocs.pm/desktop/,MIT License,215,False,False
56,cachex,whitfin/cachex,whitfin,"A powerful caching library for Elixir with support for transactions, fallbacks and expirations",Elixir,1729,117,7,2016-02-15T17:06:20Z,2026-02-21T16:33:01Z,https://github.com/whitfin/cachex,https://hexdocs.pm/cachex/,MIT License,2041,False,False
57,ueberauth,ueberauth/ueberauth,ueberauth,An Elixir Authentication System for Plug-based Web Applications,Elixir,1702,119,29,2014-10-13T21:37:35Z,2026-02-03T15:31:34Z,https://github.com/ueberauth/ueberauth,,MIT License,227,False,False
58,learn-elixir,dwyl/learn-elixir,dwyl,":droplet: Learn the Elixir programming language to build functional, fast, scalable and maintainable web applications!",Elixir,1693,113,131,2016-12-01T06:33:44Z,2026-02-07T19:00:43Z,https://github.com/dwyl/learn-elixir,,,5297,False,False
59,axon,elixir-nx/axon,elixir-nx,Nx-powered Neural Networks,Elixir,1670,119,23,2021-01-25T13:09:52Z,2026-02-21T10:49:50Z,https://github.com/elixir-nx/axon,,Apache License 2.0,141832,False,False
60,jason,michalmuskala/jason,michalmuskala,A blazing fast JSON parser and generator in pure Elixir.,Elixir,1666,176,20,2017-06-04T19:00:57Z,2026-02-18T16:58:25Z,https://github.com/michalmuskala/jason,,Other,3710,False,False
61,elixir-companies,beam-community/elixir-companies,beam-community,A list of companies currently using Elixir in production.,Elixir,1663,382,2,2015-06-11T21:46:12Z,2026-02-11T17:02:50Z,https://github.com/beam-community/elixir-companies,https://elixir-companies.com,MIT License,1853,False,False
62,pow,pow-auth/pow,pow-auth,"Robust, modular, and extendable user authentication system",Elixir,1663,160,70,2018-05-07T16:27:27Z,2026-02-11T13:36:01Z,https://github.com/pow-auth/pow,https://powauth.com,MIT License,2249,False,False
63,sorted_set_nif,discord/sorted_set_nif,discord,Elixir SortedSet backed by a Rust-based NIF,Elixir,1651,100,12,2018-11-26T21:46:35Z,2026-02-17T05:33:57Z,https://github.com/discord/sorted_set_nif,,MIT License,67,False,False
64,live_svelte,woutdp/live_svelte,woutdp,Svelte inside Phoenix LiveView with seamless end-to-end reactivity,Elixir,1629,74,30,2023-02-21T04:40:06Z,2026-02-22T18:09:26Z,https://github.com/woutdp/live_svelte,https://hexdocs.pm/live_svelte,MIT License,20092,False,False
65,flow,dashbitco/flow,dashbitco,Computational parallel flows on top of GenStage,Elixir,1609,88,1,2017-01-18T00:32:54Z,2026-02-14T07:19:08Z,https://github.com/dashbitco/flow,https://hexdocs.pm/flow,,359,False,False
66,bumblebee,elixir-nx/bumblebee,elixir-nx,Pre-trained Neural Network models in Axon (+ 🤗 Models integration),Elixir,1589,128,33,2022-05-03T13:59:36Z,2026-02-21T22:39:42Z,https://github.com/elixir-nx/bumblebee,,Apache License 2.0,6915,False,False
67,gen_stage,elixir-lang/gen_stage,elixir-lang,Producer and consumer actors with back-pressure for Elixir,Elixir,1580,196,3,2015-08-26T17:57:36Z,2026-02-22T14:08:44Z,https://github.com/elixir-lang/gen_stage,http://hexdocs.pm/gen_stage,,1309,False,False
68,ex_doc,elixir-lang/ex_doc,elixir-lang,ExDoc produces HTML and EPUB documentation for Elixir projects,Elixir,1579,356,12,2012-03-06T21:35:38Z,2026-02-20T23:32:55Z,https://github.com/elixir-lang/ex_doc,http://elixir-lang.org,Other,15153,False,False
69,elixirscript,elixirscript/elixirscript,elixirscript,Converts Elixir to JavaScript,Elixir,1567,68,19,2015-02-01T21:22:05Z,2026-02-12T12:43:26Z,https://github.com/elixirscript/elixirscript,https://elixirscript.github.io/,MIT License,3793,False,False
70,bors-ng,bors-ng/bors-ng,bors-ng,👁 A merge bot for GitHub Pull Requests,Elixir,1529,184,181,2016-12-29T00:41:38Z,2026-02-21T21:09:30Z,https://github.com/bors-ng/bors-ng,https://bors.tech/,Apache License 2.0,4942,False,True
71,exq,akira/exq,akira,Job processing library for Elixir  - compatible with Resque / Sidekiq,Elixir,1526,184,27,2013-07-31T05:10:24Z,2026-02-21T02:23:17Z,https://github.com/akira/exq,,Other,3083,False,False
72,swoosh,swoosh/swoosh,swoosh,"Compose, deliver and test your emails easily in Elixir",Elixir,1517,244,14,2016-03-04T23:48:56Z,2026-02-19T08:13:38Z,https://github.com/swoosh/swoosh,https://hexdocs.pm/swoosh,MIT License,2265,False,False
73,Elixir-Code-Smells,lucasvegi/Elixir-Code-Smells,lucasvegi,Catalog of Elixir-specific code smells,Elixir,1506,57,1,2022-02-15T16:03:05Z,2026-02-15T04:31:55Z,https://github.com/lucasvegi/Elixir-Code-Smells,https://doi.org/10.1007/s10664-023-10343-6,MIT License,4775,False,False
74,grpc,elixir-grpc/grpc,elixir-grpc,An Elixir implementation of gRPC,Elixir,1502,240,34,2016-07-20T17:12:07Z,2026-02-21T21:37:45Z,https://github.com/elixir-grpc/grpc,https://hex.pm/packages/grpc,Apache License 2.0,16378,False,False
75,benchee,bencheeorg/benchee,bencheeorg,Easy and extensible benchmarking in Elixir providing you with lots of statistics!,Elixir,1500,68,25,2016-05-22T18:48:43Z,2026-02-17T16:46:28Z,https://github.com/bencheeorg/benchee,,MIT License,1932,False,False
76,accent,mirego/accent,mirego,The first developer-oriented translation tool. True asynchronous flow between translators and your team.,Elixir,1473,118,55,2018-03-20T00:42:03Z,2026-02-22T14:47:12Z,https://github.com/mirego/accent,https://www.accent.reviews,"BSD 3-Clause ""New"" or ""Revised"" License",13336,False,False
77,semaphore,semaphoreio/semaphore,semaphoreio,All-in-one delivery platform for AI-driven development.,Elixir,1466,74,141,2025-01-21T12:37:52Z,2026-02-22T14:13:03Z,https://github.com/semaphoreio/semaphore,https://semaphore.io,Other,71024,False,False
78,membrane_core,membraneframework/membrane_core,membraneframework,"The core of Membrane Framework, multimedia processing framework written in Elixir",Elixir,1463,45,72,2017-01-26T11:31:00Z,2026-02-19T16:25:59Z,https://github.com/membraneframework/membrane_core,https://membrane.stream,Apache License 2.0,5876,False,False
79,horde,elixir-horde/horde,elixir-horde,Horde is a distributed Supervisor and Registry backed by Postgres,Elixir,1458,117,0,2018-05-08T15:01:01Z,2026-02-11T15:20:11Z,https://github.com/elixir-horde/horde,,MIT License,857,False,False
80,kaffy,aesmail/kaffy,aesmail,Powerfully simple admin package for phoenix applications,Elixir,1422,174,74,2020-05-07T02:56:34Z,2026-02-02T22:25:46Z,https://github.com/aesmail/kaffy,https://kaffy.fly.dev/admin/,MIT License,14815,False,False
81,mint,elixir-mint/mint,elixir-mint,Functional HTTP client for Elixir with support for HTTP/1 and HTTP/2 🌱,Elixir,1408,118,7,2017-10-25T13:22:12Z,2026-02-11T15:22:19Z,https://github.com/elixir-mint/mint,,Apache License 2.0,1080,False,False
82,midarr-server,midarrlabs/midarr-server,midarrlabs,"🔥Midarr, the minimal lightweight media server.",Elixir,1397,39,6,2022-02-02T21:25:40Z,2026-02-20T16:32:19Z,https://github.com/midarrlabs/midarr-server,,MIT License,609372,False,False
83,mox,dashbitco/mox,dashbitco,Mocks and explicit contracts in Elixir,Elixir,1389,77,8,2017-09-25T10:24:09Z,2026-02-20T10:46:52Z,https://github.com/dashbitco/mox,,,154,False,False
84,hound,HashNuke/hound,HashNuke,Elixir library for writing integration tests and browser automation,Elixir,1380,141,86,2013-12-15T14:01:16Z,2026-02-09T08:31:28Z,https://github.com/HashNuke/hound,http://hexdocs.pm/hound,MIT License,474,False,False
85,nebulex,elixir-nebulex/nebulex,elixir-nebulex,In-memory and distributed caching toolkit for Elixir.,Elixir,1373,78,5,2017-02-14T10:48:00Z,2026-02-21T15:28:28Z,https://github.com/elixir-nebulex/nebulex,https://hexdocs.pm/nebulex,MIT License,1226,False,False
86,live_beats,fly-apps/live_beats,fly-apps,,Elixir,1364,183,15,2021-11-05T12:58:38Z,2026-02-18T09:18:30Z,https://github.com/fly-apps/live_beats,,MIT License,538,False,False
87,uneebee,zoonk/uneebee,zoonk,Platform for creating interactive courses.,Elixir,1351,90,0,2023-09-10T06:17:15Z,2026-02-13T18:47:02Z,https://github.com/zoonk/uneebee,https://zoonk.org,GNU Affero General Public License v3.0,4963,False,True
88,finch,sneako/finch,sneako,"Elixir HTTP client, focused on performance",Elixir,1348,131,33,2019-10-23T21:03:44Z,2026-02-20T12:40:17Z,https://github.com/sneako/finch,,MIT License,1044,False,False
89,ex_aws,ex-aws/ex_aws,ex-aws,"A flexible, easy to use set of clients AWS APIs for Elixir",Elixir,1333,565,81,2014-09-15T16:02:48Z,2026-02-16T03:22:55Z,https://github.com/ex-aws/ex_aws,https://hex.pm/packages/ex_aws,MIT License,2150,False,False
90,maru,elixir-maru/maru,elixir-maru,Elixir RESTful Framework ,Elixir,1319,86,18,2014-12-31T07:07:57Z,2025-10-24T23:38:42Z,https://github.com/elixir-maru/maru,https://maru.readme.io,"BSD 3-Clause ""New"" or ""Revised"" License",609,False,False
91,comeonin,riverrun/comeonin,riverrun,Password hashing specification for the Elixir programming language,Elixir,1318,64,2,2014-12-19T09:38:57Z,2026-02-01T14:53:10Z,https://github.com/riverrun/comeonin,https://hex.pm/packages/comeonin,Other,520,False,False
92,lanyard,Phineas/lanyard,Phineas,🏷️   Expose your Discord presence and activities to a RESTful API and WebSocket in less than 10 seconds,Elixir,1304,173,20,2021-03-10T17:13:33Z,2026-02-22T14:35:44Z,https://github.com/Phineas/lanyard,https://discord.gg/lanyard,MIT License,422,False,False
93,req,wojtekmach/req,wojtekmach,Req is a batteries-included HTTP client for Elixir.,Elixir,1287,156,69,2021-03-28T16:59:50Z,2026-02-20T12:56:15Z,https://github.com/wojtekmach/req,https://hexdocs.pm/req,Apache License 2.0,975,False,False
94,fast-elixir,devonestes/fast-elixir,devonestes,:dash: Writing Fast Elixir :heart_eyes: -- Collect Common Elixir idioms.,Elixir,1286,43,8,2017-04-01T13:13:46Z,2026-02-20T17:02:42Z,https://github.com/devonestes/fast-elixir,https://github.com/devonestes/fast-elixir,,1123,False,False
95,coherence,smpallen99/coherence,smpallen99,"Coherence is a full featured, configurable authentication system for Phoenix",Elixir,1259,221,75,2016-07-04T19:47:25Z,2026-02-05T14:06:43Z,https://github.com/smpallen99/coherence,,MIT License,1106,False,False
96,explorer,elixir-explorer/explorer,elixir-explorer,Series (one-dimensional) and dataframes (two-dimensional) for fast and elegant data exploration in Elixir,Elixir,1251,144,52,2021-07-23T05:05:39Z,2026-02-21T10:49:50Z,https://github.com/elixir-explorer/explorer,https://hexdocs.pm/explorer,MIT License,3942,False,False
97,swarm,bitwalker/swarm,bitwalker,"Easy clustering, registration, and distribution of worker processes for Erlang/Elixir",Elixir,1249,109,45,2016-07-25T22:29:49Z,2026-02-10T09:59:35Z,https://github.com/bitwalker/swarm,,MIT License,522,False,False
98,tv,algora-io/tv,algora-io,Open source Twitch for developers,Elixir,1248,78,14,2024-02-29T19:32:27Z,2026-02-04T17:45:42Z,https://github.com/algora-io/tv,,Other,10968,False,False
99,00,technomancy-dev/00,technomancy-dev,A markdown email micro service for the people!,Elixir,1236,65,9,2024-04-23T14:58:35Z,2026-02-19T16:12:10Z,https://github.com/technomancy-dev/00,https://www.double-zero.cloud,GNU Affero General Public License v3.0,14436,False,False
100,policr-mini,Hentioe/policr-mini,Hentioe,专注于验证的 Telegram 机器人,Elixir,1235,116,11,2020-06-07T11:37:08Z,2026-02-13T12:25:04Z,https://github.com/Hentioe/policr-mini,https://mini.gramlabs.org/,MIT License,3189,False,False
