排名,项目名称,完整名称,作者,描述,语言,Stars,Forks,Issues,创建时间,更新时间,仓库链接,主页链接,许可证,大小(KB),是否Fork,是否已归档
1,anoma,anoma/anoma,anoma,Reference implementation of Anoma,Elixir,34340,4093,195,2021-02-02T10:00:16Z,2025-09-15T01:55:51Z,https://github.com/anoma/anoma,https://anoma.net,MIT License,77954,False,False
2,elixir,elixir-lang/elixir,elixir-lang,"Elixir is a dynamic, functional language for building scalable and maintainable applications",Elixir,25765,3464,30,2011-01-09T08:43:57Z,2025-09-15T00:24:57Z,https://github.com/elixir-lang/elixir,https://elixir-lang.org/,Apache License 2.0,67216,False,False
3,analytics,plausible/analytics,plausible,"Simple, open source, lightweight and privacy-friendly web analytics alternative to Google Analytics.",Elixir,23334,1274,58,2018-12-04T22:33:36Z,2025-09-15T01:02:40Z,https://github.com/plausible/analytics,https://plausible.io,GNU Affero General Public License v3.0,459467,False,False
4,phoenix,phoenixframework/phoenix,phoenixframework,Peace of mind from prototype to production,Elixir,22444,3002,55,2014-01-20T14:14:11Z,2025-09-14T18:20:39Z,https://github.com/phoenixframework/phoenix,https://www.phoenixframework.org,MIT License,22799,False,False
5,awesome-elixir,h4cc/awesome-elixir,h4cc,"A curated list of amazingly awesome Elixir and Erlang libraries, resources and shiny things. Updates:",Elixir,12997,1192,5,2014-07-01T21:12:03Z,2025-09-14T17:10:22Z,https://github.com/h4cc/awesome-elixir,https://twitter.com/AwesomeElixir,MIT License,2720,False,False
6,electric,electric-sql/electric,electric-sql,Real-time sync for Postgres.,Elixir,9181,263,150,2022-06-01T14:18:11Z,2025-09-15T01:14:56Z,https://github.com/electric-sql/electric,https://electric-sql.com,Apache License 2.0,153122,False,False
7,firezone,firezone/firezone,firezone,Enterprise-ready zero-trust access platform built on WireGuard®.,Elixir,7510,333,468,2020-04-22T04:05:12Z,2025-09-13T21:49:14Z,https://github.com/firezone/firezone,https://www.firezone.dev,Apache License 2.0,185537,False,False
8,realtime,supabase/realtime,supabase,"Broadcast, Presence, and Postgres Changes via WebSockets",Elixir,7278,393,56,2019-09-23T12:15:45Z,2025-09-14T21:58:36Z,https://github.com/supabase/realtime,https://supabase.com/realtime,Apache License 2.0,9211,False,False
9,teslamate,teslamate-org/teslamate,teslamate-org,A self-hosted data logger for your Tesla  🚘 [main maintainer=@JakobLichterfeld],Elixir,7129,857,72,2019-03-31T20:27:26Z,2025-09-15T00:48:11Z,https://github.com/teslamate-org/teslamate,https://docs.teslamate.org,MIT License,89375,False,False
10,phoenix_live_view,phoenixframework/phoenix_live_view,phoenixframework,"Rich, real-time user experiences with server-rendered HTML",Elixir,6595,1004,59,2018-09-12T01:27:33Z,2025-09-14T12:42:07Z,https://github.com/phoenixframework/phoenix_live_view,https://hex.pm/packages/phoenix_live_view,MIT License,19979,False,False
11,ecto,elixir-ecto/ecto,elixir-ecto,A toolkit for data mapping and language integrated query.,Elixir,6373,1463,14,2013-06-12T18:42:06Z,2025-09-14T17:10:27Z,https://github.com/elixir-ecto/ecto,https://hexdocs.pm/ecto,Apache License 2.0,16185,False,False
12,papercups,papercups-io/papercups,papercups-io,Open-source live customer chat,Elixir,5877,557,173,2020-07-15T14:46:06Z,2025-09-11T20:29:03Z,https://github.com/papercups-io/papercups,https://app.papercups.io/demo,MIT License,4816,False,False
13,livebook,livebook-dev/livebook,livebook-dev,Automate code & data workflows with interactive Elixir notebooks,Elixir,5505,471,31,2021-01-07T19:57:18Z,2025-09-14T14:54:09Z,https://github.com/livebook-dev/livebook,https://livebook.dev,Apache License 2.0,123583,False,False
14,credo,rrrene/credo,rrrene,A static code analysis tool for the Elixir language with a focus on code consistency and teaching.,Elixir,5068,431,40,2015-09-27T13:16:15Z,2025-09-13T19:01:02Z,https://github.com/rrrene/credo,http://credo-ci.org/,MIT License,5472,False,False
15,elixir_style_guide,christopheradams/elixir_style_guide,christopheradams,A community driven style guide for Elixir,Elixir,4418,301,8,2013-09-24T09:35:30Z,2025-09-11T13:33:28Z,https://github.com/christopheradams/elixir_style_guide,,,214,False,False
16,absinthe,absinthe-graphql/absinthe,absinthe-graphql,The GraphQL toolkit for Elixir,Elixir,4355,535,62,2015-10-17T01:56:28Z,2025-09-12T19:38:32Z,https://github.com/absinthe-graphql/absinthe,http://absinthe-graphql.org,Other,4390,False,False
17,blockscout,blockscout/blockscout,blockscout,Blockchain explorer for Ethereum based network and a tool for inspecting and analyzing EVM based blockchains. ,Elixir,4181,2836,414,2018-01-12T22:45:24Z,2025-09-14T16:44:58Z,https://github.com/blockscout/blockscout,http://docs.blockscout.com,GNU General Public License v3.0,208957,False,False
18,pinchflat,kieraneglin/pinchflat,kieraneglin,Your next YouTube media manager,Elixir,3720,82,133,2024-01-19T04:45:13Z,2025-09-15T00:35:35Z,https://github.com/kieraneglin/pinchflat,,GNU Affero General Public License v3.0,14731,False,False
19,oban,oban-bg/oban,oban-bg,"💎 Robust job processing in Elixir, backed by modern PostgreSQL, SQLite3, and MySQL",Elixir,3640,338,3,2019-02-25T15:29:11Z,2025-09-14T13:24:29Z,https://github.com/oban-bg/oban,https://oban.pro,Apache License 2.0,3114,False,False
20,guardian,ueberauth/guardian,ueberauth,Elixir Authentication,Elixir,3496,386,1,2015-06-16T19:53:40Z,2025-09-10T14:41:24Z,https://github.com/ueberauth/guardian,,MIT License,1267,False,False
21,magnetissimo,sergiotapia/magnetissimo,sergiotapia,"Web application that indexes all popular torrent sites, and saves it to the local database.",Elixir,3065,188,9,2016-07-22T13:50:35Z,2025-09-10T09:50:48Z,https://github.com/sergiotapia/magnetissimo,,MIT License,8977,False,False
22,30-days-of-elixir,seven1m/30-days-of-elixir,seven1m,A walk through the Elixir language in 30 exercises.,Elixir,3051,430,0,2013-12-10T05:24:55Z,2025-09-05T11:00:28Z,https://github.com/seven1m/30-days-of-elixir,,MIT License,149,False,False
23,distillery,bitwalker/distillery,bitwalker,Simplify deployments in Elixir with OTP releases!,Elixir,2966,401,56,2016-07-15T00:12:24Z,2025-09-10T14:41:28Z,https://github.com/bitwalker/distillery,,MIT License,1598,False,False
24,plug,elixir-plug/plug,elixir-plug,Compose web applications with functions,Elixir,2951,599,3,2013-11-15T10:30:47Z,2025-09-14T18:46:54Z,https://github.com/elixir-plug/plug,https://hex.pm/packages/plug,Other,2901,False,False
25,nx,elixir-nx/nx,elixir-nx,Multi-dimensional arrays (tensors) and numerical definitions for Elixir,Elixir,2810,213,19,2020-10-29T00:15:01Z,2025-09-14T20:08:16Z,https://github.com/elixir-nx/nx,,,7391,False,False
26,changelog.com,thechangelog/changelog.com,thechangelog,Changelog makes world-class developer pods. This is our open source platform.,Elixir,2757,248,9,2015-12-28T16:18:22Z,2025-09-12T15:42:34Z,https://github.com/thechangelog/changelog.com,https://changelog.com/posts/changelog-is-open-source,Other,69056,False,False
27,broadway,dashbitco/broadway,dashbitco,Concurrent and multi-stage data ingestion and data processing with Elixir,Elixir,2576,169,6,2018-11-05T11:52:33Z,2025-09-13T13:26:25Z,https://github.com/dashbitco/broadway,https://elixir-broadway.org,Apache License 2.0,675,False,False
28,asciinema-server,asciinema/asciinema-server,asciinema,Platform for hosting and sharing terminal session recordings,Elixir,2388,278,11,2011-03-09T18:00:49Z,2025-09-14T11:11:41Z,https://github.com/asciinema/asciinema-server,https://docs.asciinema.org/manual/server/,Apache License 2.0,14576,False,False
29,nerves,nerves-project/nerves,nerves-project,Craft and deploy bulletproof embedded software in Elixir,Elixir,2384,197,31,2016-01-23T21:42:42Z,2025-09-12T05:21:20Z,https://github.com/nerves-project/nerves,http://nerves-project.org,,7609,False,False
30,quantum-core,quantum-elixir/quantum-core,quantum-elixir,:watch: Cron-like job scheduler for Elixir,Elixir,2375,152,8,2015-04-27T11:56:49Z,2025-09-14T10:12:52Z,https://github.com/quantum-elixir/quantum-core,https://hexdocs.pm/quantum/,Apache License 2.0,983,False,False
31,elixir-koans,elixirkoans/elixir-koans,elixirkoans,Elixir learning exercises,Elixir,2347,620,24,2015-12-16T12:47:51Z,2025-09-09T10:26:16Z,https://github.com/elixirkoans/elixir-koans,,MIT License,506,False,False
32,httpoison,edgurgel/httpoison,edgurgel,Yet Another HTTP client for Elixir powered by hackney,Elixir,2261,339,34,2013-09-11T07:21:25Z,2025-09-12T02:44:32Z,https://github.com/edgurgel/httpoison,https://hex.pm/packages/httpoison,MIT License,478,False,False
33,floki,philss/floki,philss,Floki is a simple HTML parser that enables search for nodes using CSS selectors.,Elixir,2128,163,22,2014-11-02T20:49:15Z,2025-09-04T12:30:22Z,https://github.com/philss/floki,https://hex.pm/packages/floki,MIT License,1674,False,False
34,phoenix_live_dashboard,phoenixframework/phoenix_live_dashboard,phoenixframework,"Realtime dashboard with metrics, request logging, plus storage, OS and VM insights",Elixir,2122,200,15,2019-11-27T23:29:51Z,2025-09-13T18:29:07Z,https://github.com/phoenixframework/phoenix_live_dashboard,,MIT License,4457,False,False
35,surface,surface-ui/surface,surface-ui,A server-side rendering component library for Phoenix,Elixir,2121,151,34,2019-07-17T22:32:27Z,2025-09-14T23:15:13Z,https://github.com/surface-ui/surface,https://surface-ui.org,MIT License,2786,False,False
36,ash,ash-project/ash,ash-project,"A declarative, extensible framework for building Elixir applications.",Elixir,2105,315,125,2019-10-03T03:07:55Z,2025-09-14T19:38:57Z,https://github.com/ash-project/ash,https://www.ash-hq.org,MIT License,26277,False,False
37,libcluster,bitwalker/libcluster,bitwalker,Automatic cluster formation/healing for Elixir applications,Elixir,2087,197,22,2016-09-30T18:33:32Z,2025-09-14T21:09:29Z,https://github.com/bitwalker/libcluster,,MIT License,217,False,False
38,tesla,elixir-tesla/tesla,elixir-tesla,"The flexible HTTP client library for Elixir, with support for middleware and multiple adapters.",Elixir,2055,356,21,2015-03-16T22:55:37Z,2025-09-13T13:26:02Z,https://github.com/elixir-tesla/tesla,,MIT License,2376,False,False
39,supavisor,supabase/supavisor,supabase,"A cloud-native, multi-tenant Postgres connection pooler.",Elixir,2037,82,38,2023-01-12T16:16:57Z,2025-09-13T13:24:49Z,https://github.com/supabase/supavisor,https://supabase.github.io/supavisor/,Apache License 2.0,4533,False,False
40,poison,devinus/poison,devinus,"An incredibly fast, pure Elixir JSON library",Elixir,2032,215,39,2014-04-06T23:29:31Z,2025-09-09T01:53:43Z,https://github.com/devinus/poison,,BSD Zero Clause License,2376,False,False
41,scenic,ScenicFramework/scenic,ScenicFramework,Core Scenic library,Elixir,2030,133,26,2018-05-01T01:37:59Z,2025-09-13T07:20:04Z,https://github.com/ScenicFramework/scenic,,Apache License 2.0,3175,False,False
42,ex_machina,beam-community/ex_machina,beam-community,Create test data for Elixir applications,Elixir,2023,147,1,2015-09-14T15:40:28Z,2025-09-12T17:09:50Z,https://github.com/beam-community/ex_machina,https://hex.pm/packages/ex_machina,MIT License,445,False,False
43,bamboo,beam-community/bamboo,beam-community,"Testable, composable, and adapter based Elixir email library for devs that love piping.",Elixir,1947,342,2,2015-11-03T02:30:34Z,2025-09-13T16:40:20Z,https://github.com/beam-community/bamboo,https://hex.pm/packages/bamboo,MIT License,913,False,False
44,commanded,commanded/commanded,commanded,Use Commanded to build Elixir CQRS/ES applications,Elixir,1943,251,26,2016-03-25T22:01:38Z,2025-09-14T17:10:17Z,https://github.com/commanded/commanded,,MIT License,2543,False,False
45,bandit,mtrudel/bandit,mtrudel,Bandit is a pure Elixir HTTP server for Plug & WebSock applications,Elixir,1834,94,5,2019-11-10T21:14:23Z,2025-09-14T15:50:26Z,https://github.com/mtrudel/bandit,,MIT License,15819,False,False
46,manifold,discord/manifold,discord,Fast batch message passing between nodes for Erlang/Elixir.,Elixir,1815,73,2,2017-02-15T20:57:49Z,2025-09-15T01:01:36Z,https://github.com/discord/manifold,,MIT License,87,False,False
47,keila,pentacent/keila,pentacent,Open Source Newsletter Tool.,Elixir,1805,114,80,2021-01-01T22:29:37Z,2025-09-13T23:16:17Z,https://github.com/pentacent/keila,https://keila.io,GNU Affero General Public License v3.0,8626,False,False
48,timex,bitwalker/timex,bitwalker,A complete date/time library for Elixir projects.,Elixir,1804,395,60,2014-07-27T06:53:52Z,2025-09-14T09:56:40Z,https://github.com/bitwalker/timex,https://hexdocs.pm/timex,MIT License,2575,False,False
49,dialyxir,jeremyjh/dialyxir,jeremyjh,Mix tasks to simplify use of Dialyzer in Elixir projects.,Elixir,1769,153,67,2013-05-28T03:39:58Z,2025-09-13T13:25:44Z,https://github.com/jeremyjh/dialyxir,,Apache License 2.0,691,False,False
50,wallaby,elixir-wallaby/wallaby,elixir-wallaby,Concurrent browser tests for your Elixir web apps.,Elixir,1763,207,50,2016-02-26T16:57:42Z,2025-09-12T20:18:21Z,https://github.com/elixir-wallaby/wallaby,https://twitter.com/elixir_wallaby,MIT License,1289,False,False
51,sobelow,nccgroup/sobelow,nccgroup,Security-focused static analysis for the Phoenix Framework,Elixir,1751,111,37,2017-05-12T17:44:17Z,2025-09-12T17:33:59Z,https://github.com/nccgroup/sobelow,,Apache License 2.0,1395,False,False
52,cachex,whitfin/cachex,whitfin,"A powerful caching library for Elixir with support for transactions, fallbacks and expirations",Elixir,1697,117,7,2016-02-15T17:06:20Z,2025-09-12T15:42:34Z,https://github.com/whitfin/cachex,https://hexdocs.pm/cachex/,MIT License,1572,False,False
53,elixir-ls,elixir-lsp/elixir-ls,elixir-lsp,"A frontend-independent IDE ""smartness"" server for Elixir. Implements the ""Language Server Protocol"" standard and provides debugger support via the ""Debug Adapter Protocol""",Elixir,1691,220,65,2018-03-25T22:45:34Z,2025-09-14T19:55:32Z,https://github.com/elixir-lsp/elixir-ls,https://elixir-lsp.github.io/elixir-ls/,Apache License 2.0,9276,False,False
54,ueberauth,ueberauth/ueberauth,ueberauth,An Elixir Authentication System for Plug-based Web Applications,Elixir,1685,120,28,2014-10-13T21:37:35Z,2025-09-14T11:04:11Z,https://github.com/ueberauth/ueberauth,,MIT License,227,False,False
55,learn-elixir,dwyl/learn-elixir,dwyl,":droplet: Learn the Elixir programming language to build functional, fast, scalable and maintainable web applications!",Elixir,1683,113,129,2016-12-01T06:33:44Z,2025-09-09T14:26:14Z,https://github.com/dwyl/learn-elixir,,,5297,False,False
56,desktop,elixir-desktop/desktop,elixir-desktop,"Building Local-First apps for Windows, MacOS, Linux, iOS and Android using Phoenix LiveView & Elixir!",Elixir,1673,58,9,2021-03-01T17:39:36Z,2025-09-12T01:07:25Z,https://github.com/elixir-desktop/desktop,https://hexdocs.pm/desktop/,MIT License,190,False,False
57,jason,michalmuskala/jason,michalmuskala,A blazing fast JSON parser and generator in pure Elixir.,Elixir,1652,174,20,2017-06-04T19:00:57Z,2025-09-08T20:46:07Z,https://github.com/michalmuskala/jason,,Other,3710,False,False
58,elixir-companies,beam-community/elixir-companies,beam-community,A list of companies currently using Elixir in production.,Elixir,1650,377,4,2015-06-11T21:46:12Z,2025-09-09T14:26:26Z,https://github.com/beam-community/elixir-companies,https://elixir-companies.com,MIT License,1830,False,False
59,pow,pow-auth/pow,pow-auth,"Robust, modular, and extendable user authentication system",Elixir,1645,158,70,2018-05-07T16:27:27Z,2025-09-13T14:54:09Z,https://github.com/pow-auth/pow,https://powauth.com,MIT License,2249,False,False
60,axon,elixir-nx/axon,elixir-nx,Nx-powered Neural Networks,Elixir,1638,113,24,2021-01-25T13:09:52Z,2025-09-09T17:23:16Z,https://github.com/elixir-nx/axon,,Apache License 2.0,141077,False,False
61,sorted_set_nif,discord/sorted_set_nif,discord,Elixir SortedSet backed by a Rust-based NIF,Elixir,1634,100,12,2018-11-26T21:46:35Z,2025-09-08T17:10:13Z,https://github.com/discord/sorted_set_nif,,MIT License,67,False,False
62,flow,dashbitco/flow,dashbitco,Computational parallel flows on top of GenStage,Elixir,1602,88,2,2017-01-18T00:32:54Z,2025-09-13T13:26:23Z,https://github.com/dashbitco/flow,https://hexdocs.pm/flow,,359,False,False
63,sequin,sequinstream/sequin,sequinstream,"Postgres change data capture to streams, queues, and search indexes like Kafka, SQS, Elasticsearch, HTTP endpoints, and more",Elixir,1598,82,62,2024-06-26T01:50:46Z,2025-09-13T17:05:19Z,https://github.com/sequinstream/sequin,https://sequinstream.com,MIT License,137181,False,False
64,elixirscript,elixirscript/elixirscript,elixirscript,Converts Elixir to JavaScript,Elixir,1567,68,19,2015-02-01T21:22:05Z,2025-07-06T06:20:37Z,https://github.com/elixirscript/elixirscript,https://elixirscript.github.io/,MIT License,3793,False,False
65,gen_stage,elixir-lang/gen_stage,elixir-lang,Producer and consumer actors with back-pressure for Elixir,Elixir,1561,195,3,2015-08-26T17:57:36Z,2025-08-29T14:30:36Z,https://github.com/elixir-lang/gen_stage,http://hexdocs.pm/gen_stage,,1271,False,False
66,live_svelte,woutdp/live_svelte,woutdp,Svelte inside Phoenix LiveView with seamless end-to-end reactivity,Elixir,1558,68,23,2023-02-21T04:40:06Z,2025-09-09T15:40:58Z,https://github.com/woutdp/live_svelte,https://hexdocs.pm/live_svelte,MIT License,20005,False,False
67,ex_doc,elixir-lang/ex_doc,elixir-lang,ExDoc produces HTML and EPUB documentation for Elixir projects,Elixir,1546,350,22,2012-03-06T21:35:38Z,2025-09-13T07:23:32Z,https://github.com/elixir-lang/ex_doc,http://elixir-lang.org,Other,14779,False,False
68,bumblebee,elixir-nx/bumblebee,elixir-nx,Pre-trained Neural Network models in Axon (+ 🤗 Models integration),Elixir,1536,114,32,2022-05-03T13:59:36Z,2025-09-14T22:32:25Z,https://github.com/elixir-nx/bumblebee,,Apache License 2.0,6906,False,False
69,bors-ng,bors-ng/bors-ng,bors-ng,👁 A merge bot for GitHub Pull Requests,Elixir,1528,182,181,2016-12-29T00:41:38Z,2025-09-03T17:00:34Z,https://github.com/bors-ng/bors-ng,https://bors.tech/,Apache License 2.0,4942,False,True
70,exq,akira/exq,akira,Job processing library for Elixir  - compatible with Resque / Sidekiq,Elixir,1522,182,29,2013-07-31T05:10:24Z,2025-09-02T22:21:09Z,https://github.com/akira/exq,,Other,3034,False,False
71,swoosh,swoosh/swoosh,swoosh,"Compose, deliver and test your emails easily in Elixir",Elixir,1510,239,13,2016-03-04T23:48:56Z,2025-09-13T13:24:45Z,https://github.com/swoosh/swoosh,https://hexdocs.pm/swoosh,MIT License,2207,False,False
72,Elixir-Code-Smells,lucasvegi/Elixir-Code-Smells,lucasvegi,Catalog of Elixir-specific code smells,Elixir,1501,56,1,2022-02-15T16:03:05Z,2025-09-09T22:23:03Z,https://github.com/lucasvegi/Elixir-Code-Smells,https://doi.org/10.1007/s10664-023-10343-6,MIT License,4775,False,False
73,standard-webhooks,standard-webhooks/standard-webhooks,standard-webhooks,The Standard Webhooks specification,Elixir,1496,43,47,2023-08-27T16:08:55Z,2025-09-12T11:25:02Z,https://github.com/standard-webhooks/standard-webhooks,https://www.standardwebhooks.com/,Apache License 2.0,545,False,False
74,benchee,bencheeorg/benchee,bencheeorg,Easy and extensible benchmarking in Elixir providing you with lots of statistics!,Elixir,1481,69,27,2016-05-22T18:48:43Z,2025-09-13T13:26:37Z,https://github.com/bencheeorg/benchee,,MIT License,1768,False,False
75,grpc,elixir-grpc/grpc,elixir-grpc,An Elixir implementation of gRPC,Elixir,1475,227,40,2016-07-20T17:12:07Z,2025-09-12T23:17:09Z,https://github.com/elixir-grpc/grpc,https://hex.pm/packages/grpc,Apache License 2.0,3785,False,False
76,expert,elixir-lang/expert,elixir-lang,Official Elixir Language Server Protocol implementation,Elixir,1458,30,40,2024-09-18T13:26:43Z,2025-09-14T19:55:17Z,https://github.com/elixir-lang/expert,https://www.expert-lsp.org,Apache License 2.0,4479,False,False
77,membrane_core,membraneframework/membrane_core,membraneframework,"The core of Membrane Framework, multimedia processing framework written in Elixir",Elixir,1436,41,55,2017-01-26T11:31:00Z,2025-09-14T04:48:08Z,https://github.com/membraneframework/membrane_core,https://membrane.stream,Apache License 2.0,5169,False,False
78,accent,mirego/accent,mirego,The first developer-oriented translation tool. True asynchronous flow between translators and your team.,Elixir,1426,112,48,2018-03-20T00:42:03Z,2025-09-12T13:18:37Z,https://github.com/mirego/accent,https://www.accent.reviews,"BSD 3-Clause ""New"" or ""Revised"" License",13122,False,False
79,kaffy,aesmail/kaffy,aesmail,Powerfully simple admin package for phoenix applications,Elixir,1407,175,73,2020-05-07T02:56:34Z,2025-09-09T17:58:29Z,https://github.com/aesmail/kaffy,https://kaffy.fly.dev/admin/,MIT License,14833,False,False
80,mint,elixir-mint/mint,elixir-mint,Functional HTTP client for Elixir with support for HTTP/1 and HTTP/2 🌱,Elixir,1403,116,8,2017-10-25T13:22:12Z,2025-09-10T21:10:02Z,https://github.com/elixir-mint/mint,,Apache License 2.0,1108,False,False
81,horde,derekkraan/horde,derekkraan,Horde is a distributed Supervisor and Registry backed by DeltaCrdt,Elixir,1391,117,35,2018-05-08T15:01:01Z,2025-09-14T16:33:41Z,https://github.com/derekkraan/horde,,MIT License,606,False,False
82,mox,dashbitco/mox,dashbitco,Mocks and explicit contracts in Elixir,Elixir,1378,76,5,2017-09-25T10:24:09Z,2025-09-11T01:18:01Z,https://github.com/dashbitco/mox,,,151,False,False
83,hound,HashNuke/hound,HashNuke,Elixir library for writing integration tests and browser automation,Elixir,1377,145,86,2013-12-15T14:01:16Z,2025-09-07T03:44:26Z,https://github.com/HashNuke/hound,http://hexdocs.pm/hound,MIT License,474,False,False
84,uneebee,zoonk/uneebee,zoonk,Platform for creating interactive courses.,Elixir,1356,90,0,2023-09-10T06:17:15Z,2025-09-07T09:21:59Z,https://github.com/zoonk/uneebee,https://zoonk.org,GNU Affero General Public License v3.0,4963,False,True
85,live_beats,fly-apps/live_beats,fly-apps,,Elixir,1355,178,15,2021-11-05T12:58:38Z,2025-09-09T19:59:05Z,https://github.com/fly-apps/live_beats,,MIT License,538,False,False
86,nebulex,elixir-nebulex/nebulex,elixir-nebulex,In-memory and distributed caching toolkit for Elixir.,Elixir,1347,77,9,2017-02-14T10:48:00Z,2025-09-13T23:21:44Z,https://github.com/elixir-nebulex/nebulex,https://hexdocs.pm/nebulex,MIT License,1061,False,False
87,midarr-server,midarrlabs/midarr-server,midarrlabs,"🔥Midarr, the minimal lightweight media server.",Elixir,1330,38,6,2022-02-02T21:25:40Z,2025-09-14T23:13:13Z,https://github.com/midarrlabs/midarr-server,,MIT License,609329,False,False
88,finch,sneako/finch,sneako,"Elixir HTTP client, focused on performance",Elixir,1327,127,41,2019-10-23T21:03:44Z,2025-09-12T23:44:22Z,https://github.com/sneako/finch,,MIT License,869,False,False
89,ex_aws,ex-aws/ex_aws,ex-aws,"A flexible, easy to use set of clients AWS APIs for Elixir",Elixir,1321,553,75,2014-09-15T16:02:48Z,2025-09-03T04:43:21Z,https://github.com/ex-aws/ex_aws,https://hex.pm/packages/ex_aws,MIT License,2136,False,False
90,maru,elixir-maru/maru,elixir-maru,Elixir RESTful Framework ,Elixir,1320,86,18,2014-12-31T07:07:57Z,2025-09-02T14:04:51Z,https://github.com/elixir-maru/maru,https://maru.readme.io,"BSD 3-Clause ""New"" or ""Revised"" License",609,False,False
91,comeonin,riverrun/comeonin,riverrun,Password hashing specification for the Elixir programming language,Elixir,1317,65,2,2014-12-19T09:38:57Z,2025-08-22T07:41:42Z,https://github.com/riverrun/comeonin,https://hex.pm/packages/comeonin,Other,520,False,False
92,semaphore,semaphoreio/semaphore,semaphoreio,Semaphore is an open source CI/CD platform. Self-host Semaphore on your own servers or on a cloud provider.,Elixir,1294,62,93,2025-01-21T12:37:52Z,2025-09-13T16:06:23Z,https://github.com/semaphoreio/semaphore,https://semaphore.io,Other,62183,False,False
93,fast-elixir,devonestes/fast-elixir,devonestes,:dash: Writing Fast Elixir :heart_eyes: -- Collect Common Elixir idioms.,Elixir,1286,42,8,2017-04-01T13:13:46Z,2025-09-01T04:11:06Z,https://github.com/devonestes/fast-elixir,https://github.com/devonestes/fast-elixir,,1123,False,False
94,coherence,smpallen99/coherence,smpallen99,"Coherence is a full featured, configurable authentication system for Phoenix",Elixir,1261,223,75,2016-07-04T19:47:25Z,2025-08-21T06:52:10Z,https://github.com/smpallen99/coherence,,MIT License,1106,False,False
95,req,wojtekmach/req,wojtekmach,Req is a batteries-included HTTP client for Elixir.,Elixir,1253,151,65,2021-03-28T16:59:50Z,2025-09-13T13:24:32Z,https://github.com/wojtekmach/req,https://hexdocs.pm/req,Apache License 2.0,963,False,False
96,swarm,bitwalker/swarm,bitwalker,"Easy clustering, registration, and distribution of worker processes for Erlang/Elixir",Elixir,1237,104,44,2016-07-25T22:29:49Z,2025-09-01T19:36:35Z,https://github.com/bitwalker/swarm,,MIT License,522,False,False
97,tv,algora-io/tv,algora-io,Open source Twitch for developers,Elixir,1228,77,15,2024-02-29T19:32:27Z,2025-09-13T13:47:38Z,https://github.com/algora-io/tv,https://algora.tv,Other,10960,False,False
98,explorer,elixir-explorer/explorer,elixir-explorer,Series (one-dimensional) and dataframes (two-dimensional) for fast and elegant data exploration in Elixir,Elixir,1220,141,44,2021-07-23T05:05:39Z,2025-09-09T14:29:00Z,https://github.com/elixir-explorer/explorer,https://hexdocs.pm/explorer,MIT License,3695,False,False
99,witchcraft,witchcrafters/witchcraft,witchcrafters,Monads and other dark magic for Elixir,Elixir,1214,61,24,2015-10-06T20:56:18Z,2025-09-01T21:11:31Z,https://github.com/witchcrafters/witchcraft,https://witchcrafters.github.io,MIT License,6732,False,False
100,ex_admin,smpallen99/ex_admin,smpallen99,ExAdmin is an auto administration package for Elixir and the Phoenix Framework,Elixir,1203,271,132,2015-05-28T22:55:28Z,2025-09-03T06:01:46Z,https://github.com/smpallen99/ex_admin,,MIT License,16831,False,False
