排名,项目名称,完整名称,作者,描述,语言,Stars,Forks,Issues,创建时间,更新时间,仓库链接,主页链接,许可证,大小(KB),是否Fork,是否已归档
87,dashboards,keen/dashboards,keen,Responsive dashboard templates 📊✨,HTML,11038,1391,6,2014-08-08T17:16:17Z,2026-06-17T07:00:39Z,https://github.com/keen/dashboards,http://keen.github.io/dashboards/,MIT License,2240,False,False
88,craftinginterpreters,munificent/craftinginterpreters,munificent,"Repository for the book ""Crafting Interpreters""",HTML,10853,1276,143,2017-01-15T19:46:57Z,2026-06-21T20:27:32Z,https://github.com/munificent/craftinginterpreters,http://www.craftinginterpreters.com/,Other,23405,False,False
89,zh.javascript.info,javascript-tutorial/zh.javascript.info,javascript-tutorial,现代 JavaScript 教程（The Modern JavaScript Tutorial），以最新的 ECMAScript 规范为基准，通过简单但足够详细的内容，为你讲解从基础到高阶的 JavaScript 相关知识。,HTML,10756,1208,28,2018-04-04T06:01:58Z,2026-06-22T03:23:24Z,https://github.com/javascript-tutorial/zh.javascript.info,https://zh.javascript.info,Other,500975,False,False
90,lancedb,lancedb/lancedb,lancedb,Developer-friendly OSS embedded retrieval library for multimodal AI. Search More; Manage Less.,HTML,10674,920,650,2023-02-28T01:15:17Z,2026-06-22T03:33:58Z,https://github.com/lancedb/lancedb,https://lancedb.com/docs,Apache License 2.0,27528,False,False
91,chatgpt_system_prompt,LouisShark/chatgpt_system_prompt,LouisShark,A collection of GPT system prompts and various prompt injection/leaking knowledge.,HTML,10636,1466,2,2023-11-01T12:35:05Z,2026-06-21T23:48:26Z,https://github.com/LouisShark/chatgpt_system_prompt,,MIT License,30047,False,False
92,fluentui-system-icons,microsoft/fluentui-system-icons,microsoft,"Fluent System Icons are a collection of familiar, friendly and modern icons from Microsoft.",HTML,10631,786,215,2020-05-12T21:05:57Z,2026-06-22T04:46:33Z,https://github.com/microsoft/fluentui-system-icons,https://aka.ms/fluentui-system-icons,MIT License,840337,False,False
93,pdf2htmlEX,coolwanglu/pdf2htmlEX,coolwanglu,Convert PDF to HTML without losing text or format.,HTML,10602,1844,244,2012-08-04T17:59:25Z,2026-06-19T14:11:16Z,https://github.com/coolwanglu/pdf2htmlEX,http://coolwanglu.github.com/pdf2htmlEX/,Other,137088,False,True
94,sovereign,sovereign/sovereign,sovereign,"A set of Ansible playbooks to build and maintain your own private cloud: email, calendar, contacts, file sync, IRC bouncer, VPN, and more.",HTML,10506,819,101,2013-08-19T22:09:16Z,2026-06-20T20:01:10Z,https://github.com/sovereign/sovereign,,Other,1052,False,False
95,node-interview,ElemeFE/node-interview,ElemeFE,How to pass the Node.js interview of ElemeFE.,HTML,10491,1550,8,2017-01-23T07:26:07Z,2026-06-18T12:13:09Z,https://github.com/ElemeFE/node-interview,https://elemefe.github.io/node-interview/,MIT License,804,False,False
96,raytracing.github.io,RayTracing/raytracing.github.io,RayTracing,Main Web Site (Online Books),HTML,10462,1005,77,2019-07-18T22:17:09Z,2026-06-21T22:00:55Z,https://github.com/RayTracing/raytracing.github.io,https://raytracing.github.io/,Creative Commons Zero v1.0 Universal,40313,False,False
97,machine-learning-systems-design,chiphuyen/machine-learning-systems-design,chiphuyen,"A booklet on machine learning systems design with exercises. NOT the repo for the book ""Designing Machine Learning Systems"", which is `dmls-book`",HTML,10434,1617,11,2019-11-24T23:16:28Z,2026-06-21T10:30:47Z,https://github.com/chiphuyen/machine-learning-systems-design,https://huyenchip.com/machine-learning-systems-design/toc.html,,1408,False,False
98,bug,liu673cn/bug,liu673cn,TVbox开源版（空壳-自行配置）,HTML,10383,1996,6,2022-05-10T06:57:04Z,2026-06-22T03:41:46Z,https://github.com/liu673cn/bug,,,99682,False,False
99,electron-api-demos,electron/electron-api-demos,electron,Explore the Electron APIs,HTML,10235,2079,49,2015-10-16T17:59:08Z,2026-06-18T21:38:38Z,https://github.com/electron/electron-api-demos,http://electronjs.org/#get-started,MIT License,5674,False,True
100,milligram,milligram/milligram,milligram,A minimalist CSS framework.,HTML,10214,726,125,2015-12-10T17:03:36Z,2026-06-20T14:38:04Z,https://github.com/milligram/milligram,https://milligram.io,MIT License,8408,False,False
