排名,项目名称,完整名称,作者,描述,语言,Stars,Forks,Issues,创建时间,更新时间,仓库链接,主页链接,许可证,大小(KB),是否Fork,是否已归档
1,computer-science,ossu/computer-science,ossu,🎓 Path to a free self-taught education in Computer Science!,HTML,205142,25492,25,2014-05-04T00:18:39Z,2026-06-22T04:59:14Z,https://github.com/ossu/computer-science,https://cs.ossu.dev,MIT License,1784,False,False
2,FreeDomain,DigitalPlatDev/FreeDomain,DigitalPlatDev,DigitalPlat FreeDomain: Free Domain For Everyone,HTML,179694,3658,33,2024-05-30T13:23:00Z,2026-06-22T04:59:46Z,https://github.com/DigitalPlatDev/FreeDomain,https://domain.digitalplat.org,GNU Affero General Public License v3.0,972,False,False
3,prompts.chat,f/prompts.chat,f,"f.k.a. Awesome ChatGPT Prompts. Share, discover, and collect prompts from the community. Free and open source — self-host for your organization with complete privacy.",HTML,164059,21253,55,2022-12-05T13:54:13Z,2026-06-22T04:37:50Z,https://github.com/f/prompts.chat,https://prompts.chat,Other,400629,False,False
4,free-for-dev,ripienaar/free-for-dev,ripienaar,"A list of SaaS, PaaS and IaaS offerings that have free tiers of interest to devops and infradev",HTML,123291,13001,11,2015-03-18T21:06:26Z,2026-06-22T05:01:22Z,https://github.com/ripienaar/free-for-dev,https://free-for.dev/,,10158,False,False
5,cs-self-learning,PKUFlyingPig/cs-self-learning,PKUFlyingPig,计算机自学指南,HTML,73278,7887,150,2021-10-20T13:43:42Z,2026-06-22T04:59:26Z,https://github.com/PKUFlyingPig/cs-self-learning,https://csdiy.wiki,MIT License,69980,False,False
6,claude-code-best-practice,shanraisshan/claude-code-best-practice,shanraisshan,from vibe coding to agentic engineering - practice makes claude perfect,HTML,58513,5888,11,2025-10-31T14:15:28Z,2026-06-22T05:02:09Z,https://github.com/shanraisshan/claude-code-best-practice,https://linkedin.com/in/shanraisshan,MIT License,72122,False,False
7,awesome-compose,docker/awesome-compose,docker,Awesome Docker Compose samples,HTML,45594,8214,394,2020-02-13T08:51:42Z,2026-06-22T00:43:31Z,https://github.com/docker/awesome-compose,https://docs.docker.com/compose/,Creative Commons Zero v1.0 Universal,10957,False,False
8,retrofit,square/retrofit,square,A type-safe HTTP client for Android and the JVM,HTML,43908,7341,170,2010-09-06T21:39:43Z,2026-06-20T11:30:58Z,https://github.com/square/retrofit,https://square.github.io/retrofit/,Apache License 2.0,7417,False,False
9,tabler,tabler/tabler,tabler,Tabler is free and open-source HTML Dashboard UI Kit built on Bootstrap,HTML,41190,4371,140,2018-02-01T09:08:59Z,2026-06-22T03:22:21Z,https://github.com/tabler/tabler,https://tabler.io,MIT License,374332,False,False
10,zju-icicles,QSCTech/zju-icicles,QSCTech,浙江大学课程攻略共享计划,HTML,40626,9575,10,2016-06-28T16:17:32Z,2026-06-22T03:38:42Z,https://github.com/QSCTech/zju-icicles,https://qsctech.github.io/zju-icicles/,,6076928,False,False
11,styleguide,google/styleguide,google,Style guides for Google-originated open-source projects,HTML,39390,12966,171,2015-05-20T19:18:59Z,2026-06-22T02:39:21Z,https://github.com/google/styleguide,https://google.github.io/styleguide/,Other,3293,False,False
12,REKCARC-TSC-UHT,PKUanonym/REKCARC-TSC-UHT,PKUanonym,"清华大学计算机系课程攻略 Guidance for courses in Department of Computer Science and Technology, Tsinghua University",HTML,37193,7838,4,2019-04-05T03:31:23Z,2026-06-22T03:54:48Z,https://github.com/PKUanonym/REKCARC-TSC-UHT,https://rekcarc-tsc-uht.readthedocs.io/,Creative Commons Attribution Share Alike 4.0 International,4739330,False,False
13,Coursera-ML-AndrewNg-Notes,fengdu78/Coursera-ML-AndrewNg-Notes,fengdu78,吴恩达老师的机器学习课程个人笔记,HTML,37189,11179,68,2017-11-04T10:04:08Z,2026-06-22T01:00:42Z,https://github.com/fengdu78/Coursera-ML-AndrewNg-Notes,,,662586,False,False
14,manifesto,opentofu/manifesto,opentofu,The OpenTF Manifesto expresses concern over HashiCorp's switch of the Terraform license from open-source to the Business Source License (BSL) and calls for the tool's return to a truly open-source license.,HTML,35748,1031,20,2023-08-13T16:17:24Z,2026-06-21T15:50:25Z,https://github.com/opentofu/manifesto,https://opentf.org,Apache License 2.0,1858,False,True
15,material-design-lite,google/material-design-lite,google,Material Design Components in HTML/CSS/JS,HTML,32177,4922,431,2015-01-14T22:01:33Z,2026-06-21T07:14:39Z,https://github.com/google/material-design-lite,,Apache License 2.0,56990,False,False
16,alpine,alpinejs/alpine,alpinejs,"A rugged, minimal framework for composing JavaScript behavior in your markup. ",HTML,31693,1371,3,2019-11-28T13:51:55Z,2026-06-22T02:44:46Z,https://github.com/alpinejs/alpine,https://alpinejs.dev,MIT License,8968,False,False
17,foundation-sites,foundation/foundation-sites,foundation,The most advanced responsive front-end framework in the world. Quickly create prototypes and production code for sites that work on any kind of device.,HTML,29778,5381,78,2011-10-13T23:05:42Z,2026-06-20T19:24:13Z,https://github.com/foundation/foundation-sites,https://get.foundation,MIT License,126117,False,False
18,JavaScript30,wesbos/JavaScript30,wesbos,30 Day Vanilla JS Challenge,HTML,29183,42035,3,2016-12-07T19:15:31Z,2026-06-22T03:06:09Z,https://github.com/wesbos/JavaScript30,https://JavaScript30.com,,46998,False,False
19,awesome-generative-ai-guide,aishwaryanr/awesome-generative-ai-guide,aishwaryanr,"A one stop repository for generative AI research updates, interview resources, notebooks and much more!",HTML,27828,5756,24,2024-02-06T18:14:14Z,2026-06-22T04:19:22Z,https://github.com/aishwaryanr/awesome-generative-ai-guide,https://www.linkedin.com/in/areganti/,MIT License,161532,False,False
20,weui,Tencent/weui,Tencent,"A UI library by WeChat official design team, includes the most useful widgets/modules in mobile web applications.",HTML,27377,6298,64,2014-12-18T04:09:54Z,2026-06-22T03:47:00Z,https://github.com/Tencent/weui,https://weui.io,Other,12651,False,False
21,hacker-laws,dwmkerr/hacker-laws,dwmkerr,"🧠 Laws, Theories, Principles and Patterns for developers and technologists.",HTML,27185,1561,152,2018-01-25T03:46:34Z,2026-06-21T21:59:48Z,https://github.com/dwmkerr/hacker-laws,http://hacker-laws.com/,Creative Commons Attribution Share Alike 4.0 International,2940,False,False
22,awesome-quant,wilsonfreitas/awesome-quant,wilsonfreitas,"A curated list of insanely awesome libraries, packages and resources for Quants (Quantitative Finance)",HTML,26950,3592,50,2015-09-30T09:53:49Z,2026-06-22T03:45:51Z,https://github.com/wilsonfreitas/awesome-quant,https://wilsonfreitas.github.io/awesome-quant/,,5873,False,False
23,awesome-piracy,Igglybuff/awesome-piracy,Igglybuff,A curated list of awesome warez and piracy links,HTML,26805,2271,1,2018-10-09T22:09:56Z,2026-06-21T23:46:42Z,https://github.com/Igglybuff/awesome-piracy,,Creative Commons Zero v1.0 Universal,2154,False,True
24,fastText,facebookresearch/fastText,facebookresearch,Library for fast text representation and classification.,HTML,26539,4810,554,2016-07-16T13:38:42Z,2026-06-21T23:34:25Z,https://github.com/facebookresearch/fastText,https://fasttext.cc/,MIT License,8318,False,True
25,OpenClash,vernesong/OpenClash,vernesong,A Clash Client For OpenWrt,HTML,26379,3936,61,2019-05-29T15:52:27Z,2026-06-22T04:33:20Z,https://github.com/vernesong/OpenClash,,MIT License,18585344,False,False
26,en.javascript.info,javascript-tutorial/en.javascript.info,javascript-tutorial,Modern JavaScript Tutorial ,HTML,25341,3996,533,2017-06-03T14:27:57Z,2026-06-22T04:33:16Z,https://github.com/javascript-tutorial/en.javascript.info,https://javascript.info,Other,772358,False,False
27,bitcoinbook,bitcoinbook/bitcoinbook,bitcoinbook,Mastering Bitcoin 3rd Edition - Programming the Open Blockchain,HTML,25219,6190,194,2013-08-11T23:18:28Z,2026-06-21T08:35:04Z,https://github.com/bitcoinbook/bitcoinbook,https://aantonop.com/books,Other,62974,False,False
28,Awesome-Linux-Software,luong-komorebi/Awesome-Linux-Software,luong-komorebi,🐧 A list of awesome Linux softwares ,HTML,25218,2216,0,2016-08-06T13:16:29Z,2026-06-22T02:50:00Z,https://github.com/luong-komorebi/Awesome-Linux-Software,https://luong-komorebi.github.io/Awesome-Linux-Software/,,6759,False,True
29,llm-action,liguodongiot/llm-action,liguodongiot,本项目旨在分享大模型相关技术原理以及实战经验（大模型工程化、大模型应用落地）,HTML,24561,2808,19,2023-05-23T05:29:16Z,2026-06-22T02:53:19Z,https://github.com/liguodongiot/llm-action,https://www.zhihu.com/column/c_1456193767213043713,Apache License 2.0,25433,False,False
30,flash-linux0.11-talk,dibingfa/flash-linux0.11-talk,dibingfa,你管这破玩意叫操作系统源码 — 像小说一样品读 Linux 0.11 核心代码,HTML,22427,2943,56,2021-11-06T04:58:25Z,2026-06-22T01:48:21Z,https://github.com/dibingfa/flash-linux0.11-talk,,,184307,False,False
31,polymer,Polymer/polymer,Polymer,Our original Web Component library.,HTML,22024,1963,84,2012-08-23T20:56:30Z,2026-06-21T19:50:25Z,https://github.com/Polymer/polymer,https://polymer-library.polymer-project.org/,"BSD 3-Clause ""New"" or ""Revised"" License",31785,False,False
32,chosen,harvesthq/chosen,harvesthq,"Deprecated - Chosen is a library for making long, unwieldy select boxes more friendly.",HTML,21979,4023,309,2011-04-18T15:07:41Z,2026-06-22T03:47:01Z,https://github.com/harvesthq/chosen,http://harvesthq.github.io/chosen/,Other,3057,False,False
33,skill-map,TeamStuQ/skill-map,TeamStuQ,程序员技能图谱,HTML,21660,4402,80,2015-11-17T11:17:38Z,2026-06-21T17:15:37Z,https://github.com/TeamStuQ/skill-map,https://github.com/TeamStuQ/skill-map,,33969,False,False
34,gentelella,ColorlibHQ/gentelella,ColorlibHQ,Free Bootstrap 5 Admin Dashboard Template,HTML,21372,6837,1,2015-05-15T06:57:27Z,2026-06-22T03:47:18Z,https://github.com/ColorlibHQ/gentelella,https://gentelella.colorlib.com/,MIT License,56615,False,False
35,rough,rough-stuff/rough,rough-stuff,"Create graphics with a hand-drawn, sketchy, appearance",HTML,21030,658,42,2016-12-13T09:12:55Z,2026-06-21T20:14:21Z,https://github.com/rough-stuff/rough,http://roughjs.com,MIT License,6173,False,False
36,architecture.of.internet-product,davideuler/architecture.of.internet-product,davideuler,互联网公司技术架构，微信/淘宝/微博/腾讯/阿里/美团点评/百度/OpenAI/Google/Facebook/Amazon/eBay的架构，欢迎PR补充,HTML,20792,4747,5,2018-04-30T10:25:31Z,2026-06-21T18:07:00Z,https://github.com/davideuler/architecture.of.internet-product,,,845499,False,False
37,deeplearning_ai_books,fengdu78/deeplearning_ai_books,fengdu78,deeplearning.ai（吴恩达老师的深度学习课程笔记及资源）,HTML,20735,6137,55,2017-12-08T08:47:42Z,2026-06-22T02:28:53Z,https://github.com/fengdu78/deeplearning_ai_books,,,585160,False,False
38,You-Dont-Need-JavaScript,you-dont-need/You-Dont-Need-JavaScript,you-dont-need,"CSS is powerful, you can do a lot of things without JS.",HTML,20539,1503,75,2016-07-05T07:30:42Z,2026-06-21T07:32:51Z,https://github.com/you-dont-need/You-Dont-Need-JavaScript,,GNU General Public License v3.0,693000,False,False
39,SummaryOfLoanSuspension,WeNeedHome/SummaryOfLoanSuspension,WeNeedHome,全国各省市停贷通知汇总,HTML,20406,2075,125,2022-07-12T16:33:25Z,2026-06-18T13:56:06Z,https://github.com/WeNeedHome/SummaryOfLoanSuspension,,,193948,False,False
40,fonts,google/fonts,google,"Font files available from Google Fonts, and a public issue tracker for all things Google Fonts",HTML,20170,2899,1379,2015-02-11T23:34:54Z,2026-06-22T04:04:40Z,https://github.com/google/fonts,http://google.github.io/fonts/,,3270255,False,False
41,Dism-Multi-language,Chuyu-Team/Dism-Multi-language,Chuyu-Team,Dism++ Multi-language Support & BUG Report,HTML,19780,1213,320,2016-11-26T06:45:37Z,2026-06-22T04:39:20Z,https://github.com/Chuyu-Team/Dism-Multi-language,,MIT License,8813,False,False
42,huashu-design,alchaincyf/huashu-design,alchaincyf,Huashu Design · HTML-native design skill for Claude Code · Claude Code 里 HTML 原生的设计 skill · 高保真原型 / 幻灯片 / 动画 + 20 设计哲学 + 5 维评审 + MP4 导出 · Agent-agnostic,HTML,19381,2396,15,2026-04-19T14:42:06Z,2026-06-22T03:52:40Z,https://github.com/alchaincyf/huashu-design,,MIT License,222545,False,False
43,cua,trycua/cua,trycua,"Open-source infrastructure for Computer-Use Agents. Sandboxes, SDKs, and benchmarks to train and evaluate AI agents that can control full desktops (macOS, Linux, Windows).",HTML,18587,1205,393,2025-01-31T15:02:49Z,2026-06-22T03:51:25Z,https://github.com/trycua/cua,https://cua.ai,MIT License,261471,False,False
44,fastclick,ftlabs/fastclick,ftlabs,Polyfill to remove click delays on browsers with touch UIs,HTML,18535,3136,277,2012-02-13T08:38:00Z,2026-06-20T16:01:13Z,https://github.com/ftlabs/fastclick,,MIT License,322,False,True
45,uikit,uikit/uikit,uikit,A lightweight and modular front-end framework for developing fast and powerful web interfaces,HTML,18535,2292,606,2013-07-18T16:00:26Z,2026-06-21T14:41:00Z,https://github.com/uikit/uikit,http://getuikit.com,MIT License,57021,False,False
46,skrollr,Prinzhorn/skrollr,Prinzhorn,Stand-alone parallax scrolling library for mobile (Android + iOS) and desktop. No jQuery. Just plain JavaScript (and some love).,HTML,18425,3404,262,2012-03-18T15:41:35Z,2026-06-20T08:30:18Z,https://github.com/Prinzhorn/skrollr,http://prinzhorn.github.io/skrollr/,MIT License,1659,False,True
47,guizang-ppt-skill,op7418/guizang-ppt-skill,op7418,"AI-agent Skill for generating polished HTML slide decks: editorial magazine and Swiss layouts, image prompts, social covers, and a WebGL/low-power presentation runtime.",HTML,18350,1342,23,2026-04-23T13:23:07Z,2026-06-22T04:52:30Z,https://github.com/op7418/guizang-ppt-skill,,GNU Affero General Public License v3.0,1913,False,False
48,web-starter-kit,google/web-starter-kit,google,Web Starter Kit - a workflow for multi-device websites,HTML,18297,2921,74,2014-04-07T08:45:18Z,2026-06-20T08:32:34Z,https://github.com/google/web-starter-kit,http://developers.google.com/web/starter-kit,Apache License 2.0,10100,False,True
49,twemoji,twitter/twemoji,twitter,Emoji for everyone. https://twemoji.twitter.com/,HTML,17678,1893,143,2014-11-06T21:49:34Z,2026-06-21T23:40:00Z,https://github.com/twitter/twemoji,,MIT License,842458,False,False
50,blog_os,phil-opp/blog_os,phil-opp,Writing an OS in Rust,HTML,17532,1203,98,2015-07-23T15:23:54Z,2026-06-22T04:49:12Z,https://github.com/phil-opp/blog_os,http://os.phil-opp.com,Apache License 2.0,18830,False,False
51,masonry,desandro/masonry,desandro,:love_hotel: Cascading grid layout plugin,HTML,16709,2076,85,2009-11-21T21:04:56Z,2026-06-22T04:31:14Z,https://github.com/desandro/masonry,https://masonry.desandro.com,,1479,False,False
52,Screenshot-to-code,emilwallner/Screenshot-to-code,emilwallner,A neural network that transforms a design mock-up into a static website.,HTML,16485,1544,22,2017-10-16T11:41:48Z,2026-06-20T21:54:26Z,https://github.com/emilwallner/Screenshot-to-code,,Other,51643,False,False
53,html-css,gustavoguanabara/html-css,gustavoguanabara,Curso de HTML5 e CSS3,HTML,16331,3848,541,2020-03-09T19:54:04Z,2026-06-21T22:10:49Z,https://github.com/gustavoguanabara/html-css,https://gustavoguanabara.github.io/html-css/,MIT License,279613,False,False
54,zphisher,htr-tech/zphisher,htr-tech,An automated phishing tool with 30+ templates. This Tool is made for educational purpose only ! Author will not be responsible for any misuse of this toolkit !,HTML,16243,6111,445,2019-11-25T13:22:20Z,2026-06-22T04:55:58Z,https://github.com/htr-tech/zphisher,,GNU General Public License v3.0,29374,False,False
55,Modern-CPP-Programming,federico-busato/Modern-CPP-Programming,federico-busato,Modern C++ Programming Course (C++03/11/14/17/20/23/26),HTML,15806,1113,3,2018-03-08T09:06:52Z,2026-06-21T08:55:33Z,https://github.com/federico-busato/Modern-CPP-Programming,https://federico-busato.github.io/Modern-CPP-Programming/,Creative Commons Attribution Share Alike 4.0 International,700247,False,False
56,AR.js,jeromeetienne/AR.js,jeromeetienne,Efficient Augmented Reality for the Web - 60fps on mobile!,HTML,15801,2211,24,2017-02-17T10:27:59Z,2026-06-21T22:56:32Z,https://github.com/jeromeetienne/AR.js,,MIT License,327340,False,False
57,al-folio,alshedivat/al-folio,alshedivat,"A beautiful, simple, clean, and responsive Jekyll theme for academics",HTML,15757,13072,38,2016-05-30T16:32:46Z,2026-06-22T02:46:44Z,https://github.com/alshedivat/al-folio,https://alshedivat.github.io/al-folio/,MIT License,360817,False,False
58,ecma262,tc39/ecma262,tc39,"Status, process, and documents for ECMA-262",HTML,15653,1413,479,2014-04-09T19:04:33Z,2026-06-21T02:14:27Z,https://github.com/tc39/ecma262,https://tc39.es/ecma262/,Other,1190288,False,False
59,opensource.guide,github/opensource.guide,github,📚 Community guides for open source creators,HTML,15524,15427,6,2016-06-15T12:03:11Z,2026-06-21T16:04:22Z,https://github.com/github/opensource.guide,https://opensource.guide/,Creative Commons Attribution 4.0 International,20184,False,False
60,zepto,madrobby/zepto,madrobby,"Zepto.js is a minimalist JavaScript library for modern browsers, with a jQuery-compatible API",HTML,15104,3845,1,2010-09-20T07:57:57Z,2026-06-21T11:33:13Z,https://github.com/madrobby/zepto,http://zeptojs.com,Other,8244,False,False
61,dotnet,microsoft/dotnet,microsoft,"This repo is the official home of .NET on GitHub. It's a great starting point to find many .NET OSS projects from Microsoft and the community, including many that are part of the .NET Foundation.",HTML,15067,2244,267,2014-10-23T21:58:29Z,2026-06-19T21:09:43Z,https://github.com/microsoft/dotnet,https://devblogs.microsoft.com/dotnet/,MIT License,3218,False,False
62,unstructured,Unstructured-IO/unstructured,Unstructured-IO,"Convert documents to structured data effortlessly. Unstructured is open-source ETL solution for transforming complex documents into clean, structured formats for language models.  Visit our website to learn more about our enterprise grade Platform product for production grade workflows, partitioning, enrichments, chunking and embedding.",HTML,14978,1258,253,2022-09-26T21:53:41Z,2026-06-21T23:24:32Z,https://github.com/Unstructured-IO/unstructured,https://www.unstructured.io/,Apache License 2.0,236978,False,False
63,awesome-creative-coding,terkelg/awesome-creative-coding,terkelg,"Creative Coding: Generative Art, Data visualization, Interaction Design, Resources.",HTML,14972,959,15,2016-11-01T23:50:27Z,2026-06-22T00:12:43Z,https://github.com/terkelg/awesome-creative-coding,,,554,False,False
64,examples-of-web-crawlers,shengqiangzhang/examples-of-web-crawlers,shengqiangzhang,"一些非常有趣的python爬虫例子,对新手比较友好,主要爬取淘宝、天猫、微信、微信读书、豆瓣、QQ等网站。(Some interesting examples of python crawlers that are friendly to beginners. )",HTML,14649,3794,21,2019-03-13T07:11:23Z,2026-06-21T08:47:03Z,https://github.com/shengqiangzhang/examples-of-web-crawlers,,MIT License,286452,False,False
65,llm_interview_note,wdndev/llm_interview_note,wdndev,主要记录大语言大模型（LLMs） 算法（应用）工程师相关的知识及面试题,HTML,14524,1433,22,2023-11-08T02:52:13Z,2026-06-22T01:52:39Z,https://github.com/wdndev/llm_interview_note,https://wdndev.github.io/llm_interview_note,,139079,False,False
66,smiley-sans,atelier-anchor/smiley-sans,atelier-anchor,得意黑 Smiley Sans：一款在人文观感和几何特征中寻找平衡的中文黑体,HTML,14519,378,41,2022-11-11T13:49:16Z,2026-06-22T03:34:22Z,https://github.com/atelier-anchor/smiley-sans,https://atelier-anchor.com/typefaces/smiley-sans/,SIL Open Font License 1.1,13257,False,False
67,ai-edu,microsoft/ai-edu,microsoft,"AI education materials for Chinese students, teachers and IT professionals.",HTML,14067,2938,99,2018-11-16T04:36:22Z,2026-06-21T13:24:17Z,https://github.com/microsoft/ai-edu,https://microsoft.github.io/ai-edu/,Other,989499,False,False
68,Spoon-Knife,octocat/Spoon-Knife,octocat,This repo is for demonstration purposes only.,HTML,13853,157633,20662,2011-01-27T19:30:43Z,2026-06-21T11:47:10Z,https://github.com/octocat/Spoon-Knife,,,2,False,False
69,hugo-PaperMod,adityatelange/hugo-PaperMod,adityatelange," A fast, clean, responsive Hugo theme.",HTML,13693,3397,7,2020-07-21T04:45:10Z,2026-06-22T03:20:44Z,https://github.com/adityatelange/hugo-PaperMod,https://adityatelange.github.io/hugo-PaperMod/,MIT License,10012,False,False
70,responsive-html-email-template,leemunroe/responsive-html-email-template,leemunroe,A free simple responsive HTML email template,HTML,13684,4313,10,2013-12-20T14:21:13Z,2026-06-21T23:13:21Z,https://github.com/leemunroe/responsive-html-email-template,http://leemunroe.github.io/responsive-html-email-template/email.html,MIT License,100,False,False
71,minimal-mistakes,mmistakes/minimal-mistakes,mmistakes,":triangular_ruler: Jekyll theme for building a personal site, blog, project documentation, or portfolio.",HTML,13524,27276,27,2013-05-24T14:13:30Z,2026-06-20T23:54:11Z,https://github.com/mmistakes/minimal-mistakes,https://mmistakes.github.io/minimal-mistakes/,MIT License,48603,False,False
72,PakePlus,Sjj1024/PakePlus,Sjj1024,Turn any webpage/HTML/Vue/React and so on into desktop and mobile app under 5M with easy in few minutes. 轻松将任意网站/HTML/Vue/React等项目构建为轻量级(小于5M)多端桌面应用和手机应用仅需几分钟. https://ppofficial.netlify.app,HTML,13126,5546,9,2024-09-10T13:12:25Z,2026-06-22T04:06:23Z,https://github.com/Sjj1024/PakePlus,https://pakeplus.com,MIT License,202209,False,False
73,awesome-modern-cpp,rigtorp/awesome-modern-cpp,rigtorp,A collection of resources on modern C++,HTML,13054,1230,18,2016-03-30T17:26:27Z,2026-06-22T02:59:02Z,https://github.com/rigtorp/awesome-modern-cpp,http://awesomecpp.com,,214,False,False
74,keeweb,keeweb/keeweb,keeweb,Free cross-platform password manager compatible with KeePass,HTML,12941,1154,439,2015-10-17T21:41:47Z,2026-06-20T16:21:42Z,https://github.com/keeweb/keeweb,https://keeweb.info,Other,326282,False,False
75,language-server-protocol,microsoft/language-server-protocol,microsoft,Defines a common protocol for language servers.,HTML,12889,971,292,2015-09-04T09:24:55Z,2026-06-21T23:31:07Z,https://github.com/microsoft/language-server-protocol,https://microsoft.github.io/language-server-protocol/,Creative Commons Attribution 4.0 International,7517,False,False
76,deep-learning-drizzle,kmario23/deep-learning-drizzle,kmario23,"Drench yourself in Deep Learning, Reinforcement Learning, Machine Learning, Computer Vision, and NLP by learning from these exciting lectures!!",HTML,12819,2973,5,2018-11-26T01:17:36Z,2026-06-21T20:16:00Z,https://github.com/kmario23/deep-learning-drizzle,https://deep-learning-drizzle.github.io,,267,False,False
77,YubiKey-Guide,drduh/YubiKey-Guide,drduh,Community guide to using YubiKey for GnuPG and SSH - protect secrets with hardware crypto.,HTML,12370,1246,14,2016-02-01T01:56:49Z,2026-06-21T09:59:24Z,https://github.com/drduh/YubiKey-Guide,https://drduh.github.io/YubiKey-Guide/,MIT License,1069,False,False
78,Awesome-Diffusion-Models,diff-usion/Awesome-Diffusion-Models,diff-usion, A collection of resources and papers on Diffusion Models,HTML,12349,1016,27,2021-09-18T01:24:24Z,2026-06-21T14:10:20Z,https://github.com/diff-usion/Awesome-Diffusion-Models,https://diff-usion.github.io/Awesome-Diffusion-Models/,MIT License,1925,False,False
79,flag-icons,lipis/flag-icons,lipis,:flags: A curated collection of all country flags in SVG — plus the CSS for easier integration,HTML,12222,1945,33,2013-09-25T16:39:58Z,2026-06-21T14:03:18Z,https://github.com/lipis/flag-icons,https://flagicons.lipis.dev,MIT License,17019,False,False
80,coreui-free-bootstrap-admin-template,coreui/coreui-free-bootstrap-admin-template,coreui,Free Bootstrap Admin & Dashboard Template Built for AI-Assisted Development,HTML,12217,3136,4,2016-08-04T12:30:57Z,2026-06-22T03:32:07Z,https://github.com/coreui/coreui-free-bootstrap-admin-template,https://coreui.io/product/free-bootstrap-admin-template/,MIT License,34063,False,False
81,hyperui,markmead/hyperui,markmead,"Free Tailwind CSS v4 components for your next project, designed to enhance your web development with the latest features and styles 🚀",HTML,12133,502,6,2021-11-12T17:14:11Z,2026-06-21T20:20:01Z,https://github.com/markmead/hyperui,https://hyperui.dev,MIT License,43190,False,False
82,owncast,owncast/owncast,owncast,Take control over your live stream video by running it yourself.  Streaming + chat out of the box.,HTML,11364,1200,174,2020-05-24T00:58:13Z,2026-06-22T03:50:17Z,https://github.com/owncast/owncast,https://owncast.online,MIT License,1038116,False,False
83,turndown,mixmark-io/turndown,mixmark-io,🛏 An HTML to Markdown converter written in JavaScript,HTML,11275,989,141,2011-10-23T10:35:39Z,2026-06-21T20:33:16Z,https://github.com/mixmark-io/turndown,https://mixmark-io.github.io/turndown,MIT License,4231,False,False
84,LearnCS8-Resume,JordanSchuetz/LearnCS8-Resume,JordanSchuetz,Resume template website for the LearnCS8 Lab 3,HTML,11202,199,1,2019-09-20T01:59:27Z,2026-06-14T02:40:01Z,https://github.com/JordanSchuetz/LearnCS8-Resume,https://jordanschuetz.github.io/LearnCS8-Resume/,,4326,False,False
85,galaxy,uiverse-io/galaxy,uiverse-io,The largest Open-Source UI Library! Community-made and free to use. Made with either CSS or Tailwind.,HTML,11149,770,14,2023-10-01T17:22:04Z,2026-06-22T01:49:05Z,https://github.com/uiverse-io/galaxy,https://Uiverse.io,MIT License,5373,False,False
86,isotope,metafizzy/isotope,metafizzy,:revolving_hearts: Filter & sort magical layouts,HTML,11101,1378,76,2011-01-01T05:20:00Z,2026-06-21T23:00:26Z,https://github.com/metafizzy/isotope,https://isotope.metafizzy.co,,1699,False,False
