排名,项目名称,完整名称,作者,描述,语言,Stars,Forks,Issues,创建时间,更新时间,仓库链接,主页链接,许可证,大小(KB),是否Fork,是否已归档
1,computer-science,ossu/computer-science,ossu,🎓 Path to a free self-taught education in Computer Science!,HTML,204156,25409,22,2014-05-04T00:18:39Z,2026-05-25T04:06:50Z,https://github.com/ossu/computer-science,https://cs.ossu.dev,MIT License,1784,False,False
2,FreeDomain,DigitalPlatDev/FreeDomain,DigitalPlatDev,DigitalPlat FreeDomain: Free Domain For Everyone,HTML,164745,2893,33,2024-05-30T13:23:00Z,2026-05-25T04:19:03Z,https://github.com/DigitalPlatDev/FreeDomain,https://domain.digitalplat.org,GNU Affero General Public License v3.0,972,False,False
3,prompts.chat,f/prompts.chat,f,"f.k.a. Awesome ChatGPT Prompts. Share, discover, and collect prompts from the community. Free and open source — self-host for your organization with complete privacy.",HTML,162778,21173,45,2022-12-05T13:54:13Z,2026-05-25T04:14:12Z,https://github.com/f/prompts.chat,https://prompts.chat,Other,373450,False,False
4,free-for-dev,ripienaar/free-for-dev,ripienaar,"A list of SaaS, PaaS and IaaS offerings that have free tiers of interest to devops and infradev",HTML,122608,12865,13,2015-03-18T21:06:26Z,2026-05-25T03:17:02Z,https://github.com/ripienaar/free-for-dev,https://free-for.dev/,,10144,False,False
5,cs-self-learning,PKUFlyingPig/cs-self-learning,PKUFlyingPig,计算机自学指南,HTML,72904,7892,145,2021-10-20T13:43:42Z,2026-05-25T03:53:35Z,https://github.com/PKUFlyingPig/cs-self-learning,https://csdiy.wiki,MIT License,69980,False,False
6,claude-code-best-practice,shanraisshan/claude-code-best-practice,shanraisshan,from vibe coding to agentic engineering - practice makes claude perfect,HTML,54706,5484,25,2025-10-31T14:15:28Z,2026-05-25T04:14:55Z,https://github.com/shanraisshan/claude-code-best-practice,https://linkedin.com/in/shanraisshan,MIT License,69704,False,False
7,awesome-compose,docker/awesome-compose,docker,Awesome Docker Compose samples,HTML,45388,8157,377,2020-02-13T08:51:42Z,2026-05-25T03:43:18Z,https://github.com/docker/awesome-compose,https://docs.docker.com/compose/,Creative Commons Zero v1.0 Universal,10195,False,False
8,retrofit,square/retrofit,square,A type-safe HTTP client for Android and the JVM,HTML,43906,7346,170,2010-09-06T21:39:43Z,2026-05-24T20:16:12Z,https://github.com/square/retrofit,https://square.github.io/retrofit/,Apache License 2.0,7417,False,False
9,tabler,tabler/tabler,tabler,Tabler is free and open-source HTML Dashboard UI Kit built on Bootstrap,HTML,41087,4367,134,2018-02-01T09:08:59Z,2026-05-24T23:04:25Z,https://github.com/tabler/tabler,https://tabler.io,MIT License,374225,False,False
10,zju-icicles,QSCTech/zju-icicles,QSCTech,浙江大学课程攻略共享计划,HTML,40546,9584,10,2016-06-28T16:17:32Z,2026-05-24T10:24:23Z,https://github.com/QSCTech/zju-icicles,https://qsctech.github.io/zju-icicles/,,6076928,False,False
11,styleguide,google/styleguide,google,Style guides for Google-originated open-source projects,HTML,39319,12977,173,2015-05-20T19:18:59Z,2026-05-24T18:36:51Z,https://github.com/google/styleguide,https://google.github.io/styleguide/,Other,3295,False,False
12,REKCARC-TSC-UHT,PKUanonym/REKCARC-TSC-UHT,PKUanonym,"清华大学计算机系课程攻略 Guidance for courses in Department of Computer Science and Technology, Tsinghua University",HTML,37069,7844,3,2019-04-05T03:31:23Z,2026-05-24T15:25:11Z,https://github.com/PKUanonym/REKCARC-TSC-UHT,https://rekcarc-tsc-uht.readthedocs.io/,Creative Commons Attribution Share Alike 4.0 International,4721748,False,False
13,Coursera-ML-AndrewNg-Notes,fengdu78/Coursera-ML-AndrewNg-Notes,fengdu78,吴恩达老师的机器学习课程个人笔记,HTML,37002,11179,68,2017-11-04T10:04:08Z,2026-05-25T02:23:52Z,https://github.com/fengdu78/Coursera-ML-AndrewNg-Notes,,,662586,False,False
14,manifesto,opentofu/manifesto,opentofu,The OpenTF Manifesto expresses concern over HashiCorp's switch of the Terraform license from open-source to the Business Source License (BSL) and calls for the tool's return to a truly open-source license.,HTML,35779,1036,20,2023-08-13T16:17:24Z,2026-05-25T02:06:02Z,https://github.com/opentofu/manifesto,https://opentf.org,Apache License 2.0,1858,False,True
15,material-design-lite,google/material-design-lite,google,Material Design Components in HTML/CSS/JS,HTML,32176,4923,430,2015-01-14T22:01:33Z,2026-05-24T03:47:00Z,https://github.com/google/material-design-lite,,Apache License 2.0,56990,False,False
16,alpine,alpinejs/alpine,alpinejs,"A rugged, minimal framework for composing JavaScript behavior in your markup. ",HTML,31599,1366,1,2019-11-28T13:51:55Z,2026-05-25T02:29:15Z,https://github.com/alpinejs/alpine,https://alpinejs.dev,MIT License,8967,False,False
17,foundation-sites,foundation/foundation-sites,foundation,The most advanced responsive front-end framework in the world. Quickly create prototypes and production code for sites that work on any kind of device.,HTML,29769,5389,78,2011-10-13T23:05:42Z,2026-05-25T02:09:37Z,https://github.com/foundation/foundation-sites,https://get.foundation,MIT License,126117,False,False
18,JavaScript30,wesbos/JavaScript30,wesbos,30 Day Vanilla JS Challenge,HTML,29136,41922,70,2016-12-07T19:15:31Z,2026-05-24T21:49:04Z,https://github.com/wesbos/JavaScript30,https://JavaScript30.com,,46988,False,False
19,weui,Tencent/weui,Tencent,"A UI library by WeChat official design team, includes the most useful widgets/modules in mobile web applications.",HTML,27372,6307,64,2014-12-18T04:09:54Z,2026-05-25T02:46:39Z,https://github.com/Tencent/weui,https://weui.io,Other,12651,False,False
20,hacker-laws,dwmkerr/hacker-laws,dwmkerr,"🧠 Laws, Theories, Principles and Patterns for developers and technologists.",HTML,27148,1566,147,2018-01-25T03:46:34Z,2026-05-24T23:02:11Z,https://github.com/dwmkerr/hacker-laws,http://hacker-laws.com/,Creative Commons Attribution Share Alike 4.0 International,2940,False,False
21,awesome-generative-ai-guide,aishwaryanr/awesome-generative-ai-guide,aishwaryanr,"A one stop repository for generative AI research updates, interview resources, notebooks and much more!",HTML,26844,5638,6,2024-02-06T18:14:14Z,2026-05-25T02:12:25Z,https://github.com/aishwaryanr/awesome-generative-ai-guide,https://www.linkedin.com/in/areganti/,MIT License,161504,False,False
22,awesome-piracy,Igglybuff/awesome-piracy,Igglybuff,A curated list of awesome warez and piracy links,HTML,26611,2267,1,2018-10-09T22:09:56Z,2026-05-25T04:10:41Z,https://github.com/Igglybuff/awesome-piracy,,Creative Commons Zero v1.0 Universal,2154,False,True
23,fastText,facebookresearch/fastText,facebookresearch,Library for fast text representation and classification.,HTML,26524,4816,554,2016-07-16T13:38:42Z,2026-05-25T03:18:44Z,https://github.com/facebookresearch/fastText,https://fasttext.cc/,MIT License,8318,False,True
24,awesome-quant,wilsonfreitas/awesome-quant,wilsonfreitas,"A curated list of insanely awesome libraries, packages and resources for Quants (Quantitative Finance)",HTML,26404,3526,43,2015-09-30T09:53:49Z,2026-05-25T04:14:52Z,https://github.com/wilsonfreitas/awesome-quant,https://wilsonfreitas.github.io/awesome-quant/,,5629,False,False
25,OpenClash,vernesong/OpenClash,vernesong,A Clash Client For OpenWrt,HTML,25932,3894,86,2019-05-29T15:52:27Z,2026-05-25T04:06:21Z,https://github.com/vernesong/OpenClash,,MIT License,11459826,False,False
26,en.javascript.info,javascript-tutorial/en.javascript.info,javascript-tutorial,Modern JavaScript Tutorial ,HTML,25294,3995,528,2017-06-03T14:27:57Z,2026-05-23T19:28:30Z,https://github.com/javascript-tutorial/en.javascript.info,https://javascript.info,Other,772358,False,False
27,bitcoinbook,bitcoinbook/bitcoinbook,bitcoinbook,Mastering Bitcoin 3rd Edition - Programming the Open Blockchain,HTML,25208,6198,193,2013-08-11T23:18:28Z,2026-05-24T14:47:06Z,https://github.com/bitcoinbook/bitcoinbook,https://aantonop.com/books,Other,62974,False,False
28,Awesome-Linux-Software,luong-komorebi/Awesome-Linux-Software,luong-komorebi,🐧 A list of awesome Linux softwares ,HTML,24949,2203,0,2016-08-06T13:16:29Z,2026-05-24T21:24:48Z,https://github.com/luong-komorebi/Awesome-Linux-Software,https://luong-komorebi.github.io/Awesome-Linux-Software/,,6759,False,True
29,llm-action,liguodongiot/llm-action,liguodongiot,本项目旨在分享大模型相关技术原理以及实战经验（大模型工程化、大模型应用落地）,HTML,24357,2796,18,2023-05-23T05:29:16Z,2026-05-25T03:12:04Z,https://github.com/liguodongiot/llm-action,https://www.zhihu.com/column/c_1456193767213043713,Apache License 2.0,25416,False,False
30,flash-linux0.11-talk,dibingfa/flash-linux0.11-talk,dibingfa,你管这破玩意叫操作系统源码 — 像小说一样品读 Linux 0.11 核心代码,HTML,22356,2941,55,2021-11-06T04:58:25Z,2026-05-25T01:18:50Z,https://github.com/dibingfa/flash-linux0.11-talk,,,184307,False,False
31,polymer,Polymer/polymer,Polymer,Our original Web Component library.,HTML,22038,1967,84,2012-08-23T20:56:30Z,2026-05-23T10:34:01Z,https://github.com/Polymer/polymer,https://polymer-library.polymer-project.org/,"BSD 3-Clause ""New"" or ""Revised"" License",31785,False,False
32,chosen,harvesthq/chosen,harvesthq,"Deprecated - Chosen is a library for making long, unwieldy select boxes more friendly.",HTML,21989,4028,309,2011-04-18T15:07:41Z,2026-05-23T19:19:17Z,https://github.com/harvesthq/chosen,http://harvesthq.github.io/chosen/,Other,3057,False,False
33,skill-map,TeamStuQ/skill-map,TeamStuQ,程序员技能图谱,HTML,21540,4402,80,2015-11-17T11:17:38Z,2026-05-25T01:03:27Z,https://github.com/TeamStuQ/skill-map,https://github.com/TeamStuQ/skill-map,,33969,False,False
34,gentelella,ColorlibHQ/gentelella,ColorlibHQ,Free Bootstrap 5 Admin Dashboard Template,HTML,21328,6834,1,2015-05-15T06:57:27Z,2026-05-25T01:44:04Z,https://github.com/ColorlibHQ/gentelella,https://gentelella.colorlib.com/,MIT License,56156,False,False
35,rough,rough-stuff/rough,rough-stuff,"Create graphics with a hand-drawn, sketchy, appearance",HTML,20972,656,42,2016-12-13T09:12:55Z,2026-05-24T19:20:42Z,https://github.com/rough-stuff/rough,http://roughjs.com,MIT License,6173,False,False
36,architecture.of.internet-product,davideuler/architecture.of.internet-product,davideuler,互联网公司技术架构，微信/淘宝/微博/腾讯/阿里/美团点评/百度/OpenAI/Google/Facebook/Amazon/eBay的架构，欢迎PR补充,HTML,20778,4753,5,2018-04-30T10:25:31Z,2026-05-25T02:42:02Z,https://github.com/davideuler/architecture.of.internet-product,,,845499,False,False
37,deeplearning_ai_books,fengdu78/deeplearning_ai_books,fengdu78,deeplearning.ai（吴恩达老师的深度学习课程笔记及资源）,HTML,20637,6122,55,2017-12-08T08:47:42Z,2026-05-25T02:24:14Z,https://github.com/fengdu78/deeplearning_ai_books,,,585160,False,False
38,You-Dont-Need-JavaScript,you-dont-need/You-Dont-Need-JavaScript,you-dont-need,"CSS is powerful, you can do a lot of things without JS.",HTML,20532,1496,75,2016-07-05T07:30:42Z,2026-05-24T18:06:38Z,https://github.com/you-dont-need/You-Dont-Need-JavaScript,,GNU General Public License v3.0,693000,False,False
39,SummaryOfLoanSuspension,WeNeedHome/SummaryOfLoanSuspension,WeNeedHome,全国各省市停贷通知汇总,HTML,20420,2083,125,2022-07-12T16:33:25Z,2026-05-24T14:39:49Z,https://github.com/WeNeedHome/SummaryOfLoanSuspension,,,193948,False,False
40,fonts,google/fonts,google,"Font files available from Google Fonts, and a public issue tracker for all things Google Fonts",HTML,20101,2886,1371,2015-02-11T23:34:54Z,2026-05-25T04:02:27Z,https://github.com/google/fonts,http://google.github.io/fonts/,,2923181,False,False
41,Dism-Multi-language,Chuyu-Team/Dism-Multi-language,Chuyu-Team,Dism++ Multi-language Support & BUG Report,HTML,19555,1204,322,2016-11-26T06:45:37Z,2026-05-25T02:53:23Z,https://github.com/Chuyu-Team/Dism-Multi-language,,MIT License,8806,False,False
42,uikit,uikit/uikit,uikit,A lightweight and modular front-end framework for developing fast and powerful web interfaces,HTML,18539,2296,606,2013-07-18T16:00:26Z,2026-05-24T13:48:42Z,https://github.com/uikit/uikit,http://getuikit.com,MIT License,56986,False,False
43,fastclick,ftlabs/fastclick,ftlabs,Polyfill to remove click delays on browsers with touch UIs,HTML,18537,3138,277,2012-02-13T08:38:00Z,2026-05-23T19:19:18Z,https://github.com/ftlabs/fastclick,,MIT License,322,False,True
44,skrollr,Prinzhorn/skrollr,Prinzhorn,Stand-alone parallax scrolling library for mobile (Android + iOS) and desktop. No jQuery. Just plain JavaScript (and some love).,HTML,18414,3411,262,2012-03-18T15:41:35Z,2026-05-22T07:15:27Z,https://github.com/Prinzhorn/skrollr,http://prinzhorn.github.io/skrollr/,MIT License,1659,False,True
45,web-starter-kit,google/web-starter-kit,google,Web Starter Kit - a workflow for multi-device websites,HTML,18307,2926,74,2014-04-07T08:45:18Z,2026-05-20T19:26:20Z,https://github.com/google/web-starter-kit,http://developers.google.com/web/starter-kit,Apache License 2.0,10100,False,True
46,twemoji,twitter/twemoji,twitter,Emoji for everyone. https://twemoji.twitter.com/,HTML,17646,1896,143,2014-11-06T21:49:34Z,2026-05-24T22:12:25Z,https://github.com/twitter/twemoji,,MIT License,842458,False,False
47,blog_os,phil-opp/blog_os,phil-opp,Writing an OS in Rust,HTML,17480,1203,101,2015-07-23T15:23:54Z,2026-05-25T01:18:09Z,https://github.com/phil-opp/blog_os,http://os.phil-opp.com,Apache License 2.0,18773,False,False
48,cua,trycua/cua,trycua,"Open-source infrastructure for Computer-Use Agents. Sandboxes, SDKs, and benchmarks to train and evaluate AI agents that can control full desktops (macOS, Linux, Windows).",HTML,17065,1085,320,2025-01-31T15:02:49Z,2026-05-25T04:20:01Z,https://github.com/trycua/cua,https://cua.ai,MIT License,215478,False,False
49,masonry,desandro/masonry,desandro,:love_hotel: Cascading grid layout plugin,HTML,16708,2078,85,2009-11-21T21:04:56Z,2026-05-22T15:57:10Z,https://github.com/desandro/masonry,https://masonry.desandro.com,,1479,False,False
50,windmill,windmill-labs/windmill,windmill-labs,"Open-source developer platform to power your entire infra and turn scripts into webhooks, workflows and UIs. Fastest workflow engine (13x vs Airflow). Open-source alternative to Retool and Temporal.",HTML,16568,967,732,2022-05-05T02:21:17Z,2026-05-25T03:27:16Z,https://github.com/windmill-labs/windmill,https://windmill.dev,Other,416715,False,False
51,Screenshot-to-code,emilwallner/Screenshot-to-code,emilwallner,A neural network that transforms a design mock-up into a static website.,HTML,16483,1547,22,2017-10-16T11:41:48Z,2026-05-24T19:23:30Z,https://github.com/emilwallner/Screenshot-to-code,,Other,51643,False,False
52,html-css,gustavoguanabara/html-css,gustavoguanabara,Curso de HTML5 e CSS3,HTML,16289,3842,540,2020-03-09T19:54:04Z,2026-05-24T17:18:57Z,https://github.com/gustavoguanabara/html-css,https://gustavoguanabara.github.io/html-css/,MIT License,279613,False,False
53,zphisher,htr-tech/zphisher,htr-tech,An automated phishing tool with 30+ templates. This Tool is made for educational purpose only ! Author will not be responsible for any misuse of this toolkit !,HTML,16029,6047,440,2019-11-25T13:22:20Z,2026-05-25T02:46:20Z,https://github.com/htr-tech/zphisher,,GNU General Public License v3.0,29374,False,False
54,AR.js,jeromeetienne/AR.js,jeromeetienne,Efficient Augmented Reality for the Web - 60fps on mobile!,HTML,15808,2212,24,2017-02-17T10:27:59Z,2026-05-20T08:55:29Z,https://github.com/jeromeetienne/AR.js,,MIT License,327340,False,False
55,Modern-CPP-Programming,federico-busato/Modern-CPP-Programming,federico-busato,Modern C++ Programming Course (C++03/11/14/17/20/23/26),HTML,15663,1104,3,2018-03-08T09:06:52Z,2026-05-25T02:23:26Z,https://github.com/federico-busato/Modern-CPP-Programming,https://federico-busato.github.io/Modern-CPP-Programming/,Creative Commons Attribution Share Alike 4.0 International,700247,False,False
56,al-folio,alshedivat/al-folio,alshedivat,"A beautiful, simple, clean, and responsive Jekyll theme for academics",HTML,15650,13031,45,2016-05-30T16:32:46Z,2026-05-25T03:02:15Z,https://github.com/alshedivat/al-folio,https://alshedivat.github.io/al-folio/,MIT License,359845,False,False
57,ecma262,tc39/ecma262,tc39,"Status, process, and documents for ECMA-262",HTML,15631,1409,503,2014-04-09T19:04:33Z,2026-05-24T21:20:15Z,https://github.com/tc39/ecma262,https://tc39.es/ecma262/,Other,1087490,False,False
58,opensource.guide,github/opensource.guide,github,📚 Community guides for open source creators,HTML,15456,15388,8,2016-06-15T12:03:11Z,2026-05-24T20:03:19Z,https://github.com/github/opensource.guide,https://opensource.guide/,Creative Commons Attribution 4.0 International,19828,False,False
59,zepto,madrobby/zepto,madrobby,"Zepto.js is a minimalist JavaScript library for modern browsers, with a jQuery-compatible API",HTML,15112,3852,1,2010-09-20T07:57:57Z,2026-05-20T08:28:33Z,https://github.com/madrobby/zepto,http://zeptojs.com,Other,8244,False,False
60,dotnet,microsoft/dotnet,microsoft,"This repo is the official home of .NET on GitHub. It's a great starting point to find many .NET OSS projects from Microsoft and the community, including many that are part of the .NET Foundation.",HTML,15050,2241,265,2014-10-23T21:58:29Z,2026-05-24T20:20:37Z,https://github.com/microsoft/dotnet,https://devblogs.microsoft.com/dotnet/,MIT License,3218,False,False
61,huashu-design,alchaincyf/huashu-design,alchaincyf,Huashu Design · HTML-native design skill for Claude Code · Claude Code 里 HTML 原生的设计 skill · 高保真原型 / 幻灯片 / 动画 + 20 设计哲学 + 5 维评审 + MP4 导出 · Agent-agnostic,HTML,14917,2003,5,2026-04-19T14:42:06Z,2026-05-25T04:18:02Z,https://github.com/alchaincyf/huashu-design,,MIT License,222404,False,False
62,awesome-creative-coding,terkelg/awesome-creative-coding,terkelg,"Creative Coding: Generative Art, Data visualization, Interaction Design, Resources.",HTML,14844,948,20,2016-11-01T23:50:27Z,2026-05-24T21:50:18Z,https://github.com/terkelg/awesome-creative-coding,,,528,False,False
63,unstructured,Unstructured-IO/unstructured,Unstructured-IO,"Convert documents to structured data effortlessly. Unstructured is open-source ETL solution for transforming complex documents into clean, structured formats for language models.  Visit our website to learn more about our enterprise grade Platform product for production grade workflows, partitioning, enrichments, chunking and embedding.",HTML,14771,1239,243,2022-09-26T21:53:41Z,2026-05-25T04:17:58Z,https://github.com/Unstructured-IO/unstructured,https://www.unstructured.io/,Apache License 2.0,236405,False,False
64,examples-of-web-crawlers,shengqiangzhang/examples-of-web-crawlers,shengqiangzhang,"一些非常有趣的python爬虫例子,对新手比较友好,主要爬取淘宝、天猫、微信、微信读书、豆瓣、QQ等网站。(Some interesting examples of python crawlers that are friendly to beginners. )",HTML,14643,3803,21,2019-03-13T07:11:23Z,2026-05-25T02:58:26Z,https://github.com/shengqiangzhang/examples-of-web-crawlers,,MIT License,286452,False,False
65,smiley-sans,atelier-anchor/smiley-sans,atelier-anchor,得意黑 Smiley Sans：一款在人文观感和几何特征中寻找平衡的中文黑体,HTML,14453,378,41,2022-11-11T13:49:16Z,2026-05-24T20:21:49Z,https://github.com/atelier-anchor/smiley-sans,https://atelier-anchor.com/typefaces/smiley-sans/,SIL Open Font License 1.1,13257,False,False
66,llm_interview_note,wdndev/llm_interview_note,wdndev,主要记录大语言大模型（LLMs） 算法（应用）工程师相关的知识及面试题,HTML,14291,1414,26,2023-11-08T02:52:13Z,2026-05-25T03:44:45Z,https://github.com/wdndev/llm_interview_note,https://wdndev.github.io/llm_interview_note,,139441,False,False
67,ai-edu,microsoft/ai-edu,microsoft,"AI education materials for Chinese students, teachers and IT professionals.",HTML,14068,2942,98,2018-11-16T04:36:22Z,2026-05-25T03:25:56Z,https://github.com/microsoft/ai-edu,https://microsoft.github.io/ai-edu/,Other,989499,False,False
68,extensions,keiyoushi/extensions,keiyoushi,Extension repository for Mihon and variants,HTML,13915,1178,0,2024-01-08T23:17:13Z,2026-05-25T03:04:39Z,https://github.com/keiyoushi/extensions,https://keiyoushi.github.io/,,629650,False,False
69,Spoon-Knife,octocat/Spoon-Knife,octocat,This repo is for demonstration purposes only.,HTML,13806,157290,20578,2011-01-27T19:30:43Z,2026-05-25T03:43:14Z,https://github.com/octocat/Spoon-Knife,,,2,False,False
70,responsive-html-email-template,leemunroe/responsive-html-email-template,leemunroe,A free simple responsive HTML email template,HTML,13685,4323,10,2013-12-20T14:21:13Z,2026-05-24T22:49:48Z,https://github.com/leemunroe/responsive-html-email-template,http://leemunroe.github.io/responsive-html-email-template/email.html,MIT License,100,False,False
71,design-blocks,froala/design-blocks,froala,A set of 170+ Bootstrap based design blocks ready to be used to create clean modern websites.,HTML,13641,1223,33,2017-08-03T13:22:43Z,2026-05-23T19:22:09Z,https://github.com/froala/design-blocks,https://www.froala.com/design-blocks,Other,379039,False,False
72,hugo-PaperMod,adityatelange/hugo-PaperMod,adityatelange," A fast, clean, responsive Hugo theme.",HTML,13560,3388,4,2020-07-21T04:45:10Z,2026-05-24T16:56:16Z,https://github.com/adityatelange/hugo-PaperMod,https://adityatelange.github.io/hugo-PaperMod/,MIT License,10012,False,False
73,minimal-mistakes,mmistakes/minimal-mistakes,mmistakes,":triangular_ruler: Jekyll theme for building a personal site, blog, project documentation, or portfolio.",HTML,13504,27290,24,2013-05-24T14:13:30Z,2026-05-24T21:48:20Z,https://github.com/mmistakes/minimal-mistakes,https://mmistakes.github.io/minimal-mistakes/,MIT License,48603,False,False
74,awesome-modern-cpp,rigtorp/awesome-modern-cpp,rigtorp,A collection of resources on modern C++,HTML,13005,1229,18,2016-03-30T17:26:27Z,2026-05-25T01:06:14Z,https://github.com/rigtorp/awesome-modern-cpp,http://awesomecpp.com,,214,False,False
75,keeweb,keeweb/keeweb,keeweb,Free cross-platform password manager compatible with KeePass,HTML,12928,1151,434,2015-10-17T21:41:47Z,2026-05-23T16:45:53Z,https://github.com/keeweb/keeweb,https://keeweb.info,Other,326282,False,False
76,language-server-protocol,microsoft/language-server-protocol,microsoft,Defines a common protocol for language servers.,HTML,12845,962,289,2015-09-04T09:24:55Z,2026-05-25T04:14:20Z,https://github.com/microsoft/language-server-protocol,https://microsoft.github.io/language-server-protocol/,Creative Commons Attribution 4.0 International,7468,False,False
77,deep-learning-drizzle,kmario23/deep-learning-drizzle,kmario23,"Drench yourself in Deep Learning, Reinforcement Learning, Machine Learning, Computer Vision, and NLP by learning from these exciting lectures!!",HTML,12812,2974,5,2018-11-26T01:17:36Z,2026-05-23T09:45:32Z,https://github.com/kmario23/deep-learning-drizzle,https://deep-learning-drizzle.github.io,,267,False,False
78,PakePlus,Sjj1024/PakePlus,Sjj1024,Turn any webpage/HTML/Vue/React and so on into desktop and mobile app under 5M with easy in few minutes. 轻松将任意网站/HTML/Vue/React等项目构建为轻量级(小于5M)多端桌面应用和手机应用仅需几分钟. https://ppofficial.netlify.app,HTML,12478,4902,9,2024-09-10T13:12:25Z,2026-05-25T03:39:35Z,https://github.com/Sjj1024/PakePlus,https://pakeplus.com,MIT License,200545,False,False
79,YubiKey-Guide,drduh/YubiKey-Guide,drduh,Community guide to using YubiKey for GnuPG and SSH - protect secrets with hardware crypto.,HTML,12338,1248,14,2016-02-01T01:56:49Z,2026-05-25T03:46:56Z,https://github.com/drduh/YubiKey-Guide,https://drduh.github.io/YubiKey-Guide/,MIT License,1069,False,False
80,Awesome-Diffusion-Models,diff-usion/Awesome-Diffusion-Models,diff-usion, A collection of resources and papers on Diffusion Models,HTML,12329,1014,27,2021-09-18T01:24:24Z,2026-05-24T07:06:52Z,https://github.com/diff-usion/Awesome-Diffusion-Models,https://diff-usion.github.io/Awesome-Diffusion-Models/,MIT License,1925,False,False
81,coreui-free-bootstrap-admin-template,coreui/coreui-free-bootstrap-admin-template,coreui,Free Bootstrap Admin & Dashboard Template Built for AI-Assisted Development,HTML,12211,3146,4,2016-08-04T12:30:57Z,2026-05-24T13:45:41Z,https://github.com/coreui/coreui-free-bootstrap-admin-template,https://coreui.io/product/free-bootstrap-admin-template/,MIT License,34063,False,False
82,flag-icons,lipis/flag-icons,lipis,:flags: A curated collection of all country flags in SVG — plus the CSS for easier integration,HTML,12140,1947,33,2013-09-25T16:39:58Z,2026-05-25T00:43:32Z,https://github.com/lipis/flag-icons,https://flagicons.lipis.dev,MIT License,17120,False,False
83,hyperui,markmead/hyperui,markmead,"Free Tailwind CSS v4 components for your next project, designed to enhance your web development with the latest features and styles 🚀",HTML,12085,503,4,2021-11-12T17:14:11Z,2026-05-25T03:50:08Z,https://github.com/markmead/hyperui,https://hyperui.dev,MIT License,42856,False,False
84,guizang-ppt-skill,op7418/guizang-ppt-skill,op7418,"AI-agent Skill for generating polished HTML slide decks: editorial magazine and Swiss layouts, image prompts, social covers, and a WebGL/low-power presentation runtime.",HTML,11817,916,12,2026-04-23T13:23:07Z,2026-05-25T04:17:31Z,https://github.com/op7418/guizang-ppt-skill,,MIT License,1909,False,False
85,LearnCS8-Resume,JordanSchuetz/LearnCS8-Resume,JordanSchuetz,Resume template website for the LearnCS8 Lab 3,HTML,11198,199,1,2019-09-20T01:59:27Z,2026-05-20T20:00:20Z,https://github.com/JordanSchuetz/LearnCS8-Resume,https://jordanschuetz.github.io/LearnCS8-Resume/,,4326,False,False
