排名,项目名称,完整名称,作者,描述,语言,Stars,Forks,Issues,创建时间,更新时间,仓库链接,主页链接,许可证,大小(KB),是否Fork,是否已归档
86,turndown,mixmark-io/turndown,mixmark-io,🛏 An HTML to Markdown converter written in JavaScript,HTML,11193,981,140,2011-10-23T10:35:39Z,2026-05-25T02:30:01Z,https://github.com/mixmark-io/turndown,https://mixmark-io.github.io/turndown,MIT License,4350,False,False
87,isotope,metafizzy/isotope,metafizzy,:revolving_hearts: Filter & sort magical layouts,HTML,11096,1381,76,2011-01-01T05:20:00Z,2026-05-17T19:05:35Z,https://github.com/metafizzy/isotope,https://isotope.metafizzy.co,,1699,False,False
88,dashboards,keen/dashboards,keen,Responsive dashboard templates 📊✨,HTML,11038,1392,6,2014-08-08T17:16:17Z,2026-05-23T17:10:34Z,https://github.com/keen/dashboards,http://keen.github.io/dashboards/,MIT License,2240,False,False
89,galaxy,uiverse-io/galaxy,uiverse-io,The largest Open-Source UI Library! Community-made and free to use. Made with either CSS or Tailwind.,HTML,10878,751,13,2023-10-01T17:22:04Z,2026-05-25T03:14:29Z,https://github.com/uiverse-io/galaxy,https://Uiverse.io,MIT License,5373,False,False
90,craftinginterpreters,munificent/craftinginterpreters,munificent,"Repository for the book ""Crafting Interpreters""",HTML,10777,1262,142,2017-01-15T19:46:57Z,2026-05-25T01:36:32Z,https://github.com/munificent/craftinginterpreters,http://www.craftinginterpreters.com/,Other,23405,False,False
91,zh.javascript.info,javascript-tutorial/zh.javascript.info,javascript-tutorial,现代 JavaScript 教程（The Modern JavaScript Tutorial），以最新的 ECMAScript 规范为基准，通过简单但足够详细的内容，为你讲解从基础到高阶的 JavaScript 相关知识。,HTML,10744,1211,26,2018-04-04T06:01:58Z,2026-05-24T10:41:59Z,https://github.com/javascript-tutorial/zh.javascript.info,https://zh.javascript.info,Other,500975,False,False
92,pdf2htmlEX,coolwanglu/pdf2htmlEX,coolwanglu,Convert PDF to HTML without losing text or format.,HTML,10592,1846,244,2012-08-04T17:59:25Z,2026-05-24T04:13:35Z,https://github.com/coolwanglu/pdf2htmlEX,http://coolwanglu.github.com/pdf2htmlEX/,Other,137088,False,True
93,chatgpt_system_prompt,LouisShark/chatgpt_system_prompt,LouisShark,A collection of GPT system prompts and various prompt injection/leaking knowledge.,HTML,10579,1466,1,2023-11-01T12:35:05Z,2026-05-24T04:58:05Z,https://github.com/LouisShark/chatgpt_system_prompt,,MIT License,29942,False,False
94,fluentui-system-icons,microsoft/fluentui-system-icons,microsoft,"Fluent System Icons are a collection of familiar, friendly and modern icons from Microsoft.",HTML,10571,781,196,2020-05-12T21:05:57Z,2026-05-25T01:33:37Z,https://github.com/microsoft/fluentui-system-icons,https://aka.ms/fluentui-system-icons,MIT License,827485,False,False
95,node-interview,ElemeFE/node-interview,ElemeFE,How to pass the Node.js interview of ElemeFE.,HTML,10499,1550,8,2017-01-23T07:26:07Z,2026-05-22T08:35:44Z,https://github.com/ElemeFE/node-interview,https://elemefe.github.io/node-interview/,MIT License,804,False,False
96,sovereign,sovereign/sovereign,sovereign,"A set of Ansible playbooks to build and maintain your own private cloud: email, calendar, contacts, file sync, IRC bouncer, VPN, and more.",HTML,10494,819,101,2013-08-19T22:09:16Z,2026-05-25T02:26:49Z,https://github.com/sovereign/sovereign,,Other,1052,False,False
97,machine-learning-systems-design,chiphuyen/machine-learning-systems-design,chiphuyen,"A booklet on machine learning systems design with exercises. NOT the repo for the book ""Designing Machine Learning Systems"", which is `dmls-book`",HTML,10404,1613,11,2019-11-24T23:16:28Z,2026-05-24T18:32:06Z,https://github.com/chiphuyen/machine-learning-systems-design,https://huyenchip.com/machine-learning-systems-design/toc.html,,1408,False,False
98,bug,liu673cn/bug,liu673cn,TVbox开源版（空壳-自行配置）,HTML,10394,1993,6,2022-05-10T06:57:04Z,2026-05-23T12:31:30Z,https://github.com/liu673cn/bug,,,99682,False,False
99,lancedb,lancedb/lancedb,lancedb,Developer-friendly OSS embedded retrieval library for multimodal AI. Search More; Manage Less.,HTML,10391,883,669,2023-02-28T01:15:17Z,2026-05-25T03:29:43Z,https://github.com/lancedb/lancedb,https://lancedb.com/docs,Apache License 2.0,26138,False,False
100,raytracing.github.io,RayTracing/raytracing.github.io,RayTracing,Main Web Site (Online Books),HTML,10357,997,77,2019-07-18T22:17:09Z,2026-05-24T11:52:54Z,https://github.com/RayTracing/raytracing.github.io,https://raytracing.github.io/,Creative Commons Zero v1.0 Universal,40313,False,False
