排名,项目名称,完整名称,作者,描述,语言,Stars,Forks,Issues,创建时间,更新时间,仓库链接,主页链接,许可证,大小(KB),是否Fork,是否已归档
87,marked,markedjs/marked,markedjs,A markdown parser and compiler. Built for speed.,JavaScript,36871,3540,8,2011-07-24T13:15:51Z,2026-06-08T03:14:45Z,https://github.com/markedjs/marked,https://marked.js.org,Other,10570,False,False
88,fastify,fastify/fastify,fastify,"Fast and low overhead web framework, for Node.js",JavaScript,36433,2707,147,2016-09-28T19:10:14Z,2026-06-08T01:09:07Z,https://github.com/fastify/fastify,https://www.fastify.dev,MIT License,10258,False,False
89,carbon,carbon-app/carbon,carbon-app,:black_heart: Create and share beautiful images of your source code,JavaScript,36034,1973,82,2017-06-16T02:50:28Z,2026-06-08T03:56:10Z,https://github.com/carbon-app/carbon,https://carbon.now.sh,MIT License,21055,False,False
90,koa,koajs/koa,koajs,Expressive middleware for node.js using ES2017 async functions,JavaScript,35712,3220,33,2013-07-20T18:53:45Z,2026-06-06T02:14:17Z,https://github.com/koajs/koa,https://koajs.com,MIT License,4368,False,False
91,impeccable,pbakaus/impeccable,pbakaus,The design language that makes your AI harness better at design.,JavaScript,35691,1947,36,2025-11-16T01:52:04Z,2026-06-08T04:40:52Z,https://github.com/pbakaus/impeccable,https://impeccable.style,Apache License 2.0,56519,False,False
92,awesome-react-native,jondot/awesome-react-native,jondot,"Awesome React Native components, news, tools, and learning material!",JavaScript,35686,4016,128,2015-03-26T19:58:06Z,2026-06-08T04:33:00Z,https://github.com/jondot/awesome-react-native,http://www.awesome-react-native.com,,5250,False,False
93,fullPage.js,alvarotrigo/fullPage.js,alvarotrigo,fullPage plugin by Alvaro Trigo. Create full screen pages fast and simple,JavaScript,35439,7131,127,2013-09-20T11:58:29Z,2026-06-07T21:55:56Z,https://github.com/alvarotrigo/fullPage.js,http://alvarotrigo.com/fullPage/,GNU General Public License v3.0,17123,False,False
94,hackathon-starter,sahat/hackathon-starter,sahat,A boilerplate for Node.js web applications,JavaScript,35219,8167,4,2013-11-13T17:24:12Z,2026-06-07T21:55:31Z,https://github.com/sahat/hackathon-starter,,MIT License,16252,False,False
95,How-To-Ask-Questions-The-Smart-Way,ryanhanwu/How-To-Ask-Questions-The-Smart-Way,ryanhanwu,本文原文由知名 Hacker Eric S. Raymond 所撰寫，教你如何正確的提出技術問題並獲得你滿意的答案。,JavaScript,35193,5828,11,2015-03-28T16:52:40Z,2026-06-08T04:30:33Z,https://github.com/ryanhanwu/How-To-Ask-Questions-The-Smart-Way,,MIT License,380,False,False
96,husky,typicode/husky,typicode,Git hooks made easy 🐶 woof!,JavaScript,35131,1085,105,2014-06-23T12:14:21Z,2026-06-08T03:55:14Z,https://github.com/typicode/husky,https://typicode.github.io/husky,MIT License,4846,False,False
97,CyberChef,gchq/CyberChef,gchq,"The Cyber Swiss Army Knife - a web app for encryption, encoding, compression and data analysis",JavaScript,35032,3987,631,2016-11-28T10:34:07Z,2026-06-08T04:35:22Z,https://github.com/gchq/CyberChef,https://gchq.github.io/CyberChef,Apache License 2.0,89358,False,False
98,one-api,songquanpeng/one-api,songquanpeng,"LLM API 管理 & 分发系统，支持 OpenAI、Azure、Anthropic Claude、Google Gemini、DeepSeek、字节豆包、ChatGLM、文心一言、讯飞星火、通义千问、360 智脑、腾讯混元等主流模型，统一 API 适配，可用于 key 管理与二次分发。单可执行文件，提供 Docker 镜像，一键部署，开箱即用。LLM API management & key redistribution system, unifying multiple providers under a single API. Single binary, Docker-ready, with an English UI.",JavaScript,34707,6605,1014,2023-04-22T12:39:24Z,2026-06-08T04:38:16Z,https://github.com/songquanpeng/one-api,https://oneapi.justsong.cn/,MIT License,15963,False,False
99,AnotherRedisDesktopManager,qishibo/AnotherRedisDesktopManager,qishibo,"🚀🚀🚀A faster, better and more stable Redis desktop manager [GUI client], compatible with Linux, Windows, Mac.",JavaScript,34388,2703,183,2019-01-08T06:01:56Z,2026-06-08T03:28:42Z,https://github.com/qishibo/AnotherRedisDesktopManager,,MIT License,5533,False,False
100,JavaScript,TheAlgorithms/JavaScript,TheAlgorithms,"Algorithms and Data Structures implemented in JavaScript for beginners, following best practices.",JavaScript,34188,5853,207,2017-07-13T06:12:33Z,2026-06-07T14:02:13Z,https://github.com/TheAlgorithms/JavaScript,https://the-algorithms.com/language/javascript,GNU General Public License v3.0,3007,False,False
