排名,项目名称,完整名称,作者,描述,语言,Stars,Forks,Issues,创建时间,更新时间,仓库链接,主页链接,许可证,大小(KB),是否Fork,是否已归档
96,GeoStats.jl,JuliaEarth/GeoStats.jl,JuliaEarth,An extensible framework for geospatial data science and geostatistical modeling fully written in Julia,Julia,565,64,8,2015-04-12T18:11:22Z,2025-09-13T09:01:08Z,https://github.com/JuliaEarth/GeoStats.jl,https://juliaearth.github.io/GeoStatsDocs/stable/,MIT License,22980,False,False
97,ThinkJulia.jl,BenLauwens/ThinkJulia.jl,BenLauwens,Port of the book Think Python to the Julia programming language,Julia,561,140,22,2018-03-08T20:01:12Z,2025-09-14T06:33:10Z,https://github.com/BenLauwens/ThinkJulia.jl,,Other,14139,False,False
98,ControlSystems.jl,JuliaControl/ControlSystems.jl,JuliaControl,A Control Systems Toolbox for Julia,Julia,560,90,53,2015-01-20T00:30:32Z,2025-09-14T10:30:50Z,https://github.com/JuliaControl/ControlSystems.jl,https://juliacontrol.github.io/ControlSystems.jl/stable/,Other,224771,False,False
99,Transformers.jl,chengchingwen/Transformers.jl,chengchingwen,Julia Implementation of Transformer models,Julia,559,81,40,2018-12-27T06:24:53Z,2025-09-12T08:00:55Z,https://github.com/chengchingwen/Transformers.jl,,MIT License,3321,False,False
100,Interpolations.jl,JuliaMath/Interpolations.jl,JuliaMath,"Fast, continuous interpolation of discrete datasets in Julia",Julia,556,112,110,2014-08-27T09:36:22Z,2025-09-14T10:25:51Z,https://github.com/JuliaMath/Interpolations.jl,http://juliamath.github.io/Interpolations.jl/,Other,13298,False,False
