排名,项目名称,完整名称,作者,描述,语言,Stars,Forks,Issues,创建时间,更新时间,仓库链接,主页链接,许可证,大小(KB),是否Fork,是否已归档
93,SDCycleScrollView,gsdios/SDCycleScrollView,gsdios,Autoscroll Banner.   无限循环图片、文字轮播器。,Objective-C,6210,1506,505,2015-03-24T09:07:13Z,2026-01-17T12:41:33Z,https://github.com/gsdios/SDCycleScrollView,,MIT License,1973,False,False
94,JSONKit,johnezang/JSONKit,johnezang,Objective-C JSON,Objective-C,6205,1639,104,2010-07-27T10:06:21Z,2026-01-06T13:09:21Z,https://github.com/johnezang/JSONKit,,,1191,False,False
95,JXCategoryView,pujiaxin33/JXCategoryView,pujiaxin33,"A powerful and easy to use category view (segmentedcontrol, segmentview, pagingview, pagerview, pagecontrol) (腾讯新闻、今日头条、QQ音乐、网易云音乐、京东、爱奇艺、腾讯视频、淘宝、天猫、简书、微博等所有主流APP分类切换滚动视图)",Objective-C,6181,1164,39,2018-03-22T07:54:35Z,2026-01-17T12:40:55Z,https://github.com/pujiaxin33/JXCategoryView,,MIT License,31912,False,False
96,KeepingYouAwake,newmarcel/KeepingYouAwake,newmarcel,Prevents your Mac from going to sleep.,Objective-C,6177,245,35,2014-10-19T15:52:33Z,2026-01-19T01:30:46Z,https://github.com/newmarcel/KeepingYouAwake,https://keepingyouawake.app,MIT License,7167,False,False
97,lemon-cleaner,Tencent/lemon-cleaner,Tencent,腾讯柠檬清理是针对macOS系统专属制定的清理工具。主要功能包括重复文件和相似照片的识别、软件的定制化垃圾扫描、可视化的全盘空间分析、内存释放、浏览器隐私清理以及设备实时状态的监控等。重点聚焦清理功能，对上百款软件提供定制化的清理方案，提供专业的清理建议，帮助用户轻松完成一键式清理。,Objective-C,6064,783,27,2022-07-12T09:23:14Z,2026-01-18T11:03:49Z,https://github.com/Tencent/lemon-cleaner,,Other,24930,False,False
98,AnyBar,tonsky/AnyBar,tonsky,OS X menubar status indicator,Objective-C,6008,158,17,2015-03-02T19:27:52Z,2026-01-10T16:08:04Z,https://github.com/tonsky/AnyBar,,Eclipse Public License 1.0,1079,False,False
99,MobileIMSDK,JackJiang2011/MobileIMSDK,JackJiang2011,原创全平台IM通信层框架，轻量级、高度提炼，历经10年、久经考验。可能是市面上唯一同时支持UDP+TCP+WebSocket三种协议的同类开源框架，支持 iOS、Android、Java、H5、小程序、Uniapp、鸿蒙Next，服务端基于Netty。,Objective-C,5960,1363,17,2015-10-07T14:23:26Z,2026-01-18T14:07:52Z,https://github.com/JackJiang2011/MobileIMSDK,http://www.52im.net/forum-89-1.html,Apache License 2.0,270617,False,False
100,FDFullscreenPopGesture,forkingdog/FDFullscreenPopGesture,forkingdog,A UINavigationController's category to enable fullscreen pop gesture with iOS7+ system style.,Objective-C,5901,1144,111,2015-05-29T06:15:39Z,2026-01-17T13:34:10Z,https://github.com/forkingdog/FDFullscreenPopGesture,,MIT License,1065,False,False
