排名,项目名称,完整名称,作者,描述,语言,Stars,Forks,Issues,创建时间,更新时间,仓库链接,主页链接,许可证,大小(KB),是否Fork,是否已归档
1,uni-app,dcloudio/uni-app,dcloudio,A cross-platform framework using Vue.js,Objective-C,41554,3711,691,2018-07-12T08:52:39Z,2026-06-29T03:34:55Z,https://github.com/dcloudio/uni-app,https://uniapp.dcloud.io,Apache License 2.0,8009146,False,False
2,AFNetworking,AFNetworking/AFNetworking,AFNetworking,"A delightful networking framework for iOS, macOS, watchOS, and tvOS.",Objective-C,33431,10603,102,2011-05-31T21:28:44Z,2026-06-29T01:15:30Z,https://github.com/AFNetworking/AFNetworking,http://afnetworking.com,MIT License,6129,False,True
3,SDWebImage,SDWebImage/SDWebImage,SDWebImage,Asynchronous image downloader with cache support as a UIImageView category,Objective-C,25642,5965,126,2009-09-21T17:39:19Z,2026-06-28T16:56:14Z,https://github.com/SDWebImage/SDWebImage,https://sdwebimage.github.io,MIT License,25653,False,False
4,WeChatExtension-ForMac,MustangYM/WeChatExtension-ForMac,MustangYM,A plugin for Mac WeChat,Objective-C,22609,3561,906,2019-04-25T03:02:16Z,2026-06-29T00:48:44Z,https://github.com/MustangYM/WeChatExtension-ForMac,,MIT License,208645,False,True
5,TrollStore,opa334/TrollStore,opa334,Jailed iOS app that can install IPAs permanently with arbitary entitlements and root helpers because it trolls Apple,Objective-C,21619,1594,48,2022-09-02T15:17:20Z,2026-06-29T04:03:53Z,https://github.com/opa334/TrollStore,,Other,7567,False,False
6,GPUImage,BradLarson/GPUImage,BradLarson,An open source iOS framework for GPU-based image and video processing,Objective-C,20293,4558,1001,2012-02-13T15:20:02Z,2026-06-27T15:48:50Z,https://github.com/BradLarson/GPUImage,http://www.sunsetlakesoftware.com/2012/02/12/introducing-gpuimage-framework,"BSD 3-Clause ""New"" or ""Revised"" License",44862,False,False
7,Masonry,SnapKit/Masonry,SnapKit,"Harness the power of AutoLayout NSLayoutConstraints with a simplified, chainable and expressive syntax. Supports iOS and OSX Auto Layout",Objective-C,18153,3149,151,2013-07-22T01:15:48Z,2026-06-27T15:49:31Z,https://github.com/SnapKit/Masonry,,MIT License,767,False,False
8,iTerm2,gnachman/iTerm2,gnachman,iTerm2 is a terminal emulator for Mac OS X that does amazing things.,Objective-C,17764,1419,63,2011-04-07T00:46:28Z,2026-06-29T03:11:46Z,https://github.com/gnachman/iTerm2,https://iterm2.com/,GNU General Public License v2.0,533021,False,False
9,realm-swift,realm/realm-swift,realm,Realm is a mobile database: a replacement for Core Data & SQLite,Objective-C,16608,2231,498,2012-04-16T20:06:56Z,2026-06-26T19:53:12Z,https://github.com/realm/realm-swift,https://realm.io,Apache License 2.0,67702,False,False
10,MBProgressHUD,jdg/MBProgressHUD,jdg,MBProgressHUD + Customizations,Objective-C,15948,3567,94,2009-05-31T21:45:41Z,2026-06-28T09:02:05Z,https://github.com/jdg/MBProgressHUD,http://www.bukovinski.com/,MIT License,1254,False,False
11,hammerspoon,Hammerspoon/hammerspoon,Hammerspoon,Staggeringly powerful macOS desktop automation with Lua,Objective-C,15642,691,675,2014-10-08T19:24:44Z,2026-06-29T03:32:30Z,https://github.com/Hammerspoon/hammerspoon,http://www.hammerspoon.org,MIT License,163104,False,False
12,keycastr,keycastr/keycastr,keycastr,"KeyCastr, an open-source keystroke visualizer",Objective-C,14917,568,97,2009-02-19T23:59:41Z,2026-06-28T23:42:35Z,https://github.com/keycastr/keycastr,,"BSD 3-Clause ""New"" or ""Revised"" License",58181,False,False
13,FLEX,FLEXTool/FLEX,FLEXTool,An in-app debugging and exploration tool for iOS,Objective-C,14613,1784,50,2014-05-29T00:58:29Z,2026-06-27T14:21:39Z,https://github.com/FLEXTool/FLEX,,Other,31178,False,False
14,WebViewJavascriptBridge,marcuswestin/WebViewJavascriptBridge,marcuswestin,An iOS/OSX bridge for sending messages between Obj-C and JavaScript in UIWebViews/WebViews,Objective-C,14320,2963,105,2011-08-28T02:25:27Z,2026-06-25T14:49:24Z,https://github.com/marcuswestin/WebViewJavascriptBridge,http://marcuswest.in,MIT License,522,False,False
15,WeChatPlugin-MacOS,TKkk-iOSer/WeChatPlugin-MacOS,TKkk-iOSer,微信小助手,Objective-C,14273,2455,152,2017-04-20T14:37:37Z,2026-06-23T09:13:24Z,https://github.com/TKkk-iOSer/WeChatPlugin-MacOS,,MIT License,25525,False,False
16,YYKit,ibireme/YYKit,ibireme,A collection of iOS components.,Objective-C,13981,3717,308,2013-04-10T19:47:33Z,2026-06-27T16:05:50Z,https://github.com/ibireme/YYKit,,MIT License,56960,False,False
17,fmdb,ccgus/fmdb,ccgus,A Cocoa / Objective-C wrapper around SQLite,Objective-C,13845,2738,271,2010-07-06T22:50:17Z,2026-06-27T03:24:02Z,https://github.com/ccgus/fmdb,,Other,1674,False,False
18,MJRefresh,CoderMJLee/MJRefresh,CoderMJLee,An easy way to use pull-to-refresh.,Objective-C,13813,3527,58,2014-05-23T16:22:32Z,2026-06-25T14:49:29Z,https://github.com/CoderMJLee/MJRefresh,,MIT License,15452,False,False
19,spectacle,eczarny/spectacle,eczarny,Spectacle allows you to organize your windows without using a mouse.,Objective-C,13631,847,148,2010-07-11T01:58:03Z,2026-06-27T14:29:42Z,https://github.com/eczarny/spectacle,https://spectacleapp.com/,Other,12787,False,True
20,CocoaLumberjack,CocoaLumberjack/CocoaLumberjack,CocoaLumberjack,"A fast & simple, yet powerful & flexible logging framework for macOS, iOS, tvOS, watchOS and visionOS",Objective-C,13329,2276,6,2011-03-31T02:38:39Z,2026-06-27T00:03:41Z,https://github.com/CocoaLumberjack/CocoaLumberjack,https://cocoalumberjack.github.io,"BSD 3-Clause ""New"" or ""Revised"" License",6219,False,False
21,IGListKit,Instagram/IGListKit,Instagram,A data-driven UICollectionView framework for building fast and flexible lists.,Objective-C,13068,1540,59,2016-09-07T08:39:27Z,2026-06-27T14:52:13Z,https://github.com/Instagram/IGListKit,https://instagram.github.io/IGListKit/,MIT License,9418,False,False
22,LuLu,objective-see/LuLu,objective-see,LuLu is the free open-source macOS firewall,Objective-C,12872,575,511,2017-09-10T06:56:23Z,2026-06-29T01:08:11Z,https://github.com/objective-see/LuLu,https://objective-see.org/products/lulu.html,GNU General Public License v3.0,26261,False,False
23,darling,darlinghq/darling,darlinghq,Darwin/macOS emulation layer for Linux,Objective-C,12844,508,391,2012-12-09T10:31:44Z,2026-06-28T18:00:35Z,https://github.com/darlinghq/darling,http://www.darlinghq.org,GNU General Public License v3.0,41097,False,False
24,SVProgressHUD,SVProgressHUD/SVProgressHUD,SVProgressHUD,A clean and lightweight progress HUD for your iOS and tvOS app.,Objective-C,12457,2664,85,2011-03-28T19:23:04Z,2026-06-27T16:07:24Z,https://github.com/SVProgressHUD/SVProgressHUD,https://github.com/SVProgressHUD/SVProgressHUD,MIT License,1414,False,False
25,CocoaAsyncSocket,robbiehanson/CocoaAsyncSocket,robbiehanson,Asynchronous socket networking library for Mac and iOS,Objective-C,12449,2996,1,2011-11-22T10:25:54Z,2026-06-25T14:49:24Z,https://github.com/robbiehanson/CocoaAsyncSocket,,Other,2243,False,False
26,chameleon,vicc/chameleon,vicc,"Color framework for Swift & Objective-C (Gradient colors, hexcode support, colors from images & more).",Objective-C,12322,1289,66,2014-07-26T09:01:09Z,2026-06-26T17:29:18Z,https://github.com/vicc/chameleon,,Other,11765,False,True
27,iCarousel,nicklockwood/iCarousel,nicklockwood,"A simple, highly customisable, data-driven 3D carousel for iOS and Mac OS",Objective-C,12126,2532,400,2011-04-06T23:23:43Z,2026-06-27T03:24:30Z,https://github.com/nicklockwood/iCarousel,http://www.charcoaldesign.co.uk/source/cocoa#icarousel,Other,3896,False,False
28,GitUp,git-up/GitUp,git-up,The Git interface you've been missing all your life has finally arrived.,Objective-C,12023,1471,372,2015-08-13T04:11:10Z,2026-06-27T04:38:00Z,https://github.com/git-up/GitUp,http://gitup.co,GNU General Public License v3.0,67983,False,False
29,DZNEmptyDataSet,dzenbot/DZNEmptyDataSet,dzenbot,A drop-in UITableView/UICollectionView superclass category for showing empty datasets whenever the view has no content to display,Objective-C,12020,1715,190,2014-06-03T14:50:31Z,2026-06-24T21:48:28Z,https://github.com/dzenbot/DZNEmptyDataSet,https://www.cocoacontrols.com/controls/dznemptydataset,MIT License,14208,False,True
30,JSPatch,bang590/JSPatch,bang590,JSPatch bridge Objective-C and Javascript using the Objective-C runtime. You can call any Objective-C class and method in JavaScript by just including a small engine. JSPatch is generally used to hotfix iOS App.,Objective-C,11330,2219,106,2015-05-25T02:37:22Z,2026-06-24T21:48:28Z,https://github.com/bang590/JSPatch,,MIT License,7890,False,False
31,Mantle,Mantle/Mantle,Mantle,Model framework for Cocoa and Cocoa Touch,Objective-C,11254,1464,0,2012-09-05T06:24:59Z,2026-06-25T00:52:56Z,https://github.com/Mantle/Mantle,,Other,1635,False,False
32,JSQMessagesViewController,jessesquires/JSQMessagesViewController,jessesquires,An elegant messages UI library for iOS,Objective-C,11078,2759,0,2013-02-17T21:40:44Z,2026-06-25T14:49:26Z,https://github.com/jessesquires/JSQMessagesViewController,https://www.jessesquires.com/blog/officially-deprecating-jsqmessagesviewcontroller/,Other,20414,False,True
33,MagicalRecord,magicalpanda/MagicalRecord,magicalpanda,Super Awesome Easy Fetching for Core Data!,Objective-C,10708,1766,242,2010-07-27T23:58:18Z,2026-06-23T18:56:31Z,https://github.com/magicalpanda/MagicalRecord,,Other,8165,False,False
34,FSCalendar,WenchaoD/FSCalendar,WenchaoD,"A fully customizable iOS calendar library, compatible with Objective-C and Swift",Objective-C,10650,1945,504,2015-02-15T08:43:09Z,2026-06-27T14:30:16Z,https://github.com/WenchaoD/FSCalendar,,MIT License,2513,False,False
35,mac-mouse-fix,noah-nuebling/mac-mouse-fix,noah-nuebling,Mac Mouse Fix - Make Your $10 Mouse Better Than an Apple Trackpad!,Objective-C,10316,346,1147,2019-08-07T22:09:17Z,2026-06-29T02:27:57Z,https://github.com/noah-nuebling/mac-mouse-fix,https://macmousefix.com/,Other,139380,False,False
36,RestKit,RestKit/RestKit,RestKit,RestKit is a framework for consuming and modeling RESTful web resources on iOS and OS X,Objective-C,10103,2072,364,2010-02-09T01:14:06Z,2026-06-20T16:01:31Z,https://github.com/RestKit/RestKit,,Apache License 2.0,43492,False,False
37,UITableView-FDTemplateLayoutCell,forkingdog/UITableView-FDTemplateLayoutCell,forkingdog,Template auto layout cell for automatically UITableViewCell height calculating,Objective-C,9865,1990,130,2015-04-16T13:14:19Z,2026-06-27T15:49:53Z,https://github.com/forkingdog/UITableView-FDTemplateLayoutCell,,MIT License,4257,False,False
38,Alcatraz,alcatraz/Alcatraz,alcatraz,Package manager for Xcode,Objective-C,9798,1121,39,2013-04-22T16:40:10Z,2026-06-25T22:52:59Z,https://github.com/alcatraz/Alcatraz,alcatraz.io,MIT License,9153,False,True
39,PNChart,kevinzhow/PNChart,kevinzhow,A simple and beautiful chart lib used in Piner and CoinsMan for iOS,Objective-C,9651,1738,173,2013-11-06T22:06:17Z,2026-06-27T15:57:40Z,https://github.com/kevinzhow/PNChart,,MIT License,676,False,False
40,SocketRocket,facebookincubator/SocketRocket,facebookincubator,A conforming Objective-C WebSocket client library.,Objective-C,9616,2007,190,2012-01-30T00:21:34Z,2026-06-26T10:17:46Z,https://github.com/facebookincubator/SocketRocket,,Other,2458,False,False
41,Shimmer,facebookarchive/Shimmer,facebookarchive,"An easy way to add a simple, shimmering effect to any view in an iOS app.",Objective-C,9331,1116,21,2014-02-18T22:15:19Z,2026-06-22T10:19:32Z,https://github.com/facebookarchive/Shimmer,,Other,2770,False,True
42,Sparkle,sparkle-project/Sparkle,sparkle-project,A software update framework for macOS,Objective-C,9289,1115,19,2009-08-11T07:05:25Z,2026-06-28T22:08:08Z,https://github.com/sparkle-project/Sparkle,https://sparkle-project.org,Other,45074,False,False
43,sequelpro,sequelpro/sequelpro,sequelpro,MySQL/MariaDB database management for macOS,Objective-C,9198,836,530,2013-11-08T05:27:37Z,2026-06-27T16:13:26Z,https://github.com/sequelpro/sequelpro,https://sequelpro.com/,Other,57089,False,False
44,Sloth,sveinbjornt/Sloth,sveinbjornt,"Mac app that shows all open files, directories, sockets, pipes and devices in use by all running processes. Nice GUI for lsof.",Objective-C,8915,174,3,2011-03-28T02:47:23Z,2026-06-29T00:52:50Z,https://github.com/sveinbjornt/Sloth,https://sveinbjorn.org/sloth,"BSD 3-Clause ""New"" or ""Revised"" License",13788,False,False
45,YYText,ibireme/YYText,ibireme,Powerful text framework for iOS to display and edit rich text.,Objective-C,8872,1837,518,2015-11-05T13:13:53Z,2026-06-25T14:49:39Z,https://github.com/ibireme/YYText,,MIT License,21807,False,False
46,BaiduNetdiskPlugin-macOS,CodeTips/BaiduNetdiskPlugin-macOS,CodeTips,For macOS.百度网盘 破解SVIP、下载速度限制~,Objective-C,8849,1753,66,2018-03-06T13:48:48Z,2026-06-27T05:41:37Z,https://github.com/CodeTips/BaiduNetdiskPlugin-macOS,,MIT License,1324,False,True
47,MWPhotoBrowser,mwaterfall/MWPhotoBrowser,mwaterfall,"A simple iOS photo and video browser with grid view, captions and selections.",Objective-C,8716,2659,335,2010-10-21T15:40:47Z,2026-06-25T00:53:12Z,https://github.com/mwaterfall/MWPhotoBrowser,,MIT License,21737,False,False
48,TTTAttributedLabel,TTTAttributedLabel/TTTAttributedLabel,TTTAttributedLabel,"A drop-in replacement for UILabel that supports attributes, data detectors, links, and more",Objective-C,8713,1692,177,2011-05-06T23:37:12Z,2026-06-25T22:33:58Z,https://github.com/TTTAttributedLabel/TTTAttributedLabel,,MIT License,1653,False,False
49,MJExtension,CoderMJLee/MJExtension,CoderMJLee,"A fast, convenient and nonintrusive conversion framework between JSON and model. Your model class doesn't need to extend any base class. You don't need to modify any model file.",Objective-C,8499,2135,28,2014-05-23T15:54:00Z,2026-06-27T15:04:51Z,https://github.com/CoderMJLee/MJExtension,,MIT License,2716,False,False
50,Aspects,steipete/Aspects,steipete,"Delightful, simple library for aspect oriented programming in Objective-C and Swift.",Objective-C,8423,1266,107,2014-05-03T17:06:00Z,2026-06-26T16:23:16Z,https://github.com/steipete/Aspects,https://twitter.com/steipete,MIT License,501,False,True
51,SlackTextViewController,slackhq/SlackTextViewController,slackhq,⛔️**DEPRECATED** ⛔️ A drop-in UIViewController subclass with a growing text input view and other useful messaging features,Objective-C,8267,1069,79,2014-08-18T18:46:06Z,2026-06-25T00:52:54Z,https://github.com/slackhq/SlackTextViewController,https://slack.com/,MIT License,16262,False,True
52,VVDocumenter-Xcode,onevcat/VVDocumenter-Xcode,onevcat,"Xcode plug-in which helps you write documentation comment easier, for both Objective-C and Swift.",Objective-C,8247,1513,63,2013-07-16T09:58:02Z,2026-06-25T14:49:27Z,https://github.com/onevcat/VVDocumenter-Xcode,,MIT License,4377,False,True
53,TZImagePickerController,banchichen/TZImagePickerController,banchichen,"一个支持多选、选原图和视频的图片选择器，同时有预览、裁剪功能，支持iOS6+。  A clone of UIImagePickerController, support picking multiple photos、original photo、video, also allow preview photo and video, support iOS6+",Objective-C,8156,1891,63,2016-01-07T09:23:01Z,2026-06-25T14:49:40Z,https://github.com/banchichen/TZImagePickerController,,MIT License,7130,False,False
54,shadowsocks-iOS,shadowsocks/shadowsocks-iOS,shadowsocks,Removed according to regulations.,Objective-C,8136,3401,178,2012-12-27T09:23:49Z,2026-06-25T14:49:26Z,https://github.com/shadowsocks/shadowsocks-iOS,,,13127,False,False
55,analyze,draveness/analyze,draveness,Draven's Blog,Objective-C,8087,1942,11,2016-03-19T02:53:31Z,2026-06-25T14:49:42Z,https://github.com/draveness/analyze,https://draveness.me,,103436,False,False
56,FastImageCache,path/FastImageCache,path,iOS library for quickly displaying images while scrolling,Objective-C,8070,923,40,2013-08-21T22:44:53Z,2026-06-22T15:13:27Z,https://github.com/path/FastImageCache,,MIT License,1744,False,False
57,iOS-Runtime-Headers,nst/iOS-Runtime-Headers,nst,iOS Objective-C headers as derived from runtime introspection,Objective-C,7972,1595,59,2011-01-09T13:37:14Z,2026-06-27T15:59:32Z,https://github.com/nst/iOS-Runtime-Headers,https://github.com/nst/RuntimeBrowser,,171868,False,False
58,FLAnimatedImage,Flipboard/FLAnimatedImage,Flipboard,Performant animated GIF engine for iOS,Objective-C,7953,1208,83,2014-05-19T17:44:51Z,2026-06-25T14:49:28Z,https://github.com/Flipboard/FLAnimatedImage,,MIT License,4079,False,False
59,trip-to-iOS,Aufree/trip-to-iOS,Aufree,A curated list of delightful iOS resources.,Objective-C,7880,2208,3,2015-01-02T08:18:53Z,2026-06-25T14:49:32Z,https://github.com/Aufree/trip-to-iOS,,,156,False,False
60,slate,jigish/slate,jigish,A window management application (replacement for Divvy/SizeUp/ShiftIt),Objective-C,7835,510,261,2011-05-23T08:56:15Z,2026-06-28T13:08:22Z,https://github.com/jigish/slate,,GNU General Public License v3.0,48772,False,False
61,FlatUIKit,Grouper/FlatUIKit,Grouper,A collection of awesome flat UI components for iOS.,Objective-C,7742,927,35,2013-05-08T21:56:44Z,2026-06-25T21:43:44Z,https://github.com/Grouper/FlatUIKit,,MIT License,2121,False,False
62,V2RayX,Cenmrev/V2RayX,Cenmrev,GUI for v2ray-core on macOS,Objective-C,7649,1120,118,2016-02-10T08:56:28Z,2026-06-26T04:00:43Z,https://github.com/Cenmrev/V2RayX,,GNU General Public License v3.0,23703,False,True
63,PureLayout,PureLayout/PureLayout,PureLayout,"The ultimate API for iOS & OS X Auto Layout — impressively simple, immensely powerful. Objective-C and Swift compatible.",Objective-C,7598,730,47,2014-06-23T00:13:14Z,2026-06-24T13:20:25Z,https://github.com/PureLayout/PureLayout,,Other,1086,False,False
64,Sequel-Ace,Sequel-Ace/Sequel-Ace,Sequel-Ace,MySQL/MariaDB database management for macOS,Objective-C,7447,317,185,2020-06-11T13:31:01Z,2026-06-28T16:53:41Z,https://github.com/Sequel-Ace/Sequel-Ace,https://sequel-ace.com,Other,224400,False,False
65,KVOController,facebookarchive/KVOController,facebookarchive,"Simple, modern, thread-safe key-value observing for iOS and OS X.",Objective-C,7291,915,15,2014-02-24T20:25:08Z,2026-06-25T14:49:28Z,https://github.com/facebookarchive/KVOController,,Other,163,False,True
66,terminal-notifier,julienXX/terminal-notifier,julienXX,Send User Notifications on macOS from the command-line.,Objective-C,7231,353,52,2012-07-15T15:48:59Z,2026-06-27T06:18:07Z,https://github.com/julienXX/terminal-notifier,,Other,3007,False,False
67,QMUI_iOS,Tencent/QMUI_iOS,Tencent,QMUI iOS——致力于提高项目 UI 开发效率的解决方案,Objective-C,7201,1443,224,2016-12-20T07:34:32Z,2026-06-25T14:49:49Z,https://github.com/Tencent/QMUI_iOS,http://qmuiteam.com/ios,Other,7197,False,False
68,DateTools,MatthewYork/DateTools,MatthewYork,Dates and times made easy in iOS,Objective-C,7182,941,109,2014-03-19T14:55:47Z,2026-06-23T13:04:30Z,https://github.com/MatthewYork/DateTools,,MIT License,673,False,False
69,three20,facebookarchive/three20,facebookarchive,Three20 is an Objective-C library for iPhone developers,Objective-C,7170,1458,204,2009-02-19T06:31:51Z,2026-06-22T10:19:29Z,https://github.com/facebookarchive/three20,,Other,33231,False,True
70,JVFloatLabeledTextField,jverdi/JVFloatLabeledTextField,jverdi,UITextField subclass with floating labels - inspired by Matt D. Smith's design: http://dribbble.com/shots/1254439--GIF-Mobile-Form-Interaction?list=users,Objective-C,7148,719,28,2013-10-01T04:31:03Z,2026-06-21T06:54:36Z,https://github.com/jverdi/JVFloatLabeledTextField,,MIT License,401,False,False
71,ZFPlayer,renzifeng/ZFPlayer,renzifeng,Support customization of any player SDK and control layer(支持定制任何播放器SDK和控制层),Objective-C,7131,1770,256,2016-03-03T03:32:48Z,2026-06-26T09:02:07Z,https://github.com/renzifeng/ZFPlayer,,MIT License,160158,False,False
72,Dash-iOS,Kapeli/Dash-iOS,Kapeli,Dash for iOS was discontinued. Please check out Dash for macOS instead.,Objective-C,7101,909,38,2016-11-06T17:31:43Z,2026-06-18T06:03:42Z,https://github.com/Kapeli/Dash-iOS,https://kapeli.com/dash,Other,54753,False,False
73,SWTableViewCell,CEWendel/SWTableViewCell,CEWendel,An easy-to-use UITableViewCell subclass that implements a swippable content view which exposes utility buttons (similar to iOS 7 Mail Application),Objective-C,7068,1246,172,2013-09-10T05:45:34Z,2026-06-27T22:52:49Z,https://github.com/CEWendel/SWTableViewCell,,MIT License,2900,False,False
74,RESideMenu,romaonthego/RESideMenu,romaonthego,iOS 7/8 style side menu with parallax effect.,Objective-C,7046,1318,132,2013-06-17T15:37:52Z,2026-06-24T21:48:29Z,https://github.com/romaonthego/RESideMenu,,MIT License,11964,False,False
75,Reachability,tonymillion/Reachability,tonymillion,ARC and GCD Compatible Reachability Class for iOS and MacOS. Drop in replacement for Apple Reachability,Objective-C,6961,1249,70,2011-11-12T00:45:36Z,2026-06-23T08:32:09Z,https://github.com/tonymillion/Reachability,,"BSD 2-Clause ""Simplified"" License",144,False,False
76,MGSwipeTableCell,MortimerGoro/MGSwipeTableCell,MortimerGoro,An easy to use UITableViewCell subclass that allows to display swippable buttons with a variety of transitions.,Objective-C,6916,1061,132,2014-08-09T13:56:25Z,2026-06-18T14:02:13Z,https://github.com/MortimerGoro/MGSwipeTableCell,,MIT License,2169,False,False
77,ANE,maderix/ANE,maderix,Training neural networks on Apple Neural Engine via reverse-engineered private APIs,Objective-C,6895,947,28,2026-02-28T09:27:28Z,2026-06-29T03:26:03Z,https://github.com/maderix/ANE,,MIT License,500,False,False
78,xctool,facebookarchive/xctool,facebookarchive,An extension for Apple's xcodebuild that makes it easier to test iOS and macOS apps.,Objective-C,6868,721,9,2013-04-24T05:18:44Z,2026-06-22T04:58:47Z,https://github.com/facebookarchive/xctool,,Apache License 2.0,9526,False,True
79,MacPass,MacPass/MacPass,MacPass,A native macOS KeePass client ,Objective-C,6851,470,293,2012-07-21T00:48:01Z,2026-06-26T16:33:44Z,https://github.com/MacPass/MacPass,https://macpassapp.org,Other,25879,False,False
80,BlocksKit,BlocksKit/BlocksKit,BlocksKit,The Objective-C block utilities you always wish you had.,Objective-C,6836,1248,91,2011-05-17T18:06:36Z,2026-06-24T21:48:27Z,https://github.com/BlocksKit/BlocksKit,,MIT License,5860,False,True
81,jsonmodel,jsonmodel/jsonmodel,jsonmodel,"Magical Data Modeling Framework for JSON - allows rapid creation of smart data models. You can use it in your iOS, macOS, watchOS and tvOS apps.",Objective-C,6812,1048,34,2012-12-02T17:19:21Z,2026-06-25T14:49:25Z,https://github.com/jsonmodel/jsonmodel,,MIT License,1637,False,False
82,MonkeyDev,AloneMonkey/MonkeyDev,AloneMonkey,"CaptainHook Tweak、Logos Tweak and Command-line Tool、Patch iOS Apps,  Without Jailbreak.",Objective-C,6788,1240,186,2017-06-27T10:00:02Z,2026-06-28T08:54:27Z,https://github.com/AloneMonkey/MonkeyDev,,GNU General Public License v3.0,20217,False,False
83,MMDrawerController,griddynamics-archive/MMDrawerController,griddynamics-archive," A lightweight, easy to use, Side Drawer Navigation Controller",Objective-C,6714,1355,189,2013-05-07T14:47:41Z,2026-06-25T10:29:45Z,https://github.com/griddynamics-archive/MMDrawerController,http://griddynamics-archive.github.io/MMDrawerController/,MIT License,2930,False,False
84,KeepingYouAwake,newmarcel/KeepingYouAwake,newmarcel,Prevents your Mac from going to sleep.,Objective-C,6696,261,30,2014-10-19T15:52:33Z,2026-06-29T00:29:14Z,https://github.com/newmarcel/KeepingYouAwake,https://keepingyouawake.app,MIT License,7058,False,False
85,GCDWebServer,swisspol/GCDWebServer,swisspol,"The #1 HTTP server for iOS, macOS & tvOS (also includes web based uploader & WebDAV server)",Objective-C,6623,1327,42,2012-12-29T18:22:34Z,2026-06-27T15:03:32Z,https://github.com/swisspol/GCDWebServer,,Other,12325,False,True
86,Onboard,mamaral/Onboard,mamaral,An iOS framework to easily create a beautiful and engaging onboarding experience with only a few lines of code.,Objective-C,6578,750,45,2014-08-19T01:43:54Z,2026-06-28T15:59:29Z,https://github.com/mamaral/Onboard,,MIT License,80037,False,False
87,YTKNetwork,kanyun-inc/YTKNetwork,kanyun-inc,YTKNetwork is a high level request util based on AFNetworking.,Objective-C,6562,1638,126,2014-10-31T09:33:15Z,2026-06-25T14:49:31Z,https://github.com/kanyun-inc/YTKNetwork,,MIT License,653,False,False
88,injectionforxcode,johnno1962/injectionforxcode,johnno1962,Runtime Code Injection for Objective-C & Swift,Objective-C,6536,564,76,2012-05-28T15:37:09Z,2026-06-17T11:00:02Z,https://github.com/johnno1962/injectionforxcode,,MIT License,6639,False,False
89,nimbus,jverkoey/nimbus,jverkoey,The iOS framework that grows only as fast as its documentation,Objective-C,6417,1275,3,2011-06-09T15:01:53Z,2026-06-23T18:27:51Z,https://github.com/jverkoey/nimbus,nimbuskit.info,Apache License 2.0,45418,False,True
90,JazzHands,IFTTT/JazzHands,IFTTT,A simple keyframe-based animation framework for UIKit. Perfect for scrolling app intros.,Objective-C,6366,661,15,2013-09-29T22:03:15Z,2026-06-17T11:04:30Z,https://github.com/IFTTT/JazzHands,http://ifttt.github.io,MIT License,3051,False,False
91,react-native-image-crop-picker,ivpusic/react-native-image-crop-picker,ivpusic,"iOS/Android image picker with support for camera, video, configurable compression, multiple images and cropping",Objective-C,6349,1608,653,2016-05-17T14:25:03Z,2026-06-10T07:16:44Z,https://github.com/ivpusic/react-native-image-crop-picker,,MIT License,8795,False,False
92,NWPusher,noodlewerk/NWPusher,noodlewerk,OS X and iOS application and framework to play with the Apple Push Notification service (APNs),Objective-C,6309,666,29,2012-09-09T20:23:33Z,2026-06-19T00:10:11Z,https://github.com/noodlewerk/NWPusher,,"BSD 2-Clause ""Simplified"" License",2838,False,False
