排名,项目名称,完整名称,作者,描述,语言,Stars,Forks,Issues,创建时间,更新时间,仓库链接,主页链接,许可证,大小(KB),是否Fork,是否已归档
90,google-api-php-client,googleapis/google-api-php-client,googleapis,A PHP client library for accessing Google APIs,PHP,9771,3554,19,2013-08-16T19:48:39Z,2026-04-11T15:39:49Z,https://github.com/googleapis/google-api-php-client,http://googleapis.github.io/google-api-php-client/,Apache License 2.0,15591,False,False
91,akaunting,akaunting/akaunting,akaunting,Online Accounting Software,PHP,9715,2884,7,2017-06-21T14:17:56Z,2026-04-12T20:41:05Z,https://github.com/akaunting/akaunting,https://akaunting.com,Other,83853,False,False
92,dbal,doctrine/dbal,doctrine,Doctrine Database Abstraction Layer,PHP,9696,1374,293,2010-05-20T17:01:42Z,2026-04-12T21:02:14Z,https://github.com/doctrine/dbal,https://www.doctrine-project.org/projects/dbal.html,MIT License,45059,False,False
93,invoiceninja,invoiceninja/invoiceninja,invoiceninja,"A source-available invoice, quote, project and time-tracking app built with Laravel",PHP,9654,2618,915,2013-11-26T12:30:05Z,2026-04-13T00:55:35Z,https://github.com/invoiceninja/invoiceninja,https://invoiceninja.com,Other,4165892,False,False
94,unopim,unopim/unopim,unopim,"A free and open-source Laravel-based Product Information Management (PIM) system that helps businesses organize, manage, and enrich their product data from a single, central platform. Learn how UnoPIM scales to handle over 10 million products:  https://unopim.com/scaling-unopim-for-10-million-products/",PHP,9547,133,31,2024-07-24T07:04:52Z,2026-04-13T03:25:57Z,https://github.com/unopim/unopim,https://unopim.com,MIT License,23325,False,False
95,kanboard,kanboard/kanboard,kanboard,Kanban project management software,PHP,9542,1947,145,2014-01-25T19:58:30Z,2026-04-12T23:04:34Z,https://github.com/kanboard/kanboard,https://kanboard.org,MIT License,95917,False,False
96,all-in-one,nextcloud/all-in-one,nextcloud,📦 The official Nextcloud installation method. Provides easy deployment and maintenance with most features included in this one Nextcloud instance.,PHP,9525,1011,70,2021-11-30T10:16:41Z,2026-04-12T20:05:27Z,https://github.com/nextcloud/all-in-one,https://nextcloud.com/blog/how-to-install-the-nextcloud-all-in-one-on-linux/,GNU Affero General Public License v3.0,11995,False,False
97,leantime,Leantime/leantime,Leantime,"Leantime is a goals focused project management system for non-project managers. Building with ADHD, Autism, and dyslexia in mind.",PHP,9489,935,321,2015-01-23T17:52:06Z,2026-04-13T02:17:22Z,https://github.com/Leantime/leantime,https://leantime.io,GNU Affero General Public License v3.0,247757,False,False
98,swiftmailer,swiftmailer/swiftmailer,swiftmailer,Comprehensive mailing tools for PHP,PHP,9466,859,0,2008-12-19T08:31:03Z,2026-04-06T08:21:12Z,https://github.com/swiftmailer/swiftmailer,https://swiftmailer.symfony.com/,MIT License,9247,False,True
99,mautic,mautic/mautic,mautic,Mautic: Open Source Marketing Automation Software.,PHP,9435,3229,279,2013-08-19T00:36:28Z,2026-04-12T20:37:15Z,https://github.com/mautic/mautic,https://www.mautic.org,Other,273395,False,False
100,ReflectionDocBlock,phpDocumentor/ReflectionDocBlock,phpDocumentor,,PHP,9387,134,12,2012-04-06T17:17:37Z,2026-04-12T12:33:45Z,https://github.com/phpDocumentor/ReflectionDocBlock,,MIT License,1380,False,False
