排名,项目名称,完整名称,作者,描述,语言,Stars,Forks,Issues,创建时间,更新时间,仓库链接,主页链接,许可证,大小(KB),是否Fork,是否已归档
1,winutil,ChrisTitusTech/winutil,ChrisTitusTech,"Chris Titus Tech's Windows Utility - Install Programs, Tweaks, Fixes, and Updates",PowerShell,38055,2054,204,2022-04-28T02:25:19Z,2025-07-28T18:18:40Z,https://github.com/ChrisTitusTech/winutil,,MIT License,10412,False,False
2,claude-code,anthropics/claude-code,anthropics,"Claude Code is an agentic coding tool that lives in your terminal, understands your codebase, and helps you code faster by executing routine tasks, explaining complex code, and handling git workflows - all through natural language commands.",PowerShell,26452,1458,2530,2025-02-22T17:41:21Z,2025-07-28T18:30:02Z,https://github.com/anthropics/claude-code,https://docs.anthropic.com/s/claude-code,,15637,False,False
3,Win11Debloat,Raphire/Win11Debloat,Raphire,"A simple, easy to use PowerShell script to remove pre-installed apps, disable telemetry, as well as perform various other changes to customize, declutter and improve your Windows experience. Win11Debloat works for both Windows 10 and Windows 11.",PowerShell,23594,974,32,2020-10-27T22:26:59Z,2025-07-28T17:45:31Z,https://github.com/Raphire/Win11Debloat,,MIT License,382,False,False
4,Scoop,ScoopInstaller/Scoop,ScoopInstaller,A command-line installer for Windows.,PowerShell,22665,1468,392,2013-05-11T03:52:15Z,2025-07-28T14:25:47Z,https://github.com/ScoopInstaller/Scoop,https://scoop.sh,Other,14064,False,False
5,core,dotnet/core,dotnet,".NET news, announcements, release notes, and more!",PowerShell,21513,4919,337,2014-11-18T00:44:57Z,2025-07-28T17:45:56Z,https://github.com/dotnet/core,https://dot.net,MIT License,48835,False,False
6,Windows10Debloater,Sycnex/Windows10Debloater,Sycnex,Script to remove Windows 10 bloatware.,PowerShell,18584,2073,300,2017-12-12T01:35:58Z,2025-07-28T17:47:57Z,https://github.com/Sycnex/Windows10Debloater,,MIT License,478,False,True
7,SpotX,SpotX-Official/SpotX,SpotX-Official,SpotX patcher used for patching the desktop version of Spotify,PowerShell,17667,909,6,2021-08-11T18:01:20Z,2025-07-28T14:10:19Z,https://github.com/SpotX-Official/SpotX,,MIT License,25124,False,False
8,Atlas,Atlas-OS/Atlas,Atlas-OS,"🚀 An open and lightweight modification to Windows, designed to optimize performance, privacy and usability.",PowerShell,16249,586,6,2021-02-08T00:26:23Z,2025-07-28T13:33:56Z,https://github.com/Atlas-OS/Atlas,https://atlasos.net,GNU General Public License v3.0,339774,False,False
9,PowerSploit,PowerShellMafia/PowerSploit,PowerShellMafia,PowerSploit - A PowerShell Post-Exploitation Framework,PowerShell,12482,4700,104,2012-05-26T16:08:48Z,2025-07-28T17:59:37Z,https://github.com/PowerShellMafia/PowerSploit,,Other,10719,False,True
10,tiny11builder,ntdevlabs/tiny11builder,ntdevlabs,Scripts to build a trimmed-down Windows 11 image.,PowerShell,12396,1004,165,2023-02-24T23:42:36Z,2025-07-28T17:32:20Z,https://github.com/ntdevlabs/tiny11builder,,,249,False,False
11,Office-Tool,YerongAI/Office-Tool,YerongAI,Office Tool Plus localization projects.,PowerShell,11607,959,1,2018-11-06T10:54:58Z,2025-07-28T14:57:15Z,https://github.com/YerongAI/Office-Tool,https://www.officetool.plus,MIT License,39037,False,False
12,runner-images,actions/runner-images,actions,GitHub Actions runner images,PowerShell,11601,3411,43,2019-06-05T15:02:59Z,2025-07-28T15:29:29Z,https://github.com/actions/runner-images,,MIT License,13952,False,False
13,BloodHound-Legacy,SpecterOps/BloodHound-Legacy,SpecterOps,Six Degrees of Domain Admin,PowerShell,10265,1781,95,2016-04-17T18:36:14Z,2025-07-28T17:23:57Z,https://github.com/SpecterOps/BloodHound-Legacy,,GNU General Public License v3.0,190008,False,False
14,winget-pkgs,microsoft/winget-pkgs,microsoft,The Microsoft community Windows Package Manager manifest repository,PowerShell,9569,5259,1277,2019-07-16T22:21:48Z,2025-07-28T18:22:46Z,https://github.com/microsoft/winget-pkgs,,MIT License,490353,False,False
15,nishang,samratashok/nishang,samratashok,"Nishang - Offensive PowerShell for red team, penetration testing and offensive security. ",PowerShell,9358,2518,22,2014-05-19T11:48:24Z,2025-07-28T08:03:42Z,https://github.com/samratashok/nishang,,Other,11154,False,False
16,blazor,dotnet/blazor,dotnet,Blazor moved to https://github.com/dotnet/aspnetcore,PowerShell,9325,649,0,2018-01-03T16:53:27Z,2025-07-24T13:16:43Z,https://github.com/dotnet/blazor,https://blazor.net/,Apache License 2.0,228933,False,True
17,Sophia-Script-for-Windows,farag2/Sophia-Script-for-Windows,farag2,:zap: The most powerful PowerShell module for fine-tuning Windows,PowerShell,8504,609,0,2018-10-17T11:09:58Z,2025-07-28T17:08:10Z,https://github.com/farag2/Sophia-Script-for-Windows,,MIT License,173133,False,False
18,posh-git,dahlbyk/posh-git,dahlbyk,A PowerShell environment for Git,PowerShell,8009,818,110,2010-03-10T03:52:24Z,2025-07-27T18:45:35Z,https://github.com/dahlbyk/posh-git,http://dahlbyk.github.io/posh-git/,MIT License,2966,False,False
19,Empire,EmpireProject/Empire,EmpireProject,Empire is a PowerShell and Python post-exploitation agent.,PowerShell,7664,2892,101,2015-08-05T18:25:57Z,2025-07-28T17:50:14Z,https://github.com/EmpireProject/Empire,http://www.powershellempire.com/,"BSD 3-Clause ""New"" or ""Revised"" License",22502,False,True
20,flare-vm,mandiant/flare-vm,mandiant,A collection of software installations scripts for Windows systems that allows you to easily setup and maintain a reverse engineering environment on a VM.,PowerShell,7526,1005,22,2017-07-05T21:17:16Z,2025-07-28T07:27:25Z,https://github.com/mandiant/flare-vm,,Apache License 2.0,15740,False,False
21,commando-vm,mandiant/commando-vm,mandiant,"Complete Mandiant Offensive VM (Commando VM), a fully customizable Windows-based pentesting virtual machine distribution. commandovm@mandiant.com",PowerShell,7300,1326,9,2019-03-26T22:36:32Z,2025-07-28T08:03:34Z,https://github.com/mandiant/commando-vm,https://www.mandiant.com/resources/blog/commando-vm-windows-offensive-distribution,Apache License 2.0,16798,False,False
22,docker,jenkinsci/docker,jenkinsci,Docker official jenkins repo,PowerShell,7084,4644,18,2014-07-18T05:51:05Z,2025-07-28T05:41:27Z,https://github.com/jenkinsci/docker,https://hub.docker.com/r/jenkins/jenkins,MIT License,2474,False,False
23,GOAD,Orange-Cyberdefense/GOAD,Orange-Cyberdefense,game of active directory,PowerShell,6673,934,97,2021-09-27T08:48:33Z,2025-07-28T12:50:56Z,https://github.com/Orange-Cyberdefense/GOAD,,GNU General Public License v3.0,25279,False,False
24,Debloat-Windows-10,W4RH4WK/Debloat-Windows-10,W4RH4WK,A Collection of Scripts Which Disable / Remove Windows 10 Features and Apps,PowerShell,6195,835,43,2015-08-03T22:16:34Z,2025-07-28T16:17:09Z,https://github.com/W4RH4WK/Debloat-Windows-10,,Other,288,False,False
25,Win-Debloat-Tools,LeDragoX/Win-Debloat-Tools,LeDragoX,"Re-imagining Windows like a minimal OS install, already debloated with minimal impact for most functionality.",PowerShell,6164,302,23,2020-08-26T13:32:48Z,2025-07-28T17:44:46Z,https://github.com/LeDragoX/Win-Debloat-Tools,,MIT License,49022,False,False
26,Flipper-Zero-BadUSB,I-Am-Jakoby/Flipper-Zero-BadUSB,I-Am-Jakoby,Repository for my flipper zero badUSB payloads. Now almost entirely plug and play.,PowerShell,6094,765,58,2022-05-25T02:30:26Z,2025-07-28T15:30:10Z,https://github.com/I-Am-Jakoby/Flipper-Zero-BadUSB,,,25917,False,False
27,K8tools,k8gege/K8tools,k8gege,K8工具合集(内网渗透/提权工具/远程溢出/漏洞利用/扫描工具/密码破解/免杀工具/Exploit/APT/0day/Shellcode/Payload/priviledge/BypassUAC/OverFlow/WebShell/PenTest) Web GetShell Exploit(Struts2/Zimbra/Weblogic/Tomcat/Apache/Jboss/DotNetNuke/zabbix),PowerShell,6022,2070,5,2019-02-23T14:04:52Z,2025-07-28T14:47:20Z,https://github.com/k8gege/K8tools,http://k8gege.org,MIT License,623500,False,False
28,windows-defender-remover,ionuttbara/windows-defender-remover,ionuttbara,"A tool which is uses to remove Windows Defender in Windows 8.x, Windows 10 (every version) and Windows 11.",PowerShell,5935,392,33,2021-08-13T20:44:46Z,2025-07-28T17:47:39Z,https://github.com/ionuttbara/windows-defender-remover,,Other,4793,False,False
29,awesome-powershell,janikvonrotz/awesome-powershell,janikvonrotz,A curated list of delightful PowerShell modules and resources,PowerShell,5199,433,15,2015-05-28T12:10:06Z,2025-07-28T15:09:33Z,https://github.com/janikvonrotz/awesome-powershell,,GNU Affero General Public License v3.0,200,False,False
30,oh-my-posh2,JanDeDobbeleer/oh-my-posh2,JanDeDobbeleer,A prompt theming engine for Powershell,PowerShell,5198,286,0,2016-03-18T19:22:41Z,2025-07-27T16:46:48Z,https://github.com/JanDeDobbeleer/oh-my-posh2,,MIT License,541,False,True
31,k8s-for-docker-desktop,denverdino/k8s-for-docker-desktop,denverdino,为Docker Desktop for Mac/Windows开启Kubernetes和Istio。,PowerShell,5031,1123,36,2018-03-04T12:18:16Z,2025-07-28T01:35:04Z,https://github.com/denverdino/k8s-for-docker-desktop,,,2689,False,False
32,UnattendedWinstall,memstechtips/UnattendedWinstall,memstechtips,Personalized Unattended Answer Files that helps automatically debloat and customize Windows 10 & 11 during the installation process.,PowerShell,5014,508,61,2024-06-13T10:15:05Z,2025-07-28T14:29:49Z,https://github.com/memstechtips/UnattendedWinstall,,MIT License,231,False,False
33,Easy-GPU-PV,jamesstringerparsec/Easy-GPU-PV,jamesstringerparsec,A Project dedicated to making GPU Partitioning on Windows easier!,PowerShell,4986,505,252,2021-06-22T22:22:21Z,2025-07-28T05:47:25Z,https://github.com/jamesstringerparsec/Easy-GPU-PV,,,144,False,False
34,usbrubberducky-payloads,hak5/usbrubberducky-payloads,hak5,The Official USB Rubber Ducky Payload Repository,PowerShell,4958,1516,51,2021-07-13T22:03:56Z,2025-07-28T13:17:05Z,https://github.com/hak5/usbrubberducky-payloads,https://usbrubberducky.com,,59042,False,False
35,Win10-Initial-Setup-Script,Disassembler0/Win10-Initial-Setup-Script,Disassembler0,PowerShell script for automation of routine tasks done after fresh installations of Windows 10 / Server 2016 / Server 2019,PowerShell,4692,1074,37,2016-01-16T18:25:27Z,2025-07-24T02:54:46Z,https://github.com/Disassembler0/Win10-Initial-Setup-Script,,MIT License,966,False,True
36,machinelearning-samples,dotnet/machinelearning-samples,dotnet,"Samples for ML.NET, an open source and cross-platform machine learning framework for .NET.",PowerShell,4634,2701,211,2018-05-25T18:43:54Z,2025-07-27T08:28:34Z,https://github.com/dotnet/machinelearning-samples,https://dot.net/ml,MIT License,2069455,False,False
37,RedTeaming-Tactics-and-Techniques,mantvydasb/RedTeaming-Tactics-and-Techniques,mantvydasb,Red Teaming Tactics and Techniques,PowerShell,4329,1093,19,2019-03-02T13:33:33Z,2025-07-28T02:06:58Z,https://github.com/mantvydasb/RedTeaming-Tactics-and-Techniques,http://ired.team,,360619,False,False
38,Invoke-Obfuscation,danielbohannon/Invoke-Obfuscation,danielbohannon,PowerShell Obfuscator,PowerShell,4038,796,13,2016-09-25T03:38:02Z,2025-07-27T21:47:59Z,https://github.com/danielbohannon/Invoke-Obfuscation,,Apache License 2.0,480,False,False
39,WinPwn,S3cur3Th1sSh1t/WinPwn,S3cur3Th1sSh1t,Automation for internal Windows Penetrationtest / AD-Security,PowerShell,3531,539,2,2018-03-07T12:51:25Z,2025-07-27T22:15:45Z,https://github.com/S3cur3Th1sSh1t/WinPwn,,"BSD 3-Clause ""New"" or ""Revised"" License",435724,False,False
40,win10script,ChrisTitusTech/win10script,ChrisTitusTech,This is the Ultimate Windows 10 Script from a creation from multiple debloat scripts and gists from github. ,PowerShell,3512,1043,121,2020-07-23T16:57:26Z,2025-07-28T17:31:35Z,https://github.com/ChrisTitusTech/win10script,,MIT License,384,False,True
41,svg-explorer-extension,tibold/svg-explorer-extension,tibold,"Extension module for Windows Explorer to render SVG thumbnails, so that you can have an overview of your SVG files",PowerShell,3450,198,50,2017-07-21T18:28:45Z,2025-07-28T14:06:36Z,https://github.com/tibold/svg-explorer-extension,,Other,2333,False,False
42,PrivescCheck,itm4n/PrivescCheck,itm4n,Privilege Escalation Enumeration Script for Windows,PowerShell,3389,483,0,2020-01-16T12:28:10Z,2025-07-28T17:41:59Z,https://github.com/itm4n/PrivescCheck,,"BSD 3-Clause ""New"" or ""Revised"" License",7434,False,False
43,OSCP,0xsyr0/OSCP,0xsyr0,OSCP Cheat Sheet,PowerShell,3338,704,0,2021-10-22T09:36:48Z,2025-07-28T08:15:39Z,https://github.com/0xsyr0/OSCP,,,5238,False,False
44,Pester,pester/Pester,pester,Pester is the ubiquitous test and mock framework for PowerShell.,PowerShell,3200,477,158,2011-01-02T03:33:19Z,2025-07-27T15:34:37Z,https://github.com/pester/Pester,https://pester.dev/,Other,21968,False,False
45,MailSniper,dafthack/MailSniper,dafthack,"MailSniper is a penetration testing tool for searching through email in a Microsoft Exchange environment for specific terms (passwords, insider intel, network architecture information, etc.). It can be used as a non-administrative user to search their own email, or by an administrator to search the mailboxes of every user in a domain.",PowerShell,3104,586,21,2016-09-08T00:36:51Z,2025-07-28T08:03:37Z,https://github.com/dafthack/MailSniper,,MIT License,3677,False,False
46,Thanos.sh,hotvulcan/Thanos.sh,hotvulcan,"if you are Thanos(root), this command could delete half your files randomly",PowerShell,2966,290,47,2018-08-20T02:35:07Z,2025-07-27T13:08:18Z,https://github.com/hotvulcan/Thanos.sh,,MIT License,27,False,False
47,sysmon-modular,olafhartong/sysmon-modular,olafhartong,A repository of sysmon configuration modules,PowerShell,2832,629,53,2018-01-13T21:20:59Z,2025-07-28T18:08:49Z,https://github.com/olafhartong/sysmon-modular,,MIT License,4910,False,False
48,chocolatey,chocolatey-archive/chocolatey,chocolatey-archive,"[DEPRECATED - https://github.com/chocolatey/choco] Chocolatey NuGet - Like apt-get, but for windows.",PowerShell,2801,338,164,2011-05-11T18:22:52Z,2025-05-28T20:04:08Z,https://github.com/chocolatey-archive/chocolatey,https://chocolatey.org,Apache License 2.0,22803,False,True
49,PowerShell,fleschutz/PowerShell,fleschutz,"500+ free PowerShell scripts (.ps1) for Linux, Mac OS, and Windows.",PowerShell,2796,492,1,2020-04-30T15:49:26Z,2025-07-28T09:11:12Z,https://github.com/fleschutz/PowerShell,,Creative Commons Zero v1.0 Universal,41085,False,False
50,bashbunny-payloads,hak5/bashbunny-payloads,hak5,The Official Bash Bunny Payload Repository,PowerShell,2794,1474,106,2017-01-04T19:27:33Z,2025-07-28T13:20:05Z,https://github.com/hak5/bashbunny-payloads,https://bashbunny.com,,69651,False,False
51,Penetration-Testing-Tools,mgeeky/Penetration-Testing-Tools,mgeeky,"A collection of more than 170+ tools, scripts, cheatsheets and other loots that I've developed over years for Red Teaming/Pentesting/IT Security audits purposes.",PowerShell,2750,533,4,2018-02-02T21:24:03Z,2025-07-28T12:13:31Z,https://github.com/mgeeky/Penetration-Testing-Tools,,MIT License,17555,False,False
52,PowerShell,lazywinadmin/PowerShell,lazywinadmin,"PowerShell functions and scripts (Azure, Active Directory, SCCM, SCSM, Exchange, O365, ...)",PowerShell,2743,731,19,2013-12-29T21:22:25Z,2025-07-28T16:02:15Z,https://github.com/lazywinadmin/PowerShell,http://lazywinadmin.com,MIT License,1372,False,False
53,Terminal-Icons,devblackops/Terminal-Icons,devblackops,A PowerShell module to show file and folder icons in the terminal,PowerShell,2708,120,62,2019-04-06T21:39:51Z,2025-07-27T13:02:30Z,https://github.com/devblackops/Terminal-Icons,,MIT License,982,False,False
54,PowerShell-Suite,FuzzySecurity/PowerShell-Suite,FuzzySecurity,My musings with PowerShell,PowerShell,2679,770,8,2015-12-11T13:14:41Z,2025-07-25T07:14:59Z,https://github.com/FuzzySecurity/PowerShell-Suite,,"BSD 3-Clause ""New"" or ""Revised"" License",6081,False,False
55,PowerUpSQL,NetSPI/PowerUpSQL,NetSPI,PowerUpSQL: A PowerShell Toolkit for Attacking SQL Server,PowerShell,2611,480,25,2016-06-22T01:22:39Z,2025-07-28T01:07:03Z,https://github.com/NetSPI/PowerUpSQL,,Other,21697,False,False
56,Active-Directory-Exploitation-Cheat-Sheet,Integration-IT/Active-Directory-Exploitation-Cheat-Sheet,Integration-IT,A cheat sheet that contains common enumeration and attack methods for Windows Active Directory.,PowerShell,2610,516,2,2020-05-28T21:19:37Z,2025-07-28T10:48:51Z,https://github.com/Integration-IT/Active-Directory-Exploitation-Cheat-Sheet,,MIT License,185445,False,False
57,dbatools,dataplat/dbatools,dataplat,"🚀 SQL Server automation and instance migrations have never been safer, faster or freer",PowerShell,2609,837,266,2015-02-02T23:50:31Z,2025-07-28T15:06:15Z,https://github.com/dataplat/dbatools,https://dbatools.io,MIT License,72210,False,False
58,ImportExcel,dfinke/ImportExcel,dfinke,"PowerShell module to import/export Excel spreadsheets, without Excel",PowerShell,2607,417,4,2015-03-27T18:01:13Z,2025-07-26T14:04:29Z,https://github.com/dfinke/ImportExcel,https://www.powershellgallery.com/packages/ImportExcel/,Apache License 2.0,77571,False,False
59,Fido,pbatard/Fido,pbatard,A PowerShell script to download Windows or UEFI Shell ISOs,PowerShell,2604,240,1,2019-01-11T23:28:48Z,2025-07-27T11:55:50Z,https://github.com/pbatard/Fido,,GNU General Public License v3.0,315,False,False
60,windows_hardening,0x6d69636b/windows_hardening,0x6d69636b,HardeningKitty and Windows Hardening Settings,PowerShell,2505,329,10,2017-10-23T05:29:04Z,2025-07-28T17:40:30Z,https://github.com/0x6d69636b/windows_hardening,,MIT License,2266,False,False
61,sRDI,monoxgas/sRDI,monoxgas,Shellcode implementation of Reflective DLL Injection. Convert DLLs to position independent shellcode,PowerShell,2333,477,15,2017-07-28T19:30:53Z,2025-07-26T21:39:21Z,https://github.com/monoxgas/sRDI,,Other,424,False,False
62,AzureAD-Attack-Defense,Cloud-Architekt/AzureAD-Attack-Defense,Cloud-Architekt,This publication is a collection of various common attack scenarios on Microsoft Entra ID (formerly known as Azure Active Directory) and how they can be mitigated or detected.,PowerShell,2329,341,8,2020-10-29T06:17:12Z,2025-07-27T09:25:10Z,https://github.com/Cloud-Architekt/AzureAD-Attack-Defense,,,44008,False,False
63,DeepBlueCLI,sans-blue-team/DeepBlueCLI,sans-blue-team,,PowerShell,2304,369,14,2016-09-20T16:06:06Z,2025-07-26T11:53:52Z,https://github.com/sans-blue-team/DeepBlueCLI,,GNU General Public License v3.0,5939,False,False
64,powercat,besimorhino/powercat,besimorhino,netshell features all in version 2 powershell,PowerShell,2269,487,12,2014-08-21T14:38:46Z,2025-07-26T17:49:53Z,https://github.com/besimorhino/powercat,,Apache License 2.0,59,False,False
65,ScubaGear,cisagov/ScubaGear,cisagov,Automation to assess the state of your M365 tenant against CISA's baselines,PowerShell,2235,301,194,2022-07-21T16:46:41Z,2025-07-28T17:29:26Z,https://github.com/cisagov/ScubaGear,https://www.cisa.gov/resources-tools/services/secure-cloud-business-applications-scuba-project,Creative Commons Zero v1.0 Universal,34070,False,False
66,PowerShell-Docs,MicrosoftDocs/PowerShell-Docs,MicrosoftDocs,The official PowerShell documentation sources,PowerShell,2219,1635,33,2015-10-16T21:28:16Z,2025-07-28T09:01:13Z,https://github.com/MicrosoftDocs/PowerShell-Docs,https://learn.microsoft.com/powershell,Other,98012,False,False
67,PowerRemoteDesktop,PhrozenIO/PowerRemoteDesktop,PhrozenIO,Remote Desktop entirely coded in PowerShell.,PowerShell,2217,255,10,2022-01-07T14:20:56Z,2025-07-26T15:32:42Z,https://github.com/PhrozenIO/PowerRemoteDesktop,https://www.phrozen.io,Apache License 2.0,24659,False,False
68,MicroBurst,NetSPI/MicroBurst,NetSPI,A collection of scripts for assessing Microsoft Azure security,PowerShell,2210,325,5,2018-07-16T16:47:20Z,2025-07-27T12:33:47Z,https://github.com/NetSPI/MicroBurst,,"BSD 3-Clause ""New"" or ""Revised"" License",528,False,False
69,Invoke-PSImage,peewpw/Invoke-PSImage,peewpw,Encodes a PowerShell script in the pixels of a PNG file and generates a oneliner to execute,PowerShell,2185,399,7,2017-12-17T18:41:44Z,2025-07-25T19:18:30Z,https://github.com/peewpw/Invoke-PSImage,,MIT License,645,False,False
70,BadBlood,davidprowe/BadBlood,davidprowe,"BadBlood by @davidprowe, Secframe.com, fills a Microsoft Active Directory Domain with a structure and thousands of objects. The output of the tool is a domain similar to a domain in the real world.  After BadBlood is ran on a domain, security analysts and engineers can practice using tools to gain an understanding and prescribe to securing Active Directory. Each time this tool runs, it produces different results.  The domain, users, groups, computers and permissions are different. Every. Single. Time.",PowerShell,2161,287,9,2020-01-16T16:08:54Z,2025-07-25T23:13:28Z,https://github.com/davidprowe/BadBlood,https://www.secframe.com/badblood,GNU General Public License v3.0,666,False,False
71,vulnerable-AD,safebuffer/vulnerable-AD,safebuffer,Create a vulnerable active directory that's allowing you to test most of the active directory attacks in a local lab ,PowerShell,2154,422,11,2020-06-19T09:30:18Z,2025-07-26T21:39:27Z,https://github.com/safebuffer/vulnerable-AD,,MIT License,31,False,False
72,PowerTools,PowerShellEmpire/PowerTools,PowerShellEmpire,PowerTools is a collection of PowerShell projects with a focus on offensive operations.,PowerShell,2127,823,7,2014-03-06T14:49:51Z,2025-07-27T04:37:35Z,https://github.com/PowerShellEmpire/PowerTools,,Other,23293,False,False
73,AutomatedLab,AutomatedLab/AutomatedLab,AutomatedLab,"AutomatedLab is a provisioning solution and framework that lets you deploy complex labs on HyperV and Azure with simple PowerShell scripts. It supports all Windows operating systems from 2008 R2 to 2022, some Linux distributions and various products like AD, Exchange, PKI, IIS, etc.",PowerShell,2114,380,28,2016-08-23T00:08:15Z,2025-07-27T07:26:53Z,https://github.com/AutomatedLab/AutomatedLab,,MIT License,39743,False,False
74,Fast-Kubernetes,omerbsezer/Fast-Kubernetes,omerbsezer,"This repo covers Kubernetes with LABs: Kubectl, Pod, Deployment, Service, PV, PVC, Rollout, Multicontainer, Daemonset, Taint-Toleration, Job, Ingress, Kubeadm, Helm, etc.",PowerShell,2020,602,0,2021-12-14T09:30:14Z,2025-07-27T18:42:01Z,https://github.com/omerbsezer/Fast-Kubernetes,,MIT License,573,False,False
75,UltimateAppLockerByPassList,api0cradle/UltimateAppLockerByPassList,api0cradle,The goal of this repository is to document the most common techniques to bypass AppLocker. ,PowerShell,2005,366,10,2017-07-11T20:36:42Z,2025-07-28T01:01:34Z,https://github.com/api0cradle/UltimateAppLockerByPassList,,,695,False,False
76,PersistenceSniper,last-byte/PersistenceSniper,last-byte,"Powershell module that can be used by Blue Teams, Incident Responders and System Administrators to hunt persistences implanted in Windows machines. Official Twitter/X account @PersistSniper. Made with ❤️ by @last0x00 and @dottor_morte",PowerShell,2003,204,8,2022-07-20T07:19:16Z,2025-07-24T18:34:36Z,https://github.com/last-byte/PersistenceSniper,,Other,2515,False,False
77,PoshC2,nettitude/PoshC2,nettitude,A proxy aware C2 framework used to aid red teamers with post-exploitation and lateral movement.,PowerShell,1987,346,25,2018-07-23T08:53:32Z,2025-07-26T17:17:21Z,https://github.com/nettitude/PoshC2,,"BSD 3-Clause ""New"" or ""Revised"" License",121069,False,False
78,Sherlock,rasta-mouse/Sherlock,rasta-mouse,PowerShell script to quickly find missing software patches for local privilege escalation vulnerabilities.,PowerShell,1953,423,3,2017-04-02T16:01:53Z,2025-07-24T05:16:59Z,https://github.com/rasta-mouse/Sherlock,,GNU General Public License v3.0,32,False,True
79,Extras,ScoopInstaller/Extras,ScoopInstaller,📦 The Extras bucket for Scoop.,PowerShell,1931,1488,792,2013-08-06T03:27:50Z,2025-07-28T16:30:27Z,https://github.com/ScoopInstaller/Extras,https://scoop.sh,The Unlicense,57890,False,False
80,DomainPasswordSpray,dafthack/DomainPasswordSpray,dafthack,DomainPasswordSpray is a tool written in PowerShell to perform a password spray attack against users of a domain. By default it will automatically generate the userlist from the domain. BE VERY CAREFUL NOT TO LOCKOUT ACCOUNTS!,PowerShell,1914,397,21,2016-10-04T23:37:37Z,2025-07-28T14:18:32Z,https://github.com/dafthack/DomainPasswordSpray,,MIT License,66,False,False
81,Windows-Super-God-Mode,ThioJoe/Windows-Super-God-Mode,ThioJoe,Creates shortcuts to virtually every special location or action built into Windows,PowerShell,1904,136,3,2024-08-14T17:51:35Z,2025-07-26T11:40:02Z,https://github.com/ThioJoe/Windows-Super-God-Mode,,GNU General Public License v3.0,385,False,False
82,Microsoft365DSC,microsoft/Microsoft365DSC,microsoft,"Manages, configures, extracts and monitors Microsoft 365 tenant configurations",PowerShell,1904,576,265,2018-11-21T16:54:50Z,2025-07-28T11:28:30Z,https://github.com/microsoft/Microsoft365DSC,https://aka.ms/M365DSC,MIT License,219320,False,False
83,windows-dev-box-setup-scripts,microsoft/windows-dev-box-setup-scripts,microsoft,Scripts to simplify setting up a Windows developer box,PowerShell,1860,401,31,2018-04-03T19:44:23Z,2025-07-26T17:44:41Z,https://github.com/microsoft/windows-dev-box-setup-scripts,,MIT License,96,False,False
84,Virtualization-Documentation,MicrosoftDocs/Virtualization-Documentation,MicrosoftDocs,"Place to store our documentation, code samples, etc for public consumption.",PowerShell,1860,1543,69,2015-07-27T17:17:39Z,2025-07-27T19:35:59Z,https://github.com/MicrosoftDocs/Virtualization-Documentation,http://docs.microsoft.com/virtualization/,Creative Commons Attribution 4.0 International,100859,False,False
85,bloatbox,builtbybel/bloatbox,builtbybel,☑️🌠 Remove Bloatwares from Windows 10,PowerShell,1853,113,23,2020-07-20T17:37:19Z,2025-07-28T04:07:33Z,https://github.com/builtbybel/bloatbox,https://www.builtbybel.com/apps/bloatbox,GNU General Public License v3.0,2908,False,False
