排名,项目名称,完整名称,作者,描述,语言,Stars,Forks,Issues,创建时间,更新时间,仓库链接,主页链接,许可证,大小(KB),是否Fork,是否已归档
86,mimikittenz,orlyjamie/mimikittenz,orlyjamie,A post-exploitation powershell tool for extracting juicy info from memory.,PowerShell,1851,334,9,2016-07-04T13:57:18Z,2025-07-24T16:59:44Z,https://github.com/orlyjamie/mimikittenz,,,11,False,False
87,Enterprise-Scale,Azure/Enterprise-Scale,Azure,"The Azure Landing Zones (Enterprise-Scale) architecture provides prescriptive guidance coupled with Azure best practices, and it follows design principles across the critical design areas for organizations to define their Azure architecture",PowerShell,1830,1022,110,2020-05-15T21:36:46Z,2025-07-27T16:03:16Z,https://github.com/Azure/Enterprise-Scale,https://aka.ms/alz,MIT License,119980,False,False
88,A1111-Web-UI-Installer,EmpireMediaScience/A1111-Web-UI-Installer,EmpireMediaScience,Complete installer for Automatic1111's infamous Stable Diffusion WebUI,PowerShell,1820,208,0,2022-10-14T17:06:54Z,2025-07-26T14:21:35Z,https://github.com/EmpireMediaScience/A1111-Web-UI-Installer,https://discord.gg/xU8y74HG4d,,9749,False,False
89,Microsoft-Defender-for-Cloud,Azure/Microsoft-Defender-for-Cloud,Azure,Welcome to the Microsoft Defender for Cloud community repository,PowerShell,1818,816,30,2019-05-02T21:43:36Z,2025-07-24T03:24:27Z,https://github.com/Azure/Microsoft-Defender-for-Cloud,https://azure.microsoft.com/en-us/services/security-center/,MIT License,180697,False,False
90,JAWS,411Hall/JAWS,411Hall,JAWS - Just Another Windows (Enum) Script,PowerShell,1811,316,5,2017-08-16T14:02:46Z,2025-07-28T16:17:23Z,https://github.com/411Hall/JAWS,,MIT License,42,False,False
91,PSKoans,vexx32/PSKoans,vexx32,"A simple, fun, and interactive way to learn the PowerShell language through Pester unit testing.",PowerShell,1786,178,52,2018-07-05T20:50:52Z,2025-07-26T00:08:34Z,https://github.com/vexx32/PSKoans,,GNU General Public License v3.0,3403,False,False
92,windowsterminal-shell,lextm/windowsterminal-shell,lextm,Install/uninstall scripts for Windows Terminal context menu items,PowerShell,1725,152,16,2020-05-05T22:51:22Z,2025-07-18T12:14:26Z,https://github.com/lextm/windowsterminal-shell,https://docs.lextudio.com/blog/the-challenges-to-enable-open-with-windows-terminal-8090b2d92d5a,MIT License,175,False,False
93,Main,ScoopInstaller/Main,ScoopInstaller,📦 The default bucket for Scoop.,PowerShell,1716,1063,157,2019-01-31T07:05:24Z,2025-07-28T16:30:59Z,https://github.com/ScoopInstaller/Main,https://scoop.sh,The Unlicense,39518,False,False
94,Security-Datasets,OTRF/Security-Datasets,OTRF,Re-play Security Events,PowerShell,1661,244,10,2018-05-31T19:48:47Z,2025-07-28T15:56:23Z,https://github.com/OTRF/Security-Datasets,,MIT License,829918,False,False
95,packer-windows,joefitzgerald/packer-windows,joefitzgerald,Windows Packer Templates,PowerShell,1641,1118,40,2013-07-29T15:21:35Z,2025-07-04T18:39:47Z,https://github.com/joefitzgerald/packer-windows,,MIT License,445,False,True
96,winfetch,lptstr/winfetch,lptstr,"🛠 A command-line system information utility written in PowerShell. Like Neofetch, but for Windows.",PowerShell,1632,90,25,2019-04-02T16:00:39Z,2025-07-27T20:57:15Z,https://github.com/lptstr/winfetch,,MIT License,1914,False,False
97,Invoke-TheHash,Kevin-Robertson/Invoke-TheHash,Kevin-Robertson,PowerShell Pass The Hash Utils,PowerShell,1621,308,5,2017-01-03T01:05:39Z,2025-07-23T17:25:52Z,https://github.com/Kevin-Robertson/Invoke-TheHash,,"BSD 3-Clause ""New"" or ""Revised"" License",102,False,False
98,Kansa,davehull/Kansa,davehull,A Powershell incident response framework,PowerShell,1605,273,46,2014-03-09T07:08:39Z,2025-07-26T21:39:16Z,https://github.com/davehull/Kansa,,Apache License 2.0,1139,False,False
99,PowerSharpPack,S3cur3Th1sSh1t/PowerSharpPack,S3cur3Th1sSh1t,,PowerShell,1604,311,1,2020-04-06T16:34:52Z,2025-07-27T22:09:35Z,https://github.com/S3cur3Th1sSh1t/PowerSharpPack,,,96496,False,False
100,Azure-Red-Team,rootsecdev/Azure-Red-Team,rootsecdev,Azure Security Resources and Notes,PowerShell,1581,212,1,2020-03-14T12:02:14Z,2025-07-27T07:54:18Z,https://github.com/rootsecdev/Azure-Red-Team,,,1052,False,False
