排名,项目名称,完整名称,作者,描述,语言,Stars,Forks,Issues,创建时间,更新时间,仓库链接,主页链接,许可证,大小(KB),是否Fork,是否已归档
86,Microsoft-Defender-for-Cloud,Azure/Microsoft-Defender-for-Cloud,Azure,Welcome to the Microsoft Defender for Cloud community repository,PowerShell,1879,843,38,2019-05-02T21:43:36Z,2026-02-22T13:55:16Z,https://github.com/Azure/Microsoft-Defender-for-Cloud,https://azure.microsoft.com/en-us/services/security-center/,MIT License,189123,False,False
87,windows-dev-box-setup-scripts,microsoft/windows-dev-box-setup-scripts,microsoft,Scripts to simplify setting up a Windows developer box,PowerShell,1872,394,31,2018-04-03T19:44:23Z,2026-02-22T10:11:04Z,https://github.com/microsoft/windows-dev-box-setup-scripts,,MIT License,96,False,False
88,bloatbox,builtbybel/bloatbox,builtbybel,☑️🌠 Remove Bloatwares from Windows 10,PowerShell,1871,110,23,2020-07-20T17:37:19Z,2026-02-22T19:18:50Z,https://github.com/builtbybel/bloatbox,https://www.builtbybel.com/apps/bloatbox,GNU General Public License v3.0,2908,False,False
89,mimikittenz,orlyjamie/mimikittenz,orlyjamie,A post-exploitation powershell tool for extracting juicy info from memory.,PowerShell,1864,331,9,2016-07-04T13:57:18Z,2026-02-17T05:09:19Z,https://github.com/orlyjamie/mimikittenz,,,11,False,False
90,IntuneManagement,Micke-K/IntuneManagement,Micke-K,"Copy, export, import, delete, document and compare policies and profiles in Intune and Azure with PowerShell script and WPF UI. Import ADMX files and registry settings with ADMX ingestion. View and edit PowerShell script.  ",PowerShell,1835,344,72,2019-06-10T02:11:53Z,2026-02-21T11:36:45Z,https://github.com/Micke-K/IntuneManagement,,MIT License,40090,False,False
91,PSKoans,vexx32/PSKoans,vexx32,"A simple, fun, and interactive way to learn the PowerShell language through Pester unit testing.",PowerShell,1829,179,52,2018-07-05T20:50:52Z,2026-02-18T06:26:55Z,https://github.com/vexx32/PSKoans,,GNU General Public License v3.0,3403,False,False
92,powershell-scripts,admindroid-community/powershell-scripts,admindroid-community,Office 365 Reporting PowerShell Scripts,PowerShell,1818,458,1,2019-04-12T10:19:36Z,2026-02-22T02:05:24Z,https://github.com/admindroid-community/powershell-scripts,,,805,False,False
93,A1111-Web-UI-Installer,EmpireMediaScience/A1111-Web-UI-Installer,EmpireMediaScience,Complete installer for Automatic1111's infamous Stable Diffusion WebUI,PowerShell,1814,203,0,2022-10-14T17:06:54Z,2026-02-22T16:51:00Z,https://github.com/EmpireMediaScience/A1111-Web-UI-Installer,https://discord.gg/xU8y74HG4d,,9749,False,False
94,Main,ScoopInstaller/Main,ScoopInstaller,📦 The default bucket for Scoop.,PowerShell,1802,1124,220,2019-01-31T07:05:24Z,2026-02-23T00:54:00Z,https://github.com/ScoopInstaller/Main,https://scoop.sh,The Unlicense,43785,False,False
95,badusb,FalsePhilosopher/badusb,FalsePhilosopher,Flipper Zero badusb payload library,PowerShell,1796,260,0,2022-07-31T23:54:35Z,2026-02-22T11:09:47Z,https://github.com/FalsePhilosopher/badusb,,Other,60774,False,False
96,skills,GuDaStudio/skills,GuDaStudio,"This repository contains a collection of Agent Skills developed by GudaStudio, enabling seamless collaboration between Claude and other AI models and tools.",PowerShell,1787,90,8,2025-12-16T14:54:52Z,2026-02-22T17:08:32Z,https://github.com/GuDaStudio/skills,https://code.guda.studio,MIT License,1895,False,False
97,Winget-AutoUpdate,Romanitho/Winget-AutoUpdate,Romanitho,WAU daily updates apps as system and notify connected users. (Allowlist and Blocklist support),PowerShell,1775,184,19,2022-01-16T17:01:18Z,2026-02-21T17:57:31Z,https://github.com/Romanitho/Winget-AutoUpdate,,MIT License,1575,False,False
98,windowsterminal-shell,lextm/windowsterminal-shell,lextm,Install/uninstall scripts for Windows Terminal context menu items,PowerShell,1759,154,16,2020-05-05T22:51:22Z,2026-02-21T20:54:11Z,https://github.com/lextm/windowsterminal-shell,https://docs.lextudio.com/blog/the-challenges-to-enable-open-with-windows-terminal-8090b2d92d5a,MIT License,175,False,False
99,winfetch,lptstr/winfetch,lptstr,"🛠 A command-line system information utility written in PowerShell. Like Neofetch, but for Windows.",PowerShell,1748,92,25,2019-04-02T16:00:39Z,2026-02-22T17:07:46Z,https://github.com/lptstr/winfetch,,MIT License,1914,False,False
100,playbook,meetrevision/playbook,meetrevision,"A lightweight, stable, and performance-focused customized version of Windows that enhances privacy and compatibility",PowerShell,1738,101,7,2023-03-31T15:23:24Z,2026-02-22T16:43:01Z,https://github.com/meetrevision/playbook,https://www.revi.cc,Creative Commons Attribution Share Alike 4.0 International,9643,False,False
