排名,项目名称,完整名称,作者,描述,语言,Stars,Forks,Issues,创建时间,更新时间,仓库链接,主页链接,许可证,大小(KB),是否Fork,是否已归档
1,FriendsDontLetFriends,cxli233/FriendsDontLetFriends,cxli233,Friends don't let friends make certain types of data visualization - What are they and why are they bad. ,R,7058,285,11,2022-05-24T18:26:12Z,2026-05-17T21:14:03Z,https://github.com/cxli233/FriendsDontLetFriends,,MIT License,10452,False,False
2,ggplot2,tidyverse/ggplot2,tidyverse,An implementation of the Grammar of Graphics in R,R,6932,2134,126,2008-05-25T01:21:32Z,2026-05-16T21:05:51Z,https://github.com/tidyverse/ggplot2,https://ggplot2.tidyverse.org,Other,1318792,False,False
3,awesome-R,qinwf/awesome-R,qinwf,"A curated list of awesome R packages, frameworks and software.",R,6461,1511,25,2014-07-19T06:02:47Z,2026-05-16T08:24:10Z,https://github.com/qinwf/awesome-R,,,1254,False,False
4,shiny,rstudio/shiny,rstudio,Easy interactive web applications with R,R,5650,1890,866,2012-06-20T18:45:11Z,2026-05-16T22:17:47Z,https://github.com/rstudio/shiny,https://shiny.posit.co/,Other,68588,False,False
5,r4ds,hadley/r4ds,hadley,R for data science: a book,R,5055,4416,22,2015-07-27T21:52:44Z,2026-05-17T07:58:03Z,https://github.com/hadley/r4ds,https://r4ds.hadley.nz/,Other,78479,False,False
6,dplyr,tidyverse/dplyr,tidyverse,dplyr: A grammar of data manipulation,R,5025,2131,86,2012-10-28T13:39:17Z,2026-05-14T16:51:21Z,https://github.com/tidyverse/dplyr,https://dplyr.tidyverse.org/,Other,77301,False,False
7,swirl_courses,swirldev/swirl_courses,swirldev,:mortar_board: A collection of interactive courses for the swirl R package.,R,4547,7216,208,2014-02-23T04:48:04Z,2026-05-17T06:55:10Z,https://github.com/swirldev/swirl_courses,http://swirlstats.com,Other,48394,False,False
8,stat_rethinking_2022,rmcelreath/stat_rethinking_2022,rmcelreath,Statistical Rethinking course winter 2022,R,4104,435,12,2021-10-08T12:24:05Z,2026-05-07T16:43:02Z,https://github.com/rmcelreath/stat_rethinking_2022,,,15803,False,False
9,awesome-network-analysis,briatte/awesome-network-analysis,briatte,A curated list of awesome network analysis resources.,R,4041,628,14,2016-04-10T20:31:19Z,2026-05-16T15:28:16Z,https://github.com/briatte/awesome-network-analysis,http://f.briatte.org/r/awesome-network-analysis-list,,1413,False,False
10,data.table,Rdatatable/data.table,Rdatatable,R's data.table package extends data.frame:,R,3891,1046,978,2014-06-07T16:38:05Z,2026-05-16T22:11:14Z,https://github.com/Rdatatable/data.table,http://r-datatable.com,Mozilla Public License 2.0,65918,False,False
11,ML_for_Hackers,johnmyleswhite/ML_for_Hackers,johnmyleswhite,"Code accompanying the book ""Machine Learning for Hackers""",R,3739,2186,36,2012-02-10T03:00:23Z,2026-05-12T15:30:33Z,https://github.com/johnmyleswhite/ML_for_Hackers,http://shop.oreilly.com/product/0636920018483.do,,121125,False,False
12,AnomalyDetection,twitter/AnomalyDetection,twitter,Anomaly Detection with R,R,3609,765,71,2014-12-09T17:46:24Z,2026-05-14T16:51:22Z,https://github.com/twitter/AnomalyDetection,,GNU General Public License v3.0,1377,False,True
13,rmarkdown,rstudio/rmarkdown,rstudio,Dynamic Documents for R,R,3037,992,266,2014-01-22T17:25:19Z,2026-05-14T16:51:21Z,https://github.com/rstudio/rmarkdown,https://rmarkdown.rstudio.com,Other,125433,False,False
14,seurat,satijalab/seurat,satijalab,R toolkit for single cell genomics,R,2729,986,206,2015-05-20T05:23:02Z,2026-05-17T23:34:19Z,https://github.com/satijalab/seurat,http://www.satijalab.org/seurat,Other,82593,False,False
15,plotly.R,plotly/plotly.R,plotly,An interactive graphing library for R,R,2666,642,755,2013-11-21T05:56:51Z,2026-05-15T12:57:30Z,https://github.com/plotly/plotly.R,https://plotly-r.com,Other,124949,False,False
16,patchwork,thomasp85/patchwork,thomasp85,The Composer of ggplots,R,2604,170,78,2017-11-28T20:55:08Z,2026-05-14T02:18:53Z,https://github.com/thomasp85/patchwork,https://patchwork.data-imaginist.com,Other,63142,False,False
17,devtools,r-lib/devtools,r-lib,Tools to make an R developer's life easier,R,2509,761,5,2010-05-03T04:08:49Z,2026-05-14T16:51:21Z,https://github.com/r-lib/devtools,https://devtools.r-lib.org,Other,14820,False,False
18,knitr,yihui/knitr,yihui,A general-purpose tool for dynamic report generation in R,R,2452,879,151,2011-10-17T20:09:04Z,2026-05-16T13:35:53Z,https://github.com/yihui/knitr,https://yihui.org/knitr/,,8360,False,False
19,rethinking,rmcelreath/rethinking,rmcelreath,Statistical Rethinking course and book package,R,2379,627,272,2013-03-07T20:18:09Z,2026-05-15T20:14:49Z,https://github.com/rmcelreath/rethinking,,,2895,False,False
20,stat_rethinking_2023,rmcelreath/stat_rethinking_2023,rmcelreath,Statistical Rethinking Course for Jan-Mar 2023,R,2378,268,13,2022-11-30T09:01:17Z,2026-05-14T18:38:10Z,https://github.com/rmcelreath/stat_rethinking_2023,,Creative Commons Zero v1.0 Universal,143783,False,False
21,ggstatsplot,IndrajeetPatil/ggstatsplot,IndrajeetPatil,Enhancing {ggplot2} plots with statistical analysis 📊📣,R,2183,204,0,2018-01-08T19:16:42Z,2026-05-18T00:52:22Z,https://github.com/IndrajeetPatil/ggstatsplot,https://www.indrapatil.com/ggstatsplot/,Other,2597360,False,False
22,rayshader,tylermorganwall/rayshader,tylermorganwall,R Package for 2D and 3D mapping and data visualization,R,2160,218,44,2018-05-13T13:51:00Z,2026-05-17T12:47:34Z,https://github.com/tylermorganwall/rayshader,https://www.rayshader.com/,,2317042,False,False
23,gt,rstudio/gt,rstudio,"Easily generate information-rich, publication-quality tables from R",R,2146,222,331,2018-03-20T15:18:51Z,2026-05-13T14:44:24Z,https://github.com/rstudio/gt,https://gt.rstudio.com,Other,314478,False,False
24,labs,genomicsclass/labs,genomicsclass,Rmd source files for the HarvardX series PH525x,R,2143,1951,22,2013-12-12T17:12:53Z,2026-05-17T23:38:06Z,https://github.com/genomicsclass/labs,http://genomicsclass.github.io/book,MIT License,8480,False,False
25,DataScienceR,ujjwalkarn/DataScienceR,ujjwalkarn,"a curated list of R tutorials for Data Science, NLP and Machine Learning ",R,2130,880,7,2014-10-08T07:29:44Z,2026-05-17T21:05:31Z,https://github.com/ujjwalkarn/DataScienceR,,MIT License,16514,False,False
26,wesanderson,karthik/wesanderson,karthik,A Wes Anderson color palette for R,R,2106,150,23,2014-03-18T06:55:09Z,2026-05-15T12:53:24Z,https://github.com/karthik/wesanderson,,Other,3414,False,False
27,nyc-taxi-data,toddwschneider/nyc-taxi-data,toddwschneider,"Import public NYC taxi and for-hire vehicle (Uber, Lyft) trip data into a PostgreSQL or ClickHouse database",R,2069,567,3,2015-11-16T02:58:16Z,2026-05-16T08:24:09Z,https://github.com/toddwschneider/nyc-taxi-data,,MIT License,49698,False,False
28,gganimate,thomasp85/gganimate,thomasp85,A Grammar of Animated Graphics,R,1982,314,86,2016-02-01T21:28:54Z,2026-05-15T12:29:04Z,https://github.com/thomasp85/gganimate,https://gganimate.com,Other,57396,False,False
29,benchm-ml,szilard/benchm-ml,szilard,"A minimal benchmark for scalability, speed and accuracy of commonly used open source implementations (R packages, Python scikit-learn, H2O, xgboost, Spark MLlib etc.) of the top machine learning algorithms for binary classification (random forests, gradient boosted trees, deep neural networks etc.).",R,1895,328,12,2015-03-28T00:34:18Z,2026-04-27T02:08:36Z,https://github.com/szilard/benchm-ml,,MIT License,1133,False,False
30,esquisse,dreamRs/esquisse,dreamRs,RStudio add-in to make plots interactively with ggplot2,R,1849,244,53,2017-10-27T10:21:09Z,2026-05-16T23:04:13Z,https://github.com/dreamRs/esquisse,https://dreamrs.github.io/esquisse,Other,16958,False,False
31,CausalImpact,google/CausalImpact,google,An R package for causal inference in time series,R,1830,263,31,2014-08-08T17:16:13Z,2026-05-16T17:25:03Z,https://github.com/google/CausalImpact,,Apache License 2.0,3323,False,False
32,tidyverse,tidyverse/tidyverse,tidyverse,Easily install and load packages from the tidyverse,R,1790,295,15,2016-09-06T13:29:39Z,2026-05-16T17:07:32Z,https://github.com/tidyverse/tidyverse,https://tidyverse.tidyverse.org,Other,3579,False,False
33,blogdown,rstudio/blogdown,rstudio,Create Blogs and Websites with R Markdown,R,1789,325,29,2016-11-02T18:57:35Z,2026-05-15T12:57:27Z,https://github.com/rstudio/blogdown,https://pkgs.rstudio.com/blogdown/,,3550,False,False
34,stat_rethinking_2024,rmcelreath/stat_rethinking_2024,rmcelreath,,R,1786,208,3,2023-11-26T14:41:43Z,2026-05-16T22:34:06Z,https://github.com/rmcelreath/stat_rethinking_2024,,Creative Commons Zero v1.0 Universal,149562,False,False
35,geocompr,geocompx/geocompr,geocompx,Geocomputation with R: an open source book,R,1763,614,11,2017-03-07T16:40:47Z,2026-05-15T19:12:38Z,https://github.com/geocompx/geocompr,https://r.geocompx.org/,Other,291311,False,False
36,reticulate,rstudio/reticulate,rstudio,R Interface to Python,R,1748,347,470,2017-02-06T18:59:46Z,2026-05-15T03:30:58Z,https://github.com/rstudio/reticulate,https://rstudio.github.io/reticulate,Apache License 2.0,27718,False,False
37,investing,zonination/investing,zonination,Investing Returns on the Market as a Whole,R,1747,111,0,2016-06-23T18:12:14Z,2026-04-21T14:19:51Z,https://github.com/zonination/investing,,MIT License,11832,False,False
38,DiagrammeR,rich-iannone/DiagrammeR,rich-iannone,Graph and network visualization using tabular data in R,R,1736,248,171,2014-12-28T08:01:15Z,2026-05-15T16:26:29Z,https://github.com/rich-iannone/DiagrammeR,https://rich-iannone.github.io/DiagrammeR/,Other,105160,False,False
39,r-color-palettes,EmilHvitfeldt/r-color-palettes,EmilHvitfeldt,Comprehensive list of color palettes available in R ❤️🧡💛💚💙💜,R,1694,145,19,2018-03-02T05:08:25Z,2026-05-14T19:41:23Z,https://github.com/EmilHvitfeldt/r-color-palettes,https://EmilHvitfeldt.github.io/r-color-palettes/,,1606465,False,False
40,mlr,mlr-org/mlr,mlr-org,Machine Learning in R ,R,1681,404,13,2013-08-29T16:26:13Z,2026-05-15T12:21:31Z,https://github.com/mlr-org/mlr,https://mlr.mlr-org.com,Other,633611,False,False
41,caret,topepo/caret,topepo,caret (Classification And Regression Training) R package that contains misc functions for training and plotting classification and regression models,R,1675,629,223,2014-05-16T15:50:16Z,2026-05-02T05:41:52Z,https://github.com/topepo/caret,http://topepo.github.io/caret/index.html,,396367,False,False
42,awesome-shiny-extensions,nanxstats/awesome-shiny-extensions,nanxstats,🐝 Awesome R and Python packages offering extended UI or server components for the web framework Shiny,R,1651,187,0,2018-12-03T21:01:34Z,2026-05-14T17:16:54Z,https://github.com/nanxstats/awesome-shiny-extensions,,Creative Commons Zero v1.0 Universal,469,False,False
43,bbplot,bbc/bbplot,bbc,R package that helps create and export ggplot2 charts in the style used by the BBC News data team,R,1629,271,15,2019-01-15T17:28:21Z,2026-05-08T16:40:41Z,https://github.com/bbc/bbplot,,,6956,False,False
44,stats337,hadley/stats337,hadley,Readings in applied data science,R,1614,223,7,2018-03-26T22:51:33Z,2026-04-24T03:26:58Z,https://github.com/hadley/stats337,,Creative Commons Attribution Share Alike 4.0 International,18634,False,False
45,rvest,tidyverse/rvest,tidyverse,Simple web scraping for R,R,1519,351,38,2014-07-23T21:22:27Z,2026-05-13T10:17:33Z,https://github.com/tidyverse/rvest,https://rvest.tidyverse.org,Other,13418,False,False
46,broom,tidymodels/broom,tidymodels,Convert statistical analysis objects from R into tidy format,R,1514,303,15,2014-09-11T19:17:04Z,2026-05-14T16:20:23Z,https://github.com/tidymodels/broom,https://broom.tidymodels.org,Other,92411,False,False
47,tofsims,fossasia/tofsims,fossasia,,R,1495,6,0,2016-11-24T22:48:01Z,2026-04-07T21:23:50Z,https://github.com/fossasia/tofsims,http://bioconductor.org/packages/devel/bioc/html/tofsims.html,,56026,False,False
48,ComplexHeatmap,jokergoo/ComplexHeatmap,jokergoo,Make Complex Heatmaps ,R,1494,246,232,2015-01-29T11:45:58Z,2026-05-17T17:23:10Z,https://github.com/jokergoo/ComplexHeatmap,https://jokergoo.github.io/ComplexHeatmap-reference/book/,Other,15978,False,False
49,janitor,sfirke/janitor,sfirke,simple tools for data cleaning in R,R,1446,132,40,2016-04-12T22:29:40Z,2026-05-04T20:21:52Z,https://github.com/sfirke/janitor,http://sfirke.github.io/janitor/,Other,8594,False,False
50,plumber,rstudio/plumber,rstudio,Turn your R code into a web API.,R,1436,257,125,2015-06-04T05:09:10Z,2026-05-15T12:29:06Z,https://github.com/rstudio/plumber,https://www.rplumber.io,Other,21971,False,False
51,sf,r-spatial/sf,r-spatial,Simple Features for R,R,1432,302,63,2015-11-06T21:49:34Z,2026-05-13T10:36:11Z,https://github.com/r-spatial/sf,https://r-spatial.github.io/sf/,Other,152343,False,False
52,tidyr,tidyverse/tidyr,tidyverse,Tidy Messy Data,R,1429,419,59,2014-06-10T14:24:33Z,2026-05-13T16:43:37Z,https://github.com/tidyverse/tidyr,https://tidyr.tidyverse.org/,Other,21784,False,False
53,rnaseq_tutorial,griffithlab/rnaseq_tutorial,griffithlab,"Informatics for RNA-seq: A web resource for analysis on the cloud. Educational tutorials and working pipelines for RNA-seq analysis including an introduction to: cloud computing, critical file formats, reference genomes, gene annotation, expression, differential expression, alternative splicing, data visualization, and interpretation.",R,1422,616,6,2014-07-31T18:58:09Z,2026-05-07T11:18:16Z,https://github.com/griffithlab/rnaseq_tutorial,,Other,459472,False,False
54,brms,paul-buerkner/brms,paul-buerkner,brms R package for Bayesian generalized multivariate non-linear multilevel models using Stan,R,1403,221,146,2015-06-17T16:29:31Z,2026-05-15T14:40:19Z,https://github.com/paul-buerkner/brms,https://paulbuerkner.com/brms/,GNU General Public License v2.0,273359,False,False
55,purrr,tidyverse/purrr,tidyverse,A functional programming toolkit for R,R,1391,293,36,2014-11-29T17:33:40Z,2026-05-17T20:26:01Z,https://github.com/tidyverse/purrr,https://purrr.tidyverse.org/,Other,11454,False,False
56,mastering-shiny,hadley/mastering-shiny,hadley,Mastering Shiny: a book,R,1378,568,79,2016-07-09T07:45:54Z,2026-05-16T22:18:06Z,https://github.com/hadley/mastering-shiny,https://mastering-shiny.org/,Other,54841,False,False
57,ggthemes,jrnold/ggthemes,jrnold,"Additional themes, scales, and geoms for ggplot2",R,1355,228,15,2012-09-07T00:00:07Z,2026-05-03T14:55:56Z,https://github.com/jrnold/ggthemes,http://jrnold.github.io/ggthemes/,,64931,False,False
58,hrbrthemes,hrbrmstr/hrbrthemes,hrbrmstr,":lock_with_ink_pen: Opinionated, typographic-centric ggplot2 themes and theme components",R,1344,98,35,2017-02-11T17:03:01Z,2026-05-17T22:01:45Z,https://github.com/hrbrmstr/hrbrthemes,,Other,19025,False,False
59,drake,ropensci/drake,ropensci,An R-focused pipeline toolkit for reproducibility and high-performance computing,R,1342,130,0,2017-02-20T22:28:40Z,2026-04-18T14:36:32Z,https://github.com/ropensci/drake,https://docs.ropensci.org/drake,GNU General Public License v3.0,96884,False,False
60,tensorflow,rstudio/tensorflow,rstudio,TensorFlow for R,R,1341,318,41,2016-08-22T15:46:39Z,2026-05-08T16:34:30Z,https://github.com/rstudio/tensorflow,https://tensorflow.rstudio.com,Apache License 2.0,9163,False,False
61,lintr,r-lib/lintr,r-lib,Static Code Analysis for R,R,1275,197,317,2014-09-28T02:48:15Z,2026-05-15T12:56:09Z,https://github.com/r-lib/lintr,https://lintr.r-lib.org,Other,32678,False,False
62,vitae,mitchelloharawild/vitae,mitchelloharawild,R Markdown Résumés and CVs,R,1268,245,49,2018-11-21T23:10:25Z,2026-05-17T00:08:50Z,https://github.com/mitchelloharawild/vitae,https://pkg.mitchelloharawild.com/vitae/,,5115,False,False
63,ggrepel,slowkow/ggrepel,slowkow,:round_pushpin: Repel overlapping text labels away from each other in your ggplot2 figures.,R,1257,95,26,2016-01-03T22:10:58Z,2026-05-13T23:53:48Z,https://github.com/slowkow/ggrepel,https://ggrepel.slowkow.com,GNU General Public License v3.0,46186,False,False
64,MetBrewer,BlakeRMills/MetBrewer,BlakeRMills,Color palette package in R inspired by works at the Metropolitan Museum of Art in New York,R,1256,87,11,2021-12-11T15:00:54Z,2026-05-10T10:10:52Z,https://github.com/BlakeRMills/MetBrewer,,Creative Commons Zero v1.0 Universal,158686,False,False
65,ggpubr,kassambara/ggpubr,kassambara,'ggplot2' Based Publication Ready Plots,R,1242,181,231,2016-07-19T19:35:48Z,2026-05-10T15:29:46Z,https://github.com/kassambara/ggpubr,https://rpkgs.datanovia.com/ggpubr/,,118105,False,False
66,r-source,wch/r-source,wch,"Read-only mirror of R source code from https://svn.r-project.org/R/, updated hourly. See the build instructions on the wiki page.",R,1229,328,3,2012-09-08T15:00:15Z,2026-05-17T13:14:43Z,https://github.com/wch/r-source,https://github.com/wch/r-source/wiki/,GNU General Public License v2.0,458417,False,False
67,statistics-for-data-scientists,andrewgbruce/statistics-for-data-scientists,andrewgbruce,"Code and data associated with the book ""Statistics for Data Scientists: 50 Essential Concepts""",R,1222,664,13,2017-04-30T15:47:59Z,2026-05-17T09:43:47Z,https://github.com/andrewgbruce/statistics-for-data-scientists,,,53,False,False
68,advanced-shiny,daattali/advanced-shiny,daattali,🤹 Shiny tips & tricks for improving your apps and solving common problems,R,1218,380,1,2015-07-22T08:18:11Z,2026-04-16T18:33:36Z,https://github.com/daattali/advanced-shiny,https://deanattali.com/blog/advanced-shiny-tips/,,590,False,False
69,swirl,swirldev/swirl,swirldev,":cyclone: Learn R, in R.",R,1211,597,324,2013-10-12T15:15:54Z,2026-05-14T16:51:21Z,https://github.com/swirldev/swirl,http://swirlstats.com,Other,1556,False,False
70,clusterProfiler,YuLab-SMU/clusterProfiler,YuLab-SMU,:bar_chart: A universal enrichment tool for interpreting omics data,R,1204,268,369,2014-05-31T16:34:32Z,2026-05-09T10:50:49Z,https://github.com/YuLab-SMU/clusterProfiler,https://yulab-smu.top/biomedical-knowledge-mining-book/,,23335,False,False
71,tidytext,juliasilge/tidytext,juliasilge,Text mining using tidy tools :sparkles::page_facing_up::sparkles:,R,1203,182,8,2016-03-31T18:51:39Z,2026-05-10T18:08:20Z,https://github.com/juliasilge/tidytext,https://juliasilge.github.io/tidytext/,Other,136235,False,False
72,gtsummary,ddsjoberg/gtsummary,ddsjoberg,Presentation-Ready Data Summary and Analytic Result Tables,R,1188,145,47,2019-02-27T02:44:33Z,2026-05-15T05:06:27Z,https://github.com/ddsjoberg/gtsummary,http://www.danieldsjoberg.com/gtsummary,Other,756872,False,False
73,forecast,robjhyndman/forecast,robjhyndman,Forecasting Functions for Time Series and Linear Models,R,1168,339,8,2012-04-22T23:19:09Z,2026-05-12T23:00:48Z,https://github.com/robjhyndman/forecast,http://pkg.robjhyndman.com/forecast,,241836,False,False
74,easystats,easystats/easystats,easystats,:milky_way: The R easystats-project,R,1153,87,41,2019-01-28T10:39:29Z,2026-05-09T13:31:50Z,https://github.com/easystats/easystats,https://easystats.github.io/easystats/,Other,614146,False,False
75,renv,rstudio/renv,rstudio,renv: Project environments for R.,R,1148,165,221,2018-11-28T20:25:39Z,2026-05-17T08:47:09Z,https://github.com/rstudio/renv,https://rstudio.github.io/renv/,MIT License,26990,False,False
76,fasteR,matloff/fasteR,matloff,Fast Lane to Learning R!,R,1146,187,15,2019-04-28T19:02:30Z,2026-05-16T21:01:08Z,https://github.com/matloff/fasteR,,,71373,False,False
77,performance,easystats/performance,easystats,":muscle: Models' quality and performance metrics (R2, ICC, LOO, AIC, BF, ...)",R,1140,106,109,2019-02-10T09:01:04Z,2026-05-14T19:14:06Z,https://github.com/easystats/performance,https://easystats.github.io/performance/,GNU General Public License v3.0,775428,False,False
78,R,TheAlgorithms/R,TheAlgorithms,Collection of various algorithms implemented in R.,R,1140,350,0,2018-09-23T16:10:03Z,2026-05-17T17:44:30Z,https://github.com/TheAlgorithms/R,,MIT License,1516,False,False
79,tinytex,rstudio/tinytex,rstudio,"A lightweight, cross-platform, portable, and easy-to-maintain LaTeX distribution based on TeX Live",R,1121,125,27,2017-11-16T21:24:02Z,2026-05-16T01:09:18Z,https://github.com/rstudio/tinytex,https://yihui.org/tinytex/,Other,818,False,False
80,ggraph,thomasp85/ggraph,thomasp85,Grammar of Graph Graphics,R,1115,114,56,2016-01-13T12:52:59Z,2026-05-14T21:43:49Z,https://github.com/thomasp85/ggraph,https://ggraph.data-imaginist.com,Other,477965,False,False
81,rstan,stan-dev/rstan,stan-dev,"RStan, the R interface to Stan",R,1078,271,356,2013-05-22T20:38:16Z,2026-05-15T16:06:50Z,https://github.com/stan-dev/rstan,https://mc-stan.org,,233856,False,False
82,targets,ropensci/targets,ropensci,Function-oriented Make-like declarative workflows for R,R,1077,83,0,2019-08-01T17:33:25Z,2026-05-16T19:20:39Z,https://github.com/ropensci/targets,https://docs.ropensci.org/targets/,Other,7549,False,False
83,mlr3,mlr-org/mlr3,mlr-org,mlr3: Machine Learning in R - next generation,R,1067,97,27,2018-08-26T17:18:47Z,2026-05-15T07:59:47Z,https://github.com/mlr-org/mlr3,https://mlr3.mlr-org.com,GNU Lesser General Public License v3.0,46822,False,False
84,paletteer,EmilHvitfeldt/paletteer,EmilHvitfeldt,🎨🎨🎨 Collection of most color palettes in a single R package,R,1037,53,4,2018-06-23T07:19:00Z,2026-05-14T21:04:09Z,https://github.com/EmilHvitfeldt/paletteer,https://emilhvitfeldt.github.io/paletteer/,Other,22538,False,False
85,pointblank,rstudio/pointblank,rstudio,Data quality assessment and metadata reporting for data frames and database tables,R,1033,59,121,2017-02-24T00:22:29Z,2026-05-07T19:15:08Z,https://github.com/rstudio/pointblank,https://rstudio.github.io/pointblank/,Other,111948,False,False
86,readr,tidyverse/readr,tidyverse,"Read flat files (csv, tsv, fwf) into R",R,1032,290,97,2013-07-25T15:28:22Z,2026-05-11T07:57:03Z,https://github.com/tidyverse/readr,https://readr.tidyverse.org,Other,13216,False,False
87,circlize,jokergoo/circlize,jokergoo,Circular visualization in R ,R,1014,150,67,2013-04-18T18:56:04Z,2026-05-17T17:29:44Z,https://github.com/jokergoo/circlize,http://jokergoo.github.io/circlize_book/book/,Other,115057,False,False
88,future,futureverse/future,futureverse,:rocket: R package: future: Unified Parallel and Distributed Processing in R for Everyone,R,1012,92,76,2015-06-08T02:37:06Z,2026-05-17T16:42:34Z,https://github.com/futureverse/future,https://future.futureverse.org,,20024,False,False
89,palmerpenguins,allisonhorst/palmerpenguins,allisonhorst,A great intro dataset for data exploration & visualization (alternative to iris).,R,1006,252,18,2020-06-05T14:57:15Z,2026-05-15T12:34:23Z,https://github.com/allisonhorst/palmerpenguins,https://allisonhorst.github.io/palmerpenguins/,Creative Commons Zero v1.0 Universal,45391,False,False
90,gptstudio,MichelNivard/gptstudio,MichelNivard,"GPT RStudio addins that enable GPT assisted coding, writing & analysis",R,988,120,10,2022-12-24T19:35:02Z,2026-05-15T21:17:38Z,https://github.com/MichelNivard/gptstudio,https://michelnivard.github.io/gptstudio/,Other,59743,False,False
91,httr,r-lib/httr,r-lib,httr: a friendly http package for R,R,982,1962,11,2011-11-11T15:05:00Z,2026-05-08T22:09:25Z,https://github.com/r-lib/httr,https://httr.r-lib.org,Other,9346,False,False
92,magrittr,tidyverse/magrittr,tidyverse,Improve the readability of R code with the pipe,R,970,161,27,2014-01-01T13:30:01Z,2026-05-10T18:09:20Z,https://github.com/tidyverse/magrittr,https://magrittr.tidyverse.org,Other,7376,False,False
93,sparklyr,sparklyr/sparklyr,sparklyr,R interface for Apache Spark,R,969,308,350,2016-05-20T15:28:53Z,2026-05-13T22:13:46Z,https://github.com/sparklyr/sparklyr,https://spark.posit.co/,Apache License 2.0,102549,False,False
94,MoRad,hyu020/MoRad,hyu020,,R,965,69,0,2021-09-30T12:06:22Z,2026-05-16T18:57:56Z,https://github.com/hyu020/MoRad,,,607,False,False
95,box,klmr/box,klmr,"Write reusable, composable and modular R code",R,963,49,70,2013-05-22T16:03:42Z,2026-05-17T05:50:13Z,https://github.com/klmr/box,https://klmr.me/box/,MIT License,6716,False,False
96,generativeart,cutterkom/generativeart,cutterkom,Create Generative Art with R,R,957,163,5,2018-11-15T14:39:20Z,2026-05-14T16:56:26Z,https://github.com/cutterkom/generativeart,,GNU General Public License v3.0,10419,False,False
97,ggforce,thomasp85/ggforce,thomasp85,Accelerating ggplot2,R,950,110,75,2016-01-02T16:16:58Z,2026-05-15T12:53:20Z,https://github.com/thomasp85/ggforce,https://ggforce.data-imaginist.com,Other,264907,False,False
98,see,easystats/see,easystats,:art: Visualisation toolbox for beautiful and publication-ready figures,R,946,46,35,2019-04-09T03:28:04Z,2026-05-17T19:28:54Z,https://github.com/easystats/see,https://easystats.github.io/see/,Other,3166973,False,False
99,r-pkgs,hadley/r-pkgs,hadley,Building R packages,R,944,642,44,2014-08-07T16:19:04Z,2026-05-14T16:51:22Z,https://github.com/hadley/r-pkgs,https://r-pkgs.org,Other,49023,False,False
100,golem,ThinkR-open/golem,ThinkR-open,A Framework for Building Robust Shiny Apps ,R,938,137,39,2018-05-08T20:56:04Z,2026-04-30T04:58:43Z,https://github.com/ThinkR-open/golem,https://thinkr-open.github.io/golem/,Other,6547,False,False
