排名,项目名称,完整名称,作者,描述,语言,Stars,Forks,Issues,创建时间,更新时间,仓库链接,主页链接,许可证,大小(KB),是否Fork,是否已归档
88,payload,payloadcms/payload,payloadcms,"Payload is the open-source, fullstack Next.js framework, giving you instant backend superpowers. Get a full TypeScript backend and admin panel instantly. Use Payload as a headless CMS or for building powerful applications.",TypeScript,38518,3055,766,2021-01-05T18:49:45Z,2025-11-03T01:38:08Z,https://github.com/payloadcms/payload,https://payloadcms.com,MIT License,160334,False,False
89,appsmith,appsmithorg/appsmith,appsmithorg,"Platform to build admin panels, internal tools, and dashboards. Integrates with 25+ databases and any API.",TypeScript,38346,4321,4413,2020-06-30T04:07:36Z,2025-11-03T00:48:40Z,https://github.com/appsmithorg/appsmith,https://www.appsmith.com,Apache License 2.0,794050,False,False
90,novu,novuhq/novu,novuhq,"The open-source notification Inbox infrastructure. E-mail, SMS, Push and Slack Integrations.",TypeScript,38132,4158,155,2021-08-26T15:22:44Z,2025-11-03T00:41:13Z,https://github.com/novuhq/novu,https://novu.co,Other,252853,False,False
91,ant-design-pro,ant-design/ant-design-pro,ant-design,👨🏻‍💻👩🏻‍💻 Use Ant Design like a Pro!,TypeScript,37612,8219,158,2017-08-25T10:40:44Z,2025-11-03T01:45:00Z,https://github.com/ant-design/ant-design-pro,https://pro.ant.design,MIT License,35378,False,False
92,insomnia,Kong/insomnia,Kong,"The open-source, cross-platform API client for GraphQL, REST, WebSockets, SSE and gRPC. With Cloud, Local and Git storage.",TypeScript,37458,2163,788,2016-04-23T03:54:26Z,2025-11-03T01:18:41Z,https://github.com/Kong/insomnia,https://insomnia.rest,Apache License 2.0,138708,False,False
93,chatbox,chatboxai/chatbox,chatboxai,"User-friendly Desktop Client App for AI Models/LLMs (GPT, Claude, Gemini, Ollama...)",TypeScript,37252,3768,952,2023-03-06T12:22:15Z,2025-11-03T01:54:37Z,https://github.com/chatboxai/chatbox,https://chatboxai.app?utm_medium=github,GNU General Public License v3.0,32649,False,False
94,taro,NervJS/taro,NervJS,开放式跨端跨框架解决方案，支持使用 React/Vue 等框架来开发微信/京东/百度/支付宝/字节跳动/ QQ 小程序/H5/React Native 等应用。  https://taro.zone/,TypeScript,37047,4872,1654,2018-04-08T09:32:26Z,2025-11-03T01:18:31Z,https://github.com/NervJS/taro,https://docs.taro.zone/,Other,1589969,False,False
95,ink-kit,inkonchain/ink-kit,inkonchain,React component library for onchain applications - See README for modern alternatives,TypeScript,36828,424,3,2024-11-04T16:32:17Z,2025-11-02T21:20:09Z,https://github.com/inkonchain/ink-kit,https://ink-kit.inkonchain.com,MIT License,1109,False,True
96,twenty,twentyhq/twenty,twentyhq,"Building a modern alternative to Salesforce, powered by the community.",TypeScript,36586,4479,257,2022-12-01T13:04:40Z,2025-11-03T01:57:43Z,https://github.com/twentyhq/twenty,https://twenty.com,Other,498225,False,False
97,date-fns,date-fns/date-fns,date-fns,⏳ Modern JavaScript date utility library ⌛️,TypeScript,36252,1862,857,2014-10-06T10:24:22Z,2025-11-02T21:14:20Z,https://github.com/date-fns/date-fns,https://date-fns.org,MIT License,24034,False,False
98,lerna,lerna/lerna,lerna,"Lerna is a fast, modern build system for managing and publishing multiple JavaScript/TypeScript packages from the same repository.",TypeScript,36038,2279,378,2015-12-04T09:36:55Z,2025-11-01T19:38:35Z,https://github.com/lerna/lerna,https://lerna.js.org,MIT License,39161,False,False
99,typeorm,typeorm/typeorm,typeorm,"ORM for TypeScript and JavaScript. Supports MySQL, PostgreSQL, MariaDB, SQLite, MS SQL Server, Oracle, SAP Hana, WebSQL databases. Works in NodeJS, Browser, Ionic, Cordova and Electron platforms.",TypeScript,35959,6449,520,2016-02-29T07:41:14Z,2025-11-03T01:14:41Z,https://github.com/typeorm/typeorm,http://typeorm.io,MIT License,31485,False,False
100,outline,outline/outline,outline,"The fastest knowledge base for growing teams. Beautiful, realtime collaborative, feature packed, and markdown compatible.",TypeScript,35698,2932,91,2016-05-22T21:31:47Z,2025-11-03T01:43:00Z,https://github.com/outline/outline,https://www.getoutline.com,Other,301066,False,False
