排名,项目名称,完整名称,作者,描述,语言,Stars,Forks,Issues,创建时间,更新时间,仓库链接,主页链接,许可证,大小(KB),是否Fork,是否已归档
1,freeCodeCamp,freeCodeCamp/freeCodeCamp,freeCodeCamp,"freeCodeCamp.org's open-source codebase and curriculum. Learn math, programming, and computer science for free.",TypeScript,425484,41140,306,2014-12-24T17:49:19Z,2025-08-11T02:08:25Z,https://github.com/freeCodeCamp/freeCodeCamp,https://contribute.freecodecamp.org,"BSD 3-Clause ""New"" or ""Revised"" License",510128,False,False
2,developer-roadmap,kamranahmedse/developer-roadmap,kamranahmedse,"Interactive roadmaps, guides and other educational content to help developers grow in their careers.",TypeScript,333491,42544,255,2017-03-15T13:45:52Z,2025-08-11T02:10:07Z,https://github.com/kamranahmedse/developer-roadmap,https://roadmap.sh,Other,306750,False,False
3,vue,vuejs/vue,vuejs,"This is the repo for Vue 2. For Vue 3, go to https://github.com/vuejs/core",TypeScript,209254,33736,601,2013-07-29T03:24:51Z,2025-08-10T20:44:46Z,https://github.com/vuejs/vue,http://v2.vuejs.org,MIT License,32152,False,False
4,vscode,microsoft/vscode,microsoft,Visual Studio Code,TypeScript,175602,34282,12606,2015-09-03T20:23:38Z,2025-08-11T02:08:15Z,https://github.com/microsoft/vscode,https://code.visualstudio.com,MIT License,1051047,False,False
5,n8n,n8n-io/n8n,n8n-io,"Fair-code workflow automation platform with native AI capabilities. Combine visual building with custom code, self-host or cloud, 400+ integrations.",TypeScript,128475,39627,999,2019-06-22T09:24:21Z,2025-08-11T02:08:43Z,https://github.com/n8n-io/n8n,https://n8n.io,Other,242128,False,False
6,tech-interview-handbook,yangshun/tech-interview-handbook,yangshun,💯 Curated coding interview preparation materials for busy software engineers,TypeScript,128421,15630,54,2016-07-05T05:00:48Z,2025-08-10T23:19:16Z,https://github.com/yangshun/tech-interview-handbook,https://www.techinterviewhandbook.org,MIT License,32795,False,False
7,dify,langgenius/dify,langgenius,Production-ready platform for agentic workflow development.,TypeScript,110372,16853,777,2023-04-12T07:40:24Z,2025-08-11T02:05:05Z,https://github.com/langgenius/dify,https://dify.ai,Other,109283,False,False
8,TypeScript,microsoft/TypeScript,microsoft,TypeScript is a superset of JavaScript that compiles to clean JavaScript output.,TypeScript,105568,12957,6048,2014-06-17T15:28:39Z,2025-08-11T01:28:07Z,https://github.com/microsoft/TypeScript,https://www.typescriptlang.org,Apache License 2.0,2952157,False,False
9,excalidraw,excalidraw/excalidraw,excalidraw,Virtual whiteboard for sketching hand-drawn like diagrams,TypeScript,105156,10517,2289,2020-01-02T01:04:43Z,2025-08-11T02:02:11Z,https://github.com/excalidraw/excalidraw,https://excalidraw.com,MIT License,93508,False,False
10,angular,angular/angular,angular,Deliver web apps with confidence 🚀,TypeScript,98454,26494,1570,2014-09-18T16:12:01Z,2025-08-11T02:11:41Z,https://github.com/angular/angular,https://angular.dev,MIT License,561455,False,False
11,material-ui,mui/material-ui,mui,Material UI: Comprehensive React component library that implements Google's Material Design. Free forever.,TypeScript,96337,32618,1764,2014-08-18T19:11:54Z,2025-08-11T02:08:24Z,https://github.com/mui/material-ui,https://mui.com/material-ui/,MIT License,692657,False,False
12,iptv,iptv-org/iptv,iptv-org,Collection of publicly available IPTV channels from all over the world,TypeScript,96076,3841,429,2018-11-14T22:00:57Z,2025-08-11T02:11:58Z,https://github.com/iptv-org/iptv,https://iptv-org.github.io,The Unlicense,974031,False,False
13,ant-design,ant-design/ant-design,ant-design,An enterprise-class UI design language and React UI library,TypeScript,95602,53221,1277,2015-04-24T15:37:24Z,2025-08-11T01:19:00Z,https://github.com/ant-design/ant-design,https://ant.design,MIT License,232599,False,False
14,ui,shadcn-ui/ui,shadcn-ui,"A set of beautifully-designed, accessible components and a code distribution platform. Works with your favorite frameworks. Open Source. Open Code.",TypeScript,92679,6476,1689,2023-01-04T12:43:27Z,2025-08-11T01:58:27Z,https://github.com/shadcn-ui/ui,https://ui.shadcn.com,MIT License,35424,False,False
15,puppeteer,puppeteer/puppeteer,puppeteer,JavaScript API for Chrome and Firefox,TypeScript,91688,9259,276,2017-05-09T22:16:13Z,2025-08-10T22:59:38Z,https://github.com/puppeteer/puppeteer,https://pptr.dev,Apache License 2.0,1144711,False,False
16,tailwindcss,tailwindlabs/tailwindcss,tailwindlabs,A utility-first CSS framework for rapid UI development.,TypeScript,89516,4668,100,2017-10-06T14:59:14Z,2025-08-11T01:56:18Z,https://github.com/tailwindlabs/tailwindcss,https://tailwindcss.com/,MIT License,111691,False,False
17,storybook,storybookjs/storybook,storybookjs,"Storybook is the industry standard workshop for building, documenting, and testing UI components in isolation",TypeScript,87480,9645,2173,2016-03-18T04:23:44Z,2025-08-11T00:19:41Z,https://github.com/storybookjs/storybook,https://storybook.js.org,MIT License,1040269,False,False
18,supabase,supabase/supabase,supabase,"The Postgres development platform. Supabase gives you a dedicated Postgres database to build your web, mobile, and AI applications.",TypeScript,86839,9458,707,2019-10-12T05:56:49Z,2025-08-11T02:12:13Z,https://github.com/supabase/supabase,https://supabase.com,Apache License 2.0,1747992,False,False
19,NextChat,ChatGPTNextWeb/NextChat,ChatGPTNextWeb,✨ Light and Fast AI Assistant. Support: Web | iOS | MacOS | Android |  Linux | Windows,TypeScript,85382,61081,757,2023-03-10T18:27:54Z,2025-08-11T01:50:50Z,https://github.com/ChatGPTNextWeb/NextChat,https://nextchat.club/download,MIT License,20624,False,False
20,realworld,gothinkster/realworld,gothinkster,"""The mother of all demo apps"" — Exemplary fullstack Medium.com clone powered by React, Angular, Node, Django, and many more",TypeScript,82181,7501,48,2016-02-26T20:49:53Z,2025-08-10T22:49:18Z,https://github.com/gothinkster/realworld,https://docs.realworld.show,MIT License,35093,False,False
21,mermaid,mermaid-js/mermaid,mermaid-js,Generation of diagrams like flowcharts or sequence diagrams from text in a similar manner as markdown,TypeScript,81990,7884,1416,2014-11-01T23:52:32Z,2025-08-11T01:59:00Z,https://github.com/mermaid-js/mermaid,https://mermaid.js.org,MIT License,253026,False,False
22,playwright,microsoft/playwright,microsoft,"Playwright is a framework for Web Testing and Automation. It allows testing Chromium, Firefox and WebKit with a single API. ",TypeScript,75813,4440,835,2019-11-15T18:32:42Z,2025-08-11T02:03:58Z,https://github.com/microsoft/playwright,https://playwright.dev,Apache License 2.0,184078,False,False
23,vite,vitejs/vite,vitejs,Next generation frontend tooling. It's fast!,TypeScript,74644,7040,619,2020-04-21T05:03:57Z,2025-08-11T02:11:25Z,https://github.com/vitejs/vite,http://vite.dev,MIT License,57360,False,False
24,hoppscotch,hoppscotch/hoppscotch,hoppscotch,"Open source API development ecosystem - https://hoppscotch.io (open-source alternative to Postman, Insomnia)",TypeScript,73448,5114,535,2019-08-21T13:15:24Z,2025-08-11T01:23:10Z,https://github.com/hoppscotch/hoppscotch,https://hoppscotch.io,MIT License,92801,False,False
25,code-server,coder/code-server,coder,VS Code in the browser,TypeScript,73335,6166,134,2019-02-27T16:50:41Z,2025-08-10T20:34:09Z,https://github.com/coder/code-server,https://coder.com,MIT License,53955,False,False
26,immich,immich-app/immich,immich-app,High performance self-hosted photo and video management solution.,TypeScript,72555,3823,648,2022-02-03T15:56:27Z,2025-08-11T01:44:25Z,https://github.com/immich-app/immich,https://immich.app,GNU Affero General Public License v3.0,240022,False,False
27,nest,nestjs/nest,nestjs,"A progressive Node.js framework for building efficient, scalable, and enterprise-grade server-side applications with TypeScript/JavaScript 🚀",TypeScript,72150,7973,66,2017-02-04T20:12:52Z,2025-08-10T20:21:52Z,https://github.com/nestjs/nest,https://nestjs.com,MIT License,406545,False,False
28,clash-verge-rev,clash-verge-rev/clash-verge-rev,clash-verge-rev,"A modern GUI client based on Tauri, designed to run in Windows, macOS and Linux for tailored proxy experience",TypeScript,69508,5263,89,2023-11-21T18:24:03Z,2025-08-11T02:06:27Z,https://github.com/clash-verge-rev/clash-verge-rev,https://www.clashverge.dev,GNU General Public License v3.0,66851,False,False
29,grafana,grafana/grafana,grafana,"The open and composable observability and data visualization platform. Visualize metrics, logs, and traces from multiple sources like Prometheus, Loki, Elasticsearch, InfluxDB, Postgres and many more. ",TypeScript,69378,12834,3757,2013-12-11T15:59:56Z,2025-08-11T01:23:16Z,https://github.com/grafana/grafana,https://grafana.com,GNU Affero General Public License v3.0,1303137,False,False
30,strapi,strapi/strapi,strapi,"🚀 Strapi is the leading open-source headless CMS. It’s 100% JavaScript/TypeScript, fully customizable, and developer-first.",TypeScript,68986,8838,1144,2015-09-30T15:34:48Z,2025-08-10T21:19:21Z,https://github.com/strapi/strapi,https://strapi.io,Other,596400,False,False
31,gemini-cli,google-gemini/gemini-cli,google-gemini,An open-source AI agent that brings the power of Gemini directly into your terminal.,TypeScript,68527,6784,1727,2025-04-17T17:04:31Z,2025-08-11T02:11:18Z,https://github.com/google-gemini/gemini-cli,,Apache License 2.0,25587,False,False
32,superset,apache/superset,apache,Apache Superset is a Data Visualization and Data Exploration Platform,TypeScript,67499,15484,804,2015-07-21T18:55:34Z,2025-08-11T01:47:59Z,https://github.com/apache/superset,https://superset.apache.org/,Apache License 2.0,787711,False,False
33,tabby,Eugeny/tabby,Eugeny,A terminal for a more modern age,TypeScript,65395,3678,2336,2016-12-23T09:06:10Z,2025-08-11T01:58:42Z,https://github.com/Eugeny/tabby,https://tabby.sh,MIT License,97614,False,False
34,lobe-chat,lobehub/lobe-chat,lobehub,"🤯 Lobe Chat - an open-source, modern design AI chat framework. Supports multiple AI providers (OpenAI / Claude 4 / Gemini / DeepSeek / Ollama / Qwen), Knowledge Base (file upload / RAG ), one click install MCP Marketplace and Artifacts / Thinking. One-click FREE deployment of your private AI Agent application.",TypeScript,64310,13356,943,2023-05-21T07:19:12Z,2025-08-11T01:36:58Z,https://github.com/lobehub/lobe-chat,https://lobechat.com,Other,454777,False,False
35,echarts,apache/echarts,apache,"Apache ECharts is a powerful, interactive charting and data visualization library for browser",TypeScript,64285,19755,1988,2013-04-03T03:18:59Z,2025-08-11T02:07:55Z,https://github.com/apache/echarts,https://echarts.apache.org,Apache License 2.0,265925,False,False
36,servers,modelcontextprotocol/servers,modelcontextprotocol,Model Context Protocol Servers,TypeScript,63710,7410,309,2024-11-19T01:10:17Z,2025-08-11T02:04:15Z,https://github.com/modelcontextprotocol/servers,https://modelcontextprotocol.io,MIT License,25722,False,False
37,socket.io,socketio/socket.io,socketio,Realtime application framework (Node.JS server),TypeScript,62279,10136,210,2010-03-11T18:24:48Z,2025-08-10T16:35:04Z,https://github.com/socketio/socket.io,https://socket.io,MIT License,32183,False,False
38,ragflow,infiniflow/ragflow,infiniflow,RAGFlow is an open-source RAG (Retrieval-Augmented Generation) engine based on deep document understanding.,TypeScript,62061,6328,2603,2023-12-12T06:13:13Z,2025-08-11T02:05:44Z,https://github.com/infiniflow/ragflow,https://ragflow.io,Apache License 2.0,82611,False,False
39,redux,reduxjs/redux,reduxjs,A JS library for predictable global state management,TypeScript,61297,15203,43,2015-05-29T23:53:15Z,2025-08-09T19:56:43Z,https://github.com/reduxjs/redux,https://redux.js.org,MIT License,34009,False,False
40,docusaurus,facebook/docusaurus,facebook,Easy to maintain open source documentation websites.,TypeScript,61240,9304,345,2017-06-20T16:13:53Z,2025-08-11T00:34:39Z,https://github.com/facebook/docusaurus,https://docusaurus.io,MIT License,830508,False,False
41,nuxt,nuxt/nuxt,nuxt,The Intuitive Vue Framework.,TypeScript,57888,5338,844,2016-10-26T11:18:47Z,2025-08-11T01:59:25Z,https://github.com/nuxt/nuxt,https://nuxt.com,MIT License,125317,False,False
42,nocodb,nocodb/nocodb,nocodb,🔥 🔥 🔥 Open Source Airtable Alternative,TypeScript,56337,4080,693,2017-10-29T18:51:48Z,2025-08-11T01:43:52Z,https://github.com/nocodb/nocodb,https://nocodb.com,GNU Affero General Public License v3.0,1362991,False,False
43,react-router,remix-run/react-router,remix-run,Declarative routing for React,TypeScript,55335,10691,135,2014-05-16T22:22:51Z,2025-08-10T23:24:50Z,https://github.com/remix-run/react-router,https://reactrouter.com,MIT License,41246,False,False
44,AFFiNE,toeverything/AFFiNE,toeverything,"There can be more than Notion and Miro. AFFiNE(pronounced [ə‘fain]) is a next-gen knowledge base that brings planning, sorting and creating all together. Privacy first, open-source, customizable and ready to use. ",TypeScript,54166,3665,316,2022-07-31T18:45:21Z,2025-08-11T00:42:58Z,https://github.com/toeverything/AFFiNE,https://affine.pro,Other,549265,False,False
45,zustand,pmndrs/zustand,pmndrs,🐻 Bear necessities for state management in React,TypeScript,54059,1765,7,2019-04-09T09:10:06Z,2025-08-11T01:20:26Z,https://github.com/pmndrs/zustand,https://zustand-demo.pmnd.rs/,MIT License,7603,False,False
46,astro,withastro/astro,withastro,The web framework for content-driven websites. ⭐️ Star to support our work!,TypeScript,52750,2855,198,2021-03-15T17:19:47Z,2025-08-11T01:07:07Z,https://github.com/withastro/astro,https://astro.build,Other,198650,False,False
47,appwrite,appwrite/appwrite,appwrite,Build like a team of hundreds_,TypeScript,52226,4603,806,2019-04-08T16:36:25Z,2025-08-11T00:40:20Z,https://github.com/appwrite/appwrite,https://appwrite.io,"BSD 3-Clause ""New"" or ""Revised"" License",346611,False,False
48,ionic-framework,ionic-team/ionic-framework,ionic-team,"A powerful cross-platform UI toolkit for building native-quality iOS, Android, and Progressive Web Apps with HTML, CSS, and JavaScript.",TypeScript,51968,13442,585,2013-08-20T23:06:02Z,2025-08-10T22:18:14Z,https://github.com/ionic-team/ionic-framework,https://ionicframework.com,MIT License,1515714,False,False
49,core,vuejs/core,vuejs,"🖖 Vue.js is a progressive, incrementally-adoptable JavaScript framework for building UI on the web.",TypeScript,51245,8814,1076,2018-06-12T13:49:36Z,2025-08-11T01:43:58Z,https://github.com/vuejs/core,https://vuejs.org/,MIT License,36708,False,False
50,joplin,laurent22/joplin,laurent22,"Joplin - the privacy-focused note taking app with sync capabilities for Windows, macOS, Linux, Android and iOS.",TypeScript,50722,5433,541,2017-01-16T21:49:41Z,2025-08-11T02:04:00Z,https://github.com/laurent22/joplin,https://joplinapp.org,Other,589047,False,False
51,DefinitelyTyped,DefinitelyTyped/DefinitelyTyped,DefinitelyTyped,The repository for high quality TypeScript type definitions.,TypeScript,50172,30470,709,2012-10-05T16:39:45Z,2025-08-10T19:59:46Z,https://github.com/DefinitelyTyped/DefinitelyTyped,,Other,753001,False,False
52,cline,cline/cline,cline,"Autonomous coding agent right in your IDE, capable of creating/editing files, executing commands, using the browser, and more with your permission every step of the way.",TypeScript,48960,6631,543,2024-07-06T07:28:10Z,2025-08-11T01:45:37Z,https://github.com/cline/cline,https://marketplace.visualstudio.com/items?itemName=saoudrizwan.claude-dev,Apache License 2.0,193493,False,False
53,cypress,cypress-io/cypress,cypress-io,"Fast, easy and reliable testing for anything that runs in a browser.",TypeScript,48811,3314,1310,2015-03-04T00:46:28Z,2025-08-11T01:54:11Z,https://github.com/cypress-io/cypress,https://cypress.io,MIT License,756912,False,False
54,firecrawl,mendableai/firecrawl,mendableai,"🔥 Turn entire websites into LLM-ready markdown or structured data. Scrape, crawl and extract with a single API.",TypeScript,46242,4237,205,2024-04-15T21:02:29Z,2025-08-11T02:08:31Z,https://github.com/mendableai/firecrawl,https://firecrawl.dev,GNU Affero General Public License v3.0,62431,False,False
55,type-challenges,type-challenges/type-challenges,type-challenges,Collection of TypeScript type challenges with online judge,TypeScript,46218,5039,32352,2020-07-23T14:33:11Z,2025-08-11T02:08:49Z,https://github.com/type-challenges/type-challenges,https://tsch.js.org/,MIT License,3165,False,False
56,query,TanStack/query,TanStack,"🤖 Powerful asynchronous state management, server-state utilities and data fetching for the web. TS/JS, React Query, Solid Query, Svelte Query and Vue Query.",TypeScript,46213,3392,123,2019-09-10T19:23:58Z,2025-08-11T02:11:00Z,https://github.com/TanStack/query,https://tanstack.com/query,MIT License,91498,False,False
57,quill,slab/quill,slab,Quill is a modern WYSIWYG editor built for compatibility and extensibility,TypeScript,45902,3542,575,2012-07-30T23:23:18Z,2025-08-10T17:14:58Z,https://github.com/slab/quill,https://quilljs.com,"BSD 3-Clause ""New"" or ""Revised"" License",18429,False,False
58,lx-music-desktop,lyswhut/lx-music-desktop,lyswhut,一个基于 electron 的音乐软件,TypeScript,45659,6363,953,2019-08-14T14:31:08Z,2025-08-11T01:50:25Z,https://github.com/lyswhut/lx-music-desktop,https://lyswhut.github.io/lx-music-doc/,Apache License 2.0,72304,False,False
59,pixijs,pixijs/pixijs,pixijs,"The HTML5 Creation Engine: Create beautiful digital content with the fastest, most flexible 2D WebGL renderer.",TypeScript,45517,4875,278,2013-01-21T22:40:50Z,2025-08-11T01:04:27Z,https://github.com/pixijs/pixijs,http://pixijs.com,MIT License,114808,False,False
60,jest,jestjs/jest,jestjs,Delightful JavaScript Testing.,TypeScript,44951,6591,277,2013-12-10T00:18:04Z,2025-08-10T11:37:20Z,https://github.com/jestjs/jest,https://jestjs.io,MIT License,309592,False,False
61,hyper,vercel/hyper,vercel,A terminal built on web technologies,TypeScript,44157,3537,1019,2016-07-01T06:01:21Z,2025-08-10T22:15:33Z,https://github.com/vercel/hyper,https://hyper.is,MIT License,24532,False,False
62,babel,babel/babel,babel,🐠 Babel is a compiler for writing next generation JavaScript.,TypeScript,43682,5737,762,2014-09-28T13:38:23Z,2025-08-11T01:02:34Z,https://github.com/babel/babel,https://babel.dev,MIT License,133800,False,False
63,fuels-ts,FuelLabs/fuels-ts,FuelLabs,Fuel Network Typescript SDK,TypeScript,43632,1371,73,2021-09-03T18:11:03Z,2025-08-10T17:51:46Z,https://github.com/FuelLabs/fuels-ts,https://docs.fuel.network/docs/fuels-ts/,Apache License 2.0,113800,False,False
64,react-hook-form,react-hook-form/react-hook-form,react-hook-form,📋 React Hooks for form state management and validation (Web + React Native),TypeScript,43621,2263,82,2019-03-05T23:47:10Z,2025-08-11T00:15:47Z,https://github.com/react-hook-form/react-hook-form,https://react-hook-form.com,MIT License,29931,False,False
65,prisma,prisma/prisma,prisma,"Next-generation ORM for Node.js & TypeScript | PostgreSQL, MySQL, MariaDB, SQL Server, SQLite, MongoDB and CockroachDB",TypeScript,43471,1831,2330,2019-06-20T13:33:47Z,2025-08-11T02:00:26Z,https://github.com/prisma/prisma,https://www.prisma.io,Apache License 2.0,153909,False,False
66,react-use,streamich/react-use,streamich,React Hooks — 👍,TypeScript,43392,3253,628,2018-10-27T10:16:05Z,2025-08-11T02:00:58Z,https://github.com/streamich/react-use,http://streamich.github.io/react-use,The Unlicense,83737,False,False
67,Rocket.Chat,RocketChat/Rocket.Chat,RocketChat,The communications platform that puts data protection first.,TypeScript,43163,12041,3347,2015-05-19T07:36:09Z,2025-08-11T00:25:00Z,https://github.com/RocketChat/Rocket.Chat,https://rocket.chat/,Other,1872322,False,False
68,Flowise,FlowiseAI/Flowise,FlowiseAI,"Build AI Agents, Visually",TypeScript,42509,21781,671,2023-03-31T12:23:09Z,2025-08-11T01:33:04Z,https://github.com/FlowiseAI/Flowise,https://flowiseai.com,Other,64861,False,False
69,expo,expo/expo,expo,"An open-source framework for making universal native apps with React. Expo runs on Android, iOS, and the web.",TypeScript,42289,7924,799,2016-08-15T17:14:25Z,2025-08-11T01:43:16Z,https://github.com/expo/expo,https://docs.expo.dev,MIT License,3398103,False,False
70,tldraw,tldraw/tldraw,tldraw,very good whiteboard SDK / infinite canvas SDK,TypeScript,41225,2638,283,2021-05-09T11:48:37Z,2025-08-11T01:40:33Z,https://github.com/tldraw/tldraw,https://tldraw.dev,Other,857038,False,False
71,styled-components,styled-components/styled-components,styled-components,Visual primitives for the component age. Use the best bits of ES6 and CSS to style your apps without stress 💅,TypeScript,40858,2514,325,2016-08-16T06:41:32Z,2025-08-10T16:42:07Z,https://github.com/styled-components/styled-components,https://styled-components.com,MIT License,34603,False,False
72,jsoncrack.com,AykutSarac/jsoncrack.com,AykutSarac,"✨ Innovative and open-source visualization application that transforms various data formats, such as JSON, YAML, XML, CSV and more, into interactive graphs.",TypeScript,40751,2884,39,2022-01-30T15:25:18Z,2025-08-11T01:54:59Z,https://github.com/AykutSarac/jsoncrack.com,https://jsoncrack.com/,Apache License 2.0,41043,False,False
73,vuetify,vuetifyjs/vuetify,vuetifyjs,🐉 Vue Component Framework,TypeScript,40658,7061,666,2016-09-12T00:39:35Z,2025-08-10T10:33:17Z,https://github.com/vuetifyjs/vuetify,https://vuetifyjs.com,MIT License,96738,False,False
74,hexo,hexojs/hexo,hexojs,"A fast, simple & powerful blog framework, powered by Node.js.",TypeScript,40623,4957,94,2012-09-23T15:17:08Z,2025-08-10T18:31:37Z,https://github.com/hexojs/hexo,https://hexo.io,MIT License,7029,False,False
75,chakra-ui,chakra-ui/chakra-ui,chakra-ui,Chakra UI is a component system for building SaaS products with speed ⚡️,TypeScript,39499,3469,11,2019-08-17T14:27:54Z,2025-08-10T22:42:04Z,https://github.com/chakra-ui/chakra-ui,https://chakra-ui.com,MIT License,277522,False,False
76,zod,colinhacks/zod,colinhacks,TypeScript-first schema validation with static type inference,TypeScript,39452,1560,252,2020-03-07T20:59:08Z,2025-08-11T02:10:47Z,https://github.com/colinhacks/zod,https://zod.dev,MIT License,21006,False,False
77,slidev,slidevjs/slidev,slidevjs,Presentation Slides for Developers,TypeScript,39271,1632,152,2021-04-24T01:25:23Z,2025-08-11T01:11:11Z,https://github.com/slidevjs/slidev,https://sli.dev,MIT License,79024,False,False
78,upscayl,upscayl/upscayl,upscayl,"🆙 Upscayl - #1 Free and Open Source AI Image Upscaler for Linux, MacOS and Windows.",TypeScript,38546,1782,55,2022-07-30T17:19:20Z,2025-08-11T01:53:45Z,https://github.com/upscayl/upscayl,https://upscayl.org,GNU Affero General Public License v3.0,567433,False,False
79,RSSHub,DIYgod/RSSHub,DIYgod,🧡 Everything is RSSible,TypeScript,38220,8401,382,2018-04-02T14:43:21Z,2025-08-11T01:51:18Z,https://github.com/DIYgod/RSSHub,https://docs.rsshub.app,MIT License,699492,False,False
80,trpc,trpc/trpc,trpc,🧙‍♀️  Move Fast and Break Nothing. End-to-end typesafe APIs made easy. ,TypeScript,38164,1396,188,2020-07-18T01:17:11Z,2025-08-11T01:19:12Z,https://github.com/trpc/trpc,https://tRPC.io,MIT License,53295,False,False
81,plane,makeplane/plane,makeplane,"🔥 🔥 🔥 Open Source JIRA, Linear, Monday, and Asana Alternative. Plane helps you track your issues, epics, and cycles the easiest way on the planet.",TypeScript,37970,2569,504,2022-11-19T12:55:01Z,2025-08-10T23:48:17Z,https://github.com/makeplane/plane,http://plane.so,GNU Affero General Public License v3.0,168867,False,False
82,appsmith,appsmithorg/appsmith,appsmithorg,"Platform to build admin panels, internal tools, and dashboards. Integrates with 25+ databases and any API.",TypeScript,37649,4184,4384,2020-06-30T04:07:36Z,2025-08-11T02:08:48Z,https://github.com/appsmithorg/appsmith,https://www.appsmith.com,Apache License 2.0,792162,False,False
83,cal.com,calcom/cal.com,calcom,Scheduling infrastructure for absolutely everyone.,TypeScript,37533,10201,1418,2021-03-22T13:47:42Z,2025-08-10T23:54:02Z,https://github.com/calcom/cal.com,https://cal.com,Other,1122020,False,False
84,novu,novuhq/novu,novuhq,"The open-source notification Inbox infrastructure. E-mail, SMS, Push and Slack Integrations.",TypeScript,37407,4085,236,2021-08-26T15:22:44Z,2025-08-10T19:05:47Z,https://github.com/novuhq/novu,https://novu.co,Other,238738,False,False
85,ant-design-pro,ant-design/ant-design-pro,ant-design,👨🏻‍💻👩🏻‍💻 Use Ant Design like a Pro!,TypeScript,37380,8206,154,2017-08-25T10:40:44Z,2025-08-11T01:20:20Z,https://github.com/ant-design/ant-design-pro,https://pro.ant.design,MIT License,27343,False,False
86,insomnia,Kong/insomnia,Kong,"The open-source, cross-platform API client for GraphQL, REST, WebSockets, SSE and gRPC. With Cloud, Local and Git storage.",TypeScript,36884,2107,744,2016-04-23T03:54:26Z,2025-08-10T16:07:52Z,https://github.com/Kong/insomnia,https://insomnia.rest,Apache License 2.0,136196,False,False
87,payload,payloadcms/payload,payloadcms,"Payload is the open-source, fullstack Next.js framework, giving you instant backend superpowers. Get a full TypeScript backend and admin panel instantly. Use Payload as a headless CMS or for building powerful applications.",TypeScript,36825,2778,722,2021-01-05T18:49:45Z,2025-08-11T00:11:40Z,https://github.com/payloadcms/payload,https://payloadcms.com,MIT License,150482,False,False
88,ink-kit,inkonchain/ink-kit,inkonchain,"Onchain-focused SDK with ready-to-use templates, themes, and magical animated components ✨",TypeScript,36793,409,2,2024-11-04T16:32:17Z,2025-08-11T02:04:11Z,https://github.com/inkonchain/ink-kit,https://ink-kit.inkonchain.com,MIT License,1106,False,False
