排名,项目名称,完整名称,作者,描述,语言,Stars,Forks,Issues,创建时间,更新时间,仓库链接,主页链接,许可证,大小(KB),是否Fork,是否已归档
1,freeCodeCamp,freeCodeCamp/freeCodeCamp,freeCodeCamp,"freeCodeCamp.org's open-source codebase and curriculum. Learn math, programming, and computer science for free.",TypeScript,431133,42206,299,2014-12-24T17:49:19Z,2025-11-03T00:54:44Z,https://github.com/freeCodeCamp/freeCodeCamp,https://contribute.freecodecamp.org,"BSD 3-Clause ""New"" or ""Revised"" License",527706,False,False
2,developer-roadmap,kamranahmedse/developer-roadmap,kamranahmedse,"Interactive roadmaps, guides and other educational content to help developers grow in their careers.",TypeScript,342604,43274,112,2017-03-15T13:45:52Z,2025-11-03T01:54:50Z,https://github.com/kamranahmedse/developer-roadmap,https://roadmap.sh,Other,355443,False,False
3,vue,vuejs/vue,vuejs,"This is the repo for Vue 2. For Vue 3, go to https://github.com/vuejs/core",TypeScript,209647,33800,609,2013-07-29T03:24:51Z,2025-11-02T23:42:10Z,https://github.com/vuejs/vue,http://v2.vuejs.org,MIT License,32152,False,False
4,vscode,microsoft/vscode,microsoft,Visual Studio Code,TypeScript,178147,35904,14351,2015-09-03T20:23:38Z,2025-11-03T01:50:49Z,https://github.com/microsoft/vscode,https://code.visualstudio.com,MIT License,1077453,False,False
5,n8n,n8n-io/n8n,n8n-io,"Fair-code workflow automation platform with native AI capabilities. Combine visual building with custom code, self-host or cloud, 400+ integrations.",TypeScript,153543,49041,1366,2019-06-22T09:24:21Z,2025-11-03T01:53:04Z,https://github.com/n8n-io/n8n,https://n8n.io,Other,283832,False,False
6,tech-interview-handbook,yangshun/tech-interview-handbook,yangshun,💯 Curated coding interview preparation materials for busy software engineers,TypeScript,131543,15959,54,2016-07-05T05:00:48Z,2025-11-03T00:30:33Z,https://github.com/yangshun/tech-interview-handbook,https://www.techinterviewhandbook.org,MIT License,32822,False,False
7,dify,langgenius/dify,langgenius,Production-ready platform for agentic workflow development.,TypeScript,117872,18211,640,2023-04-12T07:40:24Z,2025-11-03T01:41:08Z,https://github.com/langgenius/dify,https://dify.ai,Other,147469,False,False
8,excalidraw,excalidraw/excalidraw,excalidraw,Virtual whiteboard for sketching hand-drawn like diagrams,TypeScript,109547,11390,2526,2020-01-02T01:04:43Z,2025-11-03T01:35:38Z,https://github.com/excalidraw/excalidraw,https://excalidraw.com,MIT License,97126,False,False
9,TypeScript,microsoft/TypeScript,microsoft,TypeScript is a superset of JavaScript that compiles to clean JavaScript output.,TypeScript,106606,13087,5970,2014-06-17T15:28:39Z,2025-11-03T00:47:21Z,https://github.com/microsoft/TypeScript,https://www.typescriptlang.org,Apache License 2.0,2875377,False,False
10,angular,angular/angular,angular,Deliver web apps with confidence 🚀,TypeScript,99209,26732,1106,2014-09-18T16:12:01Z,2025-11-03T01:18:03Z,https://github.com/angular/angular,https://angular.dev,MIT License,577032,False,False
11,ui,shadcn-ui/ui,shadcn-ui,"A set of beautifully-designed, accessible components and a code distribution platform. Works with your favorite frameworks. Open Source. Open Code.",TypeScript,98875,7097,1628,2023-01-04T12:43:27Z,2025-11-03T01:55:51Z,https://github.com/shadcn-ui/ui,https://ui.shadcn.com,MIT License,38071,False,False
12,iptv,iptv-org/iptv,iptv-org,Collection of publicly available IPTV channels from all over the world,TypeScript,98231,4222,311,2018-11-14T22:00:57Z,2025-11-03T01:31:28Z,https://github.com/iptv-org/iptv,https://iptv-org.github.io,The Unlicense,1068264,False,False
13,material-ui,mui/material-ui,mui,Material UI: Comprehensive React component library that implements Google's Material Design. Free forever.,TypeScript,96922,32688,1789,2014-08-18T19:11:54Z,2025-11-02T15:25:45Z,https://github.com/mui/material-ui,https://mui.com/material-ui/,MIT License,700132,False,False
14,ant-design,ant-design/ant-design,ant-design,An enterprise-class UI design language and React UI library,TypeScript,96512,53899,1267,2015-04-24T15:37:24Z,2025-11-03T00:16:19Z,https://github.com/ant-design/ant-design,https://ant.design,MIT License,241419,False,False
15,puppeteer,puppeteer/puppeteer,puppeteer,JavaScript API for Chrome and Firefox,TypeScript,92789,9317,293,2017-05-09T22:16:13Z,2025-11-03T01:37:04Z,https://github.com/puppeteer/puppeteer,https://pptr.dev,Apache License 2.0,1225294,False,False
16,supabase,supabase/supabase,supabase,"The Postgres development platform. Supabase gives you a dedicated Postgres database to build your web, mobile, and AI applications.",TypeScript,91563,10435,825,2019-10-12T05:56:49Z,2025-11-03T02:00:05Z,https://github.com/supabase/supabase,https://supabase.com,Apache License 2.0,2169034,False,False
17,tailwindcss,tailwindlabs/tailwindcss,tailwindlabs,A utility-first CSS framework for rapid UI development.,TypeScript,90875,4767,70,2017-10-06T14:59:14Z,2025-11-03T01:47:02Z,https://github.com/tailwindlabs/tailwindcss,https://tailwindcss.com/,MIT License,112680,False,False
18,storybook,storybookjs/storybook,storybookjs,"Storybook is the industry standard workshop for building, documenting, and testing UI components in isolation",TypeScript,88541,9759,2231,2016-03-18T04:23:44Z,2025-11-03T01:59:25Z,https://github.com/storybookjs/storybook,https://storybook.js.org,MIT License,1061751,False,False
19,NextChat,ChatGPTNextWeb/NextChat,ChatGPTNextWeb,✨ Light and Fast AI Assistant. Support: Web | iOS | MacOS | Android |  Linux | Windows,TypeScript,86310,60866,775,2023-03-10T18:27:54Z,2025-11-03T01:09:56Z,https://github.com/ChatGPTNextWeb/NextChat,https://nextnext.chat,MIT License,20537,False,False
20,mermaid,mermaid-js/mermaid,mermaid-js,Generation of diagrams like flowcharts or sequence diagrams from text in a similar manner as markdown,TypeScript,83865,8232,1506,2014-11-01T23:52:32Z,2025-11-03T00:45:02Z,https://github.com/mermaid-js/mermaid,https://mermaid.js.org,MIT License,258686,False,False
21,immich,immich-app/immich,immich-app,High performance self-hosted photo and video management solution.,TypeScript,83251,4362,607,2022-02-03T15:56:27Z,2025-11-03T01:57:26Z,https://github.com/immich-app/immich,https://immich.app,GNU Affero General Public License v3.0,252265,False,False
22,realworld,gothinkster/realworld,gothinkster,"""The mother of all demo apps"" — Exemplary fullstack Medium.com clone powered by React, Angular, Node, Django, and many more",TypeScript,82497,7530,50,2016-02-26T20:49:53Z,2025-11-02T22:43:56Z,https://github.com/gothinkster/realworld,https://docs.realworld.show,MIT License,35176,False,False
23,gemini-cli,google-gemini/gemini-cli,google-gemini,An open-source AI agent that brings the power of Gemini directly into your terminal.,TypeScript,81265,9036,2616,2025-04-17T17:04:31Z,2025-11-03T01:52:39Z,https://github.com/google-gemini/gemini-cli,https://geminicli.com,Apache License 2.0,50712,False,False
24,clash-verge-rev,clash-verge-rev/clash-verge-rev,clash-verge-rev,"A modern GUI client based on Tauri, designed to run in Windows, macOS and Linux for tailored proxy experience",TypeScript,80204,5944,89,2023-11-21T18:24:03Z,2025-11-03T01:58:54Z,https://github.com/clash-verge-rev/clash-verge-rev,https://www.clashverge.dev,GNU General Public License v3.0,70582,False,False
25,playwright,microsoft/playwright,microsoft,"Playwright is a framework for Web Testing and Automation. It allows testing Chromium, Firefox and WebKit with a single API. ",TypeScript,78899,4768,554,2019-11-15T18:32:42Z,2025-11-03T01:39:15Z,https://github.com/microsoft/playwright,https://playwright.dev,Apache License 2.0,218983,False,False
26,hoppscotch,hoppscotch/hoppscotch,hoppscotch,"Open-Source API Development Ecosystem • https://hoppscotch.io • Offline, On-Prem & Cloud • Web, Desktop & CLI • Open-Source Alternative to Postman, Insomnia",TypeScript,76719,5387,569,2019-08-21T13:15:24Z,2025-11-03T01:55:41Z,https://github.com/hoppscotch/hoppscotch,https://hoppscotch.io,MIT License,93798,False,False
27,vite,vitejs/vite,vitejs,Next generation frontend tooling. It's fast!,TypeScript,76314,7426,608,2020-04-21T05:03:57Z,2025-11-03T01:35:42Z,https://github.com/vitejs/vite,http://vite.dev,MIT License,58726,False,False
28,code-server,coder/code-server,coder,VS Code in the browser,TypeScript,74497,6316,159,2019-02-27T16:50:41Z,2025-11-03T01:34:07Z,https://github.com/coder/code-server,https://coder.com,MIT License,54030,False,False
29,nest,nestjs/nest,nestjs,"A progressive Node.js framework for building efficient, scalable, and enterprise-grade server-side applications with TypeScript/JavaScript 🚀",TypeScript,73282,8082,65,2017-02-04T20:12:52Z,2025-11-03T01:22:13Z,https://github.com/nestjs/nest,https://nestjs.com,MIT License,442115,False,False
30,servers,modelcontextprotocol/servers,modelcontextprotocol,Model Context Protocol Servers,TypeScript,71782,8602,250,2024-11-19T01:10:17Z,2025-11-03T01:44:31Z,https://github.com/modelcontextprotocol/servers,https://modelcontextprotocol.io,MIT License,27309,False,False
31,grafana,grafana/grafana,grafana,"The open and composable observability and data visualization platform. Visualize metrics, logs, and traces from multiple sources like Prometheus, Loki, Elasticsearch, InfluxDB, Postgres and many more. ",TypeScript,70631,13138,3639,2013-12-11T15:59:56Z,2025-11-03T01:57:19Z,https://github.com/grafana/grafana,https://grafana.com,GNU Affero General Public License v3.0,1375533,False,False
32,strapi,strapi/strapi,strapi,"🚀 Strapi is the leading open-source headless CMS. It’s 100% JavaScript/TypeScript, fully customizable, and developer-first.",TypeScript,70224,9237,915,2015-09-30T15:34:48Z,2025-11-02T21:57:20Z,https://github.com/strapi/strapi,https://strapi.io,Other,592122,False,False
33,superset,apache/superset,apache,Apache Superset is a Data Visualization and Data Exploration Platform,TypeScript,68746,16082,962,2015-07-21T18:55:34Z,2025-11-02T23:46:30Z,https://github.com/apache/superset,https://superset.apache.org/,Apache License 2.0,818368,False,False
34,lobe-chat,lobehub/lobe-chat,lobehub,"🤯 LobeHub - an open-source, modern design AI Agent Workspace. Supports multiple AI providers (OpenAI / Claude 4 / Gemini / DeepSeek / Ollama / Qwen), Knowledge Base (file upload / RAG ), one click install MCP Marketplace and Artifacts / Thinking. One-click FREE deployment of your private AI Agent application.",TypeScript,67366,13915,973,2023-05-21T07:19:12Z,2025-11-03T01:20:15Z,https://github.com/lobehub/lobe-chat,https://lobechat.com,Other,560613,False,False
35,tabby,Eugeny/tabby,Eugeny,A terminal for a more modern age,TypeScript,66974,3744,2472,2016-12-23T09:06:10Z,2025-11-03T01:55:38Z,https://github.com/Eugeny/tabby,https://tabby.sh,MIT License,97913,False,False
36,ragflow,infiniflow/ragflow,infiniflow,RAGFlow is a leading open-source Retrieval-Augmented Generation (RAG) engine that fuses cutting-edge RAG with Agent capabilities to create a superior context layer for LLMs,TypeScript,66951,7116,2943,2023-12-12T06:13:13Z,2025-11-03T01:53:18Z,https://github.com/infiniflow/ragflow,https://ragflow.io,Apache License 2.0,91300,False,False
37,firecrawl,firecrawl/firecrawl,firecrawl,🔥 The Web Data API for AI - Turn entire websites into LLM-ready markdown or structured data,TypeScript,65974,5184,109,2024-04-15T21:02:29Z,2025-11-03T01:55:57Z,https://github.com/firecrawl/firecrawl,https://firecrawl.dev,GNU Affero General Public License v3.0,78304,False,False
38,echarts,apache/echarts,apache,"Apache ECharts is a powerful, interactive charting and data visualization library for browser",TypeScript,64931,19776,1891,2013-04-03T03:18:59Z,2025-11-02T15:33:16Z,https://github.com/apache/echarts,https://echarts.apache.org,Apache License 2.0,260138,False,False
39,socket.io,socketio/socket.io,socketio,Realtime application framework (Node.JS server),TypeScript,62549,10144,210,2010-03-11T18:24:48Z,2025-11-02T14:22:22Z,https://github.com/socketio/socket.io,https://socket.io,MIT License,32851,False,False
40,docusaurus,facebook/docusaurus,facebook,Easy to maintain open source documentation websites.,TypeScript,62477,9509,350,2017-06-20T16:13:53Z,2025-11-03T01:58:08Z,https://github.com/facebook/docusaurus,https://docusaurus.io,MIT License,915921,False,False
41,redux,reduxjs/redux,reduxjs,A JS library for predictable global state management,TypeScript,61371,15188,46,2015-05-29T23:53:15Z,2025-11-02T21:17:04Z,https://github.com/reduxjs/redux,https://redux.js.org,MIT License,34278,False,False
42,AFFiNE,toeverything/AFFiNE,toeverything,"There can be more than Notion and Miro. AFFiNE(pronounced [ə‘fain]) is a next-gen knowledge base that brings planning, sorting and creating all together. Privacy first, open-source, customizable and ready to use. ",TypeScript,58989,4004,477,2022-07-31T18:45:21Z,2025-11-03T02:00:02Z,https://github.com/toeverything/AFFiNE,https://affine.pro,Other,556855,False,False
43,nuxt,nuxt/nuxt,nuxt,The Intuitive Vue Framework.,TypeScript,58685,5422,914,2016-10-26T11:18:47Z,2025-11-03T01:23:18Z,https://github.com/nuxt/nuxt,https://nuxt.com,MIT License,129311,False,False
44,nocodb,nocodb/nocodb,nocodb,🔥 🔥 🔥 Open Source Airtable Alternative,TypeScript,58530,4323,450,2017-10-29T18:51:48Z,2025-11-03T01:54:20Z,https://github.com/nocodb/nocodb,https://nocodb.com,GNU Affero General Public License v3.0,1388855,False,False
45,react-router,remix-run/react-router,remix-run,Declarative routing for React,TypeScript,55824,10750,137,2014-05-16T22:22:51Z,2025-11-02T20:13:09Z,https://github.com/remix-run/react-router,https://reactrouter.com,MIT License,42728,False,False
46,zustand,pmndrs/zustand,pmndrs,🐻 Bear necessities for state management in React,TypeScript,55482,1839,6,2019-04-09T09:10:06Z,2025-11-03T00:51:58Z,https://github.com/pmndrs/zustand,https://zustand-demo.pmnd.rs/,MIT License,7806,False,False
47,astro,withastro/astro,withastro,The web framework for content-driven websites. ⭐️ Star to support our work!,TypeScript,54176,2942,248,2021-03-15T17:19:47Z,2025-11-03T01:28:57Z,https://github.com/withastro/astro,https://astro.build,Other,207436,False,False
48,appwrite,appwrite/appwrite,appwrite,Build like a team of hundreds_,TypeScript,53386,4792,879,2019-04-08T16:36:25Z,2025-11-03T01:12:04Z,https://github.com/appwrite/appwrite,https://appwrite.io,"BSD 3-Clause ""New"" or ""Revised"" License",368939,False,False
49,ionic-framework,ionic-team/ionic-framework,ionic-team,"A powerful cross-platform UI toolkit for building native-quality iOS, Android, and Progressive Web Apps with HTML, CSS, and JavaScript.",TypeScript,52163,13426,610,2013-08-20T23:06:02Z,2025-11-02T21:41:25Z,https://github.com/ionic-team/ionic-framework,https://ionicframework.com,MIT License,1526544,False,False
50,core,vuejs/core,vuejs,"🖖 Vue.js is a progressive, incrementally-adoptable JavaScript framework for building UI on the web.",TypeScript,52039,8923,1075,2018-06-12T13:49:36Z,2025-11-03T01:57:39Z,https://github.com/vuejs/core,https://vuejs.org/,MIT License,37616,False,False
51,cline,cline/cline,cline,"Autonomous coding agent right in your IDE, capable of creating/editing files, executing commands, using the browser, and more with your permission every step of the way.",TypeScript,51971,7592,837,2024-07-06T07:28:10Z,2025-11-03T01:49:17Z,https://github.com/cline/cline,https://marketplace.visualstudio.com/items?itemName=saoudrizwan.claude-dev,Apache License 2.0,297128,False,False
52,joplin,laurent22/joplin,laurent22,"Joplin - the privacy-focused note taking app with sync capabilities for Windows, macOS, Linux, Android and iOS.",TypeScript,51970,5579,609,2017-01-16T21:49:41Z,2025-11-02T22:34:33Z,https://github.com/laurent22/joplin,https://joplinapp.org,Other,600298,False,False
53,DefinitelyTyped,DefinitelyTyped/DefinitelyTyped,DefinitelyTyped,The repository for high quality TypeScript type definitions.,TypeScript,50576,30514,712,2012-10-05T16:39:45Z,2025-11-03T01:00:37Z,https://github.com/DefinitelyTyped/DefinitelyTyped,,Other,780764,False,False
54,cypress,cypress-io/cypress,cypress-io,"Fast, easy and reliable testing for anything that runs in a browser.",TypeScript,49408,3364,1306,2015-03-04T00:46:28Z,2025-11-02T20:09:30Z,https://github.com/cypress-io/cypress,https://cypress.io,MIT License,500256,False,False
55,query,TanStack/query,TanStack,"🤖 Powerful asynchronous state management, server-state utilities and data fetching for the web. TS/JS, React Query, Solid Query, Svelte Query and Vue Query.",TypeScript,47231,3539,115,2019-09-10T19:23:58Z,2025-11-03T00:38:51Z,https://github.com/TanStack/query,https://tanstack.com/query,MIT License,95324,False,False
56,lx-music-desktop,lyswhut/lx-music-desktop,lyswhut,一个基于 electron 的音乐软件,TypeScript,46919,6481,1018,2019-08-14T14:31:08Z,2025-11-03T01:31:26Z,https://github.com/lyswhut/lx-music-desktop,https://lyswhut.github.io/lx-music-doc/,Apache License 2.0,74525,False,False
57,type-challenges,type-challenges/type-challenges,type-challenges,Collection of TypeScript type challenges with online judge,TypeScript,46883,5126,32759,2020-07-23T14:33:11Z,2025-11-03T01:43:40Z,https://github.com/type-challenges/type-challenges,https://tsch.js.org/,MIT License,3187,False,False
58,quill,slab/quill,slab,Quill is a modern WYSIWYG editor built for compatibility and extensibility,TypeScript,46391,3586,605,2012-07-30T23:23:18Z,2025-11-02T12:35:45Z,https://github.com/slab/quill,https://quilljs.com,"BSD 3-Clause ""New"" or ""Revised"" License",18429,False,False
59,Flowise,FlowiseAI/Flowise,FlowiseAI,"Build AI Agents, Visually",TypeScript,46233,22973,696,2023-03-31T12:23:09Z,2025-11-03T01:39:06Z,https://github.com/FlowiseAI/Flowise,https://flowiseai.com,Other,68011,False,False
60,pixijs,pixijs/pixijs,pixijs,"The HTML5 Creation Engine: Create beautiful digital content with the fastest, most flexible 2D WebGL renderer.",TypeScript,45975,4912,306,2013-01-21T22:40:50Z,2025-11-02T17:29:58Z,https://github.com/pixijs/pixijs,http://pixijs.com,MIT License,118094,False,False
61,jest,jestjs/jest,jestjs,Delightful JavaScript Testing.,TypeScript,45123,6613,250,2013-12-10T00:18:04Z,2025-11-02T15:24:56Z,https://github.com/jestjs/jest,https://jestjs.io,MIT License,312462,False,False
62,expo,expo/expo,expo,"An open-source framework for making universal native apps with React. Expo runs on Android, iOS, and the web.",TypeScript,44583,9604,805,2016-08-15T17:14:25Z,2025-11-03T01:41:04Z,https://github.com/expo/expo,https://docs.expo.dev,MIT License,3475506,False,False
63,hyper,vercel/hyper,vercel,A terminal built on web technologies,TypeScript,44472,3541,1017,2016-07-01T06:01:21Z,2025-11-03T01:42:15Z,https://github.com/vercel/hyper,https://hyper.is,MIT License,24532,False,False
64,prisma,prisma/prisma,prisma,"Next-generation ORM for Node.js & TypeScript | PostgreSQL, MySQL, MariaDB, SQL Server, SQLite, MongoDB and CockroachDB",TypeScript,44202,1904,2402,2019-06-20T13:33:47Z,2025-11-03T01:32:58Z,https://github.com/prisma/prisma,https://www.prisma.io,Apache License 2.0,159708,False,False
65,react-hook-form,react-hook-form/react-hook-form,react-hook-form,📋 React Hooks for form state management and validation (Web + React Native),TypeScript,44089,2314,107,2019-03-05T23:47:10Z,2025-11-02T15:36:33Z,https://github.com/react-hook-form/react-hook-form,https://react-hook-form.com,MIT License,30322,False,False
66,babel,babel/babel,babel,🐠 Babel is a compiler for writing next generation JavaScript.,TypeScript,43775,5771,768,2014-09-28T13:38:23Z,2025-11-03T00:55:52Z,https://github.com/babel/babel,https://babel.dev,MIT License,136170,False,False
67,Rocket.Chat,RocketChat/Rocket.Chat,RocketChat,The communications platform that puts data protection first.,TypeScript,43763,12366,3428,2015-05-19T07:36:09Z,2025-11-02T21:01:18Z,https://github.com/RocketChat/Rocket.Chat,https://rocket.chat/,Other,1908624,False,False
68,react-use,streamich/react-use,streamich,React Hooks — 👍,TypeScript,43701,3276,646,2018-10-27T10:16:05Z,2025-11-02T06:04:27Z,https://github.com/streamich/react-use,http://streamich.github.io/react-use,The Unlicense,83868,False,False
69,tldraw,tldraw/tldraw,tldraw,very good whiteboard SDK / infinite canvas SDK,TypeScript,43646,2822,243,2021-05-09T11:48:37Z,2025-11-03T01:35:38Z,https://github.com/tldraw/tldraw,https://tldraw.dev,Other,949896,False,False
70,fuels-ts,FuelLabs/fuels-ts,FuelLabs,Fuel Network Typescript SDK,TypeScript,43540,1370,70,2021-09-03T18:11:03Z,2025-11-02T16:05:41Z,https://github.com/FuelLabs/fuels-ts,https://docs.fuel.network/docs/fuels-ts/,Apache License 2.0,113532,False,False
71,OpenCut,OpenCut-app/OpenCut,OpenCut-app,The open-source CapCut alternative,TypeScript,43141,4095,233,2025-06-22T08:02:17Z,2025-11-03T01:53:43Z,https://github.com/OpenCut-app/OpenCut,https://opencut.app,MIT License,14212,False,False
72,jsoncrack.com,AykutSarac/jsoncrack.com,AykutSarac,"✨ Innovative and open-source visualization application that transforms various data formats, such as JSON, YAML, XML, CSV and more, into interactive graphs.",TypeScript,42329,3032,45,2022-01-30T15:25:18Z,2025-11-03T01:25:35Z,https://github.com/AykutSarac/jsoncrack.com,https://jsoncrack.com/,Apache License 2.0,41074,False,False
73,claude-code,anthropics/claude-code,anthropics,"Claude Code is an agentic coding tool that lives in your terminal, understands your codebase, and helps you code faster by executing routine tasks, explaining complex code, and handling git workflows - all through natural language commands.",TypeScript,41188,2673,4855,2025-02-22T17:41:21Z,2025-11-03T01:58:48Z,https://github.com/anthropics/claude-code,https://docs.anthropic.com/s/claude-code,,26673,False,False
74,slidev,slidevjs/slidev,slidevjs,Presentation Slides for Developers,TypeScript,41105,1729,176,2021-04-24T01:25:23Z,2025-11-03T01:07:26Z,https://github.com/slidevjs/slidev,https://sli.dev,MIT License,79822,False,False
75,styled-components,styled-components/styled-components,styled-components,Visual primitives for the component age. Use the best bits of ES6 and CSS to style your apps without stress 💅,TypeScript,40972,2521,335,2016-08-16T06:41:32Z,2025-11-02T20:26:15Z,https://github.com/styled-components/styled-components,https://styled-components.com,MIT License,35480,False,False
76,hexo,hexojs/hexo,hexojs,"A fast, simple & powerful blog framework, powered by Node.js.",TypeScript,40960,5009,90,2012-09-23T15:17:08Z,2025-11-03T01:30:12Z,https://github.com/hexojs/hexo,https://hexo.io,MIT License,7062,False,False
77,upscayl,upscayl/upscayl,upscayl,"🆙 Upscayl - #1 Free and Open Source AI Image Upscaler for Linux, MacOS and Windows.",TypeScript,40910,1913,55,2022-07-30T17:19:20Z,2025-11-03T00:16:37Z,https://github.com/upscayl/upscayl,https://upscayl.org,GNU Affero General Public License v3.0,567266,False,False
78,vuetify,vuetifyjs/vuetify,vuetifyjs,🐉 Vue Component Framework,TypeScript,40785,7107,651,2016-09-12T00:39:35Z,2025-11-02T05:46:36Z,https://github.com/vuetifyjs/vuetify,https://vuetifyjs.com,Other,97759,False,False
79,zod,colinhacks/zod,colinhacks,TypeScript-first schema validation with static type inference,TypeScript,40554,1665,269,2020-03-07T20:59:08Z,2025-11-03T00:15:27Z,https://github.com/colinhacks/zod,https://zod.dev,MIT License,22827,False,False
80,chakra-ui,chakra-ui/chakra-ui,chakra-ui,Chakra UI is a component system for building SaaS products with speed ⚡️,TypeScript,39909,3525,14,2019-08-17T14:27:54Z,2025-11-02T19:47:19Z,https://github.com/chakra-ui/chakra-ui,https://chakra-ui.com,MIT License,278717,False,False
81,plane,makeplane/plane,makeplane,"🔥 🔥 🔥 Open Source JIRA, Linear, Monday, and Asana Alternative. Plane helps you track your issues, epics, and cycles the easiest way on the planet.",TypeScript,39684,2832,564,2022-11-19T12:55:01Z,2025-11-02T23:49:53Z,https://github.com/makeplane/plane,http://plane.so,GNU Affero General Public License v3.0,196651,False,False
82,RSSHub,DIYgod/RSSHub,DIYgod,🧡 Everything is RSSible,TypeScript,39613,8682,390,2018-04-02T14:43:21Z,2025-11-03T01:37:13Z,https://github.com/DIYgod/RSSHub,https://docs.rsshub.app,MIT License,817893,False,False
83,jan,janhq/jan,janhq,Jan is an open source alternative to ChatGPT that runs 100% offline on your computer.,TypeScript,39042,2357,169,2023-08-17T02:17:10Z,2025-11-03T01:57:02Z,https://github.com/janhq/jan,https://jan.ai/,Other,1466949,False,False
84,full-stack-fastapi-template,fastapi/full-stack-fastapi-template,fastapi,"Full stack, modern web application template. Using FastAPI, React, SQLModel, PostgreSQL, Docker, GitHub Actions, automatic HTTPS and more.",TypeScript,38808,7498,78,2019-02-23T15:08:34Z,2025-11-03T01:43:36Z,https://github.com/fastapi/full-stack-fastapi-template,,MIT License,4704,False,False
85,trpc,trpc/trpc,trpc,🧙‍♀️  Move Fast and Break Nothing. End-to-end typesafe APIs made easy. ,TypeScript,38794,1428,186,2020-07-18T01:17:11Z,2025-11-02T22:12:02Z,https://github.com/trpc/trpc,https://tRPC.io,MIT License,53867,False,False
86,siyuan,siyuan-note/siyuan,siyuan-note,"A privacy-first, self-hosted, fully open source personal knowledge management software, written in typescript and golang.",TypeScript,38770,2381,422,2020-08-30T09:21:35Z,2025-11-03T01:46:15Z,https://github.com/siyuan-note/siyuan,https://b3log.org/siyuan,GNU Affero General Public License v3.0,467808,False,False
87,cal.com,calcom/cal.com,calcom,Scheduling infrastructure for absolutely everyone.,TypeScript,38645,10934,1259,2021-03-22T13:47:42Z,2025-11-02T22:55:40Z,https://github.com/calcom/cal.com,https://cal.com,Other,1055013,False,False
