排名,项目名称,完整名称,作者,描述,语言,Stars,Forks,Issues,创建时间,更新时间,仓库链接,主页链接,许可证,大小(KB),是否Fork,是否已归档
90,every-programmer-should-know,mtdvio/every-programmer-should-know,mtdvio,A collection of (mostly) technical things every software developer should know about,,93812,8435,52,2017-08-24T13:18:26Z,2025-10-26T23:35:34Z,https://github.com/mtdvio/every-programmer-should-know,,Creative Commons Attribution 4.0 International,230,False,False
91,neovim,neovim/neovim,neovim,Vim-fork focused on extensibility and usability,Vim Script,93727,6378,2035,2014-01-31T13:39:22Z,2025-10-27T01:40:36Z,https://github.com/neovim/neovim,https://neovim.io,Other,348795,False,False
92,system-prompts-and-models-of-ai-tools,x1xhlol/system-prompts-and-models-of-ai-tools,x1xhlol,"FULL Augment Code, Claude Code, Cluely, CodeBuddy, Comet, Cursor, Devin AI, Junie, Kiro, Leap.new, Lovable, Manus Agent Tools, NotionAI, Orchids.app, Perplexity, Poke, Qoder, Replit, Same.dev, Trae, Traycer AI, VSCode Agent, Warp.dev, Windsurf, Xcode, Z.ai Code, dia & v0. (And other Open Sourced) System Prompts, Internal Tools & AI Models",,93245,25216,90,2025-03-05T16:38:29Z,2025-10-27T01:55:31Z,https://github.com/x1xhlol/system-prompts-and-models-of-ai-tools,,GNU General Public License v3.0,1128,False,False
93,java-design-patterns,iluwatar/java-design-patterns,iluwatar,Design patterns implemented in Java,Java,93214,27308,198,2014-08-09T16:45:18Z,2025-10-27T00:54:27Z,https://github.com/iluwatar/java-design-patterns,https://java-design-patterns.com,Other,46754,False,False
94,puppeteer,puppeteer/puppeteer,puppeteer,JavaScript API for Chrome and Firefox,TypeScript,92722,9314,293,2017-05-09T22:16:13Z,2025-10-26T23:40:41Z,https://github.com/puppeteer/puppeteer,https://pptr.dev,Apache License 2.0,1219509,False,False
95,Web-Dev-For-Beginners,microsoft/Web-Dev-For-Beginners,microsoft,"24 Lessons, 12 Weeks, Get Started as a Web Developer",JavaScript,92474,14329,40,2020-11-10T02:44:00Z,2025-10-27T00:38:21Z,https://github.com/microsoft/Web-Dev-For-Beginners,,MIT License,1641607,False,False
96,ComfyUI,comfyanonymous/ComfyUI,comfyanonymous,"The most powerful and modular diffusion model GUI, api and backend with a graph/nodes interface.",Python,92012,10340,3094,2023-01-17T03:15:56Z,2025-10-27T01:53:21Z,https://github.com/comfyanonymous/ComfyUI,https://www.comfy.org/,GNU General Public License v3.0,75790,False,False
97,awesome-mac,jaywcjlove/awesome-mac,jaywcjlove," Now we have become very big, Different from the original idea. Collect premium software in various categories.",JavaScript,91778,6941,159,2016-07-17T15:33:47Z,2025-10-27T01:56:39Z,https://github.com/jaywcjlove/awesome-mac,https://git.io/macx,Creative Commons Zero v1.0 Universal,23664,False,False
98,DeepSeek-R1,deepseek-ai/DeepSeek-R1,deepseek-ai,,,91375,11766,43,2025-01-20T11:57:28Z,2025-10-27T02:01:18Z,https://github.com/deepseek-ai/DeepSeek-R1,,MIT License,1571,False,False
99,fastapi,fastapi/fastapi,fastapi,"FastAPI framework, high performance, easy to learn, fast to code, ready for production",Python,91188,8122,199,2018-12-08T08:21:47Z,2025-10-27T01:58:02Z,https://github.com/fastapi/fastapi,https://fastapi.tiangolo.com/,MIT License,28408,False,False
100,tailwindcss,tailwindlabs/tailwindcss,tailwindlabs,A utility-first CSS framework for rapid UI development.,TypeScript,90788,4770,67,2017-10-06T14:59:14Z,2025-10-27T01:07:51Z,https://github.com/tailwindlabs/tailwindcss,https://tailwindcss.com/,MIT License,112514,False,False
