排名,项目名称,完整名称,作者,描述,语言,Stars,Forks,Issues,创建时间,更新时间,仓库链接,主页链接,许可证,大小(KB),是否Fork,是否已归档
1,datasharing,jtleek/datasharing,jtleek,The Leek group guide to data sharing ,,6692,243202,915,2013-11-07T13:25:07Z,2026-02-14T12:39:29Z,https://github.com/jtleek/datasharing,,,590,False,False
2,Spoon-Knife,octocat/Spoon-Knife,octocat,This repo is for demonstration purposes only.,HTML,13606,156191,20307,2011-01-27T19:30:43Z,2026-02-16T00:47:45Z,https://github.com/octocat/Spoon-Knife,,,2,False,False
3,ProgrammingAssignment2,rdpeng/ProgrammingAssignment2,rdpeng,Repository for Programming Assignment 2 for R Programming on Coursera,R,876,143910,4319,2014-01-14T22:07:41Z,2026-02-12T07:22:24Z,https://github.com/rdpeng/ProgrammingAssignment2,,,6670,False,False
4,first-contributions,firstcontributions/first-contributions,firstcontributions,🚀✨ Help beginners to contribute to open source projects,,52632,98146,308,2016-09-20T14:35:09Z,2026-02-16T01:14:28Z,https://github.com/firstcontributions/first-contributions,https://firstcontributions.github.io,MIT License,29921,False,False
5,css-exercises,TheOdinProject/css-exercises,TheOdinProject,,HTML,2568,88706,0,2021-08-17T20:33:19Z,2026-02-15T15:27:38Z,https://github.com/TheOdinProject/css-exercises,,MIT License,7027,False,False
6,SmartThingsPublic,SmartThingsCommunity/SmartThingsPublic,SmartThingsCommunity,SmartThings open-source DeviceType Handlers and SmartApps code,Groovy,2628,88065,2510,2015-08-04T22:48:02Z,2026-02-13T06:30:47Z,https://github.com/SmartThingsCommunity/SmartThingsPublic,https://developer-preview.smartthings.com/docs/devices/hub-connected/get-started,,21066,False,False
7,Complete-Python-3-Bootcamp,Pierian-Data/Complete-Python-3-Bootcamp,Pierian-Data,Course Files for Complete Python 3 Bootcamp Course on Udemy,Jupyter Notebook,29403,87511,270,2018-02-12T19:30:10Z,2026-02-15T21:58:13Z,https://github.com/Pierian-Data/Complete-Python-3-Bootcamp,,,52492,False,False
8,gitignore,github/gitignore,github,A collection of useful .gitignore templates,,172444,82833,94,2010-11-08T20:17:14Z,2026-02-16T01:46:00Z,https://github.com/github/gitignore,,Creative Commons Zero v1.0 Universal,2994,False,False
9,coding-interview-university,jwasham/coding-interview-university,jwasham,A complete computer science study plan to become a software engineer.,,337004,81645,95,2016-06-06T02:34:12Z,2026-02-16T01:44:11Z,https://github.com/jwasham/coding-interview-university,,Creative Commons Attribution Share Alike 4.0 International,22700,False,False
10,bootstrap,twbs/bootstrap,twbs,"The most popular HTML, CSS, and JavaScript framework for developing responsive, mobile first projects on the web.",MDX,173969,79107,580,2011-07-29T21:19:00Z,2026-02-15T23:10:30Z,https://github.com/twbs/bootstrap,https://getbootstrap.com,MIT License,275248,False,False
11,tensorflow,tensorflow/tensorflow,tensorflow,An Open Source Machine Learning Framework for Everyone,C++,193733,75232,3580,2015-11-07T01:19:20Z,2026-02-16T01:39:07Z,https://github.com/tensorflow/tensorflow,https://tensorflow.org,Apache License 2.0,1259575,False,False
12,cgm-remote-monitor,nightscout/cgm-remote-monitor,nightscout,nightscout web monitor,JavaScript,2678,72935,241,2014-05-22T00:32:28Z,2026-02-13T13:53:53Z,https://github.com/nightscout/cgm-remote-monitor,,GNU Affero General Public License v3.0,30440,False,False
13,docs,github/docs,github,The open-source repo for docs.github.com,TypeScript,18925,65996,182,2019-05-31T15:57:39Z,2026-02-15T19:48:08Z,https://github.com/github/docs,https://docs.github.com,Creative Commons Attribution 4.0 International,2255374,False,False
14,free-programming-books,EbookFoundation/free-programming-books,EbookFoundation,:books: Freely available programming books,Python,382572,65903,72,2013-10-11T06:50:37Z,2026-02-16T01:27:36Z,https://github.com/EbookFoundation/free-programming-books,https://ebookfoundation.github.io/free-programming-books/,Creative Commons Attribution 4.0 International,21006,False,False
15,linux,torvalds/linux,torvalds,Linux kernel source tree,C,217462,60443,3,2011-09-04T22:48:12Z,2026-02-16T02:25:25Z,https://github.com/torvalds/linux,,Other,6060161,False,False
16,NextChat,ChatGPTNextWeb/NextChat,ChatGPTNextWeb,✨ Light and Fast AI Assistant. Support: Web | iOS | MacOS | Android |  Linux | Windows,TypeScript,87296,60367,790,2023-03-10T18:27:54Z,2026-02-16T00:50:25Z,https://github.com/ChatGPTNextWeb/NextChat,https://nextchat.club,MIT License,20721,False,False
17,dio-lab-open-source,digitalinnovationone/dio-lab-open-source,digitalinnovationone,"Repositório do lab ""Contribuindo em um Projeto Open Source no GitHub"" da Digital Innovation One.",Jupyter Notebook,8475,60263,15670,2023-04-26T11:34:25Z,2026-02-16T01:13:17Z,https://github.com/digitalinnovationone/dio-lab-open-source,https://digitalinnovationone.github.io/dio-lab-open-source/,,4524455,False,False
18,generative-ai-for-beginners,microsoft/generative-ai-for-beginners,microsoft,"21 Lessons, Get Started Building with Generative AI ",Jupyter Notebook,106438,57026,19,2023-06-19T16:28:59Z,2026-02-16T02:27:12Z,https://github.com/microsoft/generative-ai-for-beginners,,MIT License,6586497,False,False
19,ExData_Plotting1,rdpeng/ExData_Plotting1,rdpeng,Plotting Assignment 1 for Exploratory Data Analysis,,294,56544,690,2014-02-09T03:37:01Z,2026-02-08T08:43:13Z,https://github.com/rdpeng/ExData_Plotting1,,,61643,False,False
20,opencv,opencv/opencv,opencv,Open Source Computer Vision Library,C++,86189,56527,2715,2012-07-19T09:40:17Z,2026-02-16T02:32:06Z,https://github.com/opencv/opencv,https://opencv.org,Apache License 2.0,553500,False,False
21,Python-100-Days,jackfrued/Python-100-Days,jackfrued,Python - 100天从新手到大师,Jupyter Notebook,178671,55406,688,2018-03-01T16:05:52Z,2026-02-16T01:53:00Z,https://github.com/jackfrued/Python-100-Days,,,401350,False,False
22,n8n,n8n-io/n8n,n8n-io,"Fair-code workflow automation platform with native AI capabilities. Combine visual building with custom code, self-host or cloud, 400+ integrations.",TypeScript,174693,54879,1383,2019-06-22T09:24:21Z,2026-02-16T02:31:03Z,https://github.com/n8n-io/n8n,https://n8n.io,Other,384103,False,False
23,ant-design,ant-design/ant-design,ant-design,An enterprise-class UI design language and React UI library,TypeScript,97527,54520,1381,2015-04-24T15:37:24Z,2026-02-16T01:35:02Z,https://github.com/ant-design/ant-design,https://ant.design,MIT License,255106,False,False
24,system-design-primer,donnemartin/system-design-primer,donnemartin,Learn how to design large-scale systems. Prep for the system design interview.  Includes Anki flashcards.,Python,335452,54430,524,2017-02-26T16:15:28Z,2026-02-16T02:33:42Z,https://github.com/donnemartin/system-design-primer,,Other,11243,False,False
25,tutorials,eugenp/tutorials,eugenp,Getting Started with Spring Boot 3: ,Java,37340,53846,34,2013-04-29T18:26:36Z,2026-02-16T02:39:50Z,https://github.com/eugenp/tutorials,https://bit.ly/github-ls,MIT License,118361,False,False
26,CS-Notes,CyC2018/CS-Notes,CyC2018,:books: 技术面试必备基础知识、Leetcode、计算机操作系统、计算机网络、系统设计,,183680,51201,194,2018-02-13T14:56:24Z,2026-02-16T02:15:42Z,https://github.com/CyC2018/CS-Notes,http://cyc2018.xyz,,116179,False,False
27,react,facebook/react,facebook,The library for web and native user interfaces.,JavaScript,243008,50582,1121,2013-05-24T16:15:54Z,2026-02-16T02:10:04Z,https://github.com/facebook/react,https://react.dev,MIT License,919204,False,False
28,Python,TheAlgorithms/Python,TheAlgorithms,All Algorithms implemented in Python,Python,217698,50052,895,2016-07-16T09:44:01Z,2026-02-16T01:57:42Z,https://github.com/TheAlgorithms/Python,https://thealgorithms.github.io/Python/,MIT License,15652,False,False
29,AutoGPT,Significant-Gravitas/AutoGPT,Significant-Gravitas,"AutoGPT is the vision of accessible AI for everyone, to use and to build on. Our mission is to provide the tools, so that you can focus on what matters.",Python,181826,46223,327,2023-03-16T09:21:07Z,2026-02-16T02:19:54Z,https://github.com/Significant-Gravitas/AutoGPT,https://agpt.co,Other,338562,False,False
30,it-cert-automation-practice,google/it-cert-automation-practice,google,Google IT Automation with Python Professional Certificate - Practice files,Python,991,46210,26482,2019-12-17T19:04:12Z,2026-02-13T09:41:59Z,https://github.com/google/it-cert-automation-practice,,Apache License 2.0,16,False,True
31,JavaGuide,Snailclimb/JavaGuide,Snailclimb,Java 面试 & 后端通用面试指南，覆盖计算机基础、数据库、分布式、高并发与系统设计。准备后端技术面试，首选 JavaGuide！,Java,153806,46113,74,2018-05-07T13:27:00Z,2026-02-15T18:33:38Z,https://github.com/Snailclimb/JavaGuide,https://javaguide.cn,Apache License 2.0,178996,False,False
32,models,tensorflow/models,tensorflow,Models and examples built with TensorFlow,Python,77687,45296,1275,2016-02-05T01:15:20Z,2026-02-15T10:38:12Z,https://github.com/tensorflow/models,,Other,661866,False,False
33,javascript-exercises,TheOdinProject/javascript-exercises,TheOdinProject,,JavaScript,1584,45166,0,2017-08-17T18:04:59Z,2026-02-15T00:23:13Z,https://github.com/TheOdinProject/javascript-exercises,,MIT License,5465,False,False
34,kickstart.nvim,nvim-lua/kickstart.nvim,nvim-lua,A launch point for your personal nvim configuration,Lua,29452,44286,58,2022-06-24T03:11:24Z,2026-02-16T02:26:10Z,https://github.com/nvim-lua/kickstart.nvim,,MIT License,840,False,False
35,build-your-own-x,codecrafters-io/build-your-own-x,codecrafters-io,Master programming by recreating your favorite technologies from scratch.,Markdown,466235,43745,474,2018-05-09T12:03:18Z,2026-02-16T02:39:52Z,https://github.com/codecrafters-io/build-your-own-x,https://codecrafters.io,,1055,False,False
36,developer-roadmap,kamranahmedse/developer-roadmap,kamranahmedse,"Interactive roadmaps, guides and other educational content to help developers grow in their careers.",TypeScript,349085,43700,34,2017-03-15T13:45:52Z,2026-02-16T01:06:11Z,https://github.com/kamranahmedse/developer-roadmap,https://roadmap.sh,Other,359178,False,False
37,qmk_firmware,qmk/qmk_firmware,qmk,Open-source keyboard firmware for Atmel AVR and Arm USB families,C,20134,43520,549,2014-12-08T22:02:05Z,2026-02-15T23:13:14Z,https://github.com/qmk/qmk_firmware,https://qmk.fm,GNU General Public License v2.0,505167,False,False
38,freeCodeCamp,freeCodeCamp/freeCodeCamp,freeCodeCamp,"freeCodeCamp.org's open-source codebase and curriculum. Learn math, programming, and computer science for free.",TypeScript,437101,43382,323,2014-12-24T17:49:19Z,2026-02-16T00:33:45Z,https://github.com/freeCodeCamp/freeCodeCamp,https://contribute.freecodecamp.org,"BSD 3-Clause ""New"" or ""Revised"" License",549929,False,False
39,DO180-apps,RedHatTraining/DO180-apps,RedHatTraining,DO180 Repository for Sample Applications,JavaScript,293,42848,72,2019-10-01T12:50:51Z,2026-01-31T06:06:40Z,https://github.com/RedHatTraining/DO180-apps,,,224,False,False
40,public-apis,public-apis/public-apis,public-apis,A collective list of free APIs,Python,398565,42640,849,2016-03-20T23:49:42Z,2026-02-16T02:17:48Z,https://github.com/public-apis/public-apis,https://APILayer.com/?utm_source=Github&utm_medium=Referral&utm_campaign=Public-apis-repo,MIT License,4955,False,False
41,kubernetes,kubernetes/kubernetes,kubernetes,Production-Grade Container Scheduling and Management,Go,120511,42463,2642,2014-06-06T22:56:04Z,2026-02-16T01:32:07Z,https://github.com/kubernetes/kubernetes,https://kubernetes.io,Apache License 2.0,1444053,False,False
42,patchwork,jlord/patchwork,jlord,All the Git-it Workshop completers! ,Rich Text Format,1147,42258,3151,2014-01-10T00:00:11Z,2026-02-02T19:16:25Z,https://github.com/jlord/patchwork,http://jlord.github.io/patchwork,Other,192800,False,False
43,spring-boot,spring-projects/spring-boot,spring-projects,"Spring Boot helps you to create Spring-powered, production-grade applications and services with absolute minimum fuss.",Java,79930,41863,497,2012-10-19T15:02:57Z,2026-02-16T01:25:28Z,https://github.com/spring-projects/spring-boot,https://spring.io/projects/spring-boot,Apache License 2.0,211610,False,False
44,edgetunnel,zizifn/edgetunnel,zizifn,Running V2ray inside edge/serverless runtime,JavaScript,8274,41697,120,2020-12-12T14:32:48Z,2026-02-15T10:43:53Z,https://github.com/zizifn/edgetunnel,,GNU General Public License v2.0,9032,False,False
45,JavaScript30,wesbos/JavaScript30,wesbos,30 Day Vanilla JS Challenge,HTML,29060,41655,67,2016-12-07T19:15:31Z,2026-02-15T22:48:44Z,https://github.com/wesbos/JavaScript30,https://JavaScript30.com,,46985,False,False
46,spring-framework,spring-projects/spring-framework,spring-projects,Spring Framework,Java,59617,38914,351,2010-12-08T04:04:45Z,2026-02-15T19:33:05Z,https://github.com/spring-projects/spring-framework,https://spring.io/projects/spring-framework,Apache License 2.0,238769,False,False
47,bitcoin,bitcoin/bitcoin,bitcoin,Bitcoin Core integration/staging tree,C++,88135,38907,736,2010-12-19T15:16:43Z,2026-02-16T00:50:31Z,https://github.com/bitcoin/bitcoin,https://bitcoincore.org/en/download,MIT License,303672,False,False
48,vscode,microsoft/vscode,microsoft,Visual Studio Code,TypeScript,181721,37959,13939,2015-09-03T20:23:38Z,2026-02-16T02:13:05Z,https://github.com/microsoft/vscode,https://code.visualstudio.com,MIT License,1127779,False,False
49,RepData_PeerAssessment1,rdpeng/RepData_PeerAssessment1,rdpeng,Peer Assessment 1 for Reproducible Research,,105,36938,347,2014-02-10T21:20:28Z,2026-01-24T22:34:12Z,https://github.com/rdpeng/RepData_PeerAssessment1,,,29349,False,False
50,core,home-assistant/core,home-assistant,:house_with_garden: Open source home automation that puts local control and privacy first.,Python,84830,36754,3258,2013-09-17T07:29:48Z,2026-02-16T00:57:28Z,https://github.com/home-assistant/core,https://www.home-assistant.io,Apache License 2.0,785762,False,False
51,three.js,mrdoob/three.js,mrdoob,JavaScript 3D Library.,JavaScript,110891,36273,605,2010-03-23T18:58:01Z,2026-02-16T01:38:23Z,https://github.com/mrdoob/three.js,https://threejs.org/,MIT License,1557973,False,False
52,jekyll-now,barryclark/jekyll-now,barryclark,"Build a Jekyll blog in minutes, without touching the command line.",CSS,8392,35172,384,2014-02-07T00:14:55Z,2026-02-11T13:17:17Z,https://github.com/barryclark/jekyll-now,,MIT License,8406,False,False
53,node,nodejs/node,nodejs,Node.js JavaScript runtime ✨🐢🚀✨,JavaScript,115722,34752,2460,2014-11-26T19:57:11Z,2026-02-16T02:19:01Z,https://github.com/nodejs/node,https://nodejs.org,Other,1415973,False,False
54,swot,leereilly/swot,leereilly,Archived — SWOT delighted millions of students with GitHub discounts and saved bazillions of review hours. Follow JetBrains/swot  for future updates.,Ruby,1165,34968,0,2012-01-31T04:00:56Z,2026-01-30T04:58:29Z,https://github.com/leereilly/swot,,MIT License,2540,False,True
55,openclaw,openclaw/openclaw,openclaw,Your own personal AI assistant. Any OS. Any Platform. The lobster way. 🦞 ,TypeScript,197582,34481,6448,2025-11-24T10:16:47Z,2026-02-16T02:42:19Z,https://github.com/openclaw/openclaw,https://openclaw.ai,MIT License,193835,False,False
56,cpython,python/cpython,python,The Python programming language,Python,71500,34082,9229,2017-02-10T19:23:51Z,2026-02-16T02:23:09Z,https://github.com/python/cpython,https://www.python.org,Other,790324,False,False
57,vue,vuejs/vue,vuejs,"This is the repo for Vue 2. For Vue 3, go to https://github.com/vuejs/core",TypeScript,209885,33881,622,2013-07-29T03:24:51Z,2026-02-16T02:06:10Z,https://github.com/vuejs/vue,http://v2.vuejs.org,MIT License,32152,False,False
58,project-based-learning,practical-tutorials/project-based-learning,practical-tutorials,Curated list of project-based tutorials,,258396,33700,275,2017-04-12T05:07:46Z,2026-02-16T02:36:27Z,https://github.com/practical-tutorials/project-based-learning,,MIT License,438,False,False
59,You-Dont-Know-JS,getify/You-Dont-Know-JS,getify,A book series (2 published editions) on the JS language.,,184395,33665,2,2013-11-16T02:37:24Z,2026-02-16T01:01:20Z,https://github.com/getify/You-Dont-Know-JS,https://www.amazon.com/dp/B085XXCJ7X,Other,15241,False,False
60,django,django/django,django,The Web framework for perfectionists with deadlines.,Python,86770,33643,413,2012-04-28T02:47:18Z,2026-02-16T02:05:35Z,https://github.com/django/django,https://www.djangoproject.com/,"BSD 3-Clause ""New"" or ""Revised"" License",276867,False,False
61,websites,RikkaApps/websites,RikkaApps,Websites for Rikka apps.,Vue,311,33686,4016,2019-08-01T13:09:23Z,2026-02-15T11:43:25Z,https://github.com/RikkaApps/websites,https://rikka.app,,4247,False,False
62,awesome,sindresorhus/awesome,sindresorhus,😎 Awesome lists about all kinds of interesting topics,,437703,33186,70,2014-07-11T13:42:37Z,2026-02-16T02:39:14Z,https://github.com/sindresorhus/awesome,,Creative Commons Zero v1.0 Universal,1520,False,False
63,simple-java-maven-app,jenkins-docs/simple-java-maven-app,jenkins-docs,For an introductory tutorial on how to use Jenkins to build a simple Java application with Maven.,Shell,527,32830,0,2017-09-26T02:35:06Z,2026-02-15T17:51:17Z,https://github.com/jenkins-docs/simple-java-maven-app,https://jenkins.io/doc/tutorials/build-a-java-app-with-maven/,MIT License,115,False,False
64,material-ui,mui/material-ui,mui,Material UI: Comprehensive React component library that implements Google's Material Design. Free forever.,JavaScript,97813,32762,1759,2014-08-18T19:11:54Z,2026-02-16T01:55:31Z,https://github.com/mui/material-ui,https://mui.com/material-ui/,MIT License,709385,False,False
65,transformers,huggingface/transformers,huggingface,"🤗 Transformers: the model-definition framework for state-of-the-art machine learning models in text, vision, audio, and multimodal models, for both inference and training. ",Python,156511,32082,2260,2018-10-29T13:56:00Z,2026-02-16T01:23:59Z,https://github.com/huggingface/transformers,https://huggingface.co/transformers,Apache License 2.0,446820,False,False
66,BPB-Worker-Panel,bia-pain-bache/BPB-Worker-Panel,bia-pain-bache,"A GUI Panel providing Worker subscriptions for VLESS, Trojan and Warp configs alongside chain proxies, offering full DNS, clean IP,  Fragment, Warp, Warp pro and routing settings for cross-platform clients using Amnezia, Wireguard, Sing-box, Clash/Mihomo and Xray cores.",TypeScript,9916,31622,24,2024-01-19T17:58:28Z,2026-02-16T02:17:28Z,https://github.com/bia-pain-bache/BPB-Worker-Panel,https://bia-pain-bache.github.io/BPB-Worker-Panel/,GNU General Public License v3.0,64559,False,False
67,odoo,odoo/odoo,odoo,Odoo. Open Source Apps To Grow Your Business.,Python,49012,31490,9298,2014-05-13T15:38:58Z,2026-02-16T00:09:07Z,https://github.com/odoo/odoo,https://www.odoo.com,Other,14070896,False,False
68,MoonTV,samqin123/MoonTV,samqin123,,TypeScript,1810,31334,22,2025-06-20T03:02:45Z,2026-02-15T21:53:55Z,https://github.com/samqin123/MoonTV,,MIT License,25147,False,False
69,courses,DataScienceSpecialization/courses,DataScienceSpecialization,Course materials for the Data Science Specialization: https://www.coursera.org/specialization/jhudatascience/1,HTML,4116,31147,89,2014-01-21T10:22:57Z,2026-02-15T08:30:59Z,https://github.com/DataScienceSpecialization/courses,,,1083379,False,False
70,javascript-algorithms,trekhleb/javascript-algorithms,trekhleb,📝 Algorithms and data structures implemented in JavaScript with explanations and links to further readings,JavaScript,195541,31127,391,2018-03-24T07:47:04Z,2026-02-16T02:08:27Z,https://github.com/trekhleb/javascript-algorithms,,MIT License,14828,False,False
71,vue-element-admin,PanJiaChen/vue-element-admin,PanJiaChen,:tada: A magical vue admin                                                                https://panjiachen.github.io/vue-element-admin,Vue,90291,30628,1372,2017-04-17T03:35:49Z,2026-02-16T01:42:08Z,https://github.com/PanJiaChen/vue-element-admin,,MIT License,15433,False,False
72,DefinitelyTyped,DefinitelyTyped/DefinitelyTyped,DefinitelyTyped,The repository for high quality TypeScript type definitions.,TypeScript,50942,30563,686,2012-10-05T16:39:45Z,2026-02-16T01:00:02Z,https://github.com/DefinitelyTyped/DefinitelyTyped,,Other,810403,False,False
73,github-readme-stats,anuraghazra/github-readme-stats,anuraghazra,:zap: Dynamically generated stats for your github readmes,JavaScript,78374,30519,250,2020-07-09T10:34:22Z,2026-02-15T23:35:11Z,https://github.com/anuraghazra/github-readme-stats,https://github-readme-stats.vercel.app,MIT License,7445,False,False
74,next.js,vercel/next.js,vercel,The React Framework,JavaScript,137692,30464,3345,2016-10-05T23:32:51Z,2026-02-16T02:13:54Z,https://github.com/vercel/next.js,https://nextjs.org,MIT License,2483706,False,False
75,flutter,flutter/flutter,flutter,Flutter makes it easy and fast to build beautiful apps for mobile and beyond,Dart,175216,29990,12457,2015-03-06T22:54:58Z,2026-02-16T02:18:17Z,https://github.com/flutter/flutter,https://flutter.dev,"BSD 3-Clause ""New"" or ""Revised"" License",429460,False,False
76,stable-diffusion-webui,AUTOMATIC1111/stable-diffusion-webui,AUTOMATIC1111,Stable Diffusion web UI,Python,160562,29957,2457,2022-08-22T14:05:26Z,2026-02-16T01:28:00Z,https://github.com/AUTOMATIC1111/stable-diffusion-webui,,GNU Affero General Public License v3.0,36544,False,False
77,mall,macrozheng/mall,macrozheng,mall项目是一套电商系统，包括前台商城系统及后台管理系统，基于Spring Boot+MyBatis实现，采用Docker容器化部署。 前台商城系统包含首页门户、商品推荐、商品搜索、商品展示、购物车、订单流程、会员中心、客户服务、帮助中心等模块。 后台管理系统包含商品管理、订单管理、会员管理、促销管理、运营管理、内容管理、统计报表、财务管理、权限管理、设置等模块。,Java,82919,29653,12,2018-04-04T01:11:44Z,2026-02-15T23:38:20Z,https://github.com/macrozheng/mall,https://www.macrozheng.com/admin/,Apache License 2.0,58726,False,False
78,system-prompts-and-models-of-ai-tools,x1xhlol/system-prompts-and-models-of-ai-tools,x1xhlol,"FULL Augment Code, Claude Code, Cluely, CodeBuddy, Comet, Cursor, Devin AI, Junie, Kiro, Leap.new, Lovable, Manus, NotionAI, Orchids.app, Perplexity, Poke, Qoder, Replit, Same.dev, Trae, Traycer AI, VSCode Agent, Warp.dev, Windsurf, Xcode, Z.ai Code, Dia & v0. (And other Open Sourced) System Prompts, Internal Tools & AI Models",,114645,29612,124,2025-03-05T16:38:29Z,2026-02-16T02:32:37Z,https://github.com/x1xhlol/system-prompts-and-models-of-ai-tools,,GNU General Public License v3.0,1343,False,False
79,jbbmo-Introduction-to-Git-and-GitHub,ibm-developer-skills-network/jbbmo-Introduction-to-Git-and-GitHub,ibm-developer-skills-network,Introduction to Git and GitHub,Python,80,29185,70,2022-01-12T21:43:00Z,2026-02-15T22:40:41Z,https://github.com/ibm-developer-skills-network/jbbmo-Introduction-to-Git-and-GitHub,,Apache License 2.0,15,False,False
80,spark,apache/spark,apache,Apache Spark - A unified analytics engine for large-scale data processing,Scala,42824,29062,259,2014-02-25T08:00:08Z,2026-02-16T01:22:27Z,https://github.com/apache/spark,https://spark.apache.org/,Apache License 2.0,537097,False,False
81,dotfiles,lewagon/dotfiles,lewagon,Default configuration for Le Wagon's students,Shell,21673,28437,3,2014-04-04T14:54:29Z,2026-02-15T02:20:52Z,https://github.com/lewagon/dotfiles,https://www.lewagon.com,MIT License,216,False,False
82,free-programming-books-zh_CN,justjavac/free-programming-books-zh_CN,justjavac,:books: 免费的计算机编程类中文书籍，欢迎投稿,,116320,28347,31,2013-11-04T01:59:19Z,2026-02-15T21:55:31Z,https://github.com/justjavac/free-programming-books-zh_CN,http://weibo.com/justjavac,GNU General Public License v3.0,1059,False,False
83,spring-petclinic,spring-projects/spring-petclinic,spring-projects,A sample Spring-based application,CSS,8960,28254,6,2013-01-09T09:05:18Z,2026-02-16T01:27:50Z,https://github.com/spring-projects/spring-petclinic,,Apache License 2.0,10850,False,False
84,git,git/git,git,Git Source Code Mirror - This is a publish-only repository but pull requests can be turned into patches to the mailing list via GitGitGadget (https://gitgitgadget.github.io/). Please follow Documentation/SubmittingPatches procedure for any of your improvements.,C,59117,27508,340,2008-07-23T14:21:26Z,2026-02-16T02:28:57Z,https://github.com/git/git,,Other,297115,False,False
85,mslearn-tailspin-spacegame-web,MicrosoftDocs/mslearn-tailspin-spacegame-web,MicrosoftDocs,Code used in Microsoft Learn modules to support Azure DevOps,Shell,215,27480,856,2019-03-22T22:20:37Z,2026-02-13T19:42:57Z,https://github.com/MicrosoftDocs/mslearn-tailspin-spacegame-web,https://aka.ms/devops-build,Creative Commons Attribution 4.0 International,926,False,False
86,learning-area,mdn/learning-area,mdn,GitHub repo for the MDN Learning Area. ,HTML,7527,27406,2,2016-03-08T14:01:49Z,2026-02-13T21:02:59Z,https://github.com/mdn/learning-area,https://developer.mozilla.org/en-US/Learn,Creative Commons Zero v1.0 Universal,87011,False,False
87,java-design-patterns,iluwatar/java-design-patterns,iluwatar,Design patterns implemented in Java,Java,93747,27395,214,2014-08-09T16:45:18Z,2026-02-16T00:41:56Z,https://github.com/iluwatar/java-design-patterns,https://java-design-patterns.com,Other,47229,False,False
88,minimal-mistakes,mmistakes/minimal-mistakes,mmistakes,":triangular_ruler: Jekyll theme for building a personal site, blog, project documentation, or portfolio.",HTML,13395,27368,35,2013-05-24T14:13:30Z,2026-02-16T01:18:13Z,https://github.com/mmistakes/minimal-mistakes,https://mmistakes.github.io/minimal-mistakes/,MIT License,48038,False,False
