排名,项目名称,完整名称,作者,描述,语言,Stars,Forks,Issues,创建时间,更新时间,仓库链接,主页链接,许可证,大小(KB),是否Fork,是否已归档
1,build-your-own-x,codecrafters-io/build-your-own-x,codecrafters-io,Master programming by recreating your favorite technologies from scratch.,Markdown,482492,45402,452,2018-05-09T12:03:18Z,2026-03-23T02:26:49Z,https://github.com/codecrafters-io/build-your-own-x,https://codecrafters.io,,1201,False,False
2,awesome,sindresorhus/awesome,sindresorhus,😎 Awesome lists about all kinds of interesting topics,,448001,33706,88,2014-07-11T13:42:37Z,2026-03-23T02:44:28Z,https://github.com/sindresorhus/awesome,,Creative Commons Zero v1.0 Universal,1534,False,False
3,freeCodeCamp,freeCodeCamp/freeCodeCamp,freeCodeCamp,"freeCodeCamp.org's open-source codebase and curriculum. Learn math, programming, and computer science for free.",TypeScript,438733,43742,232,2014-12-24T17:49:19Z,2026-03-23T02:30:08Z,https://github.com/freeCodeCamp/freeCodeCamp,https://contribute.freecodecamp.org,"BSD 3-Clause ""New"" or ""Revised"" License",556736,False,False
4,public-apis,public-apis/public-apis,public-apis,A collective list of free APIs,Python,414447,44883,1054,2016-03-20T23:49:42Z,2026-03-23T02:44:19Z,https://github.com/public-apis/public-apis,https://APILayer.com/?utm_source=Github&utm_medium=Referral&utm_campaign=Public-apis-repo,MIT License,4962,False,False
5,free-programming-books,EbookFoundation/free-programming-books,EbookFoundation,:books: Freely available programming books,Python,384448,66047,77,2013-10-11T06:50:37Z,2026-03-23T02:45:21Z,https://github.com/EbookFoundation/free-programming-books,https://ebookfoundation.github.io/free-programming-books/,Creative Commons Attribution 4.0 International,21192,False,False
6,developer-roadmap,kamranahmedse/developer-roadmap,kamranahmedse,"Interactive roadmaps, guides and other educational content to help developers grow in their careers.",TypeScript,351484,43840,39,2017-03-15T13:45:52Z,2026-03-23T02:08:23Z,https://github.com/kamranahmedse/developer-roadmap,https://roadmap.sh,Other,359761,False,False
7,system-design-primer,donnemartin/system-design-primer,donnemartin,Learn how to design large-scale systems. Prep for the system design interview.  Includes Anki flashcards.,Python,339880,54990,518,2017-02-26T16:15:28Z,2026-03-23T02:20:32Z,https://github.com/donnemartin/system-design-primer,,Other,11277,False,False
8,coding-interview-university,jwasham/coding-interview-university,jwasham,A complete computer science study plan to become a software engineer.,,338121,81617,99,2016-06-06T02:34:12Z,2026-03-23T02:45:08Z,https://github.com/jwasham/coding-interview-university,,Creative Commons Attribution Share Alike 4.0 International,22700,False,False
9,openclaw,openclaw/openclaw,openclaw,Your own personal AI assistant. Any OS. Any Platform. The lobster way. 🦞 ,TypeScript,330450,64280,15066,2025-11-24T10:16:47Z,2026-03-23T02:45:27Z,https://github.com/openclaw/openclaw,https://openclaw.ai,MIT License,325088,False,False
10,awesome-python,vinta/awesome-python,vinta,"An opinionated list of Python frameworks, libraries, tools, and resources.",Python,288546,27464,17,2014-06-27T21:00:06Z,2026-03-23T02:41:55Z,https://github.com/vinta/awesome-python,https://awesome-python.com/,Other,4947,False,False
11,awesome-selfhosted,awesome-selfhosted/awesome-selfhosted,awesome-selfhosted,A list of Free Software network services and web applications which can be hosted on your own servers,,281555,12946,0,2015-06-01T02:33:17Z,2026-03-23T02:42:06Z,https://github.com/awesome-selfhosted/awesome-selfhosted,https://awesome-selfhosted.net/,Other,16893,False,False
12,996.ICU,996icu/996.ICU,996icu,Repo for counting stars and contributing. Press F to pay respect to glorious developers.,,275812,20935,16700,2019-03-26T07:31:14Z,2026-03-23T02:14:06Z,https://github.com/996icu/996.ICU,https://996.icu,Other,189351,False,False
13,project-based-learning,practical-tutorials/project-based-learning,practical-tutorials,Curated list of project-based tutorials,,261479,34035,283,2017-04-12T05:07:46Z,2026-03-23T02:45:51Z,https://github.com/practical-tutorials/project-based-learning,,MIT License,438,False,False
14,react,facebook/react,facebook,The library for web and native user interfaces.,JavaScript,244141,50852,1182,2013-05-24T16:15:54Z,2026-03-23T02:30:43Z,https://github.com/facebook/react,https://react.dev,MIT License,945754,False,False
15,linux,torvalds/linux,torvalds,Linux kernel source tree,C,224626,61123,3,2011-09-04T22:48:12Z,2026-03-23T02:27:53Z,https://github.com/torvalds/linux,,Other,6095735,False,False
16,Python,TheAlgorithms/Python,TheAlgorithms,All Algorithms implemented in Python,Python,218976,50246,887,2016-07-16T09:44:01Z,2026-03-23T02:19:28Z,https://github.com/TheAlgorithms/Python,https://thealgorithms.github.io/Python/,MIT License,15734,False,False
17,the-book-of-secret-knowledge,trimstray/the-book-of-secret-knowledge,trimstray,"A collection of inspiring lists, manuals, cheatsheets, blogs, hacks, one-liners, cli/web tools and more.",,211223,12649,121,2018-06-23T10:43:14Z,2026-03-23T02:43:07Z,https://github.com/trimstray/the-book-of-secret-knowledge,,MIT License,1748,False,False
18,vue,vuejs/vue,vuejs,"This is the repo for Vue 2. For Vue 3, go to https://github.com/vuejs/core",TypeScript,209987,33856,621,2013-07-29T03:24:51Z,2026-03-23T02:19:12Z,https://github.com/vuejs/vue,http://v2.vuejs.org,MIT License,32152,False,False
19,computer-science,ossu/computer-science,ossu,🎓 Path to a free self-taught education in Computer Science!,HTML,202691,25167,21,2014-05-04T00:18:39Z,2026-03-23T02:19:53Z,https://github.com/ossu/computer-science,,MIT License,1771,False,False
20,javascript-algorithms,trekhleb/javascript-algorithms,trekhleb,📝 Algorithms and data structures implemented in JavaScript with explanations and links to further readings,JavaScript,195804,31105,397,2018-03-24T07:47:04Z,2026-03-23T01:20:02Z,https://github.com/trekhleb/javascript-algorithms,,MIT License,14903,False,False
21,tensorflow,tensorflow/tensorflow,tensorflow,An Open Source Machine Learning Framework for Everyone,C++,194321,75255,3916,2015-11-07T01:19:20Z,2026-03-23T02:00:54Z,https://github.com/tensorflow/tensorflow,https://tensorflow.org,Apache License 2.0,1292749,False,False
22,ohmyzsh,ohmyzsh/ohmyzsh,ohmyzsh,"🙃   A delightful community-driven (with 2,400+ contributors) framework for managing your zsh configuration. Includes 300+ optional plugins (rails, git, macOS, hub, docker, homebrew, node, php, python, etc), 140+ themes to spice up your morning, and an auto-update tool that makes it easy to keep up with the latest updates from the community.",Shell,185584,26315,529,2009-08-28T18:15:37Z,2026-03-23T02:32:37Z,https://github.com/ohmyzsh/ohmyzsh,https://ohmyz.sh,MIT License,13495,False,False
23,You-Dont-Know-JS,getify/You-Dont-Know-JS,getify,A book series (2 published editions) on the JS language.,,184533,33610,2,2013-11-16T02:37:24Z,2026-03-22T18:24:50Z,https://github.com/getify/You-Dont-Know-JS,https://www.amazon.com/dp/B085XXCJ7X,Other,15241,False,False
24,CS-Notes,CyC2018/CS-Notes,CyC2018,:books: 技术面试必备基础知识、Leetcode、计算机操作系统、计算机网络、系统设计,,183991,51128,195,2018-02-13T14:56:24Z,2026-03-23T02:37:53Z,https://github.com/CyC2018/CS-Notes,http://cyc2018.xyz,,116179,False,False
25,vscode,microsoft/vscode,microsoft,Visual Studio Code,TypeScript,182978,38695,15474,2015-09-03T20:23:38Z,2026-03-23T02:28:56Z,https://github.com/microsoft/vscode,https://code.visualstudio.com,MIT License,1158020,False,False
26,AutoGPT,Significant-Gravitas/AutoGPT,Significant-Gravitas,"AutoGPT is the vision of accessible AI for everyone, to use and to build on. Our mission is to provide the tools, so that you can focus on what matters.",Python,182722,46228,372,2023-03-16T09:21:07Z,2026-03-23T02:03:06Z,https://github.com/Significant-Gravitas/AutoGPT,https://agpt.co,Other,401060,False,False
27,n8n,n8n-io/n8n,n8n-io,"Fair-code workflow automation platform with native AI capabilities. Combine visual building with custom code, self-host or cloud, 400+ integrations.",TypeScript,180549,56058,1457,2019-06-22T09:24:21Z,2026-03-23T02:43:46Z,https://github.com/n8n-io/n8n,https://n8n.io,Other,425395,False,False
28,Python-100-Days,jackfrued/Python-100-Days,jackfrued,Python - 100天从新手到大师,Jupyter Notebook,179964,55513,693,2018-03-01T16:05:52Z,2026-03-23T02:43:20Z,https://github.com/jackfrued/Python-100-Days,,,401413,False,False
29,flutter,flutter/flutter,flutter,Flutter makes it easy and fast to build beautiful apps for mobile and beyond,Dart,175651,30151,12492,2015-03-06T22:54:58Z,2026-03-23T02:36:03Z,https://github.com/flutter/flutter,https://flutter.dev,"BSD 3-Clause ""New"" or ""Revised"" License",434761,False,False
30,bootstrap,twbs/bootstrap,twbs,"The most popular HTML, CSS, and JavaScript framework for developing responsive, mobile first projects on the web.",MDX,174108,79035,472,2011-07-29T21:19:00Z,2026-03-23T02:07:09Z,https://github.com/twbs/bootstrap,https://getbootstrap.com,MIT License,280688,False,False
31,gitignore,github/gitignore,github,A collection of useful .gitignore templates,,173162,82744,118,2010-11-08T20:17:14Z,2026-03-23T02:19:29Z,https://github.com/github/gitignore,,Creative Commons Zero v1.0 Universal,2994,False,False
32,Microsoft-Activation-Scripts,massgravel/Microsoft-Activation-Scripts,massgravel,"Open-source Windows and Office activator featuring HWID, Ohook, TSforge, and Online KMS activation methods, along with advanced troubleshooting.",Batchfile,169627,16325,1,2020-01-12T23:03:34Z,2026-03-23T02:43:46Z,https://github.com/massgravel/Microsoft-Activation-Scripts,https://massgrave.dev,GNU General Public License v3.0,12790,False,False
33,awesome-go,avelino/awesome-go,avelino,"A curated list of awesome Go frameworks, libraries and software",Go,168007,13076,172,2014-07-06T13:42:15Z,2026-03-23T02:31:06Z,https://github.com/avelino/awesome-go,https://awesome-go.com,MIT License,10993,False,False
34,ollama,ollama/ollama,ollama,"Get up and running with Kimi-K2.5, GLM-5, MiniMax, DeepSeek, gpt-oss, Qwen, Gemma and other models.",Go,165895,15107,2711,2023-06-26T19:39:32Z,2026-03-23T02:43:27Z,https://github.com/ollama/ollama,https://ollama.com,MIT License,74771,False,False
35,stable-diffusion-webui,AUTOMATIC1111/stable-diffusion-webui,AUTOMATIC1111,Stable Diffusion web UI,Python,161949,30195,2469,2022-08-22T14:05:26Z,2026-03-23T02:09:52Z,https://github.com/AUTOMATIC1111/stable-diffusion-webui,,GNU Affero General Public License v3.0,36552,False,False
36,the-art-of-command-line,jlevy/the-art-of-command-line,jlevy,"Master the command line, in one page",,160464,14795,256,2015-05-20T15:11:03Z,2026-03-23T02:09:11Z,https://github.com/jlevy/the-art-of-command-line,,,2772,False,False
37,transformers,huggingface/transformers,huggingface,"🤗 Transformers: the model-definition framework for state-of-the-art machine learning models in text, vision, audio, and multimodal models, for both inference and training. ",Python,158263,32575,2313,2018-10-29T13:56:00Z,2026-03-23T02:19:42Z,https://github.com/huggingface/transformers,https://huggingface.co/transformers,Apache License 2.0,457490,False,False
38,JavaGuide,Snailclimb/JavaGuide,Snailclimb,Java 面试 & 后端通用面试指南，覆盖计算机基础、数据库、分布式、高并发与系统设计。准备后端技术面试，首选 JavaGuide！,Java,154392,46135,69,2018-05-07T13:27:00Z,2026-03-23T02:39:05Z,https://github.com/Snailclimb/JavaGuide,https://javaguide.cn,Apache License 2.0,180001,False,False
39,prompts.chat,f/prompts.chat,f,"f.k.a. Awesome ChatGPT Prompts. Share, discover, and collect prompts from the community. Free and open source — self-host for your organization with complete privacy.",HTML,153870,20234,38,2022-12-05T13:54:13Z,2026-03-23T02:42:57Z,https://github.com/f/prompts.chat,https://prompts.chat,Creative Commons Zero v1.0 Universal,235849,False,False
40,FreeDomain,DigitalPlatDev/FreeDomain,DigitalPlatDev,DigitalPlat FreeDomain: Free Domain For Everyone,HTML,153780,2636,32,2024-05-30T13:23:00Z,2026-03-23T02:43:17Z,https://github.com/DigitalPlatDev/FreeDomain,https://domain.digitalplat.org,GNU Affero General Public License v3.0,971,False,False
41,yt-dlp,yt-dlp/yt-dlp,yt-dlp,A feature-rich command-line audio/video downloader,Python,152652,12386,2390,2020-10-26T04:22:55Z,2026-03-23T02:38:47Z,https://github.com/yt-dlp/yt-dlp,https://discord.gg/H5MNcFW63r,The Unlicense,60208,False,False
42,javascript,airbnb/javascript,airbnb,JavaScript Style Guide,JavaScript,148126,26760,189,2012-11-01T23:13:50Z,2026-03-23T00:12:17Z,https://github.com/airbnb/javascript,,MIT License,3727,False,False
43,HelloGitHub,521xueweihan/HelloGitHub,521xueweihan,":octocat: 分享 GitHub 上有趣、入门级的开源项目。Share interesting, entry-level open source projects on GitHub.",Python,147051,11251,305,2016-05-04T06:24:11Z,2026-03-23T02:44:26Z,https://github.com/521xueweihan/HelloGitHub,https://hellogithub.com,,8933,False,False
44,langflow,langflow-ai/langflow,langflow-ai,Langflow is a powerful tool for building and deploying AI-powered agents and workflows.,Python,146066,8638,899,2023-02-08T22:28:03Z,2026-03-23T02:45:33Z,https://github.com/langflow-ai/langflow,http://www.langflow.org,MIT License,1182684,False,False
45,youtube-dl,ytdl-org/youtube-dl,ytdl-org,Command-line program to download videos from YouTube.com and other video sites,Python,139931,10605,4120,2010-10-31T14:35:07Z,2026-03-22T22:13:09Z,https://github.com/ytdl-org/youtube-dl,http://ytdl-org.github.io/youtube-dl/,The Unlicense,65510,False,False
46,next.js,vercel/next.js,vercel,The React Framework,JavaScript,138443,30682,3551,2016-10-05T23:32:51Z,2026-03-23T02:42:57Z,https://github.com/vercel/next.js,https://nextjs.org,MIT License,2526071,False,False
47,tech-interview-handbook,yangshun/tech-interview-handbook,yangshun,Curated coding interview preparation materials for busy software engineers,TypeScript,138312,16475,44,2016-07-05T05:00:48Z,2026-03-22T23:53:39Z,https://github.com/yangshun/tech-interview-handbook,https://www.techinterviewhandbook.org,MIT License,33715,False,False
48,scrcpy,Genymobile/scrcpy,Genymobile,Display and control your Android device,C,137390,12806,2759,2017-11-21T18:00:27Z,2026-03-23T02:43:47Z,https://github.com/Genymobile/scrcpy,,Apache License 2.0,8100,False,False
49,dify,langgenius/dify,langgenius,Production-ready platform for agentic workflow development.,TypeScript,133987,20864,811,2023-04-12T07:40:24Z,2026-03-23T02:42:51Z,https://github.com/langgenius/dify,https://dify.ai,Other,323236,False,False
50,go,golang/go,golang,The Go programming language,Go,133152,18873,9880,2014-08-19T04:33:40Z,2026-03-23T02:32:10Z,https://github.com/golang/go,https://go.dev,"BSD 3-Clause ""New"" or ""Revised"" License",429468,False,False
51,fucking-algorithm,labuladong/fucking-algorithm,labuladong,"Crack LeetCode, not only how, but also why. ",Markdown,133104,23691,0,2020-02-19T09:01:23Z,2026-03-23T02:28:19Z,https://github.com/labuladong/fucking-algorithm,https://labuladong.online/,,126234,False,False
52,system-prompts-and-models-of-ai-tools,x1xhlol/system-prompts-and-models-of-ai-tools,x1xhlol,"FULL Augment Code, Claude Code, Cluely, CodeBuddy, Comet, Cursor, Devin AI, Junie, Kiro, Leap.new, Lovable, Manus, NotionAI, Orchids.app, Perplexity, Poke, Qoder, Replit, Same.dev, Trae, Traycer AI, VSCode Agent, Warp.dev, Windsurf, Xcode, Z.ai Code, Dia & v0. (And other Open Sourced) System Prompts, Internal Tools & AI Models",,132739,33568,134,2025-03-05T16:38:29Z,2026-03-23T02:33:14Z,https://github.com/x1xhlol/system-prompts-and-models-of-ai-tools,,GNU General Public License v3.0,1392,False,False
53,PowerToys,microsoft/PowerToys,microsoft,Microsoft PowerToys is a collection of utilities that supercharge productivity and customization on Windows,C#,130827,7803,8395,2019-05-01T17:44:02Z,2026-03-23T02:29:48Z,https://github.com/microsoft/PowerToys,,MIT License,487641,False,False
54,langchain,langchain-ai/langchain,langchain-ai,The agent engineering platform,Python,130632,21525,490,2022-10-17T02:58:36Z,2026-03-23T02:40:45Z,https://github.com/langchain-ai/langchain,https://docs.langchain.com/langchain/,MIT License,527082,False,False
55,open-webui,open-webui/open-webui,open-webui,"User-friendly AI Interface (Supports Ollama, OpenAI API, ...)",Python,128301,18129,273,2023-10-06T22:08:27Z,2026-03-23T02:45:13Z,https://github.com/open-webui/open-webui,https://openwebui.com,Other,342758,False,False
56,opencode,anomalyco/opencode,anomalyco,The open source coding agent.,TypeScript,128137,13548,7323,2025-04-30T20:08:00Z,2026-03-23T02:44:42Z,https://github.com/anomalyco/opencode,https://opencode.ai,MIT License,218512,False,False
57,30-seconds-of-code,Chalarangelo/30-seconds-of-code,Chalarangelo,Coding articles to level up your development skills,JavaScript,127190,12464,4,2017-11-29T17:35:03Z,2026-03-23T01:38:04Z,https://github.com/Chalarangelo/30-seconds-of-code,https://30secondsofcode.org/,Creative Commons Attribution 4.0 International,742733,False,False
58,react-native,facebook/react-native,facebook,A framework for building native applications using React,C++,125626,25122,1245,2015-01-09T18:10:16Z,2026-03-23T02:45:33Z,https://github.com/facebook/react-native,https://reactnative.dev,MIT License,962854,False,False
59,hello-algo,krahets/hello-algo,krahets,"《Hello 算法》：动画图解、一键运行的数据结构与算法教程。支持简中、繁中、English、日本語，提供 Python, Java, C++, C, C#, JS, Go, Swift, Rust, Ruby, Kotlin, TS, Dart 等代码实现",Java,123679,14929,29,2022-11-04T11:08:34Z,2026-03-23T02:38:28Z,https://github.com/krahets/hello-algo,https://www.hello-algo.com,Other,411458,False,False
60,kubernetes,kubernetes/kubernetes,kubernetes,Production-Grade Container Scheduling and Management,Go,121317,42717,2629,2014-06-06T22:56:04Z,2026-03-23T02:32:57Z,https://github.com/kubernetes/kubernetes,https://kubernetes.io,Apache License 2.0,1460166,False,False
61,electron,electron/electron,electron,":electron: Build cross-platform desktop apps with JavaScript, HTML, and CSS",C++,120592,17071,834,2013-04-12T01:47:36Z,2026-03-23T02:10:03Z,https://github.com/electron/electron,https://electronjs.org,MIT License,192582,False,False
62,free-for-dev,ripienaar/free-for-dev,ripienaar,"A list of SaaS, PaaS and IaaS offerings that have free tiers of interest to devops and infradev",HTML,120276,12471,12,2015-03-18T21:06:26Z,2026-03-23T02:27:13Z,https://github.com/ripienaar/free-for-dev,https://free-for.dev/,,9869,False,False
63,excalidraw,excalidraw/excalidraw,excalidraw,Virtual whiteboard for sketching hand-drawn like diagrams,TypeScript,119371,12961,2872,2020-01-02T01:04:43Z,2026-03-23T02:38:53Z,https://github.com/excalidraw/excalidraw,https://excalidraw.com,MIT License,99429,False,False
64,free-programming-books-zh_CN,justjavac/free-programming-books-zh_CN,justjavac,:books: 免费的计算机编程类中文书籍，欢迎投稿,,116498,28316,33,2013-11-04T01:59:19Z,2026-03-22T18:46:35Z,https://github.com/justjavac/free-programming-books-zh_CN,http://weibo.com/justjavac,GNU General Public License v3.0,1059,False,False
65,node,nodejs/node,nodejs,Node.js JavaScript runtime ✨🐢🚀✨,JavaScript,116415,35150,2565,2014-11-26T19:57:11Z,2026-03-23T02:31:57Z,https://github.com/nodejs/node,https://nodejs.org,Other,1439452,False,False
66,iptv,iptv-org/iptv,iptv-org,Collection of publicly available IPTV channels from all over the world,TypeScript,113320,5764,310,2018-11-14T22:00:57Z,2026-03-23T02:40:19Z,https://github.com/iptv-org/iptv,https://iptv-org.github.io,The Unlicense,1205977,False,False
67,d3,d3/d3,d3,"Bring data to life with SVG, Canvas and HTML. :bar_chart::chart_with_upwards_trend::tada:",Shell,112585,22786,29,2010-09-27T17:22:42Z,2026-03-22T23:43:19Z,https://github.com/d3/d3,https://d3js.org,ISC License,59349,False,False
68,three.js,mrdoob/three.js,mrdoob,JavaScript 3D Library.,JavaScript,111508,36307,587,2010-03-23T18:58:01Z,2026-03-23T01:19:06Z,https://github.com/mrdoob/three.js,https://threejs.org/,MIT License,1567571,False,False
69,rust,rust-lang/rust,rust-lang,Empowering everyone to build reliable and efficient software.,Rust,111438,14666,12291,2010-06-16T20:39:03Z,2026-03-23T02:31:53Z,https://github.com/rust-lang/rust,https://www.rust-lang.org,Apache License 2.0,861739,False,False
70,ui,shadcn-ui/ui,shadcn-ui,"A set of beautifully-designed, accessible components and a code distribution platform. Works with your favorite frameworks. Open Source. Open Code.",TypeScript,110426,8276,1806,2023-01-04T12:43:27Z,2026-03-23T02:44:51Z,https://github.com/shadcn-ui/ui,https://ui.shadcn.com,MIT License,55984,False,False
71,rustdesk,rustdesk/rustdesk,rustdesk,"An open-source remote desktop application designed for self-hosting, as an alternative to TeamViewer.",Rust,109845,16406,107,2020-09-28T15:36:08Z,2026-03-23T02:37:50Z,https://github.com/rustdesk/rustdesk,https://rustdesk.com,GNU Affero General Public License v3.0,69223,False,False
72,Awesome-Hacking,Hack-with-Github/Awesome-Hacking,Hack-with-Github,"A collection of various awesome lists for hackers, pentesters and security researchers",,108895,10076,35,2016-03-30T15:47:10Z,2026-03-23T02:41:51Z,https://github.com/Hack-with-Github/Awesome-Hacking,,Creative Commons Zero v1.0 Universal,160,False,False
73,axios,axios/axios,axios,Promise based HTTP client for the browser and node.js,JavaScript,108658,11563,345,2014-08-18T22:30:27Z,2026-03-22T22:34:46Z,https://github.com/axios/axios,https://axios-http.com,MIT License,25522,False,False
74,generative-ai-for-beginners,microsoft/generative-ai-for-beginners,microsoft,"21 Lessons, Get Started Building with Generative AI ",Jupyter Notebook,108379,58091,13,2023-06-19T16:28:59Z,2026-03-23T02:04:18Z,https://github.com/microsoft/generative-ai-for-beginners,,MIT License,6584890,False,False
75,godot,godotengine/godot,godotengine,Godot Engine – Multi-platform 2D and 3D game engine,C++,108297,24744,17903,2014-01-04T16:05:36Z,2026-03-23T02:11:14Z,https://github.com/godotengine/godot,https://godotengine.org,MIT License,1791456,False,False
76,TypeScript,microsoft/TypeScript,microsoft,TypeScript is a superset of JavaScript that compiles to clean JavaScript output.,TypeScript,108244,13308,5500,2014-06-17T15:28:39Z,2026-03-23T01:02:13Z,https://github.com/microsoft/TypeScript,https://www.typescriptlang.org,Apache License 2.0,2955490,False,False
77,GitHub-Chinese-Top-Charts,GrowingGit/GitHub-Chinese-Top-Charts,GrowingGit,:cn: GitHub中文排行榜，各语言分设「软件 | 资料」榜单，精准定位中文好项目。各取所需，高效学习。,Java,107036,13531,193,2019-09-05T03:01:56Z,2026-03-23T02:35:57Z,https://github.com/GrowingGit/GitHub-Chinese-Top-Charts,,Other,123199,False,False
78,ComfyUI,Comfy-Org/ComfyUI,Comfy-Org,"The most powerful and modular diffusion model GUI, api and backend with a graph/nodes interface.",Python,106682,12289,3878,2023-01-17T03:15:56Z,2026-03-23T02:43:17Z,https://github.com/Comfy-Org/ComfyUI,https://www.comfy.org/,GNU General Public License v3.0,82491,False,False
79,deno,denoland/deno,denoland,A modern runtime for JavaScript and TypeScript.,Rust,106458,5958,2316,2018-05-15T01:34:26Z,2026-03-22T23:32:28Z,https://github.com/denoland/deno,https://deno.com,MIT License,205198,False,False
80,frp,fatedier/frp,fatedier,A fast reverse proxy to help you expose a local server behind a NAT or firewall to the internet.,Go,105505,14955,45,2015-12-21T15:24:59Z,2026-03-23T02:43:57Z,https://github.com/fatedier/frp,,Apache License 2.0,31669,False,False
81,superpowers,obra/superpowers,obra,An agentic skills framework & software development methodology that works.,Shell,105464,8475,170,2025-10-09T19:45:18Z,2026-03-23T02:45:35Z,https://github.com/obra/superpowers,,MIT License,2103,False,False
82,nodebestpractices,goldbergyoni/nodebestpractices,goldbergyoni,:white_check_mark:  The Node.js best practices list (July 2024),Dockerfile,105178,10702,93,2017-09-15T08:33:19Z,2026-03-22T20:45:27Z,https://github.com/goldbergyoni/nodebestpractices,https://twitter.com/nodepractices/,Creative Commons Attribution Share Alike 4.0 International,69535,False,False
83,clash-verge-rev,clash-verge-rev/clash-verge-rev,clash-verge-rev,"A modern GUI client based on Tauri, designed to run in Windows, macOS and Linux for tailored proxy experience",TypeScript,104640,7616,199,2023-11-21T18:24:03Z,2026-03-23T02:44:29Z,https://github.com/clash-verge-rev/clash-verge-rev,https://www.clashverge.dev,GNU General Public License v3.0,74291,False,False
84,tauri,tauri-apps/tauri,tauri-apps,"Build smaller, faster, and more secure desktop and mobile applications with a web frontend.",Rust,104502,3463,1381,2019-07-13T09:09:37Z,2026-03-23T02:39:22Z,https://github.com/tauri-apps/tauri,https://tauri.app,Apache License 2.0,102792,False,False
85,papers-we-love,papers-we-love/papers-we-love,papers-we-love,Papers from the computer science community to read and discuss.,Shell,104376,6302,3,2013-12-15T14:31:41Z,2026-03-23T01:57:15Z,https://github.com/papers-we-love/papers-we-love,http://paperswelove.org/,,230836,False,False
86,create-react-app,facebook/create-react-app,facebook,Set up a modern web app by running one command.,JavaScript,103811,27109,2374,2016-07-17T14:55:11Z,2026-03-22T15:03:57Z,https://github.com/facebook/create-react-app,https://create-react-app.dev,MIT License,25186,False,False
87,awesome-llm-apps,Shubhamsaboo/awesome-llm-apps,Shubhamsaboo,"Collection of awesome LLM apps with AI Agents and RAG using OpenAI, Anthropic, Gemini and opensource models.",Python,103173,15057,3,2024-04-29T05:30:25Z,2026-03-23T02:37:33Z,https://github.com/Shubhamsaboo/awesome-llm-apps,https://www.theunwindai.com,Apache License 2.0,201337,False,False
