排名,项目名称,完整名称,作者,描述,语言,Stars,Forks,Issues,创建时间,更新时间,仓库链接,主页链接,许可证,大小(KB),是否Fork,是否已归档
87,three.js,mrdoob/three.js,mrdoob,JavaScript 3D Library.,JavaScript,113224,36394,413,2010-03-23T18:58:01Z,2026-06-22T04:10:00Z,https://github.com/mrdoob/three.js,https://threejs.org/,MIT License,1607860,False,False
88,d3,d3/d3,d3,"Bring data to life with SVG, Canvas and HTML. :bar_chart::chart_with_upwards_trend::tada:",Shell,113110,22715,20,2010-09-27T17:22:42Z,2026-06-22T02:40:19Z,https://github.com/d3/d3,https://d3js.org,ISC License,59348,False,False
89,godot,godotengine/godot,godotengine,Godot Engine – Multi-platform 2D and 3D game engine,C++,112891,25726,18478,2014-01-04T16:05:36Z,2026-06-22T04:31:15Z,https://github.com/godotengine/godot,https://godotengine.org,MIT License,1844074,False,False
90,gstack,garrytan/gstack,garrytan,"Use Garry Tan's exact Claude Code setup: 23 opinionated tools that serve as CEO, Designer, Eng Manager, Release Manager, Doc Engineer, and QA",TypeScript,112442,16713,717,2026-03-11T21:22:45Z,2026-06-22T04:59:52Z,https://github.com/garrytan/gstack,,MIT License,110636,False,False
91,generative-ai-for-beginners,microsoft/generative-ai-for-beginners,microsoft,"21 Lessons, Get Started Building with Generative AI ",Jupyter Notebook,112195,60258,9,2023-06-19T16:28:59Z,2026-06-22T04:53:04Z,https://github.com/microsoft/generative-ai-for-beginners,,MIT License,6595899,False,False
92,v2rayN,2dust/v2rayN,2dust,"A GUI client for Windows, Linux and macOS, support Xray and sing-box and others",C#,109613,15408,11,2019-07-30T03:47:24Z,2026-06-22T04:27:18Z,https://github.com/2dust/v2rayN,https://v2rayn.2dust.link,GNU General Public License v3.0,48287,False,False
93,TypeScript,microsoft/TypeScript,microsoft,TypeScript is a superset of JavaScript that compiles to clean JavaScript output.,TypeScript,109360,13444,5051,2014-06-17T15:28:39Z,2026-06-22T04:57:56Z,https://github.com/microsoft/TypeScript,https://www.typescriptlang.org,Apache License 2.0,2960443,False,False
94,axios,axios/axios,axios,Promise based HTTP client for the browser and node.js,JavaScript,109080,11724,125,2014-08-18T22:30:27Z,2026-06-22T02:15:10Z,https://github.com/axios/axios,https://axios-http.com,MIT License,27801,False,False
95,GitHub-Chinese-Top-Charts,GrowingGit/GitHub-Chinese-Top-Charts,GrowingGit,:cn: GitHub中文排行榜，各语言分设「软件 | 资料」榜单，精准定位中文好项目。各取所需，高效学习。,Java,108471,13532,193,2019-09-05T03:01:56Z,2026-06-22T04:25:17Z,https://github.com/GrowingGit/GitHub-Chinese-Top-Charts,,Other,123199,False,False
96,tauri,tauri-apps/tauri,tauri-apps,"Build smaller, faster, and more secure desktop and mobile applications with a web frontend.",Rust,108181,3714,1433,2019-07-13T09:09:37Z,2026-06-22T04:41:43Z,https://github.com/tauri-apps/tauri,https://tauri.app,Apache License 2.0,104683,False,False
97,frp,fatedier/frp,fatedier,A fast reverse proxy to help you expose a local server behind a NAT or firewall to the internet.,Go,107476,15073,49,2015-12-21T15:24:59Z,2026-06-22T03:42:58Z,https://github.com/fatedier/frp,,Apache License 2.0,32199,False,False
98,papers-we-love,papers-we-love/papers-we-love,papers-we-love,Papers from the computer science community to read and discuss.,Shell,107222,6376,2,2013-12-15T14:31:41Z,2026-06-22T04:32:56Z,https://github.com/papers-we-love/papers-we-love,http://paperswelove.org/,,230845,False,False
99,deno,denoland/deno,denoland,A modern runtime for JavaScript and TypeScript.,Rust,107191,6079,1330,2018-05-15T01:34:26Z,2026-06-22T03:19:36Z,https://github.com/denoland/deno,https://deno.com,MIT License,236446,False,False
100,awesome-mac,jaywcjlove/awesome-mac,jaywcjlove, This project is dedicated to collecting high-quality macOS software and organizing them systematically by different categories for easy search and use.,Swift,106112,7923,393,2016-07-17T15:33:47Z,2026-06-22T04:39:49Z,https://github.com/jaywcjlove/awesome-mac,https://git.io/macx,Creative Commons Zero v1.0 Universal,43687,False,False
