排名,项目名称,完整名称,作者,描述,语言,Stars,Forks,Issues,创建时间,更新时间,仓库链接,主页链接,许可证,大小(KB),是否Fork,是否已归档
1,build-your-own-x,codecrafters-io/build-your-own-x,codecrafters-io,Master programming by recreating your favorite technologies from scratch.,Markdown,518178,49018,508,2018-05-09T12:03:18Z,2026-06-22T04:58:52Z,https://github.com/codecrafters-io/build-your-own-x,https://codecrafters.io,,1201,False,False
2,awesome,sindresorhus/awesome,sindresorhus,😎 Awesome lists about all kinds of interesting topics,,477752,35496,85,2014-07-11T13:42:37Z,2026-06-22T04:53:06Z,https://github.com/sindresorhus/awesome,,Creative Commons Zero v1.0 Universal,1565,False,False
3,freeCodeCamp,freeCodeCamp/freeCodeCamp,freeCodeCamp,"freeCodeCamp.org's open-source codebase and curriculum. Learn math, programming, and computer science for free.",TypeScript,450109,45196,182,2014-12-24T17:49:19Z,2026-06-22T04:56:53Z,https://github.com/freeCodeCamp/freeCodeCamp,https://contribute.freecodecamp.org,"BSD 3-Clause ""New"" or ""Revised"" License",576313,False,False
4,public-apis,public-apis/public-apis,public-apis,A collective list of free APIs,Python,443384,48599,1440,2016-03-20T23:49:42Z,2026-06-22T04:33:18Z,https://github.com/public-apis/public-apis,https://APILayer.com/?utm_source=Github&utm_medium=Referral&utm_campaign=Public-apis-repo,MIT License,6552,False,False
5,free-programming-books,EbookFoundation/free-programming-books,EbookFoundation,:books: Freely available programming books,Python,390618,66441,82,2013-10-11T06:50:37Z,2026-06-22T04:34:27Z,https://github.com/EbookFoundation/free-programming-books,https://ebookfoundation.github.io/free-programming-books/,Creative Commons Attribution 4.0 International,21422,False,False
6,openclaw,openclaw/openclaw,openclaw,Your own personal AI assistant. Any OS. Any Platform. The lobster way. 🦞 ,TypeScript,379847,79517,6466,2025-11-24T10:16:47Z,2026-06-22T05:00:01Z,https://github.com/openclaw/openclaw,https://openclaw.ai,Other,1605574,False,False
7,developer-roadmap,nilbuild/developer-roadmap,nilbuild,"Interactive roadmaps, guides and other educational content to help developers grow in their careers.",TypeScript,357947,44247,19,2017-03-15T13:45:52Z,2026-06-22T04:59:34Z,https://github.com/nilbuild/developer-roadmap,https://roadmap.sh,Other,361305,False,False
8,system-design-primer,donnemartin/system-design-primer,donnemartin,Learn how to design large-scale systems. Prep for the system design interview.  Includes Anki flashcards.,Python,354252,56831,553,2017-02-26T16:15:28Z,2026-06-22T04:58:35Z,https://github.com/donnemartin/system-design-primer,,Other,11277,False,False
9,coding-interview-university,jwasham/coding-interview-university,jwasham,A complete computer science study plan to become a software engineer.,,353449,83761,117,2016-06-06T02:34:12Z,2026-06-22T04:58:16Z,https://github.com/jwasham/coding-interview-university,,Creative Commons Attribution Share Alike 4.0 International,22700,False,False
10,awesome-python,vinta/awesome-python,vinta,"An opinionated list of Python frameworks, libraries, tools, and resources",Python,304195,28130,19,2014-06-27T21:00:06Z,2026-06-22T05:00:39Z,https://github.com/vinta/awesome-python,https://awesome-python.com/,Other,5728,False,False
11,awesome-selfhosted,awesome-selfhosted/awesome-selfhosted,awesome-selfhosted,A list of Free Software network services and web applications which can be hosted on your own servers,,300503,14011,0,2015-06-01T02:33:17Z,2026-06-22T04:53:06Z,https://github.com/awesome-selfhosted/awesome-selfhosted,https://awesome-selfhosted.net/,Other,16977,False,False
12,996.ICU,996icu/996.ICU,996icu,Repo for counting stars and contributing. Press F to pay respect to glorious developers.,,276310,20821,16692,2019-03-26T07:31:14Z,2026-06-22T02:50:06Z,https://github.com/996icu/996.ICU,https://996.icu,Other,189351,False,False
13,project-based-learning,practical-tutorials/project-based-learning,practical-tutorials,Curated list of project-based tutorials,,270388,34965,313,2017-04-12T05:07:46Z,2026-06-22T04:55:24Z,https://github.com/practical-tutorials/project-based-learning,,MIT License,438,False,False
14,react,react/react,react,The library for web and native user interfaces.,JavaScript,245994,51080,1293,2013-05-24T16:15:54Z,2026-06-22T04:44:56Z,https://github.com/react/react,https://react.dev,MIT License,997109,False,False
15,linux,torvalds/linux,torvalds,Linux kernel source tree,C,237194,62814,3,2011-09-04T22:48:12Z,2026-06-22T04:53:36Z,https://github.com/torvalds/linux,,Other,6201031,False,False
16,superpowers,obra/superpowers,obra,An agentic skills framework & software development methodology that works.,Shell,235215,20883,276,2025-10-09T19:45:18Z,2026-06-22T05:00:16Z,https://github.com/obra/superpowers,,MIT License,3530,False,False
17,the-book-of-secret-knowledge,trimstray/the-book-of-secret-knowledge,trimstray,"A collection of inspiring lists, manuals, cheatsheets, blogs, hacks, one-liners, cli/web tools and more.",,229624,13746,155,2018-06-23T10:43:14Z,2026-06-22T05:00:33Z,https://github.com/trimstray/the-book-of-secret-knowledge,,MIT License,1748,False,False
18,Python,TheAlgorithms/Python,TheAlgorithms,All Algorithms implemented in Python,Python,222116,50774,977,2016-07-16T09:44:01Z,2026-06-22T04:37:48Z,https://github.com/TheAlgorithms/Python,https://thealgorithms.github.io/Python/,MIT License,16572,False,False
19,ECC,affaan-m/ECC,affaan-m,"The agent harness performance optimization system. Skills, instincts, memory, security, and research-first development for Claude Code, Codex, Opencode, Cursor and beyond.",JavaScript,219427,33634,67,2026-01-18T00:51:51Z,2026-06-22T04:57:49Z,https://github.com/affaan-m/ECC,https://ecc.tools,MIT License,38289,False,False
20,vue,vuejs/vue,vuejs,"This is the repo for Vue 2. For Vue 3, go to https://github.com/vuejs/core",TypeScript,209951,33707,635,2013-07-29T03:24:51Z,2026-06-22T04:08:56Z,https://github.com/vuejs/vue,http://v2.vuejs.org,MIT License,32152,False,False
21,computer-science,ossu/computer-science,ossu,🎓 Path to a free self-taught education in Computer Science!,HTML,205142,25491,25,2014-05-04T00:18:39Z,2026-06-22T04:59:14Z,https://github.com/ossu/computer-science,https://cs.ossu.dev,MIT License,1784,False,False
22,hermes-agent,NousResearch/hermes-agent,NousResearch,The agent that grows with you,Python,199181,35382,22538,2025-07-22T22:22:28Z,2026-06-22T04:57:21Z,https://github.com/NousResearch/hermes-agent,https://hermes-agent.nousresearch.com,MIT License,355261,False,False
23,javascript-algorithms,trekhleb/javascript-algorithms,trekhleb,📝 Algorithms and data structures implemented in JavaScript with explanations and links to further readings,JavaScript,196117,31053,405,2018-03-24T07:47:04Z,2026-06-22T01:45:22Z,https://github.com/trekhleb/javascript-algorithms,,MIT License,14955,False,False
24,tensorflow,tensorflow/tensorflow,tensorflow,An Open Source Machine Learning Framework for Everyone,C++,195812,75198,3514,2015-11-07T01:19:20Z,2026-06-22T04:38:11Z,https://github.com/tensorflow/tensorflow,https://tensorflow.org,Apache License 2.0,1336518,False,False
25,claw-code,ultraworkers/claw-code,ultraworkers,"An agent-managed museum exhibit, built in Rust with Gajae-Code / LazyCodex — developed and maintained with no human intervention.",Rust,194126,109925,16,2026-03-31T08:58:08Z,2026-06-22T04:55:33Z,https://github.com/ultraworkers/claw-code,,MIT License,24138,False,False
26,n8n,n8n-io/n8n,n8n-io,"Fair-code workflow automation platform with native AI capabilities. Combine visual building with custom code, self-host or cloud, 400+ integrations.",TypeScript,193542,58736,1476,2019-06-22T09:24:21Z,2026-06-22T04:53:34Z,https://github.com/n8n-io/n8n,https://n8n.io,Other,493054,False,False
27,ohmyzsh,ohmyzsh/ohmyzsh,ohmyzsh,"🙃   A delightful community-driven (with 2,500+ contributors) framework for managing your zsh configuration. Includes 300+ optional plugins (rails, git, macOS, hub, docker, homebrew, node, php, python, etc), 140+ themes to spice up your morning, and an auto-update tool that makes it easy to keep up with the latest updates from the community.",Shell,188181,26374,564,2009-08-28T18:15:37Z,2026-06-22T04:44:58Z,https://github.com/ohmyzsh/ohmyzsh,https://ohmyz.sh,MIT License,13633,False,False
28,vscode,microsoft/vscode,microsoft,Visual Studio Code,TypeScript,186621,40603,18608,2015-09-03T20:23:38Z,2026-06-22T04:58:12Z,https://github.com/microsoft/vscode,https://code.visualstudio.com,MIT License,1302441,False,False
29,AutoGPT,Significant-Gravitas/AutoGPT,Significant-Gravitas,"AutoGPT is the vision of accessible AI for everyone, to use and to build on. Our mission is to provide the tools, so that you can focus on what matters.",Python,185064,46117,452,2023-03-16T09:21:07Z,2026-06-22T04:48:04Z,https://github.com/Significant-Gravitas/AutoGPT,https://agpt.co,Other,621048,False,False
30,CS-Notes,CyC2018/CS-Notes,CyC2018,:books: 技术面试必备基础知识、Leetcode、计算机操作系统、计算机网络、系统设计,,184585,50876,196,2018-02-13T14:56:24Z,2026-06-22T03:17:57Z,https://github.com/CyC2018/CS-Notes,http://cyc2018.xyz,,116179,False,False
31,You-Dont-Know-JS,getify/You-Dont-Know-JS,getify,A book series (2 published editions) on the JS language.,,184542,33511,2,2013-11-16T02:37:24Z,2026-06-22T04:31:46Z,https://github.com/getify/You-Dont-Know-JS,https://www.amazon.com/dp/B085XXCJ7X,Other,15241,False,False
32,Python-100-Days,jackfrued/Python-100-Days,jackfrued,Python - 100天从新手到大师,Jupyter Notebook,183588,55672,701,2018-03-01T16:05:52Z,2026-06-22T04:34:39Z,https://github.com/jackfrued/Python-100-Days,,,401142,False,False
33,Microsoft-Activation-Scripts,massgravel/Microsoft-Activation-Scripts,massgravel,"Open-source Windows and Office activator featuring HWID, Ohook, TSforge, and Online KMS activation methods, along with advanced troubleshooting.",Batchfile,180185,17254,2,2020-01-12T23:03:34Z,2026-06-22T04:59:46Z,https://github.com/massgravel/Microsoft-Activation-Scripts,https://massgrave.dev,GNU General Public License v3.0,12997,False,False
34,andrej-karpathy-skills,multica-ai/andrej-karpathy-skills,multica-ai,"A single CLAUDE.md file to improve Claude Code behavior, derived from Andrej Karpathy's observations on LLM coding pitfalls.",,179879,18402,122,2026-01-27T03:53:13Z,2026-06-22T04:58:20Z,https://github.com/multica-ai/andrej-karpathy-skills,,,20,False,False
35,FreeDomain,DigitalPlatDev/FreeDomain,DigitalPlatDev,DigitalPlat FreeDomain: Free Domain For Everyone,HTML,179694,3658,33,2024-05-30T13:23:00Z,2026-06-22T04:59:46Z,https://github.com/DigitalPlatDev/FreeDomain,https://domain.digitalplat.org,GNU Affero General Public License v3.0,972,False,False
36,opencode,anomalyco/opencode,anomalyco,The open source coding agent.,TypeScript,177077,21618,7361,2025-04-30T20:08:00Z,2026-06-22T04:47:20Z,https://github.com/anomalyco/opencode,https://opencode.ai,MIT License,290727,False,False
37,flutter,flutter/flutter,flutter,Flutter makes it easy and fast to build beautiful apps for mobile and beyond,Dart,177028,30537,12849,2015-03-06T22:54:58Z,2026-06-22T04:55:11Z,https://github.com/flutter/flutter,https://flutter.dev,"BSD 3-Clause ""New"" or ""Revised"" License",447620,False,False
38,awesome-go,avelino/awesome-go,avelino,"A curated list of awesome Go frameworks, libraries and software",Go,176067,13338,184,2014-07-06T13:42:15Z,2026-06-22T04:53:51Z,https://github.com/avelino/awesome-go,https://awesome-go.com,MIT License,11730,False,False
39,ollama,ollama/ollama,ollama,"Get up and running with Kimi-K2.6, GLM-5.1, MiniMax, DeepSeek, gpt-oss, Qwen, Gemma and other models.",Go,174695,16704,3490,2023-06-26T19:39:32Z,2026-06-22T04:51:44Z,https://github.com/ollama/ollama,https://ollama.com,MIT License,88848,False,False
40,gitignore,github/gitignore,github,A collection of useful .gitignore templates,,174550,82394,71,2010-11-08T20:17:14Z,2026-06-22T02:46:49Z,https://github.com/github/gitignore,,Creative Commons Zero v1.0 Universal,3137,False,False
41,bootstrap,twbs/bootstrap,twbs,"The most popular HTML, CSS, and JavaScript framework for developing responsive, mobile first projects on the web.",MDX,174373,78792,445,2011-07-29T21:19:00Z,2026-06-22T01:30:49Z,https://github.com/twbs/bootstrap,https://getbootstrap.com,MIT License,299622,False,False
42,yt-dlp,yt-dlp/yt-dlp,yt-dlp,A feature-rich command-line audio/video downloader,Python,172445,14529,2543,2020-10-26T04:22:55Z,2026-06-22T04:57:21Z,https://github.com/yt-dlp/yt-dlp,https://discord.gg/H5MNcFW63r,The Unlicense,61131,False,False
43,prompts.chat,f/prompts.chat,f,"f.k.a. Awesome ChatGPT Prompts. Share, discover, and collect prompts from the community. Free and open source — self-host for your organization with complete privacy.",HTML,164059,21253,55,2022-12-05T13:54:13Z,2026-06-22T04:37:50Z,https://github.com/f/prompts.chat,https://prompts.chat,Other,400629,False,False
44,stable-diffusion-webui,AUTOMATIC1111/stable-diffusion-webui,AUTOMATIC1111,Stable Diffusion web UI,Python,163825,30366,2491,2022-08-22T14:05:26Z,2026-06-22T04:51:28Z,https://github.com/AUTOMATIC1111/stable-diffusion-webui,,GNU Affero General Public License v3.0,36552,False,False
45,HelloGitHub,521xueweihan/HelloGitHub,521xueweihan,":octocat: 分享 GitHub 上有趣、入门级的开源项目。Share interesting, entry-level open source projects on GitHub.",Python,162244,12202,451,2016-05-04T06:24:11Z,2026-06-22T04:44:37Z,https://github.com/521xueweihan/HelloGitHub,https://hellogithub.com,,8987,False,False
46,transformers,huggingface/transformers,huggingface,"🤗 Transformers: the model-definition framework for state-of-the-art machine learning models in text, vision, audio, and multimodal models, for both inference and training. ",Python,161783,33565,2457,2018-10-29T13:56:00Z,2026-06-22T04:40:48Z,https://github.com/huggingface/transformers,https://huggingface.co/transformers,Apache License 2.0,516294,False,False
47,the-art-of-command-line,jlevy/the-art-of-command-line,jlevy,"Master the command line, in one page",,161404,14827,256,2015-05-20T15:11:03Z,2026-06-22T03:37:31Z,https://github.com/jlevy/the-art-of-command-line,,,2772,False,False
48,markitdown,microsoft/markitdown,microsoft,Python tool for converting files and office documents to Markdown.,Python,157284,10972,859,2024-11-13T19:56:40Z,2026-06-22T04:59:13Z,https://github.com/microsoft/markitdown,,MIT License,4285,False,False
49,JavaGuide,Snailclimb/JavaGuide,Snailclimb,Java 面试 & 后端通用面试指南，覆盖计算机基础、数据库、分布式、高并发、系统设计与 AI 应用开发,JavaScript,156515,46147,59,2018-05-07T13:27:00Z,2026-06-22T04:20:52Z,https://github.com/Snailclimb/JavaGuide,https://javaguide.cn,Apache License 2.0,182918,False,False
50,skills,anthropics/skills,anthropics,Public repository for Agent Skills,Python,153605,18115,974,2025-09-22T15:53:31Z,2026-06-22T04:57:58Z,https://github.com/anthropics/skills,,,3942,False,False
51,langflow,langflow-ai/langflow,langflow-ai,Langflow is a powerful tool for building and deploying AI-powered agents and workflows.,Python,149917,9315,969,2023-02-08T22:28:03Z,2026-06-22T04:13:03Z,https://github.com/langflow-ai/langflow,http://www.langflow.org,MIT License,1370814,False,False
52,javascript,airbnb/javascript,airbnb,JavaScript Style Guide,JavaScript,148090,26649,159,2012-11-01T23:13:50Z,2026-06-22T01:28:31Z,https://github.com/airbnb/javascript,,MIT License,3738,False,False
53,dify,langgenius/dify,langgenius,Production-ready platform for agentic workflow development.,TypeScript,146089,22981,782,2023-04-12T07:40:24Z,2026-06-22T05:00:15Z,https://github.com/langgenius/dify,https://dify.ai,Other,400135,False,False
54,scrcpy,Genymobile/scrcpy,Genymobile,Display and control your Android device,C,144023,13282,2840,2017-11-21T18:00:27Z,2026-06-22T04:46:09Z,https://github.com/Genymobile/scrcpy,,Apache License 2.0,8676,False,False
55,open-webui,open-webui/open-webui,open-webui,"User-friendly AI Interface (Supports Ollama, OpenAI API, ...)",Python,142556,20498,408,2023-10-06T22:08:27Z,2026-06-22T04:52:21Z,https://github.com/open-webui/open-webui,https://openwebui.com,Other,376339,False,False
56,system-prompts-and-models-of-ai-tools,x1xhlol/system-prompts-and-models-of-ai-tools,x1xhlol,"FULL Augment Code, Claude Code, Cluely, CodeBuddy, Comet, Cursor, Devin AI, Junie, Kiro, Leap.new, Lovable, Manus, NotionAI, Orchids.app, Perplexity, Poke, Qoder, Replit, Same.dev, Trae, Traycer AI, VSCode Agent, Warp.dev, Windsurf, Xcode, Z.ai Code, Dia & v0. (And other Open Sourced) System Prompts, Internal Tools & AI Models",,141006,34744,154,2025-03-05T16:38:29Z,2026-06-22T04:54:42Z,https://github.com/x1xhlol/system-prompts-and-models-of-ai-tools,,GNU General Public License v3.0,1428,False,False
57,youtube-dl,ytdl-org/youtube-dl,ytdl-org,Command-line program to download videos from YouTube.com and other video sites,Python,140557,10677,4128,2010-10-31T14:35:07Z,2026-06-22T04:20:24Z,https://github.com/ytdl-org/youtube-dl,http://ytdl-org.github.io/youtube-dl/,The Unlicense,65510,False,False
58,tech-interview-handbook,yangshun/tech-interview-handbook,yangshun,Curated coding interview preparation materials for busy software engineers,TypeScript,140431,16632,46,2016-07-05T05:00:48Z,2026-06-22T04:42:29Z,https://github.com/yangshun/tech-interview-handbook,https://www.techinterviewhandbook.org,MIT License,33749,False,False
59,skills,mattpocock/skills,mattpocock,Skills for Real Engineers. Straight from my .claude directory.,Shell,140146,12157,87,2026-02-03T11:15:53Z,2026-06-22T05:00:16Z,https://github.com/mattpocock/skills,,MIT License,336,False,False
60,next.js,vercel/next.js,vercel,The React Framework,JavaScript,140129,31234,4119,2016-10-05T23:32:51Z,2026-06-22T04:51:36Z,https://github.com/vercel/next.js,https://nextjs.org,MIT License,2493729,False,False
61,langchain,langchain-ai/langchain,langchain-ai,The agent engineering platform.,Python,139838,23191,419,2022-10-17T02:58:36Z,2026-06-22T04:48:43Z,https://github.com/langchain-ai/langchain,https://docs.langchain.com/langchain/,MIT License,578710,False,False
62,firecrawl,firecrawl/firecrawl,firecrawl,"The API to search, scrape, and interact with the web at scale. 🔥",TypeScript,136419,7919,399,2024-04-15T21:02:29Z,2026-06-22T05:00:38Z,https://github.com/firecrawl/firecrawl,https://firecrawl.dev,GNU Affero General Public License v3.0,93353,False,False
63,PowerToys,microsoft/PowerToys,microsoft,Microsoft PowerToys is a collection of utilities that supercharge productivity and customization on Windows,C,135376,8127,7286,2019-05-01T17:44:02Z,2026-06-22T04:55:32Z,https://github.com/microsoft/PowerToys,,MIT License,510286,False,False
64,go,golang/go,golang,The Go programming language,Go,134873,19029,10161,2014-08-19T04:33:40Z,2026-06-22T04:08:56Z,https://github.com/golang/go,https://go.dev,"BSD 3-Clause ""New"" or ""Revised"" License",443305,False,False
65,fucking-algorithm,labuladong/fucking-algorithm,labuladong,"Crack LeetCode, not only how, but also why. ",Markdown,134463,23603,3,2020-02-19T09:01:23Z,2026-06-22T04:57:59Z,https://github.com/labuladong/fucking-algorithm,https://labuladong.online/,,126234,False,False
66,claude-code,anthropics/claude-code,anthropics,"Claude Code is an agentic coding tool that lives in your terminal, understands your codebase, and helps you code faster by executing routine tasks, explaining complex code, and handling git workflows - all through natural language commands.",Python,133648,21616,8681,2025-02-22T17:41:21Z,2026-06-22T04:51:05Z,https://github.com/anthropics/claude-code,https://code.claude.com/docs/en/overview,,28435,False,False
67,30-seconds-of-code,Chalarangelo/30-seconds-of-code,Chalarangelo,Coding articles to level up your development skills,JavaScript,128164,12471,1,2017-11-29T17:35:03Z,2026-06-22T03:40:09Z,https://github.com/Chalarangelo/30-seconds-of-code,https://30secondsofcode.org/,Creative Commons Attribution 4.0 International,742810,False,False
68,hello-algo,krahets/hello-algo,krahets,"《Hello 算法》：动画图解、一键运行的数据结构与算法教程。支持简中、繁中、English、日本語，提供 Python, Java, C++, C, C#, JS, Go, Swift, Rust, Ruby, Kotlin, TS, Dart 等代码实现",Java,127822,15211,38,2022-11-04T11:08:34Z,2026-06-22T04:53:59Z,https://github.com/krahets/hello-algo,https://www.hello-algo.com,Other,464747,False,False
69,iptv,iptv-org/iptv,iptv-org,Collection of publicly available IPTV channels from all over the world,TypeScript,127205,6984,20,2018-11-14T22:00:57Z,2026-06-22T05:00:31Z,https://github.com/iptv-org/iptv,https://iptv-org.github.io,The Unlicense,1273840,False,False
70,clash-verge-rev,clash-verge-rev/clash-verge-rev,clash-verge-rev,"A modern GUI client based on Tauri, designed to run in Windows, macOS and Linux for tailored proxy experience",TypeScript,127041,9243,421,2023-11-21T18:24:03Z,2026-06-22T04:57:33Z,https://github.com/clash-verge-rev/clash-verge-rev,https://www.clashverge.dev,GNU General Public License v3.0,76322,False,False
71,react-native,react/react-native,react,A framework for building native applications using React,C++,126049,25179,1051,2015-01-09T18:10:16Z,2026-06-22T04:19:26Z,https://github.com/react/react-native,https://reactnative.dev,MIT License,972335,False,False
72,excalidraw,excalidraw/excalidraw,excalidraw,Virtual whiteboard for sketching hand-drawn like diagrams,TypeScript,125918,14107,3176,2020-01-02T01:04:43Z,2026-06-22T04:54:47Z,https://github.com/excalidraw/excalidraw,https://excalidraw.com,MIT License,101642,False,False
73,free-for-dev,ripienaar/free-for-dev,ripienaar,"A list of SaaS, PaaS and IaaS offerings that have free tiers of interest to devops and infradev",HTML,123290,13001,11,2015-03-18T21:06:26Z,2026-06-22T02:14:46Z,https://github.com/ripienaar/free-for-dev,https://free-for.dev/,,10158,False,False
74,kubernetes,kubernetes/kubernetes,kubernetes,Production-Grade Container Scheduling and Management,Go,123182,43268,2759,2014-06-06T22:56:04Z,2026-06-22T04:44:57Z,https://github.com/kubernetes/kubernetes,https://kubernetes.io,Apache License 2.0,1480905,False,False
75,electron,electron/electron,electron,":electron: Build cross-platform desktop apps with JavaScript, HTML, and CSS",C++,121716,17260,864,2013-04-12T01:47:36Z,2026-06-22T03:38:47Z,https://github.com/electron/electron,https://electronjs.org,MIT License,208251,False,False
76,node,nodejs/node,nodejs,Node.js JavaScript runtime ✨🐢🚀✨,JavaScript,117907,35740,2421,2014-11-26T19:57:11Z,2026-06-22T04:39:14Z,https://github.com/nodejs/node,https://nodejs.org,Other,1501485,False,False
77,ComfyUI,Comfy-Org/ComfyUI,Comfy-Org,"The most powerful and modular diffusion model GUI, api and backend with a graph/nodes interface.",Python,117851,13779,4130,2023-01-17T03:15:56Z,2026-06-22T04:58:05Z,https://github.com/Comfy-Org/ComfyUI,https://www.comfy.org/,GNU General Public License v3.0,91083,False,False
78,llama.cpp,ggml-org/llama.cpp,ggml-org,LLM inference in C/C++,C++,117603,19797,1828,2023-03-10T18:58:00Z,2026-06-22T04:33:08Z,https://github.com/ggml-org/llama.cpp,https://llama.app,MIT License,410666,False,False
79,free-programming-books-zh_CN,justjavac/free-programming-books-zh_CN,justjavac,:books: 免费的计算机编程类中文书籍，欢迎投稿,,117155,28223,32,2013-11-04T01:59:19Z,2026-06-22T04:40:48Z,https://github.com/justjavac/free-programming-books-zh_CN,http://weibo.com/justjavac,GNU General Public License v3.0,1059,False,False
80,ui,shadcn-ui/ui,shadcn-ui,"A set of beautifully-designed, accessible components and a code distribution platform. Works with your favorite frameworks. Open Source. Open Code.",TypeScript,117109,9123,2050,2023-01-04T12:43:27Z,2026-06-22T04:51:44Z,https://github.com/shadcn-ui/ui,https://ui.shadcn.com,MIT License,66191,False,False
81,rustdesk,rustdesk/rustdesk,rustdesk,"An open-source remote desktop application designed for self-hosting, as an alternative to TeamViewer.",Rust,116636,17638,120,2020-09-28T15:36:08Z,2026-06-22T04:57:08Z,https://github.com/rustdesk/rustdesk,https://rustdesk.com,GNU Affero General Public License v3.0,72995,False,False
82,awesome-llm-apps,Shubhamsaboo/awesome-llm-apps,Shubhamsaboo,"100+ AI Agent & RAG apps you can actually run — clone, customize, ship.",Python,115266,17123,14,2024-04-29T05:30:25Z,2026-06-22T04:20:28Z,https://github.com/Shubhamsaboo/awesome-llm-apps,https://www.theunwindai.com,Apache License 2.0,209258,False,False
83,agency-agents,msitarzewski/agency-agents,msitarzewski,"A complete AI agency at your fingertips - From frontend wizards to Reddit community ninjas, from whimsy injectors to reality checkers. Each agent is a specialized expert with personality, processes, and proven deliverables.",Shell,114964,18795,81,2025-10-13T12:12:29Z,2026-06-22T04:55:36Z,https://github.com/msitarzewski/agency-agents,,MIT License,3413,False,False
84,Awesome-Hacking,Hack-with-Github/Awesome-Hacking,Hack-with-Github,"A collection of various awesome lists for hackers, pentesters and security researchers",,114820,10441,38,2016-03-30T15:47:10Z,2026-06-22T04:38:06Z,https://github.com/Hack-with-Github/Awesome-Hacking,,Creative Commons Zero v1.0 Universal,1334,False,False
85,spec-kit,github/spec-kit,github,💫 Toolkit to help you get started with Spec-Driven Development,Python,114645,10116,380,2025-08-21T22:54:31Z,2026-06-22T04:53:32Z,https://github.com/github/spec-kit,https://github.github.com/spec-kit/,MIT License,9851,False,False
86,rust,rust-lang/rust,rust-lang,Empowering everyone to build reliable and efficient software.,Rust,114034,15007,12481,2010-06-16T20:39:03Z,2026-06-22T04:39:49Z,https://github.com/rust-lang/rust,https://www.rust-lang.org,Apache License 2.0,924042,False,False
