排名,项目名称,完整名称,作者,描述,语言,Stars,Forks,Issues,创建时间,更新时间,仓库链接,主页链接,许可证,大小(KB),是否Fork,是否已归档
87,llama.cpp,ggml-org/llama.cpp,ggml-org,LLM inference in C/C++,C++,110677,18334,1664,2023-03-10T18:58:00Z,2026-05-18T03:50:16Z,https://github.com/ggml-org/llama.cpp,,MIT License,401892,False,False
88,axios,axios/axios,axios,Promise based HTTP client for the browser and node.js,JavaScript,109070,11701,160,2014-08-18T22:30:27Z,2026-05-18T03:21:54Z,https://github.com/axios/axios,https://axios-http.com,MIT License,26736,False,False
89,TypeScript,microsoft/TypeScript,microsoft,TypeScript is a superset of JavaScript that compiles to clean JavaScript output.,TypeScript,108891,13400,5037,2014-06-17T15:28:39Z,2026-05-18T00:41:30Z,https://github.com/microsoft/TypeScript,https://www.typescriptlang.org,Apache License 2.0,2960434,False,False
90,GitHub-Chinese-Top-Charts,GrowingGit/GitHub-Chinese-Top-Charts,GrowingGit,:cn: GitHub中文排行榜，各语言分设「软件 | 资料」榜单，精准定位中文好项目。各取所需，高效学习。,Java,107990,13541,191,2019-09-05T03:01:56Z,2026-05-18T04:05:42Z,https://github.com/GrowingGit/GitHub-Chinese-Top-Charts,,Other,123199,False,False
91,deno,denoland/deno,denoland,A modern runtime for JavaScript and TypeScript.,Rust,106758,6063,2254,2018-05-15T01:34:26Z,2026-05-18T03:53:43Z,https://github.com/denoland/deno,https://deno.com,MIT License,217741,False,False
92,tauri,tauri-apps/tauri,tauri-apps,"Build smaller, faster, and more secure desktop and mobile applications with a web frontend.",Rust,106754,3615,1419,2019-07-13T09:09:37Z,2026-05-18T04:07:57Z,https://github.com/tauri-apps/tauri,https://tauri.app,Apache License 2.0,103845,False,False
93,frp,fatedier/frp,fatedier,A fast reverse proxy to help you expose a local server behind a NAT or firewall to the internet.,Go,106610,15043,46,2015-12-21T15:24:59Z,2026-05-18T03:30:56Z,https://github.com/fatedier/frp,,Apache License 2.0,31809,False,False
94,papers-we-love,papers-we-love/papers-we-love,papers-we-love,Papers from the computer science community to read and discuss.,Shell,106265,6353,2,2013-12-15T14:31:41Z,2026-05-18T03:40:42Z,https://github.com/papers-we-love/papers-we-love,http://paperswelove.org/,,230845,False,False
95,v2rayN,2dust/v2rayN,2dust,"A GUI client for Windows, Linux and macOS, support Xray and sing-box and others",C#,105923,15038,5,2019-07-30T03:47:24Z,2026-05-18T04:08:04Z,https://github.com/2dust/v2rayN,https://v2rayn.2dust.link,GNU General Public License v3.0,47655,False,False
96,nodebestpractices,goldbergyoni/nodebestpractices,goldbergyoni,:white_check_mark:  The Node.js best practices list (July 2024),Dockerfile,105263,10736,112,2017-09-15T08:33:19Z,2026-05-18T02:13:49Z,https://github.com/goldbergyoni/nodebestpractices,https://twitter.com/nodepractices/,Creative Commons Attribution Share Alike 4.0 International,69535,False,False
97,awesome-mac,jaywcjlove/awesome-mac,jaywcjlove, This project is dedicated to collecting high-quality macOS software and organizing them systematically by different categories for easy search and use.,Swift,104253,7766,298,2016-07-17T15:33:47Z,2026-05-18T03:59:31Z,https://github.com/jaywcjlove/awesome-mac,https://git.io/macx,Creative Commons Zero v1.0 Universal,37728,False,False
98,gemini-cli,google-gemini/gemini-cli,google-gemini,An open-source AI agent that brings the power of Gemini directly into your terminal.,TypeScript,104198,13690,1818,2025-04-17T17:04:31Z,2026-05-18T04:01:47Z,https://github.com/google-gemini/gemini-cli,https://geminicli.com,Apache License 2.0,97063,False,False
99,DeepSeek-V3,deepseek-ai/DeepSeek-V3,deepseek-ai,,Python,103560,16747,209,2024-12-26T09:52:40Z,2026-05-18T02:52:10Z,https://github.com/deepseek-ai/DeepSeek-V3,,MIT License,1768,False,False
100,create-react-app,react/create-react-app,react,Set up a modern web app by running one command.,JavaScript,103385,27047,2388,2016-07-17T14:55:11Z,2026-05-17T23:02:57Z,https://github.com/react/create-react-app,https://create-react-app.dev/,MIT License,25186,False,False
