排名,项目名称,完整名称,作者,描述,语言,Stars,Forks,Issues,创建时间,更新时间,仓库链接,主页链接,许可证,大小(KB),是否Fork,是否已归档
89,angular.js,angular/angular.js,angular,AngularJS - HTML enhanced for web apps!,JavaScript,58976,27269,461,2010-01-06T00:34:37Z,2026-02-15T02:31:34Z,https://github.com/angular/angular.js,https://angularjs.org,MIT License,101796,False,True
90,awesome-python,vinta/awesome-python,vinta,"An opinionated list of awesome Python frameworks, libraries, software and resources.",Python,283008,27207,16,2014-06-27T21:00:06Z,2026-02-16T02:26:54Z,https://github.com/vinta/awesome-python,https://awesome-python.com/,Other,4758,False,False
91,create-react-app,facebook/create-react-app,facebook,Set up a modern web app by running one command.,JavaScript,103931,27132,2367,2016-07-17T14:55:11Z,2026-02-15T21:46:38Z,https://github.com/facebook/create-react-app,https://create-react-app.dev,MIT License,25186,False,False
92,angular,angular/angular,angular,Deliver web apps with confidence 🚀,TypeScript,99843,27063,1113,2014-09-18T16:12:01Z,2026-02-16T01:00:17Z,https://github.com/angular/angular,https://angular.dev,MIT License,611478,False,False
93,LibreTV,LibreSpark/LibreTV,LibreSpark,一分钟搭建影视站，支持Vercel/Docker等部署方式,JavaScript,13130,26959,96,2025-04-06T10:52:08Z,2026-02-15T15:14:09Z,https://github.com/LibreSpark/LibreTV,https://libretv.is-an.org,Apache License 2.0,1975,False,True
94,pytorch,pytorch/pytorch,pytorch,Tensors and Dynamic neural networks in Python with strong GPU acceleration,Python,97436,26869,18005,2016-08-13T05:26:41Z,2026-02-16T01:17:10Z,https://github.com/pytorch/pytorch,https://pytorch.org,Other,1239405,False,False
95,javascript,airbnb/javascript,airbnb,JavaScript Style Guide,JavaScript,148086,26761,185,2012-11-01T23:13:50Z,2026-02-16T02:08:25Z,https://github.com/airbnb/javascript,,MIT License,3724,False,False
96,scikit-learn,scikit-learn/scikit-learn,scikit-learn,scikit-learn: machine learning in Python,Python,65034,26695,2132,2010-08-17T09:43:38Z,2026-02-15T19:31:18Z,https://github.com/scikit-learn/scikit-learn,https://scikit-learn.org,"BSD 3-Clause ""New"" or ""Revised"" License",179331,False,False
97,dubbo,apache/dubbo,apache,The java implementation of Apache Dubbo. An RPC and microservice framework.,Java,41729,26554,914,2012-06-19T07:56:02Z,2026-02-15T18:35:23Z,https://github.com/apache/dubbo,https://dubbo.apache.org/,Apache License 2.0,61488,False,False
98,assets,trustwallet/assets,trustwallet,"A comprehensive, up-to-date collection of information about several thousands (!) of crypto tokens.",Go,5223,26440,142,2019-08-09T22:06:16Z,2026-02-14T12:47:02Z,https://github.com/trustwallet/assets,https://developer.trustwallet.com/assets/new-asset,MIT License,690202,False,False
99,ohmyzsh,ohmyzsh/ohmyzsh,ohmyzsh,"🙃   A delightful community-driven (with 2,400+ contributors) framework for managing your zsh configuration. Includes 300+ optional plugins (rails, git, macOS, hub, docker, homebrew, node, php, python, etc), 140+ themes to spice up your morning, and an auto-update tool that makes it easy to keep up with the latest updates from the community.",Shell,184708,26286,519,2009-08-28T18:15:37Z,2026-02-16T00:24:24Z,https://github.com/ohmyzsh/ohmyzsh,https://ohmyz.sh,MIT License,13397,False,False
100,elasticsearch,elastic/elasticsearch,elastic,"Free and Open Source, Distributed, RESTful Search Engine",Java,76068,25796,5494,2010-02-08T13:20:56Z,2026-02-15T23:24:23Z,https://github.com/elastic/elasticsearch,https://www.elastic.co/products/elasticsearch,Other,1552724,False,False
