排名,项目名称,完整名称,作者,描述,语言,Stars,Forks,Issues,创建时间,更新时间,仓库链接,主页链接,许可证,大小(KB),是否Fork,是否已归档
1,build-your-own-x,codecrafters-io/build-your-own-x,codecrafters-io,Master programming by recreating your favorite technologies from scratch.,Markdown,524607,49624,522,2018-05-09T12:03:18Z,2026-07-13T03:28:44Z,https://github.com/codecrafters-io/build-your-own-x,https://codecrafters.io,,1100,False,False
2,awesome,sindresorhus/awesome,sindresorhus,😎 Awesome lists about all kinds of interesting topics,,484365,35817,93,2014-07-11T13:42:37Z,2026-07-13T03:25:59Z,https://github.com/sindresorhus/awesome,,Creative Commons Zero v1.0 Universal,1565,False,False
3,freeCodeCamp,freeCodeCamp/freeCodeCamp,freeCodeCamp,"freeCodeCamp.org's open-source codebase and curriculum. Learn math, programming, and computer science for free.",TypeScript,451663,45572,261,2014-12-24T17:49:19Z,2026-07-13T03:25:11Z,https://github.com/freeCodeCamp/freeCodeCamp,https://contribute.freecodecamp.org,"BSD 3-Clause ""New"" or ""Revised"" License",578022,False,False
4,public-apis,public-apis/public-apis,public-apis,A collective list of free APIs,Python,449433,49389,1539,2016-03-20T23:49:42Z,2026-07-13T03:29:13Z,https://github.com/public-apis/public-apis,https://APILayer.com/?utm_source=Github&utm_medium=Referral&utm_campaign=Public-apis-repo,MIT License,6864,False,False
5,free-programming-books,EbookFoundation/free-programming-books,EbookFoundation,:books: Freely available programming books,Python,391823,66511,77,2013-10-11T06:50:37Z,2026-07-13T03:29:05Z,https://github.com/EbookFoundation/free-programming-books,https://ebookfoundation.github.io/free-programming-books/,Creative Commons Attribution 4.0 International,21557,False,False
6,openclaw,openclaw/openclaw,openclaw,Your own personal AI assistant. Any OS. Any Platform. The lobster way. 🦞 ,TypeScript,382725,80336,6407,2025-11-24T10:16:47Z,2026-07-13T03:27:58Z,https://github.com/openclaw/openclaw,https://openclaw.ai,Other,1809228,False,False
7,developer-roadmap,nilbuild/developer-roadmap,nilbuild,"Interactive roadmaps, guides and other educational content to help developers grow in their careers.",TypeScript,360643,44500,25,2017-03-15T13:45:52Z,2026-07-13T03:13:39Z,https://github.com/nilbuild/developer-roadmap,https://roadmap.sh,Other,361416,False,False
8,system-design-primer,donnemartin/system-design-primer,donnemartin,Learn how to design large-scale systems. Prep for the system design interview.  Includes Anki flashcards.,Python,357323,57151,569,2017-02-26T16:15:28Z,2026-07-13T03:29:37Z,https://github.com/donnemartin/system-design-primer,,Other,11277,False,False
9,coding-interview-university,jwasham/coding-interview-university,jwasham,A complete computer science study plan to become a software engineer.,,356036,84256,122,2016-06-06T02:34:12Z,2026-07-13T03:25:17Z,https://github.com/jwasham/coding-interview-university,,Creative Commons Attribution Share Alike 4.0 International,22700,False,False
10,awesome-python,vinta/awesome-python,vinta,"An opinionated list of Python frameworks, libraries, tools, and resources",Python,307796,28266,18,2014-06-27T21:00:06Z,2026-07-13T03:25:31Z,https://github.com/vinta/awesome-python,https://awesome-python.com/,Other,5712,False,False
11,awesome-selfhosted,awesome-selfhosted/awesome-selfhosted,awesome-selfhosted,A list of Free Software network services and web applications which can be hosted on your own servers,,304993,14282,0,2015-06-01T02:33:17Z,2026-07-13T03:22:59Z,https://github.com/awesome-selfhosted/awesome-selfhosted,https://awesome-selfhosted.net/,Other,17130,False,False
12,996.ICU,996icu/996.ICU,996icu,Repo for counting stars and contributing. Press F to pay respect to glorious developers.,,276378,20800,16697,2019-03-26T07:31:14Z,2026-07-13T02:51:17Z,https://github.com/996icu/996.ICU,https://996.icu,Other,189351,False,False
13,project-based-learning,practical-tutorials/project-based-learning,practical-tutorials,Curated list of project-based tutorials,Python,273055,35229,286,2017-04-12T05:07:46Z,2026-07-13T03:21:45Z,https://github.com/practical-tutorials/project-based-learning,,MIT License,456,False,False
14,superpowers,obra/superpowers,obra,An agentic skills framework & software development methodology that works.,Shell,253142,22610,324,2025-10-09T19:45:18Z,2026-07-13T03:29:50Z,https://github.com/obra/superpowers,,MIT License,3806,False,False
15,react,react/react,react,The library for web and native user interfaces.,JavaScript,246458,51204,1203,2013-05-24T16:15:54Z,2026-07-13T03:14:08Z,https://github.com/react/react,https://react.dev,MIT License,1021473,False,False
16,linux,torvalds/linux,torvalds,Linux kernel source tree,C,239294,63438,3,2011-09-04T22:48:12Z,2026-07-13T03:14:05Z,https://github.com/torvalds/linux,,Other,6323276,False,False
17,the-book-of-secret-knowledge,trimstray/the-book-of-secret-knowledge,trimstray,"A collection of inspiring lists, manuals, cheatsheets, blogs, hacks, one-liners, cli/web tools and more.",,232989,13894,158,2018-06-23T10:43:14Z,2026-07-13T03:25:16Z,https://github.com/trimstray/the-book-of-secret-knowledge,,MIT License,1748,False,False
18,ECC,affaan-m/ECC,affaan-m,"The agent harness performance optimization system. Skills, instincts, memory, security, and research-first development for Claude Code, Codex, Opencode, Cursor and beyond.",JavaScript,228985,35108,98,2026-01-18T00:51:51Z,2026-07-13T03:23:09Z,https://github.com/affaan-m/ECC,https://ecc.tools,MIT License,39538,False,False
19,Python,TheAlgorithms/Python,TheAlgorithms,All Algorithms implemented in Python,Python,222627,50838,1009,2016-07-16T09:44:01Z,2026-07-13T03:05:11Z,https://github.com/TheAlgorithms/Python,https://thealgorithms.github.io/Python/,MIT License,16568,False,False
20,hermes-agent,NousResearch/hermes-agent,NousResearch,The agent that grows with you,Python,213802,39642,26638,2025-07-22T22:22:28Z,2026-07-13T03:29:50Z,https://github.com/NousResearch/hermes-agent,https://hermes-agent.nousresearch.com,MIT License,486748,False,False
21,vue,vuejs/vue,vuejs,"This is the repo for Vue 2. For Vue 3, go to https://github.com/vuejs/core",TypeScript,210134,33934,635,2013-07-29T03:24:51Z,2026-07-13T03:08:02Z,https://github.com/vuejs/vue,http://v2.vuejs.org,MIT License,32152,False,False
22,computer-science,ossu/computer-science,ossu,🎓 Path to a free self-taught education in Computer Science!,HTML,205981,25578,24,2014-05-04T00:18:39Z,2026-07-13T02:42:24Z,https://github.com/ossu/computer-science,https://cs.ossu.dev,MIT License,1784,False,False
23,tensorflow,tensorflow/tensorflow,tensorflow,An Open Source Machine Learning Framework for Everyone,C++,196292,75501,2708,2015-11-07T01:19:20Z,2026-07-13T02:54:08Z,https://github.com/tensorflow/tensorflow,https://tensorflow.org,Apache License 2.0,1345133,False,False
24,javascript-algorithms,trekhleb/javascript-algorithms,trekhleb,📝 Algorithms and data structures implemented in JavaScript with explanations and links to further readings,JavaScript,196220,31055,403,2018-03-24T07:47:04Z,2026-07-13T01:31:20Z,https://github.com/trekhleb/javascript-algorithms,,MIT License,14956,False,False
25,n8n,n8n-io/n8n,n8n-io,"Fair-code workflow automation platform with native AI capabilities. Combine visual building with custom code, self-host or cloud, 400+ integrations.",TypeScript,196213,59294,1456,2019-06-22T09:24:21Z,2026-07-13T03:18:37Z,https://github.com/n8n-io/n8n,https://n8n.io,Other,523049,False,False
26,claw-code,ultraworkers/claw-code,ultraworkers,"An agent-managed museum exhibit, built in Rust with Gajae-Code / LazyCodex — developed and maintained with no human intervention.",Rust,194740,109727,31,2026-03-31T08:58:08Z,2026-07-13T03:26:46Z,https://github.com/ultraworkers/claw-code,,MIT License,25104,False,False
27,andrej-karpathy-skills,multica-ai/andrej-karpathy-skills,multica-ai,"A single CLAUDE.md file to improve Claude Code behavior, derived from Andrej Karpathy's observations on LLM coding pitfalls.",,191288,19637,125,2026-01-27T03:53:13Z,2026-07-13T03:27:34Z,https://github.com/multica-ai/andrej-karpathy-skills,,,20,False,False
28,ohmyzsh,ohmyzsh/ohmyzsh,ohmyzsh,"🙃   A delightful community-driven (with 2,500+ contributors) framework for managing your zsh configuration. Includes 300+ optional plugins (rails, git, macOS, hub, docker, homebrew, node, php, python, etc), 140+ themes to spice up your morning, and an auto-update tool that makes it easy to keep up with the latest updates from the community.",Shell,188667,26554,578,2009-08-28T18:15:37Z,2026-07-13T03:03:57Z,https://github.com/ohmyzsh/ohmyzsh,https://ohmyz.sh,MIT License,13654,False,False
29,vscode,microsoft/vscode,microsoft,Visual Studio Code,TypeScript,187479,41251,19236,2015-09-03T20:23:38Z,2026-07-13T03:06:34Z,https://github.com/microsoft/vscode,https://code.visualstudio.com,MIT License,1321108,False,False
30,AutoGPT,Significant-Gravitas/AutoGPT,Significant-Gravitas,"AutoGPT is the vision of accessible AI for everyone, to use and to build on. Our mission is to provide the tools, so that you can focus on what matters.",Python,185495,46105,498,2023-03-16T09:21:07Z,2026-07-13T02:47:30Z,https://github.com/Significant-Gravitas/AutoGPT,https://agpt.co,Other,630268,False,False
31,FreeDomain,DigitalPlatDev/FreeDomain,DigitalPlatDev,DigitalPlat FreeDomain: Free Domain For Everyone,HTML,185292,3874,36,2024-05-30T13:23:00Z,2026-07-13T03:29:26Z,https://github.com/DigitalPlatDev/FreeDomain,https://domain.digitalplat.org,GNU Affero General Public License v3.0,972,False,False
32,opencode,anomalyco/opencode,anomalyco,The open source coding agent.,TypeScript,185136,23111,4654,2025-04-30T20:08:00Z,2026-07-13T03:29:33Z,https://github.com/anomalyco/opencode,https://opencode.ai,MIT License,383415,False,False
33,CS-Notes,CyC2018/CS-Notes,CyC2018,:books: 技术面试必备基础知识、Leetcode、计算机操作系统、计算机网络、系统设计,,184743,50854,195,2018-02-13T14:56:24Z,2026-07-13T03:03:31Z,https://github.com/CyC2018/CS-Notes,http://cyc2018.xyz,,116179,False,False
34,You-Dont-Know-JS,getify/You-Dont-Know-JS,getify,A book series (2 published editions) on the JS language.,,184593,33488,2,2013-11-16T02:37:24Z,2026-07-13T01:02:22Z,https://github.com/getify/You-Dont-Know-JS,https://www.amazon.com/dp/B085XXCJ7X,Other,15241,False,False
35,Python-100-Days,jackfrued/Python-100-Days,jackfrued,Python - 100天从新手到大师,Jupyter Notebook,184095,55684,702,2018-03-01T16:05:52Z,2026-07-13T03:28:10Z,https://github.com/jackfrued/Python-100-Days,,,401142,False,False
36,Microsoft-Activation-Scripts,massgravel/Microsoft-Activation-Scripts,massgravel,"Open-source Windows and Office activator featuring HWID, Ohook, TSforge, and Online KMS activation methods, along with advanced troubleshooting.",Batchfile,182947,17530,3,2020-01-12T23:03:34Z,2026-07-13T03:07:40Z,https://github.com/massgravel/Microsoft-Activation-Scripts,https://massgrave.dev,GNU General Public License v3.0,13289,False,False
37,awesome-go,avelino/awesome-go,avelino,"A curated list of awesome Go frameworks, libraries and software",Go,177995,13415,191,2014-07-06T13:42:15Z,2026-07-13T03:22:59Z,https://github.com/avelino/awesome-go,https://awesome-go.com,MIT License,11768,False,False
38,flutter,flutter/flutter,flutter,Flutter makes it easy and fast to build beautiful apps for mobile and beyond,Dart,177852,30789,12931,2015-03-06T22:54:58Z,2026-07-13T03:28:43Z,https://github.com/flutter/flutter,https://flutter.dev,"BSD 3-Clause ""New"" or ""Revised"" License",452598,False,False
39,yt-dlp,yt-dlp/yt-dlp,yt-dlp,A feature-rich command-line audio/video downloader,Python,177595,15189,2507,2020-10-26T04:22:55Z,2026-07-13T03:16:27Z,https://github.com/yt-dlp/yt-dlp,https://discord.gg/H5MNcFW63r,The Unlicense,61519,False,False
40,ollama,ollama/ollama,ollama,"Get up and running with Kimi-K2.6, GLM-5.1, MiniMax, DeepSeek, gpt-oss, Qwen, Gemma and other models.",Go,176004,16958,3425,2023-06-26T19:39:32Z,2026-07-13T03:09:03Z,https://github.com/ollama/ollama,https://ollama.com,MIT License,89624,False,False
41,gitignore,github/gitignore,github,A collection of useful .gitignore templates,,174874,82344,72,2010-11-08T20:17:14Z,2026-07-13T02:57:40Z,https://github.com/github/gitignore,,Creative Commons Zero v1.0 Universal,3137,False,False
42,bootstrap,twbs/bootstrap,twbs,"The most popular HTML, CSS, and JavaScript framework for developing responsive, mobile first projects on the web.",MDX,174465,78746,289,2011-07-29T21:19:00Z,2026-07-13T00:17:03Z,https://github.com/twbs/bootstrap,https://getbootstrap.com,MIT License,302148,False,False
43,skills,mattpocock/skills,mattpocock,Skills for Real Engineers. Straight from my .claude directory.,Shell,167045,14398,147,2026-02-03T11:15:53Z,2026-07-13T03:30:01Z,https://github.com/mattpocock/skills,,MIT License,698,False,False
44,prompts.chat,f/prompts.chat,f,"f.k.a. Awesome ChatGPT Prompts. Share, discover, and collect prompts from the community. Free and open source — self-host for your organization with complete privacy.",HTML,165580,21434,63,2022-12-05T13:54:13Z,2026-07-13T03:29:10Z,https://github.com/f/prompts.chat,https://prompts.chat,Other,453220,False,False
45,markitdown,microsoft/markitdown,microsoft,Python tool for converting files and office documents to Markdown.,Python,165174,11785,836,2024-11-13T19:56:40Z,2026-07-13T03:27:55Z,https://github.com/microsoft/markitdown,,MIT License,4286,False,False
46,HelloGitHub,521xueweihan/HelloGitHub,521xueweihan,":octocat: 分享 GitHub 上有趣、入门级的开源项目。Share interesting, entry-level open source projects on GitHub.",Python,164926,12314,511,2016-05-04T06:24:11Z,2026-07-13T03:29:05Z,https://github.com/521xueweihan/HelloGitHub,https://hellogithub.com,,9207,False,False
47,stable-diffusion-webui,AUTOMATIC1111/stable-diffusion-webui,AUTOMATIC1111,Stable Diffusion web UI,Python,164202,30541,2501,2022-08-22T14:05:26Z,2026-07-13T03:15:53Z,https://github.com/AUTOMATIC1111/stable-diffusion-webui,,GNU Affero General Public License v3.0,36552,False,False
48,transformers,huggingface/transformers,huggingface,"🤗 Transformers: the model-definition framework for state-of-the-art machine learning models in text, vision, audio, and multimodal models, for both inference and training. ",Python,162552,33877,2490,2018-10-29T13:56:00Z,2026-07-13T02:36:26Z,https://github.com/huggingface/transformers,https://huggingface.co/transformers,Apache License 2.0,515087,False,False
49,the-art-of-command-line,jlevy/the-art-of-command-line,jlevy,"Master the command line, in one page",,161723,14831,255,2015-05-20T15:11:03Z,2026-07-13T03:25:25Z,https://github.com/jlevy/the-art-of-command-line,,,2772,False,False
50,skills,anthropics/skills,anthropics,Public repository for Agent Skills,Python,160625,18959,1021,2025-09-22T15:53:31Z,2026-07-13T03:29:35Z,https://github.com/anthropics/skills,,,4030,False,False
51,JavaGuide,Snailclimb/JavaGuide,Snailclimb,Java 面试 & 后端通用面试指南，覆盖计算机基础、数据库、分布式、高并发、系统设计与 AI 应用开发,JavaScript,156977,46171,58,2018-05-07T13:27:00Z,2026-07-13T03:22:09Z,https://github.com/Snailclimb/JavaGuide,https://javaguide.cn,Apache License 2.0,183406,False,False
52,langflow,langflow-ai/langflow,langflow-ai,Langflow is a powerful tool for building and deploying AI-powered agents and workflows.,Python,151786,9667,979,2023-02-08T22:28:03Z,2026-07-13T03:01:10Z,https://github.com/langflow-ai/langflow,http://www.langflow.org,MIT License,1387153,False,False
53,firecrawl,firecrawl/firecrawl,firecrawl,"The API to search, scrape, and interact with the web at scale. 🔥",TypeScript,149957,8577,402,2024-04-15T21:02:29Z,2026-07-13T03:29:38Z,https://github.com/firecrawl/firecrawl,https://firecrawl.dev,GNU Affero General Public License v3.0,95635,False,False
54,dify,langgenius/dify,langgenius,Production-ready platform for agentic workflow development.,TypeScript,148622,23426,967,2023-04-12T07:40:24Z,2026-07-13T03:26:57Z,https://github.com/langgenius/dify,https://dify.ai,Other,424660,False,False
55,javascript,airbnb/javascript,airbnb,JavaScript Style Guide,JavaScript,148080,26646,160,2012-11-01T23:13:50Z,2026-07-13T01:03:31Z,https://github.com/airbnb/javascript,,MIT License,3738,False,False
56,LibreCode,re4/LibreCode,re4,LibreCode - A Ollama cursor like coding / Reversing Interface,C#,145865,2,79958,2026-04-10T04:55:01Z,2026-07-13T03:30:17Z,https://github.com/re4/LibreCode,,Other,304,False,False
57,scrcpy,Genymobile/scrcpy,Genymobile,Display and control your Android device,C,145567,13434,2846,2017-11-21T18:00:27Z,2026-07-13T03:23:32Z,https://github.com/Genymobile/scrcpy,,Apache License 2.0,8717,False,False
58,open-webui,open-webui/open-webui,open-webui,"User-friendly AI Interface (Supports Ollama, OpenAI API, ...)",Python,145191,21037,412,2023-10-06T22:08:27Z,2026-07-13T03:28:45Z,https://github.com/open-webui/open-webui,https://openwebui.com,Other,390486,False,False
59,system-prompts-and-models-of-ai-tools,x1xhlol/system-prompts-and-models-of-ai-tools,x1xhlol,"FULL Augment Code, Claude Code, Cluely, CodeBuddy, Comet, Cursor, Devin AI, Junie, Kiro, Leap.new, Lovable, Manus, NotionAI, Orchids.app, Perplexity, Poke, Qoder, Replit, Same.dev, Trae, Traycer AI, VSCode Agent, Warp.dev, Windsurf, Xcode, Z.ai Code, Dia & v0. (And other Open Sourced) System Prompts, Internal Tools & AI Models",,141847,34810,156,2025-03-05T16:38:29Z,2026-07-13T03:17:55Z,https://github.com/x1xhlol/system-prompts-and-models-of-ai-tools,,GNU General Public License v3.0,1511,False,False
60,langchain,langchain-ai/langchain,langchain-ai,The agent engineering platform.,Python,141617,23547,421,2022-10-17T02:58:36Z,2026-07-13T03:28:37Z,https://github.com/langchain-ai/langchain,https://docs.langchain.com/langchain/,MIT License,585431,False,False
61,next.js,vercel/next.js,vercel,The React Framework,JavaScript,141028,31559,4176,2016-10-05T23:32:51Z,2026-07-13T01:18:33Z,https://github.com/vercel/next.js,https://nextjs.org,MIT License,2509088,False,False
62,tech-interview-handbook,yangshun/tech-interview-handbook,yangshun,Curated coding interview preparation materials for busy software engineers,TypeScript,140795,16674,45,2016-07-05T05:00:48Z,2026-07-13T02:59:21Z,https://github.com/yangshun/tech-interview-handbook,https://www.techinterviewhandbook.org,MIT License,33749,False,False
63,youtube-dl,ytdl-org/youtube-dl,ytdl-org,Command-line program to download videos from YouTube.com and other video sites,Python,140692,10681,4130,2010-10-31T14:35:07Z,2026-07-13T03:15:31Z,https://github.com/ytdl-org/youtube-dl,http://ytdl-org.github.io/youtube-dl/,The Unlicense,65510,False,False
64,claude-code,anthropics/claude-code,anthropics,"Claude Code is an agentic coding tool that lives in your terminal, understands your codebase, and helps you code faster by executing routine tasks, explaining complex code, and handling git workflows - all through natural language commands.",Python,137598,22218,11201,2025-02-22T17:41:21Z,2026-07-13T03:23:03Z,https://github.com/anthropics/claude-code,https://code.claude.com/docs/en/overview,,29064,False,False
65,PowerToys,microsoft/PowerToys,microsoft,Microsoft PowerToys is a collection of utilities that supercharge productivity and customization on Windows,C,136545,8368,7358,2019-05-01T17:44:02Z,2026-07-13T03:03:18Z,https://github.com/microsoft/PowerToys,,MIT License,510952,False,False
66,go,golang/go,golang,The Go programming language,Go,135345,19325,10194,2014-08-19T04:33:40Z,2026-07-13T03:05:30Z,https://github.com/golang/go,https://go.dev,"BSD 3-Clause ""New"" or ""Revised"" License",444010,False,False
67,fucking-algorithm,labuladong/fucking-algorithm,labuladong,"Crack LeetCode, not only how, but also why. ",Markdown,134803,23606,3,2020-02-19T09:01:23Z,2026-07-13T02:55:25Z,https://github.com/labuladong/fucking-algorithm,https://labuladong.online/,,126234,False,False
68,iptv,iptv-org/iptv,iptv-org,Collection of publicly available IPTV channels from all over the world,TypeScript,132640,7568,8,2018-11-14T22:00:57Z,2026-07-13T03:28:04Z,https://github.com/iptv-org/iptv,https://iptv-org.github.io,The Unlicense,1297178,False,False
69,clash-verge-rev,clash-verge-rev/clash-verge-rev,clash-verge-rev,"A modern GUI client based on Tauri, designed to run in Windows, macOS and Linux for tailored proxy experience",TypeScript,131086,9493,416,2023-11-21T18:24:03Z,2026-07-13T03:29:33Z,https://github.com/clash-verge-rev/clash-verge-rev,https://www.clashverge.dev,GNU General Public License v3.0,76894,False,False
70,agency-agents,msitarzewski/agency-agents,msitarzewski,"A complete AI agency at your fingertips - From frontend wizards to Reddit community ninjas, from whimsy injectors to reality checkers. Each agent is a specialized expert with personality, processes, and proven deliverables.",Shell,130837,21471,99,2025-10-13T12:12:29Z,2026-07-13T03:24:38Z,https://github.com/msitarzewski/agency-agents,,MIT License,3868,False,False
71,free-for-dev,ripienaar/free-for-dev,ripienaar,"A list of SaaS, PaaS and IaaS offerings that have free tiers of interest to devops and infradev",HTML,129028,13470,12,2015-03-18T21:06:26Z,2026-07-13T03:10:14Z,https://github.com/ripienaar/free-for-dev,https://free-for.dev/,,10583,False,False
72,hello-algo,krahets/hello-algo,krahets,"《Hello 算法》：动画图解、一键运行的数据结构与算法教程。支持简中、繁中、English、日本語，提供 Python, Java, C++, C, C#, JS, Go, Swift, Rust, Ruby, Kotlin, TS, Dart 等代码实现",Java,128440,15427,40,2022-11-04T11:08:34Z,2026-07-13T03:28:34Z,https://github.com/krahets/hello-algo,https://www.hello-algo.com,Other,464747,False,False
73,30-seconds-of-code,Chalarangelo/30-seconds-of-code,Chalarangelo,Coding articles to level up your development skills,JavaScript,128362,12498,0,2017-11-29T17:35:03Z,2026-07-13T02:20:54Z,https://github.com/Chalarangelo/30-seconds-of-code,https://30secondsofcode.org/,Creative Commons Attribution 4.0 International,742556,False,False
74,excalidraw,excalidraw/excalidraw,excalidraw,Virtual whiteboard for sketching hand-drawn like diagrams,TypeScript,127321,14364,3211,2020-01-02T01:04:43Z,2026-07-13T03:24:40Z,https://github.com/excalidraw/excalidraw,https://excalidraw.com,MIT License,101122,False,False
75,react-native,react/react-native,react,A framework for building native applications using React,C++,126189,25185,1033,2015-01-09T18:10:16Z,2026-07-13T03:06:31Z,https://github.com/react/react-native,https://reactnative.dev,MIT License,972553,False,False
76,kubernetes,kubernetes/kubernetes,kubernetes,Production-Grade Container Scheduling and Management,Go,123730,43744,2738,2014-06-06T22:56:04Z,2026-07-13T03:26:33Z,https://github.com/kubernetes/kubernetes,https://kubernetes.io,Apache License 2.0,1490976,False,False
77,electron,electron/electron,electron,":electron: Build cross-platform desktop apps with JavaScript, HTML, and CSS",C++,121984,17298,898,2013-04-12T01:47:36Z,2026-07-13T02:32:20Z,https://github.com/electron/electron,https://electronjs.org,MIT License,208943,False,False
78,gstack,garrytan/gstack,garrytan,"Use Garry Tan's exact Claude Code setup: 23 opinionated tools that serve as CEO, Designer, Eng Manager, Release Manager, Doc Engineer, and QA",TypeScript,121505,18184,836,2026-03-11T21:22:45Z,2026-07-13T03:29:41Z,https://github.com/garrytan/gstack,,MIT License,115516,False,False
79,ComfyUI,Comfy-Org/ComfyUI,Comfy-Org,"The most powerful and modular diffusion model GUI, api and backend with a graph/nodes interface.",Python,120502,14180,4275,2023-01-17T03:15:56Z,2026-07-13T03:25:05Z,https://github.com/Comfy-Org/ComfyUI,https://www.comfy.org/,GNU General Public License v3.0,92005,False,False
80,llama.cpp,ggml-org/llama.cpp,ggml-org,LLM inference in C/C++,C++,120183,20520,1839,2023-03-10T18:58:00Z,2026-07-13T03:27:26Z,https://github.com/ggml-org/llama.cpp,https://llama.app,MIT License,418595,False,False
81,spec-kit,github/spec-kit,github,💫 Toolkit to help you get started with Spec-Driven Development,Python,120050,10657,382,2025-08-21T22:54:31Z,2026-07-13T03:27:51Z,https://github.com/github/spec-kit,https://github.github.com/spec-kit/,MIT License,12231,False,False
82,ui,shadcn-ui/ui,shadcn-ui,"A set of beautifully-designed, accessible components and a code distribution platform. Works with your favorite frameworks. Open Source. Open Code.",TypeScript,118943,9489,2108,2023-01-04T12:43:27Z,2026-07-13T03:29:43Z,https://github.com/shadcn-ui/ui,https://ui.shadcn.com,MIT License,66706,False,False
83,awesome-llm-apps,Shubhamsaboo/awesome-llm-apps,Shubhamsaboo,"100+ AI Agent & RAG apps you can actually run — clone, customize, ship.",Python,118726,17646,9,2024-04-29T05:30:25Z,2026-07-13T03:28:13Z,https://github.com/Shubhamsaboo/awesome-llm-apps,https://www.theunwindai.com,Apache License 2.0,209463,False,False
84,node,nodejs/node,nodejs,Node.js JavaScript runtime ✨🐢🚀✨,JavaScript,118318,36193,2345,2014-11-26T19:57:11Z,2026-07-13T03:16:42Z,https://github.com/nodejs/node,https://nodejs.org,Other,1508624,False,False
85,rustdesk,rustdesk/rustdesk,rustdesk,"An open-source remote desktop application designed for self-hosting, as an alternative to TeamViewer.",Rust,118118,17972,118,2020-09-28T15:36:08Z,2026-07-13T02:55:58Z,https://github.com/rustdesk/rustdesk,https://rustdesk.com,GNU Affero General Public License v3.0,74125,False,False
86,free-programming-books-zh_CN,justjavac/free-programming-books-zh_CN,justjavac,:books: 免费的计算机编程类中文书籍，欢迎投稿,,117333,28211,33,2013-11-04T01:59:19Z,2026-07-13T02:30:42Z,https://github.com/justjavac/free-programming-books-zh_CN,http://weibo.com/justjavac,GNU General Public License v3.0,1059,False,False
