排名,项目名称,完整名称,作者,描述,语言,Stars,Forks,Issues,创建时间,更新时间,仓库链接,主页链接,许可证,大小(KB),是否Fork,是否已归档
1,datasharing,jtleek/datasharing,jtleek,The Leek group guide to data sharing ,,6736,242558,913,2013-11-07T13:25:07Z,2026-05-17T09:39:38Z,https://github.com/jtleek/datasharing,,,590,False,False
2,Spoon-Knife,octocat/Spoon-Knife,octocat,This repo is for demonstration purposes only.,HTML,13798,157201,20565,2011-01-27T19:30:43Z,2026-05-17T22:33:22Z,https://github.com/octocat/Spoon-Knife,,,2,False,False
3,ProgrammingAssignment2,rdpeng/ProgrammingAssignment2,rdpeng,Repository for Programming Assignment 2 for R Programming on Coursera,R,888,143572,4313,2014-01-14T22:07:41Z,2026-05-15T04:07:56Z,https://github.com/rdpeng/ProgrammingAssignment2,,,6670,False,False
4,claw-code,ultraworkers/claw-code,ultraworkers,The repo is finally unlocked. enjoy the party! The fastest repo in history to surpass 100K stars ⭐. Join Discord: https://discord.gg/5TUQKqFWd Built in Rust using oh-my-codex.,Rust,191826,109923,1406,2026-03-31T08:58:08Z,2026-05-18T04:00:33Z,https://github.com/ultraworkers/claw-code,,MIT License,12432,False,False
5,first-contributions,firstcontributions/first-contributions,firstcontributions,🚀✨ Help beginners to contribute to open source projects,,54024,102732,193,2016-09-20T14:35:09Z,2026-05-18T02:16:23Z,https://github.com/firstcontributions/first-contributions,https://firstcontributions.github.io,MIT License,38062,False,False
6,css-exercises,TheOdinProject/css-exercises,TheOdinProject,,HTML,2636,90676,0,2021-08-17T20:33:19Z,2026-05-17T19:33:14Z,https://github.com/TheOdinProject/css-exercises,,MIT License,7037,False,False
7,Complete-Python-3-Bootcamp,Pierian-Data/Complete-Python-3-Bootcamp,Pierian-Data,Course Files for Complete Python 3 Bootcamp Course on Udemy,Jupyter Notebook,29548,87369,269,2018-02-12T19:30:10Z,2026-05-18T01:28:30Z,https://github.com/Pierian-Data/Complete-Python-3-Bootcamp,,,52492,False,False
8,SmartThingsPublic,SmartThingsCommunity/SmartThingsPublic,SmartThingsCommunity,SmartThings open-source DeviceType Handlers and SmartApps code,Groovy,2651,87321,2506,2015-08-04T22:48:02Z,2026-05-17T00:03:16Z,https://github.com/SmartThingsCommunity/SmartThingsPublic,https://developer-preview.smartthings.com/docs/devices/hub-connected/get-started,,21066,False,False
9,coding-interview-university,jwasham/coding-interview-university,jwasham,A complete computer science study plan to become a software engineer.,,346948,82920,112,2016-06-06T02:34:12Z,2026-05-18T04:00:37Z,https://github.com/jwasham/coding-interview-university,,Creative Commons Attribution Share Alike 4.0 International,22700,False,False
10,gitignore,github/gitignore,github,A collection of useful .gitignore templates,,173973,82522,65,2010-11-08T20:17:14Z,2026-05-18T03:52:38Z,https://github.com/github/gitignore,,Creative Commons Zero v1.0 Universal,3148,False,False
11,bootstrap,twbs/bootstrap,twbs,"The most popular HTML, CSS, and JavaScript framework for developing responsive, mobile first projects on the web.",MDX,174247,78894,439,2011-07-29T21:19:00Z,2026-05-18T04:03:02Z,https://github.com/twbs/bootstrap,https://getbootstrap.com,MIT License,294439,False,False
12,openclaw,openclaw/openclaw,openclaw,Your own personal AI assistant. Any OS. Any Platform. The lobster way. 🦞 ,TypeScript,372736,77279,7018,2025-11-24T10:16:47Z,2026-05-18T04:08:29Z,https://github.com/openclaw/openclaw,https://openclaw.ai,MIT License,1274928,False,False
13,tensorflow,tensorflow/tensorflow,tensorflow,An Open Source Machine Learning Framework for Everyone,C++,195138,75307,5325,2015-11-07T01:19:20Z,2026-05-18T03:46:17Z,https://github.com/tensorflow/tensorflow,https://tensorflow.org,Apache License 2.0,1324622,False,False
14,cgm-remote-monitor,nightscout/cgm-remote-monitor,nightscout,nightscout web monitor,JavaScript,2754,73131,143,2014-05-22T00:32:28Z,2026-05-16T14:07:23Z,https://github.com/nightscout/cgm-remote-monitor,,GNU Affero General Public License v3.0,32745,False,False
15,docs,github/docs,github,The open-source repo for docs.github.com,TypeScript,19496,67085,211,2019-05-31T15:57:39Z,2026-05-18T01:17:39Z,https://github.com/github/docs,https://docs.github.com,Creative Commons Attribution 4.0 International,2300007,False,False
16,free-programming-books,EbookFoundation/free-programming-books,EbookFoundation,:books: Freely available programming books,Python,388474,66308,83,2013-10-11T06:50:37Z,2026-05-18T03:59:50Z,https://github.com/EbookFoundation/free-programming-books,https://ebookfoundation.github.io/free-programming-books/,Creative Commons Attribution 4.0 International,21361,False,False
17,linux,torvalds/linux,torvalds,Linux kernel source tree,C,233545,62357,3,2011-09-04T22:48:12Z,2026-05-18T03:58:56Z,https://github.com/torvalds/linux,,Other,6298378,False,False
18,dio-lab-open-source,digitalinnovationone/dio-lab-open-source,digitalinnovationone,"Repositório do lab ""Contribuindo em um Projeto Open Source no GitHub"" da Digital Innovation One.",Jupyter Notebook,8563,60252,15804,2023-04-26T11:34:25Z,2026-05-18T01:43:01Z,https://github.com/digitalinnovationone/dio-lab-open-source,https://digitalinnovationone.github.io/dio-lab-open-source/,,4627491,False,False
19,NextChat,ChatGPTNextWeb/NextChat,ChatGPTNextWeb,✨ Light and Fast AI Assistant. Support: Web | iOS | MacOS | Android |  Linux | Windows,TypeScript,88034,59710,824,2023-03-10T18:27:54Z,2026-05-18T04:03:55Z,https://github.com/ChatGPTNextWeb/NextChat,https://nextchat.club,MIT License,20946,False,False
20,generative-ai-for-beginners,microsoft/generative-ai-for-beginners,microsoft,"21 Lessons, Get Started Building with Generative AI ",Jupyter Notebook,110968,59519,13,2023-06-19T16:28:59Z,2026-05-18T03:55:54Z,https://github.com/microsoft/generative-ai-for-beginners,,MIT License,6594591,False,False
21,n8n,n8n-io/n8n,n8n-io,"Fair-code workflow automation platform with native AI capabilities. Combine visual building with custom code, self-host or cloud, 400+ integrations.",TypeScript,188416,57749,1488,2019-06-22T09:24:21Z,2026-05-18T04:03:34Z,https://github.com/n8n-io/n8n,https://n8n.io,Other,554540,False,False
22,opencv,opencv/opencv,opencv,Open Source Computer Vision Library,C++,87516,56576,2737,2012-07-19T09:40:17Z,2026-05-18T04:10:03Z,https://github.com/opencv/opencv,https://opencv.org,Apache License 2.0,557590,False,False
23,ExData_Plotting1,rdpeng/ExData_Plotting1,rdpeng,Plotting Assignment 1 for Exploratory Data Analysis,,300,56403,690,2014-02-09T03:37:01Z,2026-04-17T10:51:27Z,https://github.com/rdpeng/ExData_Plotting1,,,61643,False,False
24,system-design-primer,donnemartin/system-design-primer,donnemartin,Learn how to design large-scale systems. Prep for the system design interview.  Includes Anki flashcards.,Python,349070,56265,544,2017-02-26T16:15:28Z,2026-05-18T03:55:54Z,https://github.com/donnemartin/system-design-primer,,Other,11277,False,False
25,Python-100-Days,jackfrued/Python-100-Days,jackfrued,Python - 100天从新手到大师,Jupyter Notebook,182541,55697,697,2018-03-01T16:05:52Z,2026-05-18T03:33:55Z,https://github.com/jackfrued/Python-100-Days,,,401142,False,False
26,ant-design,ant-design/ant-design,ant-design,An enterprise-class UI design language and React UI library,TypeScript,98056,54612,1372,2015-04-24T15:37:24Z,2026-05-18T04:05:03Z,https://github.com/ant-design/ant-design,https://ant.design,MIT License,263387,False,False
27,tutorials,eugenp/tutorials,eugenp,Getting Started with Spring Boot 3: ,Java,37346,53570,29,2013-04-29T18:26:36Z,2026-05-17T22:57:31Z,https://github.com/eugenp/tutorials,https://bit.ly/github-ls,MIT License,119119,False,False
28,react,facebook/react,facebook,The library for web and native user interfaces.,JavaScript,245090,51060,1305,2013-05-24T16:15:54Z,2026-05-18T02:51:35Z,https://github.com/facebook/react,https://react.dev,MIT License,975534,False,False
29,CS-Notes,CyC2018/CS-Notes,CyC2018,:books: 技术面试必备基础知识、Leetcode、计算机操作系统、计算机网络、系统设计,,184384,51004,196,2018-02-13T14:56:24Z,2026-05-18T04:00:46Z,https://github.com/CyC2018/CS-Notes,http://cyc2018.xyz,,116179,False,False
30,Python,TheAlgorithms/Python,TheAlgorithms,All Algorithms implemented in Python,Python,221150,50649,978,2016-07-16T09:44:01Z,2026-05-18T04:00:39Z,https://github.com/TheAlgorithms/Python,https://thealgorithms.github.io/Python/,MIT License,16593,False,False
31,public-apis,public-apis/public-apis,public-apis,A collective list of free APIs,Python,435560,47743,1342,2016-03-20T23:49:42Z,2026-05-18T03:53:26Z,https://github.com/public-apis/public-apis,https://APILayer.com/?utm_source=Github&utm_medium=Referral&utm_campaign=Public-apis-repo,MIT License,5362,False,False
32,build-your-own-x,codecrafters-io/build-your-own-x,codecrafters-io,Master programming by recreating your favorite technologies from scratch.,Markdown,502074,47609,484,2018-05-09T12:03:18Z,2026-05-18T04:05:39Z,https://github.com/codecrafters-io/build-your-own-x,https://codecrafters.io,,1201,False,False
33,javascript-exercises,TheOdinProject/javascript-exercises,TheOdinProject,,JavaScript,1621,46522,0,2017-08-17T18:04:59Z,2026-05-14T15:02:55Z,https://github.com/TheOdinProject/javascript-exercises,,MIT License,5653,False,False
34,it-cert-automation-practice,google/it-cert-automation-practice,google,Google IT Automation with Python Professional Certificate - Practice files,Python,1010,46398,26325,2019-12-17T19:04:12Z,2026-05-16T16:51:24Z,https://github.com/google/it-cert-automation-practice,,Apache License 2.0,16,False,True
35,AutoGPT,Significant-Gravitas/AutoGPT,Significant-Gravitas,"AutoGPT is the vision of accessible AI for everyone, to use and to build on. Our mission is to provide the tools, so that you can focus on what matters.",Python,184382,46233,421,2023-03-16T09:21:07Z,2026-05-18T03:08:53Z,https://github.com/Significant-Gravitas/AutoGPT,https://agpt.co,Other,575853,False,False
36,JavaGuide,Snailclimb/JavaGuide,Snailclimb,Java 面试 & 后端通用面试指南，覆盖计算机基础、数据库、分布式、高并发、系统设计与 AI 应用开发,JavaScript,155735,46133,61,2018-05-07T13:27:00Z,2026-05-18T03:20:53Z,https://github.com/Snailclimb/JavaGuide,https://javaguide.cn,Apache License 2.0,180542,False,False
37,kickstart.nvim,nvim-lua/kickstart.nvim,nvim-lua,A launch point for your personal nvim configuration,Lua,30564,45926,23,2022-06-24T03:11:24Z,2026-05-18T03:28:39Z,https://github.com/nvim-lua/kickstart.nvim,,MIT License,866,False,False
38,models,tensorflow/models,tensorflow,Models and examples built with TensorFlow,Python,77663,45090,1287,2016-02-05T01:15:20Z,2026-05-18T01:17:39Z,https://github.com/tensorflow/models,,Other,660061,False,False
39,edgetunnel,zizifn/edgetunnel,zizifn,Running V2ray inside edge/serverless runtime,JavaScript,8528,45069,122,2020-12-12T14:32:48Z,2026-05-18T02:26:36Z,https://github.com/zizifn/edgetunnel,,GNU General Public License v2.0,9032,False,False
40,freeCodeCamp,freeCodeCamp/freeCodeCamp,freeCodeCamp,"freeCodeCamp.org's open-source codebase and curriculum. Learn math, programming, and computer science for free.",TypeScript,445033,44620,186,2014-12-24T17:49:19Z,2026-05-18T03:51:23Z,https://github.com/freeCodeCamp/freeCodeCamp,https://contribute.freecodecamp.org,"BSD 3-Clause ""New"" or ""Revised"" License",572380,False,False
41,developer-roadmap,nilbuild/developer-roadmap,nilbuild,"Interactive roadmaps, guides and other educational content to help developers grow in their careers.",TypeScript,354975,44081,16,2017-03-15T13:45:52Z,2026-05-18T03:55:51Z,https://github.com/nilbuild/developer-roadmap,https://roadmap.sh,Other,360751,False,False
42,qmk_firmware,qmk/qmk_firmware,qmk,Open-source keyboard firmware for Atmel AVR and Arm USB families,C,20376,43880,559,2014-12-08T22:02:05Z,2026-05-17T19:55:52Z,https://github.com/qmk/qmk_firmware,https://qmk.fm,GNU General Public License v2.0,518336,False,False
43,websites,RikkaApps/websites,RikkaApps,Websites for Rikka apps.,Vue,369,43663,4961,2019-08-01T13:09:23Z,2026-05-17T15:01:44Z,https://github.com/RikkaApps/websites,https://rikka.app,,4247,False,False
44,kubernetes,kubernetes/kubernetes,kubernetes,Production-Grade Container Scheduling and Management,Go,122323,43090,2704,2014-06-06T22:56:04Z,2026-05-18T03:34:07Z,https://github.com/kubernetes/kubernetes,https://kubernetes.io,Apache License 2.0,1471534,False,False
45,DO180-apps,RedHatTraining/DO180-apps,RedHatTraining,DO180 Repository for Sample Applications,JavaScript,296,42652,72,2019-10-01T12:50:51Z,2026-04-29T17:02:34Z,https://github.com/RedHatTraining/DO180-apps,,,224,False,False
46,patchwork,jlord/patchwork,jlord,All the Git-it Workshop completers! ,Rich Text Format,1158,42102,3159,2014-01-10T00:00:11Z,2026-05-11T03:57:50Z,https://github.com/jlord/patchwork,http://jlord.github.io/patchwork,Other,192800,False,False
47,spring-boot,spring-projects/spring-boot,spring-projects,"Spring Boot helps you to create Spring-powered, production-grade applications and services with absolute minimum fuss.",Java,80662,41930,496,2012-10-19T15:02:57Z,2026-05-18T03:13:50Z,https://github.com/spring-projects/spring-boot,https://spring.io/projects/spring-boot,Apache License 2.0,215240,False,False
48,JavaScript30,wesbos/JavaScript30,wesbos,30 Day Vanilla JS Challenge,HTML,29125,41903,67,2016-12-07T19:15:31Z,2026-05-18T02:12:05Z,https://github.com/wesbos/JavaScript30,https://JavaScript30.com,,46988,False,False
49,vscode,microsoft/vscode,microsoft,Visual Studio Code,TypeScript,185024,39926,17620,2015-09-03T20:23:38Z,2026-05-18T03:48:26Z,https://github.com/microsoft/vscode,https://code.visualstudio.com,MIT License,1257154,False,False
50,bitcoin,bitcoin/bitcoin,bitcoin,Bitcoin Core integration/staging tree,C++,89119,38975,701,2010-12-19T15:16:43Z,2026-05-18T03:31:04Z,https://github.com/bitcoin/bitcoin,https://bitcoincore.org/en/download,MIT License,315645,False,False
51,spring-framework,spring-projects/spring-framework,spring-projects,Spring Framework,Java,59948,38833,427,2010-12-08T04:04:45Z,2026-05-18T04:08:49Z,https://github.com/spring-projects/spring-framework,https://spring.io/projects/spring-framework,Apache License 2.0,242480,False,False
52,core,home-assistant/core,home-assistant,:house_with_garden: Open source home automation that puts local control and privacy first.,Python,87093,37508,4120,2013-09-17T07:29:48Z,2026-05-18T02:38:19Z,https://github.com/home-assistant/core,https://www.home-assistant.io,Apache License 2.0,826812,False,False
53,swot,leereilly/swot,leereilly,Archived — SWOT delighted millions of students with GitHub discounts and saved bazillions of review hours. Follow JetBrains/swot  for future updates.,Ruby,1173,37431,0,2012-01-31T04:00:56Z,2026-05-17T03:08:14Z,https://github.com/leereilly/swot,,MIT License,2540,False,True
54,RepData_PeerAssessment1,rdpeng/RepData_PeerAssessment1,rdpeng,Peer Assessment 1 for Reproducible Research,,108,36881,348,2014-02-10T21:20:28Z,2026-03-23T22:42:18Z,https://github.com/rdpeng/RepData_PeerAssessment1,,,29349,False,False
55,three.js,mrdoob/three.js,mrdoob,JavaScript 3D Library.,JavaScript,112538,36378,467,2010-03-23T18:58:01Z,2026-05-17T23:09:01Z,https://github.com/mrdoob/three.js,https://threejs.org/,MIT License,1598824,False,False
56,daily_stock_analysis,ZhuLinsen/daily_stock_analysis,ZhuLinsen,LLM驱动的 A/H/美股智能分析：多数据源行情 + 实时新闻 + LLM决策仪表盘 + 多渠道推送，零成本定时运行，纯白嫖. LLM-powered stock analysis system for A/H/US markets.,Python,36633,35968,51,2026-01-10T06:43:20Z,2026-05-18T04:03:42Z,https://github.com/ZhuLinsen/daily_stock_analysis,https://dsa.zhulinsen.tech,MIT License,69536,False,False
57,node,nodejs/node,nodejs,Node.js JavaScript runtime ✨🐢🚀✨,JavaScript,117266,35550,2690,2014-11-26T19:57:11Z,2026-05-17T23:10:52Z,https://github.com/nodejs/node,https://nodejs.org,Other,1485762,False,False
58,awesome,sindresorhus/awesome,sindresorhus,😎 Awesome lists about all kinds of interesting topics,,467483,35044,76,2014-07-11T13:42:37Z,2026-05-18T04:06:19Z,https://github.com/sindresorhus/awesome,,Creative Commons Zero v1.0 Universal,1561,False,False
59,jekyll-now,barryclark/jekyll-now,barryclark,"Build a Jekyll blog in minutes, without touching the command line.",CSS,8395,35014,391,2014-02-07T00:14:55Z,2026-05-16T20:52:37Z,https://github.com/barryclark/jekyll-now,,MIT License,8406,False,False
60,cpython,python/cpython,python,The Python programming language,Python,72736,34629,9324,2017-02-10T19:23:51Z,2026-05-18T04:02:49Z,https://github.com/python/cpython,https://www.python.org,Other,820059,False,False
61,project-based-learning,practical-tutorials/project-based-learning,practical-tutorials,Curated list of project-based tutorials,,265950,34591,298,2017-04-12T05:07:46Z,2026-05-18T04:01:44Z,https://github.com/practical-tutorials/project-based-learning,,MIT License,438,False,False
62,system-prompts-and-models-of-ai-tools,x1xhlol/system-prompts-and-models-of-ai-tools,x1xhlol,"FULL Augment Code, Claude Code, Cluely, CodeBuddy, Comet, Cursor, Devin AI, Junie, Kiro, Leap.new, Lovable, Manus, NotionAI, Orchids.app, Perplexity, Poke, Qoder, Replit, Same.dev, Trae, Traycer AI, VSCode Agent, Warp.dev, Windsurf, Xcode, Z.ai Code, Dia & v0. (And other Open Sourced) System Prompts, Internal Tools & AI Models",,137641,34317,144,2025-03-05T16:38:29Z,2026-05-18T03:40:56Z,https://github.com/x1xhlol/system-prompts-and-models-of-ai-tools,,GNU General Public License v3.0,1437,False,False
63,django,django/django,django,The Web framework for perfectionists with deadlines.,Python,87499,33898,428,2012-04-28T02:47:18Z,2026-05-18T03:33:36Z,https://github.com/django/django,https://www.djangoproject.com/,"BSD 3-Clause ""New"" or ""Revised"" License",279551,False,False
64,vue,vuejs/vue,vuejs,"This is the repo for Vue 2. For Vue 3, go to https://github.com/vuejs/core",TypeScript,209771,33850,623,2013-07-29T03:24:51Z,2026-05-18T03:35:06Z,https://github.com/vuejs/vue,http://v2.vuejs.org,MIT License,32152,False,False
65,You-Dont-Know-JS,getify/You-Dont-Know-JS,getify,A book series (2 published editions) on the JS language.,,184463,33565,2,2013-11-16T02:37:24Z,2026-05-18T02:15:49Z,https://github.com/getify/You-Dont-Know-JS,https://www.amazon.com/dp/B085XXCJ7X,Other,15241,False,False
66,simple-java-maven-app,jenkins-docs/simple-java-maven-app,jenkins-docs,For an introductory tutorial on how to use Jenkins to build a simple Java application with Maven.,Shell,537,33408,0,2017-09-26T02:35:06Z,2026-05-14T11:38:40Z,https://github.com/jenkins-docs/simple-java-maven-app,https://jenkins.io/doc/tutorials/build-a-java-app-with-maven/,MIT License,116,False,False
67,github-readme-stats,anuraghazra/github-readme-stats,anuraghazra,:zap: Dynamically generated stats for your github readmes,JavaScript,79441,33378,282,2020-07-09T10:34:22Z,2026-05-18T03:05:51Z,https://github.com/anuraghazra/github-readme-stats,https://github-readme-stats.vercel.app,MIT License,7685,False,False
68,transformers,huggingface/transformers,huggingface,"🤗 Transformers: the model-definition framework for state-of-the-art machine learning models in text, vision, audio, and multimodal models, for both inference and training. ",Python,160703,33240,2354,2018-10-29T13:56:00Z,2026-05-18T03:55:50Z,https://github.com/huggingface/transformers,https://huggingface.co/transformers,Apache License 2.0,498772,False,False
69,material-ui,mui/material-ui,mui,Material UI: Comprehensive React component library that implements Google's Material Design. Free forever.,JavaScript,98353,32639,1536,2014-08-18T19:11:54Z,2026-05-18T01:44:12Z,https://github.com/mui/material-ui,https://mui.com/material-ui/,MIT License,741602,False,False
70,odoo,odoo/odoo,odoo,Odoo. Open Source Apps To Grow Your Business.,Python,50739,32423,9731,2014-05-13T15:38:58Z,2026-05-18T03:07:06Z,https://github.com/odoo/odoo,https://www.odoo.com,Other,15806301,False,False
71,BPB-Worker-Panel,bia-pain-bache/BPB-Worker-Panel,bia-pain-bache,"A GUI Panel providing Worker subscriptions for VLESS, Trojan and Warp configs alongside a private DoH server and chain proxies, offering full DNS, clean IP,  Fragment, Warp, Warp pro and routing settings for cross-platform clients using Amnezia, Wireguard, Sing-box, Clash/Mihomo and Xray cores.",TypeScript,10373,31388,14,2024-01-19T17:58:28Z,2026-05-18T01:10:40Z,https://github.com/bia-pain-bache/BPB-Worker-Panel,https://bia-pain-bache.github.io/BPB-Worker-Panel/,GNU General Public License v3.0,64857,False,False
72,next.js,vercel/next.js,vercel,The React Framework,JavaScript,139502,31084,3956,2016-10-05T23:32:51Z,2026-05-18T03:22:22Z,https://github.com/vercel/next.js,https://nextjs.org,MIT License,2562773,False,False
73,javascript-algorithms,trekhleb/javascript-algorithms,trekhleb,📝 Algorithms and data structures implemented in JavaScript with explanations and links to further readings,JavaScript,195967,31072,406,2018-03-24T07:47:04Z,2026-05-18T03:59:27Z,https://github.com/trekhleb/javascript-algorithms,,MIT License,14903,False,False
74,courses,DataScienceSpecialization/courses,DataScienceSpecialization,Course materials for the Data Science Specialization: https://www.coursera.org/specialization/jhudatascience/1,HTML,4117,31008,87,2014-01-21T10:22:57Z,2026-05-11T18:13:52Z,https://github.com/DataScienceSpecialization/courses,,,1083379,False,False
75,MoonTV,samqin123/MoonTV,samqin123,,TypeScript,1946,30771,24,2025-06-20T03:02:45Z,2026-05-17T18:51:44Z,https://github.com/samqin123/MoonTV,,MIT License,25147,False,False
76,DefinitelyTyped,DefinitelyTyped/DefinitelyTyped,DefinitelyTyped,The repository for high quality TypeScript type definitions.,TypeScript,51245,30503,682,2012-10-05T16:39:45Z,2026-05-18T03:42:31Z,https://github.com/DefinitelyTyped/DefinitelyTyped,,Other,830857,False,False
77,vue-element-admin,PanJiaChen/vue-element-admin,PanJiaChen,:tada: A magical vue admin                                                                https://panjiachen.github.io/vue-element-admin,Vue,90273,30497,1386,2017-04-17T03:35:49Z,2026-05-18T03:26:22Z,https://github.com/PanJiaChen/vue-element-admin,,MIT License,15433,False,False
78,flutter,flutter/flutter,flutter,Flutter makes it easy and fast to build beautiful apps for mobile and beyond,Dart,176348,30383,12660,2015-03-06T22:54:58Z,2026-05-18T03:46:23Z,https://github.com/flutter/flutter,https://flutter.dev,"BSD 3-Clause ""New"" or ""Revised"" License",443334,False,False
79,stable-diffusion-webui,AUTOMATIC1111/stable-diffusion-webui,AUTOMATIC1111,Stable Diffusion web UI,Python,163114,30351,2487,2022-08-22T14:05:26Z,2026-05-18T04:04:20Z,https://github.com/AUTOMATIC1111/stable-diffusion-webui,,GNU Affero General Public License v3.0,36552,False,False
80,mall,macrozheng/mall,macrozheng,mall项目是一套电商系统，包括前台商城系统及后台管理系统，基于Spring Boot+MyBatis实现，采用Docker容器化部署。 前台商城系统包含首页门户、商品推荐、商品搜索、商品展示、购物车、订单流程、会员中心、客户服务、帮助中心等模块。 后台管理系统包含商品管理、订单管理、会员管理、促销管理、运营管理、内容管理、统计报表、财务管理、权限管理、设置等模块。,Java,83627,29702,14,2018-04-04T01:11:44Z,2026-05-18T02:53:37Z,https://github.com/macrozheng/mall,https://www.macrozheng.com/admin/,Apache License 2.0,58736,False,False
81,spring-petclinic,spring-projects/spring-petclinic,spring-projects,A sample Spring-based application,CSS,9221,29411,74,2013-01-09T09:05:18Z,2026-05-17T22:19:34Z,https://github.com/spring-projects/spring-petclinic,,Apache License 2.0,10864,False,False
82,spark,apache/spark,apache,Apache Spark - A unified analytics engine for large-scale data processing,Scala,43291,29195,398,2014-02-25T08:00:08Z,2026-05-18T03:19:48Z,https://github.com/apache/spark,https://spark.apache.org/,Apache License 2.0,556860,False,False
83,jbbmo-Introduction-to-Git-and-GitHub,ibm-developer-skills-network/jbbmo-Introduction-to-Git-and-GitHub,ibm-developer-skills-network,Introduction to Git and GitHub,Python,85,28808,70,2022-01-12T21:43:00Z,2026-05-13T16:16:46Z,https://github.com/ibm-developer-skills-network/jbbmo-Introduction-to-Git-and-GitHub,,Apache License 2.0,15,False,False
84,everything-claude-code,affaan-m/everything-claude-code,affaan-m,"The agent harness performance optimization system. Skills, instincts, memory, security, and research-first development for Claude Code, Codex, Opencode, Cursor and beyond.",JavaScript,185812,28748,0,2026-01-18T00:51:51Z,2026-05-18T04:09:15Z,https://github.com/affaan-m/everything-claude-code,https://ecc.tools,MIT License,35281,False,False
85,dotfiles,lewagon/dotfiles,lewagon,Default configuration for Le Wagon's students,Shell,21769,28675,5,2014-04-04T14:54:29Z,2026-05-16T20:54:59Z,https://github.com/lewagon/dotfiles,https://www.lewagon.com,MIT License,216,False,False
86,free-programming-books-zh_CN,justjavac/free-programming-books-zh_CN,justjavac,:books: 免费的计算机编程类中文书籍，欢迎投稿,,116960,28312,32,2013-11-04T01:59:19Z,2026-05-18T03:28:56Z,https://github.com/justjavac/free-programming-books-zh_CN,http://weibo.com/justjavac,GNU General Public License v3.0,1059,False,False
87,awesome-python,vinta/awesome-python,vinta,"An opinionated list of Python frameworks, libraries, tools, and resources",Python,298252,27928,16,2014-06-27T21:00:06Z,2026-05-18T04:06:15Z,https://github.com/vinta/awesome-python,https://awesome-python.com/,Other,5589,False,False
