排名,项目名称,完整名称,作者,描述,语言,Stars,Forks,Issues,创建时间,更新时间,仓库链接,主页链接,许可证,大小(KB),是否Fork,是否已归档
1,build-your-own-x,codecrafters-io/build-your-own-x,codecrafters-io,Master programming by recreating your favorite technologies from scratch.,Markdown,500372,47435,479,2018-05-09T12:03:18Z,2026-05-11T04:00:25Z,https://github.com/codecrafters-io/build-your-own-x,https://codecrafters.io,,1201,False,False
2,awesome,sindresorhus/awesome,sindresorhus,😎 Awesome lists about all kinds of interesting topics,,465004,34886,73,2014-07-11T13:42:37Z,2026-05-11T03:59:21Z,https://github.com/sindresorhus/awesome,,Creative Commons Zero v1.0 Universal,1561,False,False
3,freeCodeCamp,freeCodeCamp/freeCodeCamp,freeCodeCamp,"freeCodeCamp.org's open-source codebase and curriculum. Learn math, programming, and computer science for free.",TypeScript,444466,44506,186,2014-12-24T17:49:19Z,2026-05-11T03:51:07Z,https://github.com/freeCodeCamp/freeCodeCamp,https://contribute.freecodecamp.org,"BSD 3-Clause ""New"" or ""Revised"" License",571799,False,False
4,public-apis,public-apis/public-apis,public-apis,A collective list of free APIs,Python,433903,47507,1311,2016-03-20T23:49:42Z,2026-05-11T04:00:29Z,https://github.com/public-apis/public-apis,https://APILayer.com/?utm_source=Github&utm_medium=Referral&utm_campaign=Public-apis-repo,MIT License,5485,False,False
5,free-programming-books,EbookFoundation/free-programming-books,EbookFoundation,:books: Freely available programming books,Python,388032,66281,79,2013-10-11T06:50:37Z,2026-05-11T03:36:31Z,https://github.com/EbookFoundation/free-programming-books,https://ebookfoundation.github.io/free-programming-books/,Creative Commons Attribution 4.0 International,21280,False,False
6,openclaw,openclaw/openclaw,openclaw,Your own personal AI assistant. Any OS. Any Platform. The lobster way. 🦞 ,TypeScript,370624,76589,7565,2025-11-24T10:16:47Z,2026-05-11T03:59:43Z,https://github.com/openclaw/openclaw,https://openclaw.ai,MIT License,1036705,False,False
7,developer-roadmap,nilbuild/developer-roadmap,nilbuild,"Interactive roadmaps, guides and other educational content to help developers grow in their careers.",TypeScript,354546,44052,8,2017-03-15T13:45:52Z,2026-05-11T03:45:09Z,https://github.com/nilbuild/developer-roadmap,https://roadmap.sh,Other,360347,False,False
8,system-design-primer,donnemartin/system-design-primer,donnemartin,Learn how to design large-scale systems. Prep for the system design interview.  Includes Anki flashcards.,Python,347761,56104,535,2017-02-26T16:15:28Z,2026-05-11T03:56:33Z,https://github.com/donnemartin/system-design-primer,,Other,11277,False,False
9,coding-interview-university,jwasham/coding-interview-university,jwasham,A complete computer science study plan to become a software engineer.,,346530,82861,109,2016-06-06T02:34:12Z,2026-05-11T03:53:57Z,https://github.com/jwasham/coding-interview-university,,Creative Commons Attribution Share Alike 4.0 International,22700,False,False
10,awesome-python,vinta/awesome-python,vinta,"An opinionated list of Python frameworks, libraries, tools, and resources",Python,296981,27859,19,2014-06-27T21:00:06Z,2026-05-11T03:59:21Z,https://github.com/vinta/awesome-python,https://awesome-python.com/,Other,5538,False,False
11,awesome-selfhosted,awesome-selfhosted/awesome-selfhosted,awesome-selfhosted,A list of Free Software network services and web applications which can be hosted on your own servers,,291396,13445,0,2015-06-01T02:33:17Z,2026-05-11T03:45:02Z,https://github.com/awesome-selfhosted/awesome-selfhosted,https://awesome-selfhosted.net/,Other,16917,False,False
12,996.ICU,996icu/996.ICU,996icu,Repo for counting stars and contributing. Press F to pay respect to glorious developers.,,276148,20880,16694,2019-03-26T07:31:14Z,2026-05-11T03:54:27Z,https://github.com/996icu/996.ICU,https://996.icu,Other,189351,False,False
13,project-based-learning,practical-tutorials/project-based-learning,practical-tutorials,Curated list of project-based tutorials,,265286,34480,299,2017-04-12T05:07:46Z,2026-05-11T03:48:08Z,https://github.com/practical-tutorials/project-based-learning,,MIT License,438,False,False
14,react,facebook/react,facebook,The library for web and native user interfaces.,JavaScript,244938,51014,1293,2013-05-24T16:15:54Z,2026-05-11T03:43:03Z,https://github.com/facebook/react,https://react.dev,MIT License,970824,False,False
15,linux,torvalds/linux,torvalds,Linux kernel source tree,C,232710,62188,3,2011-09-04T22:48:12Z,2026-05-11T03:28:58Z,https://github.com/torvalds/linux,,Other,6300287,False,False
16,Python,TheAlgorithms/Python,TheAlgorithms,All Algorithms implemented in Python,Python,220919,50588,964,2016-07-16T09:44:01Z,2026-05-11T03:47:43Z,https://github.com/TheAlgorithms/Python,https://thealgorithms.github.io/Python/,MIT License,16593,False,False
17,the-book-of-secret-knowledge,trimstray/the-book-of-secret-knowledge,trimstray,"A collection of inspiring lists, manuals, cheatsheets, blogs, hacks, one-liners, cli/web tools and more.",,219678,13170,142,2018-06-23T10:43:14Z,2026-05-11T03:59:28Z,https://github.com/trimstray/the-book-of-secret-knowledge,,MIT License,1748,False,False
18,vue,vuejs/vue,vuejs,"This is the repo for Vue 2. For Vue 3, go to https://github.com/vuejs/core",TypeScript,209756,33836,623,2013-07-29T03:24:51Z,2026-05-11T01:38:13Z,https://github.com/vuejs/vue,http://v2.vuejs.org,MIT License,32152,False,False
19,computer-science,ossu/computer-science,ossu,🎓 Path to a free self-taught education in Computer Science!,HTML,203696,25364,22,2014-05-04T00:18:39Z,2026-05-11T01:08:41Z,https://github.com/ossu/computer-science,https://cs.ossu.dev,MIT License,1784,False,False
20,javascript-algorithms,trekhleb/javascript-algorithms,trekhleb,📝 Algorithms and data structures implemented in JavaScript with explanations and links to further readings,JavaScript,195942,31083,404,2018-03-24T07:47:04Z,2026-05-11T01:48:16Z,https://github.com/trekhleb/javascript-algorithms,,MIT License,14903,False,False
21,tensorflow,tensorflow/tensorflow,tensorflow,An Open Source Machine Learning Framework for Everyone,C++,195057,75272,5062,2015-11-07T01:19:20Z,2026-05-11T03:24:50Z,https://github.com/tensorflow/tensorflow,https://tensorflow.org,Apache License 2.0,1319884,False,False
22,claw-code,ultraworkers/claw-code,ultraworkers,The repo is finally unlocked. enjoy the party! The fastest repo in history to surpass 100K stars ⭐. Join Discord: https://discord.gg/5TUQKqFWd Built in Rust using oh-my-codex.,Rust,190987,109825,1380,2026-03-31T08:58:08Z,2026-05-11T03:50:40Z,https://github.com/ultraworkers/claw-code,,,11579,False,False
23,n8n,n8n-io/n8n,n8n-io,"Fair-code workflow automation platform with native AI capabilities. Combine visual building with custom code, self-host or cloud, 400+ integrations.",TypeScript,187376,57523,1490,2019-06-22T09:24:21Z,2026-05-11T03:59:30Z,https://github.com/n8n-io/n8n,https://n8n.io,Other,501990,False,False
24,ohmyzsh,ohmyzsh/ohmyzsh,ohmyzsh,"🙃   A delightful community-driven (with 2,500+ contributors) framework for managing your zsh configuration. Includes 300+ optional plugins (rails, git, macOS, hub, docker, homebrew, node, php, python, etc), 140+ themes to spice up your morning, and an auto-update tool that makes it easy to keep up with the latest updates from the community.",Shell,186913,26366,551,2009-08-28T18:15:37Z,2026-05-11T03:52:12Z,https://github.com/ohmyzsh/ohmyzsh,https://ohmyz.sh,MIT License,13538,False,False
25,superpowers,obra/superpowers,obra,An agentic skills framework & software development methodology that works.,Shell,185535,16488,299,2025-10-09T19:45:18Z,2026-05-11T03:59:35Z,https://github.com/obra/superpowers,,MIT License,2809,False,False
26,vscode,microsoft/vscode,microsoft,Visual Studio Code,TypeScript,184772,39747,17418,2015-09-03T20:23:38Z,2026-05-11T03:49:02Z,https://github.com/microsoft/vscode,https://code.visualstudio.com,MIT License,1249920,False,False
27,You-Dont-Know-JS,getify/You-Dont-Know-JS,getify,A book series (2 published editions) on the JS language.,,184449,33567,2,2013-11-16T02:37:24Z,2026-05-10T22:31:52Z,https://github.com/getify/You-Dont-Know-JS,https://www.amazon.com/dp/B085XXCJ7X,Other,15241,False,False
28,CS-Notes,CyC2018/CS-Notes,CyC2018,:books: 技术面试必备基础知识、Leetcode、计算机操作系统、计算机网络、系统设计,,184323,51006,196,2018-02-13T14:56:24Z,2026-05-11T03:32:35Z,https://github.com/CyC2018/CS-Notes,http://cyc2018.xyz,,116179,False,False
29,AutoGPT,Significant-Gravitas/AutoGPT,Significant-Gravitas,"AutoGPT is the vision of accessible AI for everyone, to use and to build on. Our mission is to provide the tools, so that you can focus on what matters.",Python,184160,46236,390,2023-03-16T09:21:07Z,2026-05-11T03:29:13Z,https://github.com/Significant-Gravitas/AutoGPT,https://agpt.co,Other,569696,False,False
30,Python-100-Days,jackfrued/Python-100-Days,jackfrued,Python - 100天从新手到大师,Jupyter Notebook,182319,55672,697,2018-03-01T16:05:52Z,2026-05-11T03:44:53Z,https://github.com/jackfrued/Python-100-Days,,,401142,False,False
31,everything-claude-code,affaan-m/everything-claude-code,affaan-m,"The agent harness performance optimization system. Skills, instincts, memory, security, and research-first development for Claude Code, Codex, Opencode, Cursor and beyond.",JavaScript,178480,27549,177,2026-01-18T00:51:51Z,2026-05-11T04:00:35Z,https://github.com/affaan-m/everything-claude-code,https://ecc.tools,MIT License,31432,False,False
32,flutter,flutter/flutter,flutter,Flutter makes it easy and fast to build beautiful apps for mobile and beyond,Dart,176270,30348,12632,2015-03-06T22:54:58Z,2026-05-11T03:55:03Z,https://github.com/flutter/flutter,https://flutter.dev,"BSD 3-Clause ""New"" or ""Revised"" License",442520,False,False
33,Microsoft-Activation-Scripts,massgravel/Microsoft-Activation-Scripts,massgravel,"Open-source Windows and Office activator featuring HWID, Ohook, TSforge, and Online KMS activation methods, along with advanced troubleshooting.",Batchfile,174771,16789,2,2020-01-12T23:03:34Z,2026-05-11T04:00:05Z,https://github.com/massgravel/Microsoft-Activation-Scripts,https://massgrave.dev,GNU General Public License v3.0,12955,False,False
34,bootstrap,twbs/bootstrap,twbs,"The most popular HTML, CSS, and JavaScript framework for developing responsive, mobile first projects on the web.",MDX,174239,78914,437,2011-07-29T21:19:00Z,2026-05-11T01:40:51Z,https://github.com/twbs/bootstrap,https://getbootstrap.com,MIT License,296089,False,False
35,gitignore,github/gitignore,github,A collection of useful .gitignore templates,,173811,82550,71,2010-11-08T20:17:14Z,2026-05-11T03:34:58Z,https://github.com/github/gitignore,,Creative Commons Zero v1.0 Universal,3119,False,False
36,awesome-go,avelino/awesome-go,avelino,"A curated list of awesome Go frameworks, libraries and software",Go,172316,13204,181,2014-07-06T13:42:15Z,2026-05-11T03:59:27Z,https://github.com/avelino/awesome-go,https://awesome-go.com,MIT License,11316,False,False
37,ollama,ollama/ollama,ollama,"Get up and running with Kimi-K2.5, GLM-5, MiniMax, DeepSeek, gpt-oss, Qwen, Gemma and other models.",Go,171161,16059,3232,2023-06-26T19:39:32Z,2026-05-11T03:52:12Z,https://github.com/ollama/ollama,https://ollama.com,MIT License,82260,False,False
38,stable-diffusion-webui,AUTOMATIC1111/stable-diffusion-webui,AUTOMATIC1111,Stable Diffusion web UI,Python,162811,30325,2484,2022-08-22T14:05:26Z,2026-05-11T03:58:38Z,https://github.com/AUTOMATIC1111/stable-diffusion-webui,,GNU Affero General Public License v3.0,36552,False,False
39,prompts.chat,f/prompts.chat,f,"f.k.a. Awesome ChatGPT Prompts. Share, discover, and collect prompts from the community. Free and open source — self-host for your organization with complete privacy.",HTML,161985,21101,43,2022-12-05T13:54:13Z,2026-05-11T03:54:37Z,https://github.com/f/prompts.chat,https://prompts.chat,Other,349914,False,False
40,yt-dlp,yt-dlp/yt-dlp,yt-dlp,A feature-rich command-line audio/video downloader,Python,161557,13433,2488,2020-10-26T04:22:55Z,2026-05-11T03:43:43Z,https://github.com/yt-dlp/yt-dlp,https://discord.gg/H5MNcFW63r,The Unlicense,60594,False,False
41,FreeDomain,DigitalPlatDev/FreeDomain,DigitalPlatDev,DigitalPlat FreeDomain: Free Domain For Everyone,HTML,161413,2740,32,2024-05-30T13:23:00Z,2026-05-11T04:00:13Z,https://github.com/DigitalPlatDev/FreeDomain,https://domain.digitalplat.org,GNU Affero General Public License v3.0,972,False,False
42,the-art-of-command-line,jlevy/the-art-of-command-line,jlevy,"Master the command line, in one page",,160899,14804,254,2015-05-20T15:11:03Z,2026-05-11T03:58:01Z,https://github.com/jlevy/the-art-of-command-line,,,2772,False,False
43,transformers,huggingface/transformers,huggingface,"🤗 Transformers: the model-definition framework for state-of-the-art machine learning models in text, vision, audio, and multimodal models, for both inference and training. ",Python,160452,33160,2364,2018-10-29T13:56:00Z,2026-05-11T03:57:31Z,https://github.com/huggingface/transformers,https://huggingface.co/transformers,Apache License 2.0,483257,False,False
44,opencode,anomalyco/opencode,anomalyco,The open source coding agent.,TypeScript,158095,18465,6597,2025-04-30T20:08:00Z,2026-05-11T03:58:40Z,https://github.com/anomalyco/opencode,https://opencode.ai,MIT License,256509,False,False
45,HelloGitHub,521xueweihan/HelloGitHub,521xueweihan,":octocat: 分享 GitHub 上有趣、入门级的开源项目。Share interesting, entry-level open source projects on GitHub.",Python,156028,11900,360,2016-05-04T06:24:11Z,2026-05-11T03:53:52Z,https://github.com/521xueweihan/HelloGitHub,https://hellogithub.com,,9838,False,False
46,JavaGuide,Snailclimb/JavaGuide,Snailclimb,Java 面试 & 后端通用面试指南，覆盖计算机基础、数据库、分布式、高并发、系统设计与 AI 应用开发,Java,155548,46139,64,2018-05-07T13:27:00Z,2026-05-11T03:50:03Z,https://github.com/Snailclimb/JavaGuide,https://javaguide.cn,Apache License 2.0,180024,False,False
47,javascript,airbnb/javascript,airbnb,JavaScript Style Guide,JavaScript,148119,26684,159,2012-11-01T23:13:50Z,2026-05-11T01:16:43Z,https://github.com/airbnb/javascript,,MIT License,3738,False,False
48,langflow,langflow-ai/langflow,langflow-ai,Langflow is a powerful tool for building and deploying AI-powered agents and workflows.,Python,147938,8947,927,2023-02-08T22:28:03Z,2026-05-11T03:50:21Z,https://github.com/langflow-ai/langflow,http://www.langflow.org,MIT License,1264985,False,False
49,hermes-agent,NousResearch/hermes-agent,NousResearch,The agent that grows with you,Python,142868,22290,9890,2025-07-22T22:22:28Z,2026-05-11T04:00:27Z,https://github.com/NousResearch/hermes-agent,https://hermes-agent.nousresearch.com,MIT License,202128,False,False
50,dify,langgenius/dify,langgenius,Production-ready platform for agentic workflow development.,TypeScript,140874,22116,772,2023-04-12T07:40:24Z,2026-05-11T03:58:38Z,https://github.com/langgenius/dify,https://dify.ai,Other,364024,False,False
51,youtube-dl,ytdl-org/youtube-dl,ytdl-org,Command-line program to download videos from YouTube.com and other video sites,Python,140247,10641,4125,2010-10-31T14:35:07Z,2026-05-11T02:42:38Z,https://github.com/ytdl-org/youtube-dl,http://ytdl-org.github.io/youtube-dl/,The Unlicense,65510,False,False
52,scrcpy,Genymobile/scrcpy,Genymobile,Display and control your Android device,C,139707,12990,2798,2017-11-21T18:00:27Z,2026-05-11T04:00:05Z,https://github.com/Genymobile/scrcpy,,Apache License 2.0,8627,False,False
53,tech-interview-handbook,yangshun/tech-interview-handbook,yangshun,Curated coding interview preparation materials for busy software engineers,TypeScript,139434,16559,44,2016-07-05T05:00:48Z,2026-05-11T03:56:04Z,https://github.com/yangshun/tech-interview-handbook,https://www.techinterviewhandbook.org,MIT License,33749,False,False
54,next.js,vercel/next.js,vercel,The React Framework,JavaScript,139377,31047,3907,2016-10-05T23:32:51Z,2026-05-11T03:30:07Z,https://github.com/vercel/next.js,https://nextjs.org,MIT License,2561645,False,False
55,system-prompts-and-models-of-ai-tools,x1xhlol/system-prompts-and-models-of-ai-tools,x1xhlol,"FULL Augment Code, Claude Code, Cluely, CodeBuddy, Comet, Cursor, Devin AI, Junie, Kiro, Leap.new, Lovable, Manus, NotionAI, Orchids.app, Perplexity, Poke, Qoder, Replit, Same.dev, Trae, Traycer AI, VSCode Agent, Warp.dev, Windsurf, Xcode, Z.ai Code, Dia & v0. (And other Open Sourced) System Prompts, Internal Tools & AI Models",,137083,34186,139,2025-03-05T16:38:29Z,2026-05-11T04:00:23Z,https://github.com/x1xhlol/system-prompts-and-models-of-ai-tools,,GNU General Public License v3.0,1437,False,False
56,open-webui,open-webui/open-webui,open-webui,"User-friendly AI Interface (Supports Ollama, OpenAI API, ...)",Python,136522,19440,222,2023-10-06T22:08:27Z,2026-05-11T03:49:12Z,https://github.com/open-webui/open-webui,https://openwebui.com,Other,367673,False,False
57,langchain,langchain-ai/langchain,langchain-ai,The agent engineering platform.,Python,136348,22535,569,2022-10-17T02:58:36Z,2026-05-11T03:57:41Z,https://github.com/langchain-ai/langchain,https://docs.langchain.com/langchain/,MIT License,551261,False,False
58,go,golang/go,golang,The Go programming language,Go,133829,19002,10120,2014-08-19T04:33:40Z,2026-05-11T03:24:47Z,https://github.com/golang/go,https://go.dev,"BSD 3-Clause ""New"" or ""Revised"" License",436132,False,False
59,fucking-algorithm,labuladong/fucking-algorithm,labuladong,"Crack LeetCode, not only how, but also why. ",Markdown,133408,23624,2,2020-02-19T09:01:23Z,2026-05-11T03:00:07Z,https://github.com/labuladong/fucking-algorithm,https://labuladong.online/,,126234,False,False
60,PowerToys,microsoft/PowerToys,microsoft,Microsoft PowerToys is a collection of utilities that supercharge productivity and customization on Windows,C#,133020,7959,6949,2019-05-01T17:44:02Z,2026-05-11T02:47:42Z,https://github.com/microsoft/PowerToys,,MIT License,499011,False,False
61,skills,anthropics/skills,anthropics,Public repository for Agent Skills,Python,131762,15519,826,2025-09-22T15:53:31Z,2026-05-11T03:58:41Z,https://github.com/anthropics/skills,,,3703,False,False
62,30-seconds-of-code,Chalarangelo/30-seconds-of-code,Chalarangelo,Coding articles to level up your development skills,JavaScript,127752,12486,1,2017-11-29T17:35:03Z,2026-05-11T03:02:06Z,https://github.com/Chalarangelo/30-seconds-of-code,https://30secondsofcode.org/,Creative Commons Attribution 4.0 International,742615,False,False
63,hello-algo,krahets/hello-algo,krahets,"《Hello 算法》：动画图解、一键运行的数据结构与算法教程。支持简中、繁中、English、日本語，提供 Python, Java, C++, C, C#, JS, Go, Swift, Rust, Ruby, Kotlin, TS, Dart 等代码实现",Java,126097,15120,34,2022-11-04T11:08:34Z,2026-05-11T03:49:58Z,https://github.com/krahets/hello-algo,https://www.hello-algo.com,Other,464747,False,False
64,react-native,facebook/react-native,facebook,A framework for building native applications using React,C++,125785,25149,1309,2015-01-09T18:10:16Z,2026-05-11T03:23:50Z,https://github.com/facebook/react-native,https://reactnative.dev,MIT License,967451,False,False
65,andrej-karpathy-skills,forrestchang/andrej-karpathy-skills,forrestchang,"A single CLAUDE.md file to improve Claude Code behavior, derived from Andrej Karpathy's observations on LLM coding pitfalls.",,123918,12589,88,2026-01-27T03:53:13Z,2026-05-11T03:59:13Z,https://github.com/forrestchang/andrej-karpathy-skills,,,20,False,False
66,excalidraw,excalidraw/excalidraw,excalidraw,Virtual whiteboard for sketching hand-drawn like diagrams,TypeScript,122900,13593,3040,2020-01-02T01:04:43Z,2026-05-11T03:46:16Z,https://github.com/excalidraw/excalidraw,https://excalidraw.com,MIT License,100893,False,False
67,markitdown,microsoft/markitdown,microsoft,Python tool for converting files and office documents to Markdown.,Python,122459,8242,636,2024-11-13T19:56:40Z,2026-05-11T03:57:53Z,https://github.com/microsoft/markitdown,,MIT License,4255,False,False
68,claude-code,anthropics/claude-code,anthropics,"Claude Code is an agentic coding tool that lives in your terminal, understands your codebase, and helps you code faster by executing routine tasks, explaining complex code, and handling git workflows - all through natural language commands.",Shell,122334,20216,10827,2025-02-22T17:41:21Z,2026-05-11T03:58:39Z,https://github.com/anthropics/claude-code,https://code.claude.com/docs/en/overview,,27852,False,False
69,kubernetes,kubernetes/kubernetes,kubernetes,Production-Grade Container Scheduling and Management,Go,122180,43027,2671,2014-06-06T22:56:04Z,2026-05-11T03:38:07Z,https://github.com/kubernetes/kubernetes,https://kubernetes.io,Apache License 2.0,1469801,False,False
70,free-for-dev,ripienaar/free-for-dev,ripienaar,"A list of SaaS, PaaS and IaaS offerings that have free tiers of interest to devops and infradev",HTML,122027,12786,15,2015-03-18T21:06:26Z,2026-05-11T03:47:43Z,https://github.com/ripienaar/free-for-dev,https://free-for.dev/,,9962,False,False
71,electron,electron/electron,electron,":electron: Build cross-platform desktop apps with JavaScript, HTML, and CSS",C++,121215,17193,847,2013-04-12T01:47:36Z,2026-05-11T03:24:47Z,https://github.com/electron/electron,https://electronjs.org,MIT License,200780,False,False
72,firecrawl,firecrawl/firecrawl,firecrawl,"🔥 The API to search, scrape, and interact with the web for AI",TypeScript,118015,7334,310,2024-04-15T21:02:29Z,2026-05-11T03:57:53Z,https://github.com/firecrawl/firecrawl,https://firecrawl.dev,GNU Affero General Public License v3.0,88774,False,False
73,clash-verge-rev,clash-verge-rev/clash-verge-rev,clash-verge-rev,"A modern GUI client based on Tauri, designed to run in Windows, macOS and Linux for tailored proxy experience",TypeScript,117156,8540,315,2023-11-21T18:24:03Z,2026-05-11T03:49:09Z,https://github.com/clash-verge-rev/clash-verge-rev,https://www.clashverge.dev,GNU General Public License v3.0,75523,False,False
74,node,nodejs/node,nodejs,Node.js JavaScript runtime ✨🐢🚀✨,JavaScript,117141,35516,2674,2014-11-26T19:57:11Z,2026-05-11T03:41:23Z,https://github.com/nodejs/node,https://nodejs.org,Other,1482467,False,False
75,free-programming-books-zh_CN,justjavac/free-programming-books-zh_CN,justjavac,:books: 免费的计算机编程类中文书籍，欢迎投稿,,116896,28301,32,2013-11-04T01:59:19Z,2026-05-11T02:27:07Z,https://github.com/justjavac/free-programming-books-zh_CN,http://weibo.com/justjavac,GNU General Public License v3.0,1059,False,False
76,iptv,iptv-org/iptv,iptv-org,Collection of publicly available IPTV channels from all over the world,TypeScript,116118,6115,7,2018-11-14T22:00:57Z,2026-05-11T03:46:40Z,https://github.com/iptv-org/iptv,https://iptv-org.github.io,The Unlicense,1232252,False,False
77,ui,shadcn-ui/ui,shadcn-ui,"A set of beautifully-designed, accessible components and a code distribution platform. Works with your favorite frameworks. Open Source. Open Code.",TypeScript,114003,8760,1860,2023-01-04T12:43:27Z,2026-05-11T03:52:57Z,https://github.com/shadcn-ui/ui,https://ui.shadcn.com,MIT License,63292,False,False
78,rustdesk,rustdesk/rustdesk,rustdesk,"An open-source remote desktop application designed for self-hosting, as an alternative to TeamViewer.",Rust,113879,17104,115,2020-09-28T15:36:08Z,2026-05-11T03:57:10Z,https://github.com/rustdesk/rustdesk,https://rustdesk.com,GNU Affero General Public License v3.0,71407,False,False
79,d3,d3/d3,d3,"Bring data to life with SVG, Canvas and HTML. :bar_chart::chart_with_upwards_trend::tada:",Shell,112868,22743,29,2010-09-27T17:22:42Z,2026-05-10T23:52:36Z,https://github.com/d3/d3,https://d3js.org,ISC License,59349,False,False
80,rust,rust-lang/rust,rust-lang,Empowering everyone to build reliable and efficient software.,Rust,112675,14882,12369,2010-06-16T20:39:03Z,2026-05-11T03:37:22Z,https://github.com/rust-lang/rust,https://www.rust-lang.org,Apache License 2.0,896332,False,False
81,three.js,mrdoob/three.js,mrdoob,JavaScript 3D Library.,JavaScript,112398,36367,486,2010-03-23T18:58:01Z,2026-05-11T02:55:46Z,https://github.com/mrdoob/three.js,https://threejs.org/,MIT License,1595831,False,False
82,ComfyUI,Comfy-Org/ComfyUI,Comfy-Org,"The most powerful and modular diffusion model GUI, api and backend with a graph/nodes interface.",Python,112322,13122,3988,2023-01-17T03:15:56Z,2026-05-11T03:59:35Z,https://github.com/Comfy-Org/ComfyUI,https://www.comfy.org/,GNU General Public License v3.0,88349,False,False
83,Awesome-Hacking,Hack-with-Github/Awesome-Hacking,Hack-with-Github,"A collection of various awesome lists for hackers, pentesters and security researchers",,111990,10273,29,2016-03-30T15:47:10Z,2026-05-11T03:55:04Z,https://github.com/Hack-with-Github/Awesome-Hacking,,Creative Commons Zero v1.0 Universal,1334,False,False
84,generative-ai-for-beginners,microsoft/generative-ai-for-beginners,microsoft,"21 Lessons, Get Started Building with Generative AI ",Jupyter Notebook,110610,59328,10,2023-06-19T16:28:59Z,2026-05-11T03:56:50Z,https://github.com/microsoft/generative-ai-for-beginners,,MIT License,6594574,False,False
85,godot,godotengine/godot,godotengine,Godot Engine – Multi-platform 2D and 3D game engine,C++,110540,25271,18229,2014-01-04T16:05:36Z,2026-05-11T02:53:40Z,https://github.com/godotengine/godot,https://godotengine.org,MIT License,1803171,False,False
86,awesome-llm-apps,Shubhamsaboo/awesome-llm-apps,Shubhamsaboo,"100+ AI Agent & RAG apps you can actually run — clone, customize, ship.",Python,109650,16226,9,2024-04-29T05:30:25Z,2026-05-11T03:59:07Z,https://github.com/Shubhamsaboo/awesome-llm-apps,https://www.theunwindai.com,Apache License 2.0,206183,False,False
