排名,项目名称,完整名称,作者,描述,语言,Stars,Forks,Issues,创建时间,更新时间,仓库链接,主页链接,许可证,大小(KB),是否Fork,是否已归档
88,git,git/git,git,Git Source Code Mirror - This is a publish-only repository but pull requests can be turned into patches to the mailing list via GitGitGadget (https://gitgitgadget.github.io/). Please follow Documentation/SubmittingPatches procedure for any of your improvements.,C,61014,27909,375,2008-07-23T14:21:26Z,2026-05-18T01:50:16Z,https://github.com/git/git,,Other,305386,False,False
89,pytorch,pytorch/pytorch,pytorch,Tensors and Dynamic neural networks in Python with strong GPU acceleration,Python,99972,27807,18529,2016-08-13T05:26:41Z,2026-05-18T02:27:49Z,https://github.com/pytorch/pytorch,https://pytorch.org,Other,1340305,False,False
90,java-design-patterns,iluwatar/java-design-patterns,iluwatar,Design patterns implemented in Java,Java,94000,27372,229,2014-08-09T16:45:18Z,2026-05-17T22:17:48Z,https://github.com/iluwatar/java-design-patterns,https://java-design-patterns.com,Other,47270,False,False
91,learning-area,mdn/learning-area,mdn,GitHub repo for the MDN Learning Area. ,HTML,7570,27311,2,2016-03-08T14:01:49Z,2026-05-18T03:25:30Z,https://github.com/mdn/learning-area,https://developer.mozilla.org/en-US/Learn,Creative Commons Zero v1.0 Universal,87022,False,False
92,minimal-mistakes,mmistakes/minimal-mistakes,mmistakes,":triangular_ruler: Jekyll theme for building a personal site, blog, project documentation, or portfolio.",HTML,13501,27300,24,2013-05-24T14:13:30Z,2026-05-17T22:04:50Z,https://github.com/mmistakes/minimal-mistakes,https://mmistakes.github.io/minimal-mistakes/,MIT License,48603,False,False
93,mslearn-tailspin-spacegame-web,MicrosoftDocs/mslearn-tailspin-spacegame-web,MicrosoftDocs,Code used in Microsoft Learn modules to support Azure DevOps,Shell,218,27271,846,2019-03-22T22:20:37Z,2026-05-08T22:32:49Z,https://github.com/MicrosoftDocs/mslearn-tailspin-spacegame-web,https://aka.ms/devops-build,Creative Commons Attribution 4.0 International,926,False,False
94,LibreTV,LibreSpark/LibreTV,LibreSpark,一分钟搭建影视站，支持Vercel/Docker等部署方式,JavaScript,13539,27261,96,2025-04-06T10:52:08Z,2026-05-18T03:20:26Z,https://github.com/LibreSpark/LibreTV,https://libretv.is-an.org,Apache License 2.0,1975,False,True
95,angular,angular/angular,angular,Deliver web apps with confidence 🚀,TypeScript,100110,27225,1159,2014-09-18T16:12:01Z,2026-05-18T01:06:07Z,https://github.com/angular/angular,https://angular.dev,MIT License,631402,False,False
96,angular.js,angular/angular.js,angular,AngularJS - HTML enhanced for web apps!,JavaScript,58648,27128,461,2010-01-06T00:34:37Z,2026-05-17T23:18:26Z,https://github.com/angular/angular.js,https://angularjs.org,MIT License,101796,False,True
97,create-react-app,react/create-react-app,react,Set up a modern web app by running one command.,JavaScript,103385,27047,2388,2016-07-17T14:55:11Z,2026-05-17T23:02:57Z,https://github.com/react/create-react-app,https://create-react-app.dev/,MIT License,25186,False,False
98,scikit-learn,scikit-learn/scikit-learn,scikit-learn,scikit-learn: machine learning in Python,Python,66107,27030,2025,2010-08-17T09:43:38Z,2026-05-18T02:45:03Z,https://github.com/scikit-learn/scikit-learn,https://scikit-learn.org,"BSD 3-Clause ""New"" or ""Revised"" License",182927,False,False
99,assets,trustwallet/assets,trustwallet,"A comprehensive, up-to-date collection of information about several thousands (!) of crypto tokens.",Go,5307,27035,136,2019-08-09T22:06:16Z,2026-05-17T16:31:03Z,https://github.com/trustwallet/assets,https://developer.trustwallet.com/assets/new-asset,MIT License,697416,False,False
100,javascript,airbnb/javascript,airbnb,JavaScript Style Guide,JavaScript,148126,26681,159,2012-11-01T23:13:50Z,2026-05-18T02:12:48Z,https://github.com/airbnb/javascript,,MIT License,3738,False,False
