排名,项目名称,完整名称,作者,描述,语言,Stars,Forks,Issues,创建时间,更新时间,仓库链接,主页链接,许可证,大小(KB),是否Fork,是否已归档
87,cc-switch,farion1231/cc-switch,farion1231,"A cross-platform desktop All-in-One assistant for Claude Code, Codex, OpenCode, OpenClaw, Gemini CLI & Hermes Agent. Only official website: ccswitch.io",Rust,116390,7805,1900,2025-08-04T14:16:16Z,2026-07-13T03:29:41Z,https://github.com/farion1231/cc-switch,https://ccswitch.io,MIT License,62173,False,False
88,Awesome-Hacking,Hack-with-Github/Awesome-Hacking,Hack-with-Github,"A collection of various awesome lists for hackers, pentesters and security researchers",,116087,10512,42,2016-03-30T15:47:10Z,2026-07-13T03:16:50Z,https://github.com/Hack-with-Github/Awesome-Hacking,,Creative Commons Zero v1.0 Universal,1334,False,False
89,rust,rust-lang/rust,rust-lang,Empowering everyone to build reliable and efficient software.,Rust,114668,15412,12592,2010-06-16T20:39:03Z,2026-07-13T02:44:07Z,https://github.com/rust-lang/rust,https://www.rust-lang.org,Apache License 2.0,939473,False,False
90,godot,godotengine/godot,godotengine,Godot Engine – Multi-platform 2D and 3D game engine,C++,114011,25979,18584,2014-01-04T16:05:36Z,2026-07-13T03:08:38Z,https://github.com/godotengine/godot,https://godotengine.org,MIT License,1859909,False,False
91,three.js,mrdoob/three.js,mrdoob,JavaScript 3D Library.,JavaScript,113695,36436,403,2010-03-23T18:58:01Z,2026-07-13T03:22:24Z,https://github.com/mrdoob/three.js,https://threejs.org/,MIT License,1637398,False,False
92,d3,d3/d3,d3,"Bring data to life with SVG, Canvas and HTML. :bar_chart::chart_with_upwards_trend::tada:",Shell,113207,22708,20,2010-09-27T17:22:42Z,2026-07-13T02:23:44Z,https://github.com/d3/d3,https://d3js.org,ISC License,59348,False,False
93,generative-ai-for-beginners,microsoft/generative-ai-for-beginners,microsoft,"21 Lessons, Get Started Building with Generative AI ",Jupyter Notebook,112919,60656,7,2023-06-19T16:28:59Z,2026-07-13T02:35:06Z,https://github.com/microsoft/generative-ai-for-beginners,,MIT License,6597929,False,False
94,v2rayN,2dust/v2rayN,2dust,"A GUI client for Windows, Linux and macOS, support Xray and sing-box and others",C#,111206,15511,14,2019-07-30T03:47:24Z,2026-07-13T02:55:31Z,https://github.com/2dust/v2rayN,https://v2rayn.2dust.link,GNU General Public License v3.0,48778,False,False
95,TypeScript,microsoft/TypeScript,microsoft,TypeScript is a superset of JavaScript that compiles to clean JavaScript output.,TypeScript,109877,13650,5059,2014-06-17T15:28:39Z,2026-07-13T01:21:14Z,https://github.com/microsoft/TypeScript,https://www.typescriptlang.org,Apache License 2.0,2960582,False,False
96,axios,axios/axios,axios,Promise based HTTP client for the browser and node.js,JavaScript,109106,11760,83,2014-08-18T22:30:27Z,2026-07-13T01:02:51Z,https://github.com/axios/axios,https://axios-http.com,MIT License,27606,False,False
97,tauri,tauri-apps/tauri,tauri-apps,"Build smaller, faster, and more secure desktop and mobile applications with a web frontend.",Rust,108979,3787,1440,2019-07-13T09:09:37Z,2026-07-13T03:04:26Z,https://github.com/tauri-apps/tauri,https://tauri.app,Apache License 2.0,106254,False,False
98,frp,fatedier/frp,fatedier,A fast reverse proxy to help you expose a local server behind a NAT or firewall to the internet.,Go,107967,15124,54,2015-12-21T15:24:59Z,2026-07-13T03:28:28Z,https://github.com/fatedier/frp,,Apache License 2.0,32326,False,False
99,papers-we-love,papers-we-love/papers-we-love,papers-we-love,Papers from the computer science community to read and discuss.,Shell,107777,6388,2,2013-12-15T14:31:41Z,2026-07-13T03:03:34Z,https://github.com/papers-we-love/papers-we-love,http://paperswelove.org/,,230846,False,False
100,deno,denoland/deno,denoland,A modern runtime for JavaScript and TypeScript.,Rust,107767,6286,1359,2018-05-15T01:34:26Z,2026-07-13T03:20:56Z,https://github.com/denoland/deno,https://deno.com,MIT License,242785,False,False
