排名,项目名称,完整名称,作者,描述,语言,Stars,Forks,Issues,创建时间,更新时间,仓库链接,主页链接,许可证,大小(KB),是否Fork,是否已归档
88,terminal,microsoft/terminal,microsoft,"The new Windows Terminal and the original Windows console host, all in the same place!",C++,102316,9149,1700,2017-08-11T18:38:22Z,2026-03-23T01:37:00Z,https://github.com/microsoft/terminal,,MIT License,162755,False,False
89,DeepSeek-V3,deepseek-ai/DeepSeek-V3,deepseek-ai,,Python,102312,16589,114,2024-12-26T09:52:40Z,2026-03-23T01:51:42Z,https://github.com/deepseek-ai/DeepSeek-V3,,MIT License,1768,False,False
90,awesome-mac,jaywcjlove/awesome-mac,jaywcjlove, This project is dedicated to collecting high-quality macOS software and organizing them systematically by different categories for easy search and use.,JavaScript,100688,7524,226,2016-07-17T15:33:47Z,2026-03-23T01:57:12Z,https://github.com/jaywcjlove/awesome-mac,https://git.io/macx,Creative Commons Zero v1.0 Universal,32469,False,False
91,angular,angular/angular,angular,Deliver web apps with confidence 🚀,TypeScript,100160,27135,1104,2014-09-18T16:12:01Z,2026-03-23T00:13:16Z,https://github.com/angular/angular,https://angular.dev,MIT License,619255,False,False
92,skills,anthropics/skills,anthropics,Public repository for Agent Skills,Python,100130,10919,552,2025-09-22T15:53:31Z,2026-03-23T02:44:27Z,https://github.com/anthropics/skills,,,3405,False,False
93,supabase,supabase/supabase,supabase,"The Postgres development platform. Supabase gives you a dedicated Postgres database to build your web, mobile, and AI applications.",TypeScript,99495,11859,966,2019-10-12T05:56:49Z,2026-03-23T02:39:03Z,https://github.com/supabase/supabase,https://supabase.com,Apache License 2.0,2309898,False,False
94,v2rayN,2dust/v2rayN,2dust,"A GUI client for Windows, Linux and macOS, support Xray and sing-box and others",C#,99482,14364,14,2019-07-30T03:47:24Z,2026-03-23T02:40:39Z,https://github.com/2dust/v2rayN,https://v2rayn.2dust.link,GNU General Public License v3.0,46449,False,False
95,llama.cpp,ggml-org/llama.cpp,ggml-org,LLM inference in C/C++,C++,98989,15710,1292,2023-03-10T18:58:00Z,2026-03-23T02:44:45Z,https://github.com/ggml-org/llama.cpp,,MIT License,342918,False,False
96,HowToCook,Anduin2017/HowToCook,Anduin2017,程序员在家做饭方法指南。Programmer's guide about how to cook at home (Simplified Chinese only).,Dockerfile,98981,10879,470,2020-02-29T10:43:49Z,2026-03-23T01:24:03Z,https://github.com/Anduin2017/HowToCook,https://cook.aiursoft.com,The Unlicense,465234,False,False
97,gemini-cli,google-gemini/gemini-cli,google-gemini,An open-source AI agent that brings the power of Gemini directly into your terminal.,TypeScript,98719,12531,3135,2025-04-17T17:04:31Z,2026-03-23T02:33:05Z,https://github.com/google-gemini/gemini-cli,https://geminicli.com,Apache License 2.0,64309,False,False
98,pytorch,pytorch/pytorch,pytorch,Tensors and Dynamic neural networks in Python with strong GPU acceleration,Python,98495,27274,18067,2016-08-13T05:26:41Z,2026-03-23T02:01:02Z,https://github.com/pytorch/pytorch,https://pytorch.org,Other,1273953,False,False
99,everything-claude-code,affaan-m/everything-claude-code,affaan-m,"The agent harness performance optimization system. Skills, instincts, memory, security, and research-first development for Claude Code, Codex, Opencode, Cursor and beyond.",JavaScript,98435,12850,88,2026-01-18T00:51:51Z,2026-03-23T02:45:15Z,https://github.com/affaan-m/everything-claude-code,https://ecc.tools,MIT License,25215,False,False
100,every-programmer-should-know,mtdvio/every-programmer-should-know,mtdvio,A collection of (mostly) technical things every software developer should know about,,98333,8688,22,2017-08-24T13:18:26Z,2026-03-23T02:01:22Z,https://github.com/mtdvio/every-programmer-should-know,,Creative Commons Attribution 4.0 International,226,False,False
