排名,项目名称,完整名称,作者,描述,语言,Stars,Forks,Issues,创建时间,更新时间,仓库链接,主页链接,许可证,大小(KB),是否Fork,是否已归档
87,llama.cpp,ggml-org/llama.cpp,ggml-org,LLM inference in C/C++,C++,109440,18051,1613,2023-03-10T18:58:00Z,2026-05-11T03:47:33Z,https://github.com/ggml-org/llama.cpp,,MIT License,395944,False,False
88,axios,axios/axios,axios,Promise based HTTP client for the browser and node.js,JavaScript,109045,11675,149,2014-08-18T22:30:27Z,2026-05-11T03:54:22Z,https://github.com/axios/axios,https://axios-http.com,MIT License,27193,False,False
89,TypeScript,microsoft/TypeScript,microsoft,TypeScript is a superset of JavaScript that compiles to clean JavaScript output.,TypeScript,108803,13391,5034,2014-06-17T15:28:39Z,2026-05-11T03:29:25Z,https://github.com/microsoft/TypeScript,https://www.typescriptlang.org,Apache License 2.0,2960434,False,False
90,GitHub-Chinese-Top-Charts,GrowingGit/GitHub-Chinese-Top-Charts,GrowingGit,:cn: GitHub中文排行榜，各语言分设「软件 | 资料」榜单，精准定位中文好项目。各取所需，高效学习。,Java,107891,13535,190,2019-09-05T03:01:56Z,2026-05-11T03:57:35Z,https://github.com/GrowingGit/GitHub-Chinese-Top-Charts,,Other,123199,False,False
91,deno,denoland/deno,denoland,A modern runtime for JavaScript and TypeScript.,Rust,106638,6053,2247,2018-05-15T01:34:26Z,2026-05-11T03:46:02Z,https://github.com/denoland/deno,https://deno.com,MIT License,215291,False,False
92,tauri,tauri-apps/tauri,tauri-apps,"Build smaller, faster, and more secure desktop and mobile applications with a web frontend.",Rust,106444,3585,1406,2019-07-13T09:09:37Z,2026-05-11T03:54:36Z,https://github.com/tauri-apps/tauri,https://tauri.app,Apache License 2.0,103841,False,False
93,frp,fatedier/frp,fatedier,A fast reverse proxy to help you expose a local server behind a NAT or firewall to the internet.,Go,106387,15037,39,2015-12-21T15:24:59Z,2026-05-11T03:25:01Z,https://github.com/fatedier/frp,,Apache License 2.0,31748,False,False
94,papers-we-love,papers-we-love/papers-we-love,papers-we-love,Papers from the computer science community to read and discuss.,Shell,106061,6347,3,2013-12-15T14:31:41Z,2026-05-11T02:59:02Z,https://github.com/papers-we-love/papers-we-love,http://paperswelove.org/,,230843,False,False
95,nodebestpractices,goldbergyoni/nodebestpractices,goldbergyoni,:white_check_mark:  The Node.js best practices list (July 2024),Dockerfile,105260,10734,106,2017-09-15T08:33:19Z,2026-05-10T22:32:17Z,https://github.com/goldbergyoni/nodebestpractices,https://twitter.com/nodepractices/,Creative Commons Attribution Share Alike 4.0 International,69535,False,False
96,v2rayN,2dust/v2rayN,2dust,"A GUI client for Windows, Linux and macOS, support Xray and sing-box and others",C#,105155,14951,13,2019-07-30T03:47:24Z,2026-05-11T03:53:45Z,https://github.com/2dust/v2rayN,https://v2rayn.2dust.link,GNU General Public License v3.0,47396,False,False
97,awesome-mac,jaywcjlove/awesome-mac,jaywcjlove, This project is dedicated to collecting high-quality macOS software and organizing them systematically by different categories for easy search and use.,Swift,103787,7735,278,2016-07-17T15:33:47Z,2026-05-11T03:58:41Z,https://github.com/jaywcjlove/awesome-mac,https://git.io/macx,Creative Commons Zero v1.0 Universal,38191,False,False
98,gemini-cli,google-gemini/gemini-cli,google-gemini,An open-source AI agent that brings the power of Gemini directly into your terminal.,TypeScript,103641,13575,1985,2025-04-17T17:04:31Z,2026-05-11T03:49:06Z,https://github.com/google-gemini/gemini-cli,https://geminicli.com,Apache License 2.0,95926,False,False
99,DeepSeek-V3,deepseek-ai/DeepSeek-V3,deepseek-ai,,Python,103456,16726,182,2024-12-26T09:52:40Z,2026-05-11T03:27:03Z,https://github.com/deepseek-ai/DeepSeek-V3,,MIT License,1768,False,False
100,create-react-app,facebook/create-react-app,facebook,Set up a modern web app by running one command.,JavaScript,103393,27064,2382,2016-07-17T14:55:11Z,2026-05-11T03:30:08Z,https://github.com/facebook/create-react-app,https://create-react-app.dev,MIT License,25186,False,False
