排名,项目名称,完整名称,作者,描述,语言,Stars,Forks,Issues,创建时间,更新时间,仓库链接,主页链接,许可证,大小(KB),是否Fork,是否已归档
1,T3MP3ST,elder-plinius/T3MP3ST,elder-plinius,autonomous red teaming platform; multi-agent offensive-security meta-harness,TypeScript,1801,446,23,2026-07-02T17:53:55Z,2026-07-06T04:06:36Z,https://github.com/elder-plinius/T3MP3ST,,GNU Affero General Public License v3.0,3361,False,False
2,ios-location-spoofer,mekos2772/ios-location-spoofer,mekos2772,Standalone iOS app to spoof GPS location without jailbreak. Includes Shadowrocket/Surge/Loon/QX/Stash module.,JavaScript,1341,200,1,2026-06-30T11:20:30Z,2026-07-06T03:51:59Z,https://github.com/mekos2772/ios-location-spoofer,,GNU Affero General Public License v3.0,6802,False,False
3,claude-real-video,HUANGCHIHHUNGLeo/claude-real-video,HUANGCHIHHUNGLeo,"Let Claude (or any LLM) actually watch a video — scene-aware, deduplicated frames + transcript, from a URL or local file. Runs locally, MIT.",Python,1020,60,0,2026-06-30T10:55:02Z,2026-07-06T04:01:29Z,https://github.com/HUANGCHIHHUNGLeo/claude-real-video,,MIT License,759,False,False
4,local-llm,jamesob/local-llm,jamesob,Everything I know about running LLMs locally,Shell,930,52,2,2026-07-03T13:06:03Z,2026-07-06T04:02:22Z,https://github.com/jamesob/local-llm,,,10790,False,False
5,Generals-Mac-iOS-iPad,ammaarreshi/Generals-Mac-iOS-iPad,ammaarreshi,"Command & Conquer Generals: Zero Hour running natively on macOS, iPhone & iPad — real engine (EA GPL v3 source, via GeneralsX), DXVK/MoltenVK renderer, RTS touch controls. No game assets included.",C++,840,57,1,2026-07-04T02:59:39Z,2026-07-06T04:05:50Z,https://github.com/ammaarreshi/Generals-Mac-iOS-iPad,,Other,45484,False,False
6,investing-for-beginners,xuchonglang/investing-for-beginners,xuchonglang,小隐寺投资百科官方公开索引：美股、期权与加密货币知识框架,,716,38,0,2026-07-03T03:56:00Z,2026-07-06T03:48:49Z,https://github.com/xuchonglang/investing-for-beginners,https://xiaoyinsi.com/wiki,Other,251,False,False
7,Talos,jmerelnyc/Talos,jmerelnyc,"GPU worker client for the Talos network. Pairs with your Talos account, serves open-model inference jobs over a WebSocket, and reports uptime for payouts.",Python,680,12,0,2026-07-02T14:43:11Z,2026-07-06T02:30:03Z,https://github.com/jmerelnyc/Talos,https://usetalos.xyz,MIT License,92,False,False
8,hermex,uzairansaruzi/hermex,uzairansaruzi,Native iPhone app for your Hermes agent,Swift,623,65,27,2026-07-02T12:47:31Z,2026-07-06T03:45:32Z,https://github.com/uzairansaruzi/hermex,https://hermexapp.com/,MIT License,10330,False,False
9,token-diet,Kulaxyz/token-diet,Kulaxyz,"Always-on token-efficiency skill for coding agents (Claude Code, Codex, Cursor, Windsurf, Cline). ~31% lower bill on average, no loss of correctness.",Shell,589,1,0,2026-07-03T15:20:04Z,2026-07-06T03:45:02Z,https://github.com/Kulaxyz/token-diet,,,28,False,False
10,MECCHA-VISION-ULTIMATE,CalmNoteDepot/MECCHA-VISION-ULTIMATE,CalmNoteDepot,🎯 Meccha Vision Ultimate — Ultimate Enhancement Tool for MECCHA CHAMELEON ESP · Aimbot · Fly Hack · Teleport · God Mode · Infinite Paint · Speed Hack · No Recoil,,533,0,0,2026-07-04T20:05:45Z,2026-07-06T02:21:32Z,https://github.com/CalmNoteDepot/MECCHA-VISION-ULTIMATE,,,17,False,False
11,FuckClaude,LinXiaoTao/FuckClaude,LinXiaoTao,,TypeScript,530,50,7,2026-07-02T05:36:45Z,2026-07-06T03:58:24Z,https://github.com/LinXiaoTao/FuckClaude,https://fuck-claude.vercel.app,MIT License,723,False,False
12,Fundamental-Ava,TianhangZhuzth/Fundamental-Ava,TianhangZhuzth,"Build digital human beings — autonomous, collaborative, and socially intelligent agents. FNzgGxU31RWiDgLr3GvxxSa42nRntvZNSG6aBMQ1pump",Python,525,53,0,2026-06-30T01:04:13Z,2026-07-06T01:45:07Z,https://github.com/TianhangZhuzth/Fundamental-Ava,https://fundamentalresearchlabs.com,Apache License 2.0,461,False,False
13,FrciblyK12,asz798838958/FrciblyK12,asz798838958,多线程全自动注册free 强上K12空间,Python,453,161,0,2026-07-02T03:47:34Z,2026-07-06T03:05:38Z,https://github.com/asz798838958/FrciblyK12,,GNU Affero General Public License v3.0,13143,False,False
14,OpenOPC,HKUDS/OpenOPC,HKUDS,"OpenOPC: Build Your Personal AI-Native Company — Self-Built, Self-Run, Self-Grown",Python,399,47,1,2026-07-01T10:17:37Z,2026-07-06T03:49:26Z,https://github.com/HKUDS/OpenOPC,,,8988,False,False
15,reverse-flow-skill,lingbol088-spec/reverse-flow-skill,lingbol088-spec,面向 AI Agent / Codex 的本地 CTF 逆向工程流程技能。加载后通过“真心为你”进入逆向模式，默认在本地沙盒、CTF、crackme、wargame 或训练靶场环境中工作，按“分析 → 报告 → 逆向 → 深度逆向 → 漏洞研判 → 用户选择下一步”的流程推进。,Python,399,205,2,2026-06-30T22:08:31Z,2026-07-06T04:04:33Z,https://github.com/lingbol088-spec/reverse-flow-skill,,MIT License,45,False,False
16,skills,dzhng/skills,dzhng,,JavaScript,338,20,2,2026-07-02T10:24:16Z,2026-07-06T04:05:55Z,https://github.com/dzhng/skills,,MIT License,4842,False,False
17,loopkit,Archive228/loopkit,Archive228,"33 battle-tested skills + minimal .claude harness for any coding agent (Claude Code, Cursor, Codex, Gemini CLI).",JavaScript,322,70,0,2026-06-30T08:46:55Z,2026-07-06T03:39:55Z,https://github.com/Archive228/loopkit,,MIT License,253,False,False
18,Codex-X,yynxxxxx/Codex-X,yynxxxxx,Codex Switch & Instruct desktop manager,Rust,314,55,0,2026-07-04T03:28:35Z,2026-07-06T03:51:54Z,https://github.com/yynxxxxx/Codex-X,https://github.com/yynxxxxx/Codex-X,MIT License,5617,False,False
19,GameBlocks,xt4d/GameBlocks,xt4d,Concise and self-explanatory building blocks that help coding agents prototype browser-based 3D games.,JavaScript,300,25,0,2026-07-01T16:38:56Z,2026-07-06T02:46:10Z,https://github.com/xt4d/GameBlocks,,MIT License,341,False,False
20,CSSwitch,SuperJJ007/CSSwitch,SuperJJ007,帮你的 Claude Science 一键接入你自己的 API：DeepSeek / 通义千问 / 智谱 GLM / Kimi / MiniMax / 小米 MiMo / 硅基流动 / OpenRouter / 任意 OpenAI·Anthropic 兼容端点,Rust,263,35,21,2026-07-02T16:46:56Z,2026-07-06T03:16:03Z,https://github.com/SuperJJ007/CSSwitch,,MIT License,3000,False,False
