æ’å,é¡¹ç›®åç§°,å®Œæ•´åç§°,ä½œè€…,æè¿°,è¯­è¨€,Stars,Forks,Issues,åˆ›å»ºæ—¶é—´,æ›´æ–°æ—¶é—´,ä»“åº“é“¾æ¥,ä¸»é¡µé“¾æ¥,è®¸å¯è¯,å¤§å°(KB),æ˜¯å¦Fork,æ˜¯å¦å·²å½’æ¡£
1,freeCodeCamp,freeCodeCamp/freeCodeCamp,freeCodeCamp,"freeCodeCamp.org's open-source codebase and curriculum. Learn math, programming, and computer science for free.",TypeScript,434290,42711,299,2014-12-24T17:49:19Z,2025-12-08T01:56:31Z,https://github.com/freeCodeCamp/freeCodeCamp,https://contribute.freecodecamp.org,"BSD 3-Clause ""New"" or ""Revised"" License",532781,False,False
2,free-programming-books,EbookFoundation/free-programming-books,EbookFoundation,:books: Freely available programming books,Python,378437,65608,200,2013-10-11T06:50:37Z,2025-12-08T02:01:04Z,https://github.com/EbookFoundation/free-programming-books,https://ebookfoundation.github.io/free-programming-books/,Creative Commons Attribution 4.0 International,20848,False,False
3,developer-roadmap,kamranahmedse/developer-roadmap,kamranahmedse,"Interactive roadmaps, guides and other educational content to help developers grow in their careers.",TypeScript,345015,43476,54,2017-03-15T13:45:52Z,2025-12-08T01:43:27Z,https://github.com/kamranahmedse/developer-roadmap,https://roadmap.sh,Other,358134,False,False
4,awesome-selfhosted,awesome-selfhosted/awesome-selfhosted,awesome-selfhosted,A list of Free Software network services and web applications which can be hosted on your own servers,,261954,12049,0,2015-06-01T02:33:17Z,2025-12-08T01:59:59Z,https://github.com/awesome-selfhosted/awesome-selfhosted,https://awesome-selfhosted.net/,Other,16742,False,False
5,react,facebook/react,facebook,The library for web and native user interfaces.,JavaScript,241364,50030,1100,2013-05-24T16:15:54Z,2025-12-08T01:40:51Z,https://github.com/facebook/react,https://react.dev,MIT License,865453,False,False
6,linux,torvalds/linux,torvalds,Linux kernel source tree,C,209868,58646,3,2011-09-04T22:48:12Z,2025-12-08T01:54:57Z,https://github.com/torvalds/linux,,Other,5764064,False,False
7,tensorflow,tensorflow/tensorflow,tensorflow,An Open Source Machine Learning Framework for Everyone,C++,192708,75031,2729,2015-11-07T01:19:20Z,2025-12-08T01:42:27Z,https://github.com/tensorflow/tensorflow,https://tensorflow.org,Apache License 2.0,1235756,False,False
8,ohmyzsh,ohmyzsh/ohmyzsh,ohmyzsh,"ğŸ™ƒ   A delightful community-driven (with 2,400+ contributors) framework for managing your zsh configuration. Includes 300+ optional plugins (rails, git, macOS, hub, docker, homebrew, node, php, python, etc), 140+ themes to spice up your morning, and an auto-update tool that makes it easy to keep up with the latest updates from the community.",Shell,183191,26287,533,2009-08-28T18:15:37Z,2025-12-08T01:09:28Z,https://github.com/ohmyzsh/ohmyzsh,https://ohmyz.sh,MIT License,13317,False,False
9,AutoGPT,Significant-Gravitas/AutoGPT,Significant-Gravitas,"AutoGPT is the vision of accessible AI for everyone, to use and to build on. Our mission is to provide the tools, so that you can focus on what matters.",Python,180159,46186,297,2023-03-16T09:21:07Z,2025-12-08T01:40:09Z,https://github.com/Significant-Gravitas/AutoGPT,https://agpt.co,Other,309077,False,False
10,vscode,microsoft/vscode,microsoft,Visual Studio Code,TypeScript,179385,36672,15023,2015-09-03T20:23:38Z,2025-12-08T01:37:41Z,https://github.com/microsoft/vscode,https://code.visualstudio.com,MIT License,1097038,False,False
11,Python-100-Days,jackfrued/Python-100-Days,jackfrued,Python - 100å¤©ä»æ–°æ‰‹åˆ°å¤§å¸ˆ,Jupyter Notebook,175949,55053,745,2018-03-01T16:05:52Z,2025-12-08T01:15:44Z,https://github.com/jackfrued/Python-100-Days,,,401004,False,False
12,flutter,flutter/flutter,flutter,Flutter makes it easy and fast to build beautiful apps for mobile and beyond,Dart,174179,29647,12409,2015-03-06T22:54:58Z,2025-12-08T00:20:20Z,https://github.com/flutter/flutter,https://flutter.dev,"BSD 3-Clause ""New"" or ""Revised"" License",422457,False,False
13,bootstrap,twbs/bootstrap,twbs,"The most popular HTML, CSS, and JavaScript framework for developing responsive, mobile first projects on the web.",MDX,173778,79165,598,2011-07-29T21:19:00Z,2025-12-08T01:41:35Z,https://github.com/twbs/bootstrap,https://getbootstrap.com,MIT License,265153,False,False
14,n8n,n8n-io/n8n,n8n-io,"Fair-code workflow automation platform with native AI capabilities. Combine visual building with custom code, self-host or cloud, 400+ integrations.",TypeScript,161172,51621,1317,2019-06-22T09:24:21Z,2025-12-08T02:03:55Z,https://github.com/n8n-io/n8n,https://n8n.io,Other,303404,False,False
15,ollama,ollama/ollama,ollama,"Get up and running with OpenAI gpt-oss, DeepSeek-R1, Gemma 3 and other models.",Go,157237,13856,2338,2023-06-26T19:39:32Z,2025-12-08T01:59:09Z,https://github.com/ollama/ollama,https://ollama.com,MIT License,68700,False,False
16,transformers,huggingface/transformers,huggingface,"ğŸ¤— Transformers: the model-definition framework for state-of-the-art machine learning models in text, vision, audio, and multimodal models, for both inference and training. ",Python,153560,31335,2137,2018-10-29T13:56:00Z,2025-12-08T01:37:11Z,https://github.com/huggingface/transformers,https://huggingface.co/transformers,Apache License 2.0,417288,False,False
17,JavaGuide,Snailclimb/JavaGuide,Snailclimb,"Java å­¦ä¹ &é¢è¯•æŒ‡å—ï¼ˆGoã€Python åç«¯é¢è¯•é€šç”¨,è®¡ç®—æœºåŸºç¡€é¢è¯•æ€»ç»“ï¼‰ã€‚å‡†å¤‡åç«¯æŠ€æœ¯é¢è¯•ï¼Œé¦–é€‰ JavaGuideï¼",Java,152929,46072,73,2018-05-07T13:27:00Z,2025-12-08T01:39:03Z,https://github.com/Snailclimb/JavaGuide,https://javaguide.cn,Apache License 2.0,178272,False,False
18,langflow,langflow-ai/langflow,langflow-ai,Langflow is a powerful tool for building and deploying AI-powered agents and workflows.,Python,140453,8120,966,2023-02-08T22:28:03Z,2025-12-08T01:31:07Z,https://github.com/langflow-ai/langflow,http://www.langflow.org,MIT License,1006517,False,False
19,awesome-chatgpt-prompts,f/awesome-chatgpt-prompts,f,This repo includes ChatGPT prompt curation to use ChatGPT and other LLM tools better.,JavaScript,138708,18381,291,2022-12-05T13:54:13Z,2025-12-08T01:49:05Z,https://github.com/f/awesome-chatgpt-prompts,https://prompts.chat,Creative Commons Zero v1.0 Universal,1706,False,False
20,yt-dlp,yt-dlp/yt-dlp,yt-dlp,A feature-rich command-line audio/video downloader,Python,137446,11080,2214,2020-10-26T04:22:55Z,2025-12-08T01:53:46Z,https://github.com/yt-dlp/yt-dlp,https://discord.gg/H5MNcFW63r,The Unlicense,58480,False,False
