排名,项目名称,完整名称,作者,描述,语言,Stars,Forks,Issues,创建时间,更新时间,仓库链接,主页链接,许可证,大小(KB),是否Fork,是否已归档
1,awesome,sindresorhus/awesome,sindresorhus,😎 Awesome lists about all kinds of interesting topics,,462122,34698,73,2014-07-11T13:42:37Z,2026-05-04T03:41:04Z,https://github.com/sindresorhus/awesome,,Creative Commons Zero v1.0 Universal,1560,False,False
2,freeCodeCamp,freeCodeCamp/freeCodeCamp,freeCodeCamp,"freeCodeCamp.org's open-source codebase and curriculum. Learn math, programming, and computer science for free.",TypeScript,444100,44448,192,2014-12-24T17:49:19Z,2026-05-04T03:41:34Z,https://github.com/freeCodeCamp/freeCodeCamp,https://contribute.freecodecamp.org,"BSD 3-Clause ""New"" or ""Revised"" License",571026,False,False
3,public-apis,public-apis/public-apis,public-apis,A collective list of free APIs,Python,430824,47026,1309,2016-03-20T23:49:42Z,2026-05-04T03:44:32Z,https://github.com/public-apis/public-apis,https://APILayer.com/?utm_source=Github&utm_medium=Referral&utm_campaign=Public-apis-repo,MIT License,5006,False,False
4,openclaw,openclaw/openclaw,openclaw,Your own personal AI assistant. Any OS. Any Platform. The lobster way. 🦞 ,TypeScript,367968,75754,6732,2025-11-24T10:16:47Z,2026-05-04T03:44:53Z,https://github.com/openclaw/openclaw,https://openclaw.ai,MIT License,843725,False,False
5,developer-roadmap,nilbuild/developer-roadmap,nilbuild,"Interactive roadmaps, guides and other educational content to help developers grow in their careers.",TypeScript,354110,44004,15,2017-03-15T13:45:52Z,2026-05-04T02:46:23Z,https://github.com/nilbuild/developer-roadmap,https://roadmap.sh,Other,360341,False,False
6,awesome-python,vinta/awesome-python,vinta,"An opinionated list of Python frameworks, libraries, tools, and resources",Python,295837,27811,21,2014-06-27T21:00:06Z,2026-05-04T03:34:47Z,https://github.com/vinta/awesome-python,https://awesome-python.com/,Other,5497,False,False
7,awesome-selfhosted,awesome-selfhosted/awesome-selfhosted,awesome-selfhosted,A list of Free Software network services and web applications which can be hosted on your own servers,,290041,13364,0,2015-06-01T02:33:17Z,2026-05-04T03:34:18Z,https://github.com/awesome-selfhosted/awesome-selfhosted,https://awesome-selfhosted.net/,Other,16808,False,False
8,react,facebook/react,facebook,The library for web and native user interfaces.,JavaScript,244824,51070,1266,2013-05-24T16:15:54Z,2026-05-04T02:48:43Z,https://github.com/facebook/react,https://react.dev,MIT License,968010,False,False
9,linux,torvalds/linux,torvalds,Linux kernel source tree,C,231836,62126,3,2011-09-04T22:48:12Z,2026-05-04T03:37:42Z,https://github.com/torvalds/linux,,Other,6330489,False,False
10,tensorflow,tensorflow/tensorflow,tensorflow,An Open Source Machine Learning Framework for Everyone,C++,194980,75342,4887,2015-11-07T01:19:20Z,2026-05-04T03:41:49Z,https://github.com/tensorflow/tensorflow,https://tensorflow.org,Apache License 2.0,1314553,False,False
11,claw-code,ultraworkers/claw-code,ultraworkers,The repo is finally unlocked. enjoy the party! The fastest repo in history to surpass 100K stars ⭐. Join Discord: https://discord.gg/5TUQKqFWd Built in Rust using oh-my-codex.,Rust,189848,109641,1520,2026-03-31T08:58:08Z,2026-05-04T03:40:17Z,https://github.com/ultraworkers/claw-code,,,11358,False,False
12,ohmyzsh,ohmyzsh/ohmyzsh,ohmyzsh,"🙃   A delightful community-driven (with 2,400+ contributors) framework for managing your zsh configuration. Includes 300+ optional plugins (rails, git, macOS, hub, docker, homebrew, node, php, python, etc), 140+ themes to spice up your morning, and an auto-update tool that makes it easy to keep up with the latest updates from the community.",Shell,186688,26354,550,2009-08-28T18:15:37Z,2026-05-04T01:55:50Z,https://github.com/ohmyzsh/ohmyzsh,https://ohmyz.sh,MIT License,13528,False,False
13,n8n,n8n-io/n8n,n8n-io,"Fair-code workflow automation platform with native AI capabilities. Combine visual building with custom code, self-host or cloud, 400+ integrations.",TypeScript,186604,57322,1579,2019-06-22T09:24:21Z,2026-05-04T03:45:40Z,https://github.com/n8n-io/n8n,https://n8n.io,Other,487339,False,False
14,vscode,microsoft/vscode,microsoft,Visual Studio Code,TypeScript,184525,39689,17023,2015-09-03T20:23:38Z,2026-05-04T03:33:43Z,https://github.com/microsoft/vscode,https://code.visualstudio.com,MIT License,1244417,False,False
15,AutoGPT,Significant-Gravitas/AutoGPT,Significant-Gravitas,"AutoGPT is the vision of accessible AI for everyone, to use and to build on. Our mission is to provide the tools, so that you can focus on what matters.",Python,183966,46246,395,2023-03-16T09:21:07Z,2026-05-04T03:40:39Z,https://github.com/Significant-Gravitas/AutoGPT,https://agpt.co,Other,556938,False,False
16,superpowers,obra/superpowers,obra,An agentic skills framework & software development methodology that works.,Shell,177495,15745,292,2025-10-09T19:45:18Z,2026-05-04T03:44:06Z,https://github.com/obra/superpowers,,MIT License,2527,False,False
17,flutter,flutter/flutter,flutter,Flutter makes it easy and fast to build beautiful apps for mobile and beyond,Dart,176171,30312,12574,2015-03-06T22:54:58Z,2026-05-04T02:53:21Z,https://github.com/flutter/flutter,https://flutter.dev,"BSD 3-Clause ""New"" or ""Revised"" License",441575,False,False
18,bootstrap,twbs/bootstrap,twbs,"The most popular HTML, CSS, and JavaScript framework for developing responsive, mobile first projects on the web.",MDX,174217,78934,435,2011-07-29T21:19:00Z,2026-05-04T00:59:20Z,https://github.com/twbs/bootstrap,https://getbootstrap.com,MIT License,295652,False,False
19,Microsoft-Activation-Scripts,massgravel/Microsoft-Activation-Scripts,massgravel,"Open-source Windows and Office activator featuring HWID, Ohook, TSforge, and Online KMS activation methods, along with advanced troubleshooting.",Batchfile,173940,16710,2,2020-01-12T23:03:34Z,2026-05-04T03:40:31Z,https://github.com/massgravel/Microsoft-Activation-Scripts,https://massgrave.dev,GNU General Public License v3.0,13023,False,False
20,everything-claude-code,affaan-m/everything-claude-code,affaan-m,"The agent harness performance optimization system. Skills, instincts, memory, security, and research-first development for Claude Code, Codex, Opencode, Cursor and beyond.",JavaScript,172757,26767,158,2026-01-18T00:51:51Z,2026-05-04T03:46:10Z,https://github.com/affaan-m/everything-claude-code,https://ecc.tools,MIT License,31473,False,False
