排名,项目名称,完整名称,作者,描述,语言,Stars,Forks,Issues,创建时间,更新时间,仓库链接,主页链接,许可证,大小(KB),是否Fork,是否已归档
1,freeCodeCamp,freeCodeCamp/freeCodeCamp,freeCodeCamp,"freeCodeCamp.org's open-source codebase and curriculum. Learn math, programming, and computer science for free.",TypeScript,435533,42990,331,2014-12-24T17:49:19Z,2026-01-05T02:25:59Z,https://github.com/freeCodeCamp/freeCodeCamp,https://contribute.freecodecamp.org,"BSD 3-Clause ""New"" or ""Revised"" License",536260,False,False
2,free-programming-books,EbookFoundation/free-programming-books,EbookFoundation,:books: Freely available programming books,Python,379931,65704,195,2013-10-11T06:50:37Z,2026-01-05T02:03:25Z,https://github.com/EbookFoundation/free-programming-books,https://ebookfoundation.github.io/free-programming-books/,Creative Commons Attribution 4.0 International,20911,False,False
3,developer-roadmap,kamranahmedse/developer-roadmap,kamranahmedse,"Interactive roadmaps, guides and other educational content to help developers grow in their careers.",TypeScript,346663,43594,47,2017-03-15T13:45:52Z,2026-01-05T00:43:17Z,https://github.com/kamranahmedse/developer-roadmap,https://roadmap.sh,Other,358533,False,False
4,awesome-selfhosted,awesome-selfhosted/awesome-selfhosted,awesome-selfhosted,A list of Free Software network services and web applications which can be hosted on your own servers,,266581,12221,0,2015-06-01T02:33:17Z,2026-01-05T02:17:08Z,https://github.com/awesome-selfhosted/awesome-selfhosted,https://awesome-selfhosted.net/,Other,16761,False,False
5,react,facebook/react,facebook,The library for web and native user interfaces.,JavaScript,242010,50277,1105,2013-05-24T16:15:54Z,2026-01-05T01:51:29Z,https://github.com/facebook/react,https://react.dev,MIT License,881054,False,False
6,Python,TheAlgorithms/Python,TheAlgorithms,All Algorithms implemented in Python,Python,216482,49873,828,2016-07-16T09:44:01Z,2026-01-05T02:23:29Z,https://github.com/TheAlgorithms/Python,https://thealgorithms.github.io/Python/,MIT License,15643,False,False
7,linux,torvalds/linux,torvalds,Linux kernel source tree,C,212566,59741,3,2011-09-04T22:48:12Z,2026-01-05T01:53:35Z,https://github.com/torvalds/linux,,Other,5899425,False,False
8,computer-science,ossu/computer-science,ossu,🎓 Path to a free self-taught education in Computer Science!,HTML,199823,24863,14,2014-05-04T00:18:39Z,2026-01-05T01:36:09Z,https://github.com/ossu/computer-science,,MIT License,1766,False,False
9,javascript-algorithms,trekhleb/javascript-algorithms,trekhleb,📝 Algorithms and data structures implemented in JavaScript with explanations and links to further readings,JavaScript,195267,31108,382,2018-03-24T07:47:04Z,2026-01-05T00:09:33Z,https://github.com/trekhleb/javascript-algorithms,,MIT License,14828,False,False
10,tensorflow,tensorflow/tensorflow,tensorflow,An Open Source Machine Learning Framework for Everyone,C++,193183,75152,2781,2015-11-07T01:19:20Z,2026-01-05T01:58:06Z,https://github.com/tensorflow/tensorflow,https://tensorflow.org,Apache License 2.0,1243557,False,False
11,ohmyzsh,ohmyzsh/ohmyzsh,ohmyzsh,"🙃   A delightful community-driven (with 2,400+ contributors) framework for managing your zsh configuration. Includes 300+ optional plugins (rails, git, macOS, hub, docker, homebrew, node, php, python, etc), 140+ themes to spice up your morning, and an auto-update tool that makes it easy to keep up with the latest updates from the community.",Shell,183730,26307,531,2009-08-28T18:15:37Z,2026-01-05T01:40:15Z,https://github.com/ohmyzsh/ohmyzsh,https://ohmyz.sh,MIT License,13340,False,False
12,AutoGPT,Significant-Gravitas/AutoGPT,Significant-Gravitas,"AutoGPT is the vision of accessible AI for everyone, to use and to build on. Our mission is to provide the tools, so that you can focus on what matters.",Python,180828,46252,294,2023-03-16T09:21:07Z,2026-01-05T02:23:20Z,https://github.com/Significant-Gravitas/AutoGPT,https://agpt.co,Other,320511,False,False
13,vscode,microsoft/vscode,microsoft,Visual Studio Code,TypeScript,180323,37206,12268,2015-09-03T20:23:38Z,2026-01-05T02:13:33Z,https://github.com/microsoft/vscode,https://code.visualstudio.com,MIT License,1101021,False,False
14,flutter,flutter/flutter,flutter,Flutter makes it easy and fast to build beautiful apps for mobile and beyond,Dart,174557,29788,12478,2015-03-06T22:54:58Z,2026-01-05T02:12:27Z,https://github.com/flutter/flutter,https://flutter.dev,"BSD 3-Clause ""New"" or ""Revised"" License",423219,False,False
15,bootstrap,twbs/bootstrap,twbs,"The most popular HTML, CSS, and JavaScript framework for developing responsive, mobile first projects on the web.",MDX,173884,79178,582,2011-07-29T21:19:00Z,2026-01-05T00:57:24Z,https://github.com/twbs/bootstrap,https://getbootstrap.com,MIT License,272709,False,False
16,n8n,n8n-io/n8n,n8n-io,"Fair-code workflow automation platform with native AI capabilities. Combine visual building with custom code, self-host or cloud, 400+ integrations.",TypeScript,166513,53061,1210,2019-06-22T09:24:21Z,2026-01-05T02:24:54Z,https://github.com/n8n-io/n8n,https://n8n.io,Other,316181,False,False
17,ollama,ollama/ollama,ollama,"Get up and running with OpenAI gpt-oss, DeepSeek-R1, Gemma 3 and other models.",Go,158782,14064,2367,2023-06-26T19:39:32Z,2026-01-05T01:30:30Z,https://github.com/ollama/ollama,https://ollama.com,MIT License,69979,False,False
18,transformers,huggingface/transformers,huggingface,"🤗 Transformers: the model-definition framework for state-of-the-art machine learning models in text, vision, audio, and multimodal models, for both inference and training. ",Python,154578,31631,2189,2018-10-29T13:56:00Z,2026-01-05T00:38:24Z,https://github.com/huggingface/transformers,https://huggingface.co/transformers,Apache License 2.0,432042,False,False
19,langflow,langflow-ai/langflow,langflow-ai,Langflow is a powerful tool for building and deploying AI-powered agents and workflows.,Python,142758,8241,948,2023-02-08T22:28:03Z,2026-01-05T01:58:23Z,https://github.com/langflow-ai/langflow,http://www.langflow.org,MIT License,1050368,False,False
20,awesome-chatgpt-prompts,f/awesome-chatgpt-prompts,f,"Share, discover, and collect prompts from the community. Free and open source — self-host for your organization with complete privacy.",TypeScript,141505,18757,4,2022-12-05T13:54:13Z,2026-01-05T02:24:03Z,https://github.com/f/awesome-chatgpt-prompts,https://prompts.chat,Creative Commons Zero v1.0 Universal,23800,False,False
