排名,项目名称,完整名称,作者,描述,语言,Stars,Forks,Issues,创建时间,更新时间,仓库链接,主页链接,许可证,大小(KB),是否Fork,是否已归档
1,build-your-own-x,codecrafters-io/build-your-own-x,codecrafters-io,Master programming by recreating your favorite technologies from scratch.,Markdown,529013,50048,611,2018-05-09T12:03:18Z,2026-07-20T03:40:16Z,https://github.com/codecrafters-io/build-your-own-x,https://codecrafters.io,,1086,False,False
2,freeCodeCamp,freeCodeCamp/freeCodeCamp,freeCodeCamp,"freeCodeCamp.org's open-source codebase and curriculum. Learn math, programming, and computer science for free.",TypeScript,452102,45600,269,2014-12-24T17:49:19Z,2026-07-20T03:37:13Z,https://github.com/freeCodeCamp/freeCodeCamp,https://contribute.freecodecamp.org,"BSD 3-Clause ""New"" or ""Revised"" License",578297,False,False
3,free-programming-books,EbookFoundation/free-programming-books,EbookFoundation,:books: Freely available programming books,Python,392510,66553,71,2013-10-11T06:50:37Z,2026-07-20T03:12:04Z,https://github.com/EbookFoundation/free-programming-books,https://ebookfoundation.github.io/free-programming-books/,Creative Commons Attribution 4.0 International,21594,False,False
4,openclaw,openclaw/openclaw,openclaw,Your own personal AI assistant. Any OS. Any Platform. The lobster way. 🦞 ,TypeScript,383505,80561,6923,2025-11-24T10:16:47Z,2026-07-20T03:42:03Z,https://github.com/openclaw/openclaw,https://openclaw.ai,Other,2077224,False,False
5,developer-roadmap,nilbuild/developer-roadmap,nilbuild,"Interactive roadmaps, guides and other educational content to help developers grow in their careers.",TypeScript,361798,44594,14,2017-03-15T13:45:52Z,2026-07-20T03:00:02Z,https://github.com/nilbuild/developer-roadmap,https://roadmap.sh,Other,361493,False,False
6,awesome-python,vinta/awesome-python,vinta,"An opinionated list of Python frameworks, libraries, tools, and resources",Python,309163,28348,20,2014-06-27T21:00:06Z,2026-07-20T03:41:11Z,https://github.com/vinta/awesome-python,https://awesome-python.com/,Other,5747,False,False
7,awesome-selfhosted,awesome-selfhosted/awesome-selfhosted,awesome-selfhosted,A list of Free Software network services and web applications which can be hosted on your own servers,,306812,14381,0,2015-06-01T02:33:17Z,2026-07-20T03:40:11Z,https://github.com/awesome-selfhosted/awesome-selfhosted,https://awesome-selfhosted.net/,Other,17238,False,False
8,superpowers,obra/superpowers,obra,An agentic skills framework & software development methodology that works.,Shell,257644,22955,320,2025-10-09T19:45:18Z,2026-07-20T03:42:04Z,https://github.com/obra/superpowers,,MIT License,3895,False,False
9,react,react/react,react,The library for web and native user interfaces.,JavaScript,246587,51254,1219,2013-05-24T16:15:54Z,2026-07-20T03:34:12Z,https://github.com/react/react,https://react.dev,MIT License,1027619,False,False
10,linux,torvalds/linux,torvalds,Linux kernel source tree,C,239860,63525,3,2011-09-04T22:48:12Z,2026-07-20T03:25:23Z,https://github.com/torvalds/linux,,Other,6294474,False,False
11,ECC,affaan-m/ECC,affaan-m,"The agent harness performance optimization system. Skills, instincts, memory, security, and research-first development for Claude Code, Codex, Opencode, Cursor and beyond.",JavaScript,231277,35291,115,2026-01-18T00:51:51Z,2026-07-20T03:38:32Z,https://github.com/affaan-m/ECC,https://ecc.tools,MIT License,39570,False,False
12,hermes-agent,NousResearch/hermes-agent,NousResearch,The agent that grows with you,Python,217322,40927,23973,2025-07-22T22:22:28Z,2026-07-20T03:38:35Z,https://github.com/NousResearch/hermes-agent,https://hermes-agent.nousresearch.com,MIT License,516791,False,False
13,computer-science,ossu/computer-science,ossu,🎓 Path to a free self-taught education in Computer Science!,HTML,206952,25658,23,2014-05-04T00:18:39Z,2026-07-20T02:56:50Z,https://github.com/ossu/computer-science,https://cs.ossu.dev,MIT License,1783,False,False
14,n8n,n8n-io/n8n,n8n-io,"Fair-code workflow automation platform with native AI capabilities. Combine visual building with custom code, self-host or cloud, 400+ integrations.",TypeScript,197093,59479,1404,2019-06-22T09:24:21Z,2026-07-20T03:42:00Z,https://github.com/n8n-io/n8n,https://n8n.io,Other,528818,False,False
15,tensorflow,tensorflow/tensorflow,tensorflow,An Open Source Machine Learning Framework for Everyone,C++,196387,75592,2821,2015-11-07T01:19:20Z,2026-07-20T03:21:46Z,https://github.com/tensorflow/tensorflow,https://tensorflow.org,Apache License 2.0,1351441,False,False
16,ohmyzsh,ohmyzsh/ohmyzsh,ohmyzsh,"🙃   A delightful community-driven (with 2,500+ contributors) framework for managing your zsh configuration. Includes 300+ optional plugins (rails, git, macOS, hub, docker, homebrew, node, php, python, etc), 140+ themes to spice up your morning, and an auto-update tool that makes it easy to keep up with the latest updates from the community.",Shell,188699,26466,587,2009-08-28T18:15:37Z,2026-07-20T03:15:50Z,https://github.com/ohmyzsh/ohmyzsh,https://ohmyz.sh,MIT License,13652,False,False
17,vscode,microsoft/vscode,microsoft,Visual Studio Code,TypeScript,187702,41303,19377,2015-09-03T20:23:38Z,2026-07-20T03:19:15Z,https://github.com/microsoft/vscode,https://code.visualstudio.com,MIT License,1326259,False,False
18,opencode,anomalyco/opencode,anomalyco,The open source coding agent.,TypeScript,187576,23582,4734,2025-04-30T20:08:00Z,2026-07-20T03:38:45Z,https://github.com/anomalyco/opencode,https://opencode.ai,MIT License,418316,False,False
19,FreeDomain,DigitalPlatDev/FreeDomain,DigitalPlatDev,DigitalPlat FreeDomain: Free Domain For Everyone,,186907,3918,36,2024-05-30T13:23:00Z,2026-07-20T03:38:36Z,https://github.com/DigitalPlatDev/FreeDomain,https://domain.digitalplat.org,GNU Affero General Public License v3.0,1139,False,False
20,AutoGPT,Significant-Gravitas/AutoGPT,Significant-Gravitas,"AutoGPT is the vision of accessible AI for everyone, to use and to build on. Our mission is to provide the tools, so that you can focus on what matters.",Python,185616,46075,508,2023-03-16T09:21:07Z,2026-07-20T03:22:09Z,https://github.com/Significant-Gravitas/AutoGPT,https://agpt.co,Other,632939,False,False
